,제목,날짜,본문
1416,"광주시, 5개 업체와 '인공지능 비즈니스 기반 조성' 협약",2020.07.22.,"㈜클라우드웍스는 인공지능 학습 데이터 수집·가공과 광주시 AI 기업과의 연계를 통한 생태계 구축을 위해 광주법인 및 지역사무소 설립을 추진하는 등 AI 생태계 조성 및 광주지역 일자리 창출에 적극 협력해 나갈 계획이다. 지영호 ㈜알파도 대표이사를 비롯한 업무협약 업체 대표들은 ""광주에 구축 중인..."
1417,"네이버, IBM 인공지능 통한 세계날씨 정보 제공",2020.07.22.,"기입하면 AI와 IoT, 빅데이터 기술 등 최첨단 기술과 고성능 수퍼컴퓨팅 파워, 분석 전문성을 토대로 제공되는 세계 날씨 정보를 네이버를 통해 보다 쉽게 만나볼 수 있다. IBM 더 웨더 컴퍼니와 같은 일기 예보는 데이터, 수퍼컴퓨팅, 수치 모델과 AI의 융합에 의해 만들어진다. IBM은 테라바이트 단위의..."
1418,"콤텍시스템·엔쓰리엔클라우드, AI 사업 협력 MOU",2020.07.23.,아이티센그룹의 콤텍시스템이 인공지능(AI)을 활용해 한국판 뉴딜 사업을 본격화한다. 콤텍시스템(대표 권창완)은 AI 사업발전과 기술증진을 위해 엔쓰리엔클라우드(대표 이규정)와 업무협약을 체결했다고 23일 밝혔다. 양사는 콤텍시스템의 네트워크와 엔쓰리엔클라우드가 자체 개발한 비대면 AI 플랫폼...
1419,"美 아마존, 전면 개편된 인공지능 기반 음성 인식 비서 '알렉사' 보급 개시",2020.07.26.,"27일(현지시간) 미국 경제매체 CNBC는 아마존이 인공지능(AI) 기반의 자사 음성 인식 비서인 알렉사의 애플리케이션을 전면 개편해 이날 부터 보급하기 시작했다고 보도했다. 보도에 따르면 새 알렉사 앱은 애플의 아이폰, 구글 안드로이드 스마트폰과 태블릿PC, 아마존 자체 상품인 파이어 태블릿PC 등에서 사용할..."
1420,"금융위 ""금융분야 AI 활성화""…AI 데이터 라이브러리 구축",2020.07.26.,"워킹그룹 첫 회의…규제 개선·인프라·소비자 보호 초점 금융위원회는 16일 기업과 학계 등이 참여하는 워킹그룹을 꾸려 금융 분야 인공지능(AI) 활성화 방안을 마련한다고 밝혔다. 연말까지 운영되는 워킹그룹에는 금융당국은 물론 AI 전문 기업·핀테크, 금융회사, 학계 관계자 등이 참여한다. 워킹그룹은..."
1421,"KT, AI에 마음을 담다···“이제 목소리로 전하세요”",2020.07.22.,"참가자의 목소리는 가족들의 노력과 KT의 인공지능 기술로 완성됐다. 목소리 찾기는 청력을 잃었거나 사고나 질병 등으로 후천적으로 목소리를 잃은... KT는 성별, 나이, 구강구조 등 개인의 특성을 AI 엔진으로 분석해 참가자만의 특색 있는 목소리를 만들었다. 각 참가자의 동성 가족 구성원들은 참가자의..."
1422,수학·과학으로 AI원리·빅데이터 배운다,2020.07.21.,"서울 한성과학고 등 10개 과학고, 영재학교가 인공지능(AI)과 연계된 수학·과학 혁신교육을 시행한다. 과학기술정보통신부는 한성·경기북·경북·광주·대전·세종·인천·인천진산과학고와 세종과학예술·인천과학예술 영재학교 등 10개교를 ‘미래형 수학·과학 교육혁신 선도학교’로 지정했다고 22일..."
1423,"건양대 의료인공지능학과, 학과 소개 챗봇 서비스 도입",2020.07.21.,"의료인공지능학과 김용석 학과장은 ""최근 인공지능(AI)에 대한 전 세계적 관심이 높아지고 있는 만큼 학과에 대한 다양한 문의가 들어오고 있다""며 ""코로나19로 인해 대면입시홍보가 불가능한 만큼 학과에 관심있는 학생 및 학부모에게 실시간으로 학과정보를 제공하기 위해 챗봇 서비스를 시작했다""고..."
1424,"네이버, 베트남 최고 명문대와 협력 'AI인재 육성'",2020.07.22.,"네이버가 구글, 아마존 등 글로벌 정보기술(IT) 기업에 맞서기 위해 주도하는 글로벌 인공지능(AI) 벨트 윤곽이 나오고 있다. 네이버는 베트남의 카이스트 하노이과학기술대학(HUST)과 IT인재 양성을 위한 산학협력을 진행한다고 16일 밝혔다. 1956년 설립된 하노이과학기술대학은 매년 이공계 분야에서 탁월한..."
1425,AI·광주형일자리 등 '광주형 3대 뉴딜' 추진,2020.07.22.,광주시가 추진중인 광주형 3대 뉴딜 가운데 '디지털 뉴딜'은 예타면제사업으로 추진 중인 AI(인공지능)집적단지와 연계해 지역 경제·산업혁신에 필요한 자원(데이터·기술·인력)과 인프라(데이터센터·실증기반시설 등)를 중심으로 AI산업 생태계를 조성하는 사업이다. 오는 2024년까지 4천116억원을 들여...
1426,솔트룩스 국내 B2B/B2G 인공지능 솔루션 선두업체,2020.07.22.,"솔트룩스는 인공지능(AI) 및 빅데이터 솔루션과 클라우드 서비스를 제공하는 업체다. 사업환경은 ▷인공지능 기술 발달로 금융, 의료 방송, 쇼핑 등 다양한 산업분야에서 활용되며 고성장할 전망이며 ▷정보통신기술(ICT) 발전에 따라 데이터가 급격히 증가하면서 인공지능 및 빅데이터의 중요성이..."
1427,AI가 추천하는 하반기 재테크는? 미국주식 26%·채권 30%,2020.07.19.,"모바일 간편투자 서비스 '핀트(Fint)'를 운영하는 디셈버앤컴퍼니자산운용은 자사의 인공지능 로보어드바이저 '아이작(ISAAC)' 분석 결과, 올해 하반기 글로벌 자산배분 비중을 크게 ▲주식 60%(미국 26%, 선진국 17%, 신흥국 17%) ▲채권 30% ▲원자재 10%로 분류했다고 27일 밝혔다. 7월 기준 아이작은 미국 주식에 26..."
1428,"KT 기가아이즈 ""AI가 쓰레기 무단투기 잡는다""",2020.07.19.,"KT 기가아이즈 ""AI가 쓰레기 무단투기 잡는다"" KT는 지능형 CCTV 기가아이즈를 통해 ‘버림 도난 감지 영상분석’ 서비스를 출시한다고 22일 밝혔다.이번에 출시하는 ‘버림 도난 감지 영상분석’은 쓰레기 등의 무단투기나 귀중품 등의 도난을 인공지능(AI)가 실시간으로 잡아내 알림을 주는 기능이다. 고객에게..."
1429,"LG AI 프로그램, 한국어 독해 평가서 1위",2020.07.19.,LG가 한국어 인공지능(AI) 기계독해(MRC·Machine Reading Comprehension) 평가에서 1위를 차지했다. 19일 LG그룹에 따르면 LG사이언스파크가 개발한 AI 프로그램이 AI 학습용 한국어 표준데이터셋 ‘코쿼드(KorQuAD·The Korean Question Answering Dataset)1.0’ 기계독해 평가에서 95.39점을 받아 1위를 기록했다. 기계독해는...
1430,"한화건설, KT·LG전자·네이버와 AI·IoT 기술 협력",2020.07.19.,"▲ CNB뉴스, CNBNEWS, 씨앤비뉴스 한화건설과 KT가 포레나 AI 스마트홈 구축 업무 협약을 체결했다.(사진=한화건설) 한화건설이 포레나 브랜드에 AI(인공지능) 및 IoT(사물인터넷) 기술을 적용하기 위해 KT, 네이버, LG전자와 업무 협력을 진행한다고 23일 밝혔다. 한화건설은 23일 서울 장교동 한화빌딩에서..."
1431,"KT기가아이즈, AI CCTV로 '도둑' 잡는다",2020.07.23.,포쓰저널 성은숙기­자 KT?직원들이 기가아이즈의?‘버림?도난 감지 영상분석’?서비스를 소개하고 있다./사진=KT [포쓰저널] KT가 AI(인공지능) 영상 분석으로 쓰레기 등의 무단투기나 귀중품 등의 도난을 실시간으로 잡아내 알림을 주는 CCTV 서비스를 선보였다. 고객에게 상황 발생 당시의 동영상을 제공하고...
1432,"'2020 인공지능 그랜드 챌린지' 개최, 134개 팀 겨룬다",2020.07.23.,과학기술정보통신부(이하 과기정통부)가 생활 속 문제를 인공지능(AI)으로 해결하기 위해 '2020년 인공지능 그랜드 챌린지'를 개최한다. 인공지능 그랜드 챌린지는 참가자들이 제시된 문제를 해결하기 위해 개발한 알고리즘으로 실력을 겨루는 도전·경쟁형 연구개발 경진대회다. 기존의 사업계획서 검토...
1433,"웅진씽크빅, 초등 교사에 ‘스마트올 AI 학교수학’ 무료 공개",2020.07.23.,‘스마트올 AI학교수학’은 학생 수준에 맞춰 인공지능(AI) 프로그램이 문제를 제시한다. 교과서 중심으로 제작됐고 학생별 오답유형을 자동으로 구분해 교사에게 알려준다. 학생들의 진도와 학습현황도 한 화면에서 확인할 수 있다. AI학교수학에는 웅진씽크빅이 보유한 에듀테크 및 AI관련 특허 13건의...
1434,"콤텍시스템, 엔쓰리엔클라우드와 인공지능 사업 MOU 체결",2020.07.22.,콤텍시스템(대표 권창완)은 인공지능(AI) 사업발전과 기술증진을 위해 엔쓰리엔클라우드(대표 이규정)과 업무협약을 체결했다고 23일 밝혔다. 양사는 콤텍시스템의 네트워크(Network)와 엔쓰리엔클라우드가 자체 개발한 비대면 인공지능 플랫폼 ‘치타(CHEETAH)’를 활용해 인공지능 사업을 확장하기 위해...
1435,AI 기반 차세대 출입국관리시스템 개발 본격화…450억원 투입,2020.07.22.,"과학기술정보통신부와 법무부는 23일 `인공지능(AI) 기반 출입국관리시스템 고도화를 위한 식별추적시스템 실증랩`을 개소했다고 밝혔다. 서울 상암동 누리꿈스퀘어 14층에 위치한 실증랩은 총 면적 2022㎡의 규모로, 다수의 AI 기업이 데이터 가공, 학습 및 실증작업을 수행할 수 있도록 조성됐다. 올해 인공지능..."
1436,"한화건설, KT·네이버·LG전자와 'AI 스마트홈' 구축 MOU",2020.07.27.,"한화건설이 포레나 브랜드 주택상품에 AI(인공지능) 및 IoT(사물인터넷) 기술을 적용하기 위해 음성인식 및 생활가전 분야에서 국내 최고 기업인 KT, 네이버, LG전자와 함께 업무 협력을 진행한다. 한화건설은 이를 위해 23일 장교동 한화빌딩에서 KT와 ‘포레나 AI 스마트홈 구축 업무 협약식’을 가졌다. 이..."
1437,"한화건설, KT·네이버·LG전자와 'AI 스마트홈' 구축 MOU",2020.07.23.,"한화건설이 포레나 브랜드 주택상품에 AI(인공지능) 및 IoT(사물인터넷) 기술을 적용하기 위해 음성인식 및 생활가전 분야에서 국내 최고 기업인 KT, 네이버, LG전자와 함께 업무 협력을 진행한다. 한화건설은 이를 위해 23일 장교동 한화빌딩에서 KT와 ‘포레나 AI 스마트홈 구축 업무 협약식’을 가졌다. 이..."
1438,"""인공지능으로 코로나 대응한다""",2020.07.23.,"컨소시엄은 북미영상의학회에서 시작한 COVID-19 RICORD 컨소시엄, 유럽연합에서 시작한 COVID-19 이미징 AI 이니셔티브 등과 함께 국제 협력 활동을 펼칠 계획이며, 코로나19 대응을 위한 AI 핵심표준 개발도 목표로 하고 있다. 아울러 대한의료인공지능학회, 대한영상의학회 등 국내 관련 학회와도 적극 협력할..."
1439,"데이터·AI·클라우드 분야, 총 4915억원 규모 추경사업 착수",2020.07.21.,올해 데이터·인공지능·클라우드 분야 추경 사업 안내(자료=과학기술정보통신부 제공)[이데일리 이후섭 기자] 과학기술정보통신부는 `디지털 뉴딜`의 중심축인 데이터·인공지능(AI)·클라우드 분야 총 4915억원 규모의 7개 추경 사업에 대한 사업설명회(비대면 온라인)를 개최한다고 19일 밝혔다. 데이터...
1440,"LG가 만든 AI, 한국어 독해평가 1위",2020.07.21.,LG는 LG사이언스파크가 개발한 프로그램이 한국어 인공지능(AI) 기계독해 평가에서 1위에 올랐다고 19일 발표했다. AI 학습용 한국어 표준데이터 세트 ‘코쿼드(KorQuAD) 1.0’을 활용한 기계독해 평가에서 95.39점을 받았다. 사람이 같은 독해 문제를 풀었을 때(평균 91.2점)보다 점수가 높았다. 기계독해는...
1441,AI 통합돌봄사업 비대면 복지서비스 `활약`,2020.07.19.,경남도가 비수도권지역에서 처음으로 추진한 인공지능(AI)을 활용한 통합돌봄사업이 코로나19 사태 속에 비대면 복지서비스로 자리매김하고 있다. 경남도는 지난해 11월 SK텔레콤과 창원시ㆍ김해시 등 6개 시ㆍ군， 사회적기업이 참여한 인공지능 통합돌봄서비스 구축을 협약하고 돌봄이 필요한 취약계층...
1442,"KT, AI로 고장 예측해 안전한 산업현장 만든다",2020.07.19.,"KT는 23일 컨베이어 설비업체 대양롤랜트, 예지보전업체 퓨처메인과 인공지능(AI) 기반 설비 예지보전 사업에서 협력하기로 했다고 밝혔다. 예지보전은 설비 상태를 확인해 고장을 사전에 예상하고 유지 및 보수하는 업무다. KT는 다양한 산업 현장의 설비에서 발생하는 소리와 진동을 분석해 고장을 사전에..."
1443,조선대 SW중심사업단-남구 ‘AI 활용 평생교육’ 호응,2020.07.19.,"27일 조선대에 따르면 지난해에 이어 올해에도 남구와 인공지능(AI) 활용 평생교육을 위한 업무협약을 체결하고, ‘찾아가는 초등학교 코딩교실’, ‘찾아가는 지식재산 아카데미 SW 체험교육’, ‘조손 가정 및 저소득계층 학부모·학생 대상 AI기초활용 코딩교육’을 진행하고 있다. ‘찾아가는 코딩교실’..."
1444,[뉴스워커_GS건설] 업계 최초 모델하우스 내 AI로봇 안내원 '자이봇' 도입,2020.07.19.,"GS건설이 국내 건설업계 최초로 아파트 모델하우스에 도입한 인공지능 로봇 안내원 '자이봇'(Xibot) (GS건설 제공) GS건설이 국내 건설업계 최초로 아파트... 특히 25m 원거리 및 0.05m 근거리 내 물체 인식이 가능해 장애물을 피할 수 있으며, AI음성인식 기술(NLP)이 적용돼 대화도 주고받을 수 있는 것이 특징이다...."
1445,"에이모, 자율주행 인공지능 인식기술 활성화 위한 DB 서비스 구축",2020.07.19.,"인공지능(AI) 학습데이터 가공 플랫폼 전문 기업 에이모(AIMMO, 대표 오승택)는 한국국토정보공사 공간정보연구원이 주관하는 '자율주행 인공지능 인식기술 활성화를 위한 융합 DB 서비스 구축' 사업을 수행한다고 밝혔다. 해당 사업은 국가중점 데이터 개방지원 사업의 일환으로 기획되어 자율주행 기술..."
1446,AI로 생활 속 문제 해결…'AI 그랜드 챌린지',2020.07.19.,과학기술정보통신부(이하 과기정통부)는 27일부터 인공지능(AI) 기술을 통해 생활 속 문제해결을 위한 '2020년 인공지능 그랜드 챌린지' 대회를 개최한다고 밝혔다. 인공지능 그랜드 챌린지 대회는 제시된 문제를 해결하기 위해 참가자들이 개발한 알고리즘을 가지고 실력을 겨루는 도전·경쟁형 연구개발(R&D)...
1447,AI로 생활 속 문제 해결…'AI 그랜드 챌린지',2020.07.22.,과학기술정보통신부(이하 과기정통부)는 27일부터 인공지능(AI) 기술을 통해 생활 속 문제해결을 위한 '2020년 인공지능 그랜드 챌린지' 대회를 개최한다고 밝혔다. 인공지능 그랜드 챌린지 대회는 제시된 문제를 해결하기 위해 참가자들이 개발한 알고리즘을 가지고 실력을 겨루는 도전·경쟁형 연구개발(R&D)...
1448,40년 낡은 창원국가산단에 인공지능 DNA 심는다,2020.07.21.,창원 한국전기연구원 본원에 인공지능연구센터 개소 제조업 응용 AI 세계최고 수준 캐나다워털루대 참여 전통 기계산업 창원국가산단 스마트산단 탈바꿈 시도 정부 출연 국책연구기관인 한국전기연구원(이하 KERI)에 인공지능(AI)연구센터가 문을 열었다. 인공지능 기술을 전통 기계산업에 접목해 첨단...
1449,인간과 AI의 공존을 위한 법제도 발전 방향 모색,2020.07.21.,"세미나 첫 번째 세션에서는 'AI시대 윤리의 재구성'을 주제로 인공지능 생태계를 구성하는 AI자체, AI제작자, AI이용자에 요구되는 윤리원칙과 책임의 변화를 살펴보고 인공지능기술이 적용되는 영역별 윤리적 과제와 거버넌스 등 인간과 인공지능이 공존하기 위한 윤리 정립방안을 논했다. 두 번째 세션에서는..."
1450,"KT 기가아이즈, AI CCTV로 범죄 잡는다",2020.07.24.,쓰레기 무단투기와 도난 사건을 인공지능(AI) CCTV가 감시하고 즉각 알려주는 서비스가 나왔다. KT 직원들이 기가아이즈의 '버림ㆍ도난 감지 영상분석' 서비스를 소개하고 있다 KT(대표 구현모)는 지능형 CCTV 기가아이즈에서 '버림ㆍ도난 감지 영상분석' 서비스를 출시한다고 22일 밝혔다. 지능형 영상분석은...
1451,"KT-마르시스에듀, 인공지능 코딩 교육 솔루션 개발 협약",2020.07.24.,"KT-마르시스에듀, 인공지능 코딩 교육 솔루션 개발 협약 KT는 코딩 교육 전문 기업 마르시스에듀와 서울 강남구 마르시스에듀 본사에서 ‘인공지능(AI) 코딩 교육 사업 활성화를 위한 업무협약’을 체결했다고 21일 밝혔다. 이번 협약에 따라 양사는 AI 코딩 교육용 로봇·앱 개발, AI 기반 포스트 코딩 교육..."
1452,"[특징주]솔트룩스, 코스닥 상장 첫날 강세…""국내 AI 시장 성장 최대 수혜""",2020.07.24.,"솔트룩스는 2000년 설립된 인공지능(AI)와 빅데이터 기반의 소프트웨어 전문기업이다. 데이터 플랫폼을 기반으로 기계 학습과 증강 분석 등을 통해 국방부, 기무사 등의 국방 및 안보분야의 위기감지 및 조기대응 사업을 진행했다. 또 인공지능 상담 챗봇, AI 채용 심사와 챗봇 상담, 인공지능 상담사..."
1453,"SAP코리아, 광주시와 인공지능 산업 육성 업무 제휴",2020.07.19.,광주시는 AI산업 생태계 조성을 위한 다양한 기업지원 프로그램 개발·운영 및 기업홍보를 비롯해 인공지능 분야 전문인력 교육 및 취업 프로그램 기획·추진을 맡는다. 광주시는 지난 5개월여 동안 20개 이상의 인공지능 기업을 유치했다. 이중 8개 기업이 법인 설립 및 사무실 오픈을 마쳤다. 이용섭...
1454,"LG, 한국어 AI 평가 1위…고객상담 챗봇 적용 계획",2020.07.19.,LG가 한국어 인공지능(AI) 기계독해 평가에서 1위를 차지했다. LG는 해당 기술을 고객 상담 챗봇에 적용한다는 계획이다. LG는 19일 LG사이언스파크가 개발한 AI 프로그램이 AI 학습용 한국어 표준데이터셋 ‘코쿼드1.0’ 기계독해 평가에서 95.39점을 받아 1위를 기록했다고 밝혔다. 이는 사람이 동일한 독해...
1455,"용산구, 치매안심센터 내 인공지능(A.I.) 체험존 설치",2020.07.19.,"서울 용산구(구청장 성장현)는 시니어 정보통신기술(ICT) 플랫폼 조성사업의 하나로 KT(대표이사 구현모)와 함께 치매안심센터에 ‘인공지능(AI) 체험존’을 만들었다고 21일 밝혔다. ICT와 AI를 활용, 치매 어르신들의 인지적·정서적 기능을 향상시키기 위해서다. 체험존은 구청사 지하 2층 치매가족..."
1456,서대문구 인공지능 돌보미 사업 취약계층 돌봄 역할 '톡톡',2020.07.19.,"구는 지난해 5월 ‘전국 사회경제연대 지방정부협의회’ 주관으로 SK텔레콤, 사회적기업 행복커넥트와 업무협약을 맺고 200여 명의 관내 취약계층에게 인공지능(AI) 스피커 ‘누구(NUGU)’를 통한 돌봄 서비스를 제공하고 있다. AI 스피커는 뉴스와 날씨, 음악을 들려주고 대화도 나눈다. 또 일정 시간 대화가..."
1457,"용산구, 치매안심센터 내 인공지능(A.I.) 체험존 설치",2020.07.23.,"서울 용산구(구청장 성장현)는 시니어 정보통신기술(ICT) 플랫폼 조성사업의 하나로 KT(대표이사 구현모)와 함께 치매안심센터에 ‘인공지능(AI) 체험존’을 만들었다고 21일 밝혔다. ICT와 AI를 활용, 치매 어르신들의 인지적·정서적 기능을 향상시키기 위해서다. 체험존은 구청사 지하 2층 치매가족..."
1458,서대문구 인공지능 돌보미 사업 취약계층 돌봄 역할 '톡톡',2020.07.23.,"구는 지난해 5월 ‘전국 사회경제연대 지방정부협의회’ 주관으로 SK텔레콤, 사회적기업 행복커넥트와 업무협약을 맺고 200여 명의 관내 취약계층에게 인공지능(AI) 스피커 ‘누구(NUGU)’를 통한 돌봄 서비스를 제공하고 있다. AI 스피커는 뉴스와 날씨, 음악을 들려주고 대화도 나눈다. 또 일정 시간 대화가..."
1459,"신한DS, 신한생명·스켈터랩스와 AI 활용한 보험상품개발 MOU 체결",2020.07.23.,"신한DS가 신한생명 및 인공지능(AI) 기술 스타트업 스켈터랩스와 함께 AI를 활용한 공동연구 MOU를 체결했다고 23일 밝혔다. 이번 3사 협약은 국내 최초로 최신 딥러닝 기술 기반의 기계독해 엔진을 활용해 보험 상품 이해와 분석, 기획 · 개발에 대한 공동연구를 수행하기 위해 이루어졌다. 기계독해는 AI..."
1460,"한화테크윈, 'AI 영상분석'으로 코로나19 확산 방지…SW 업데이트 무료 제공",2020.07.22.,한화테크윈이 자체 개발한 코로나19 방역 솔루션 2종의 콘셉트 이미지 한화테크윈이 코로나19 확산을 막기 위해 첨단 AI(인공지능) 기술을 활용한 신규 영상보안 솔루션을 출시한다고 23일 밝혔다. 한화테크윈이 새롭게 선보이는 코로나19용 솔루션은 '실내 적정인원 관리'와 '마스크 착용 감지' 등 2종이다....
1461,"건양대 의료인공지능학과, 학과 소개 챗봇 서비스 도입",2020.07.26.,"의료인공지능학과 김용석 학과장은 ""최근 인공지능(AI)에 대한 전 세계적 관심이 높아지고 있는 만큼 학과에 대한 다양한 문의가 들어오고 있다""며 ""코로나19로 인해 대면입시홍보가 불가능한 만큼 학과에 관심있는 학생 및 학부모에게 실시간으로 학과정보를 제공하기 위해 챗봇 서비스를 시작했다""고..."
1462,"""AI로 잃어버린 목소리 되찾았다”",2020.07.22.,"인공지능 기술로 잃어버린 목소리를 되찾는 프로젝트가 주목받고 있다. KT(대표 구현모)가 ‘목소리 찾기’ 프로젝트로 탄생한 세상에 하나뿐인... KT는 성별, 나이, 구강구조 등 개인의 특성을 AI 엔진으로 분석해 참가자만의 특색 있는 목소리를 만들었다. 각 참가자의 동성 가족 구성원들은 참가자의 목소리..."
1463,"한은, AI·블록체인 본격 도입···'디지털혁신실' 신설",2020.07.26.,"투데이코리아=유한일 기자 | 한국은행이 중앙은행 업무에 인공지능(AI)과 블록체인, 빅데이터 등 신기술을 도입하기 위한 전담 부서를 신설한다. 한은은 '디지털혁신실'을 올 하반기 조직개편을 통해 신설한다고 22일 밝혔다. 한은은 최근 급격히 발전한 정보통신기술(ICT)을 정책운영 및 내부경영에 적극적으로..."
1464,"관리자 연수를 통한 융합교육, 인공지능(AI)기반교육에 날개 달기!",2020.07.26.,"주제로 인공지능기반 교육의 필요성과 교실현장에서의 적용에 대한 다양한 사례를 전달했다. 임종식 교육감은 ""4차 산업혁명 시대를 맞아 미래사회에 적합한 핵심역량을 갖춘 인재의 필요성을 강조하며 바른 인성을 가진 창의융합인재 육성을 위한 융합교육과 인공지능(AI)기반교육을 강화하겠다""고 말했다."
1465,첫 혁신의료기기 '눈 검사 AI·첨단 암치료기' 지정,2020.07.26.,"‘의료영상진단보조소프트웨어’는 인공지능(AI) 기술을 적용해 안저영상을 분석하는 국내 최초 제품이다. 눈의 병변 부위를 탐지하고 위치를 표시해 혈관이상 등의 12가지 이상소견의 진단을 보조하기 위한 제품으로, 적용기술에 혁신성이 있다는 평가를 받았다. ‘치료용중성자조사장치’는 융복합치료기술이..."
1466,"""AI가 대출 상담을""… 현대해상, AI음성봇 보험계약대출 서비스 개시",2020.07.27.,"먼저 AI음성봇 보험계약대출 서비스는 인공지능(AI) 음성인식과 지능형 대화기술을 접목한 'AI음성봇'을 통해 고객이 원하는 시간 대에 실제 콜센터 상담원과 통화하는 것처럼 대출을 신청할 수 있는 것이 특징이다. 지난해 3월 금융위원회 지정대리인 과제로 선정되며 일찍이 혁신성을 인정받은 서비스로, 국내..."
1467,"KT 기가아이즈, 불법 쓰레기 투기·도난 사고 AI로 막는다",2020.07.27.,지능형 영상분석이란 영상 속 객체가 무엇이고 어떤 행동을 하는 상황인지를 인공지능(AI)이 스스로 판단해 알려주는 기술이다. 이를 활용하면 사람이 24시간 내내 모니터를 주시할 필요가 없이 특이상황에 대해서만 알림을 받고 즉시 대응할 수 있다. 버림 도난 감지 영상분석은 쓰레기 등의 무단투기나...
