,제목,날짜,본문
1984,"AI 학교 속으로…AI가 초등수학 가르치고, 고교에서는 AI원리 배운다",2020.09.15.,"질문을 맞추지 못하면 똑똑한 인공지능(AI)이 수준에 맞는 문제를 척척 내준다. 인공지능(AI)이 학교 교실 안으로 들어온다. 초등학교에서는 AI가 학생이 게임을 하듯 수학 공부를 할 수 있도록 돕고, 수준도 진단해 교사를 지원한다. 고등학교에서는 AI 기초를 공부할 수 있는 기회가 주어진다. 교육부는 AI를..."
1985,대구첨복재단 첨단의료기기개발지원센터 '인공지능 학습용 데이터 구축(2차) ...,2020.09.15.,"대구경북첨단의료산업진흥재단 전경 사진 대구경북첨단의료산업진흥재단(이사장 이영호, 이하 '재단') 첨단의료기기개발지원센터가 과학기술정보통신부와 한국정보화진흥원에서 추진하는 '인공지능(AI) 학습용 데이터 구축(2차) 사업' 중 체부암 과제 참여기관으로 최종선정되었다. '인공지능 학습용 데이터..."
1986,"[타이틀리포트]코로나 시대, 'AI로 비대면 교육' 호응",2020.09.15.,"이를 위해 인공지능, 즉 AI를 활용한 교육이 주목을 받고 있는데요. 전국 최초로 충남에서 AI교육 도움자료가 개발돼, 실제 일선 학교에 활용되면서 큰 호응을 얻고 있는데요. 가 보도합니다. ◀ＥＮＤ▶ ◀ＶＣＲ▶ 초등학교에서 재활용품을 어떻게 분류할 지에 대해 수업이 진행되고 있습니다. 학생들에게..."
1987,"서울 캠퍼스타운 교수창업팀, 바이오·AI 기술개발 한창",2020.09.15.,"[사진=서울캠퍼스타운] 서울 34개 캠퍼스타운에 입주 창업팀이 300개를 넘어서고 있는 가운데, 바이오·인공지능 등 전문분야 연구 성과를 갖춘... 바이오·AI 기술 기반 혁신 제품을 개발 중인 △엔테라퓨틱스 △지니얼로지 △오르조영제 △라트바이오 4개 교수창업팀을 지원하고 있다. 올해 4년차를 맞은..."
1988,인공지능 스피커가 생명 구했다,2020.09.09.,"경남도가 지난해 11월 선보인 ‘인공지능 통합돌봄서비스’는 노인, 장애인 등 취약계층 가구에 인공지능(AI) 스피커를 보급해 통합 돌봄서비스를 제공하는 것으로 도, 시·군, SK텔레콤, 행복한 에코폰 등 4자가 협력해 추진하는 민·관 융합 사업이다."
1989,"""뉴노멀 시대를 위한 AI는?""...SKT, ai.x2020 컨퍼런스 개최",2020.09.10.,"SK텔레콤(017670)은 인공지능(AI)를 활용한 현재와 미래의 위기 극복 방안을 모색하는 ‘ai.x2020’ 컨퍼런스를 10일 개최한다고 9일 밝혔다. 올해로 3회째를 맞는 ai.x 컨퍼런스는 국내외 AI 전문가와 학계, 현업 관계자 간 교류의 공간으로, 올해는 신종 코로나바이러스 감염증(코로나19)의 영향으로..."
1990,윤영찬 ‘카카오 들어오라’ 문자에... 진중권 “이제 AI와 싸우나”,2020.09.08.,"이에 대해 카카오 측은 인공지능(AI) 알고리즘에 따라 자동으로 뉴스 편집과 추천이 되기 때문에 사람이 개입할 수 없다는 입장을 밝혔다. 이에 대해 진 전 교수는 “민주당은 다음의 AI를 꼭 증인으로 채택하세요”라며 “기계에 인격을 인정해 주는 세계 최초의 예가 될 테니, 국위선양에도 도움이 될 겁니다”..."
1991,"카카오엔터프라이즈, AI 포닥 지원 프로그램 시작",2020.09.14.,카카오엔터프라이즈(대표 백상엽)가 인공지능(AI) 우수 인재를 적극 지원한다. 정보기술(IT) 업계의 개발자 확보 경쟁이 치열한 상황 등을 고려한 선도적인 조치라는 분석이 나온다. 카카오엔터프라이즈는 지난 4일 ‘카카오 i 리서치 프로그램’에 박사 학위 졸업생들을 위한 포닥(포스트닥터·박사후연구원)...
1992,"[IT핫테크]알리바바, AI 기술 탑재한 배송로봇 처음으로 공개",2020.09.09.,중국 최대 전자상거래 기업 알리바바가 새로운 인공지능(AI) 배송 로봇을 공개했다. 알리바바 클라우드는 최근 열린 회사 연례 행사 '윈치 대회'에서 자사 최초의 AI 배송 로봇 '샤오만뤼'를 공개했다. 작고 거친 나귀라는 뜻을 가진 이 로봇은 최초 물류 집하장에서 택배를 기다리는 고객이 기다리는 곳까지...
1993,"""5G·AI 최신기술 공유""…삼성 오픈소스 콘퍼런스 10월 온라인 개최",2020.09.09.,"이 콘퍼런스는 소프트웨어 개발자 2000여명이 한자리에 모여 오픈소스 기반의 5G(5세대 이동통신), AI(인공지능), 로봇, 빅데이터 등 최신 기술에 대한 정보와 의견을 공유하는 국내 최대 오픈소스 콘퍼런스다. 삼성전자는 2014년부터 매년 이 행사를 개최해왔다. 올해 콘퍼런스는 국내외 저명한 오픈소스..."
1994,"""AI 인재 모십니다""…카카오엔터프라이즈, 포닥 지원 프로그램 개설",2020.09.09.,"카카오엔터프라이즈는 인공지능(AI) 우수 인재를 지원하기 위한 포닥(포스트닥터·박사후연구원) 프로그램 지원자를 모집한다고 8일 밝혔다. '카카오 i 리서치 프로그램'은 2017년 말부터 시작한 AI 인재 지원 프로그램으로, 카카오엔터프라이즈는 그 동안 석·박사생을 대상으로 상시 연구 인턴십, 학비·연구비..."
1995,'인공지능'으로 '가짜와의 전쟁' 나선 IT스타트업,2020.09.09.,"이를 골라내는 일은 바로 인공지능(AI)이 한다. 인공지능 기술을 활용해 '가짜와의 전쟁'을 펼치는 대표적인 IT회사로 당근마켓, 마크비전, 인덴트코퍼레이션과 같은 스타트업부터, 배달의민족, 카카오 등 규모급 기업에 이르기까지 다양한 곳에서 건전한 생태계와 시장 환경 조성에 발벗고 나서며 이용자 보호에..."
1996,"중기부, '인공지능(AI) 챔피언십' 과제 공개",2020.09.09.,"제조, 의료, 영상, 소비생활 분야를 주제로 국내 굴지의 대기업·선배벤처 등 8개 기업이 인공지능(AI) 과제와 내부 데이터 첫 공개 중소벤처기업부는 올해 처음으로 개최되는 국내 최대 규모 인공지능(AI) 신생 벤처기업(스타트업) 대회인 ‘AI 챔피언십’의 대기업과 선배벤처 등이 제시한 8개의 AI 과제를..."
1997,"SKT, &apos;ai.x2020 컨퍼런스&apos; 개최",2020.09.09.,"SK텔레콤(대표 박정호)이 국내외 인공지능(AI) 전문가들을 초청해 AI를 활용한 현재와 미래의 위기 극복 방안을 모색하는 ‘ai.x2020’ 컨퍼런스를 개최한다고 9일 밝혔다. 오는 10일 시작되는 올해 컨퍼런스는 ‘인간. 기계. 함께하는 경험’을 주제로, 글로벌 팬데믹 상황에서 우리가 겪고 있는 다양한..."
1998,'해양환경 모니터링' 태양광 AI드론 제주 해안 147㎞ 날았다,2020.09.09.,"제주도는 지난 5월부터 태양광 드론을 활용해 제주해안을 대상으로 괭생이모자반, 해양쓰레기, 공유수면 불법점유 등을 AI(인공지능) 기반으로 자동 분석하는 '해양환경 모니터링 서비스' 실증사업을 12월까지 진행하고 있다. 이는 국토교통부 추진, 항공안전기술원 주관의 '드론 실증도시 구축사업'의..."
1999,中企에 대기업 수준 AI 서비스 제공,2020.09.09.,정부가 민관 합동으로 인공지능(AI) 제조 데이터 플랫폼을 구축해 중소 제조기업에 대기업 수준의 AI 서비스를 제공하기로 했다. 중소벤처기업부는 그동안 전국에 구축된 중소기업 스마트공장의 제조 데이터가 회사 차원에 머물지 않고 AI와 빅데이터 분석을 통해 다른 회사들도 활용할 수 있도록 하겠다고...
2000,"퀄컴, 클라우드 AI 100 가속기 및 엣지 개발 키트 출하",2020.09.10.,"퀄컴 스냅드래곤 865 플러스 [사진 : 퀄컴] 퀄컴은 고성능 인공지능(AI) 추론 가속기 퀄컴 클라우드 AI 100을 선보인다고 17일 밝혔다. 퀄컴 클라우드 AI 100은 데이터센터, 클라우드 엣지, 엣지 어플라이언스, 5G 인프라 등 다양한 환경에서 AI 솔루션을 지원한다. AI 100 엣지 개발 키트는 5G 연결을..."
2001,"KT-네오밸류프라퍼티, 도심 복합문화공간 AI 심는다",2020.09.10.,"KT가 도심 복합문화공간에 인공지능(AI)을 심는다. KT(사장 구현모)는 부동산 개발 및 운영사인 네오밸류프라퍼티(대표 정종현)와 경기도 수원시 앨리웨이 광교에서 '부동산 개발 및 운영 사업협력을 위한 업무협약(MOU)'을 체결했다고 10일 발표했다. 협약식에는 김채희 KT AI/빅데이터사업본부장(상무), 정종현..."
2002,[호남대학교] 4차산업혁명 선도할 AI인재 '넥스트 챔피언' 키운다,2020.09.15.,"그동안 전교생 인공지능(AI)융합인재 양성과 AI인프라 구축, AI인재 장학금 지급 등의 체계적인 노력을 선제적으로 이어왔다. 이같은 노력이 최근 대내외에서 인정을 받았다. 최근 산업통상자원부 산업정책연구원(IPS)이 주관한 '2020 국가서비스대상'에서 '대학-AI(인공지능)특성화부문 대상'을 수상, 국내..."
2003,"한림대의료원, 국내 최초 낙상·욕창 실시간 예측 AI 모델 개발",2020.09.15.,"낙상 예측 AI 모델 화면 한림대학교의료원은 입원환자의 낙상과 욕창 발생 가능성을 실시간으로 예측해주는 인공지능(AI) 모델을 개발했다고 15일 밝혔다. 낙상, 욕창 등 병원 내 안전사고 예방을 위해 고안된 머신러닝 기반 AI 모델이 나온 것은 처음이다. 한림대의료원은 이번 AI 모델을 개발하기 위해 최근..."
2004,“카카오 들어오라” 윤영찬 문자에... 카카오 측 “뉴스 편집은 AI가”,2020.09.21.,"더불어민주당 윤영찬 의원이 카카오 포털 뉴스 편집에 문제를 제기하며 카카오 관계자를 국회로 부르라고 지시하는 것으로 해석되는 문자가 사진에 포착된 가운데, 논란이 불거지자 카카오 측이 “뉴스 편집은 인공지능(AI)이 한다”고 입장을 밝혔다. 8일 국회 본회의장에서는 윤 의원이 누군가에게..."
2005,"대전도시철도, AI로 고객안전 지키고, 경영효율 높인다",2020.09.13.,도시철도 이용객 이상행동 유형 (13종)©열린뉴스통신 대전시와 대전도시철도공사는 과학기술정보통신부가 주관한 '디지털 뉴딜 사업'인공지능(AI) 분야에 2건의 사업이 선정돼 국비 53억 원을 확보했다고 21일 밝혔다. 이번 사업 선정으로 전국에서 처음으로 도시철도에 인공지능이 도입돼 안전사고를 예방하고...
2006,"ETRI-서울대, 차세대 AI 반도체 전용소자 공동 개발한다",2020.09.13.,있는 인공지능(AI) 반도체 분야 기술 공유와 개발 협력으로 연구에 탄력이 붙을 전망이다. 한국전자통신연구원(ETRI)은 서울대 반도체공동연구소(소장 이종호)와 기관 간 반도체 연구시설을 공동 플랫폼으로 활용키로 하는 등 차세대 AI 반도체 분야 협력기반을 마련했다. 이로써 지난 30여 년간 국내 반도체...
2007,공교육으로 들어온 인공지능...'AI 수학' 등 신설,2020.09.15.,포쓰저널 강민혁 기­자 unha4th@gmail.com 고등학교 교육과정에는 인공지능(AI) 관련 과목이 첫 도입된다. 초등학생 수학교육에는 인공지능을 활용한 교육과정이 처음으로 시행된다.교육부는 13일 내년 2학기부터 고등학교에 '인공지능 기초'와 '인공지능 수학'을 고교 진로 선택 과목으로 신설하는 '초·중등교육...
2008,[글로벌] AI가 지구 감시? 알리바바의 'AI EARTH' 프로젝트,2020.09.15.,"구글 어스는 위성으로 촬영한 사진만을 제공했지만, 이제는 인공지능(AI)이 위성사진을 스스로 분석하는 서비스가 등장할 예정입다. 중국 매체 충칭천바오에 따르면, 알리바바그룹은 AI 지구 관측 엔진 'AI 어스(AI EARTH)'를 출시했습니다. AI 어스는 위성사진을 기반으로 토지의 변화를 스스로 분석합니다...."
2009,"하나銀, AI 챗봇 '하이' 상담 기능 강화",2020.09.15.,"하나은행은 대화형 인공지능 금융서비스 하이뱅킹의 상담 기능을 업그레이드 해 새로운 '하나원큐' 앱에 최적화된 AI(인공지능) 챗봇 서비스 '하이(HAI)'를 출시했다고 3일 밝혔다. 하이(HAI)는 지난 3월부터 하나금융융합기술원과의 협업을 통해 자체 개발한 자연어처리 AI 기술이 적용됐고, 은행업무 관련 상담..."
2010,"한림대의료원, AI 활용 낙상·욕창 실시간 예측 모델 개발",2020.09.10.,"좌측상단부터 시계방향으로 한림대성심병원, 한림대한강성심병원, 한림대동탄성심병원, 한림대춘천성심병원, 한림대강남성심병원 한림대의료원이 입원환자의 낙상과 욕창 발생 가능성을 실시간으로 예측하는 인공지능(AI) 모델을 개발해 주목된다. 낙상과 욕창 등 병원 내 안전사고 예방을 위해 고안된..."
2011,"네이버-연세대, AI 우수 인재 발굴 위해 맞손",2020.09.10.,네이버와 연세대학교가 인공지능(AI) 교육과 산학 협력 프로젝트를 위해 손을 잡았다. 네이버는 연세대와 AI 하드웨어 및 소프트웨어 관련 교육·산학 프로그램 협력을 위한 ‘네이버 클로바 AI-연세대학교 전기전자공학부 IT 기술 혁신 및 경영 강의 교육 업무 온라인 협약식’을 진행했다고 10일 밝혔다.이번...
2012,"광주테크노파크, 1000억 규모 AI 투자펀드 유치설명회 참여기업 모집",2020.09.17.,광주테크노파크가 인공지능산업융합사업단과 공동으로 1000억원 규모의 '인공지능(AI) 투자펀드' IR 참여기업을 모집한다. 과학기술정보통신부와 광주시가 추진하는 '인공지능 중심 산업융합 집적단지 조성' 사업의 일환으로 추진 중인 '인공지능(AI) 투자펀드'는 양 기관에서 공동으로...
2013,"호남대, AI석학들 통찰력 모은 ‘빅데이터 워크숍’",2020.09.10.,"호남대학교(총장 박상철)가 인공지능시대 미래교육과 산업현장에 필요한 인재양성을 위해 마련한 빅데이터 워크숍에서 국내외 AI 석학들이 인공지능, 빅데이터 현장의 기술과 비전을 지역사회와 공유했다.호남대학교 AI빅데이터연구소(소장 백란교수)는 한국멀티미디어 학회(여과총 협력), 4차산업혁명..."
2014,"광주TP, ‘인공지능(AI) 투자펀드’ 투자유치설명회 참여기업 모집",2020.09.13.,"광주테크노파크(원장 김선민)가 인공지능산업융합사업단(단장 임차식)과 공동으로 총1,000억원 규모의 “인공지능(AI) 투자펀드” IR 참여기업을 모집한다. 과학기술정보통신부와 광주광역시가 추진하는 ‘인공지능 중심 산업융합 집적단지 조성’ 사업의 일환으로 추진 중인 “인공지능(AI) 투자펀드”..."
2015,"한국인공지능협회, 20개 기업과 '서울형 뉴딜 일자리 인공지능 AI 데이터 구축...",2020.09.15.,서울형 일자리 뉴딜 인공지능(AI) 학습데이터 구축사업의 성공을 위해 협회와 참여 기업은 인턴십을 통해 선발된 참여자의 체계적 관리와 직무에 대한 교육 및 훈련을 진행하고 이들을 통해 활용 가능한 공공 개방형 데이터를 수집 및 구축한다. 특히 인턴십 참여자들이 수료 후 AI·데이터 기업에 취업한 뒤...
2016,"KT, 네오밸류프라퍼티와 앨리웨이 광교에 AI 환경 조성",2020.09.15.,"협약식에는 김채희 KT 인공지능(AI)·빅데이터(BigData)사업본부장 상무, 정종현 네오밸류프라퍼티 정종현 대표 등 양사의 주요 관계자들이 참석했다. 네오밸류프라퍼티는 부동산 개발 전문회사인 네오밸류의 자회사로 복합문화공간 앨리웨이 광교 등을 운영하고 있으며 앨리웨이 운영 노하우를 살려 부동산..."
2017,"한국 AI, IT강국 인프라 최고나 'AI 생태계'는 취약",2020.09.15.,"전경련은 코로나19에도 불구하고 빠르게 성장하는 글로벌 인공지능(AI)시장에서의 경쟁을 위해 정부의 투자지원, 빈약한 인력풀, 규제에 막힌 산업여건 등에서 개선이 필요하다고 강조했다. 사진=픽사베이 지난 2월 세계경제포럼(WEF, World Economic Forum)에서 발표된 '글로벌 AI 인덱스'에 의하면..."
2018,"IBK기업은행, 25일부터 'AI 부동산 자동심사 시스템' 도입",2020.09.15.,"IBK기업은행은 국내 최초로 인공지능(AI)을 활용해 부동산 담보대출 가능 금액을 심사하는 'AI 부동산 자동심사 시스템'을 25일부터 도입 예정이라고 밝혔다. 'AI 부동산 자동심사 시스템'은 국토교통부, 법원, 국토정보공사 등에서 수집한 공공데이터를 바탕으로 AI가 서류발급, 권리분석, 규정검토 등을 수행해..."
2019,"카카오엔터프라이즈, 내업무를 도와주는 AI '카카오워크' 공개",2020.09.17.,"카카오워크는 카카오의 메신저 서비스 노하우와 인공지능(AI), 검색 기술력을 결합해 언택트 시대에 최적화한 업무 환경을 제공한다. ▲카카오톡처럼 편리한 사용성 ▲다양한 IT 서비스와의 유연한 연결과 확장 ▲AI 및 통합 검색 기술력과 보안 등 세 가지가 핵심이다. 카카오엔터프라이즈는 카카오워크..."
2020,"클리노믹스, ‘폐암 예후예측 인공지능 데이터 구축사업’ 주관기관 선정",2020.09.15.,［메디컬투데이 손수경 기자］ 클리노믹스는 과학기술정보통신부가 주관하는 ‘2020년도 인공지능(AI) 학습용 데이터 구축사업(2차)’ 과제 주관기관으로 최종 선정됐다고 22일 밝혔다. 인공지능(AI) 학습용 데이터 구축사업은 과학기술정보통신부와 한국정보화진흥원이 추진하는 디지털 뉴딜사업의 일환이다....
2021,"기계연, 7개 모듈 구성 AI 작업로봇 개발",2020.09.14.,"과학기술정보통신부 산하 한국기계연구원(원장 박상진, 이하 기계연)은 변종(變種)· 변량(變量)의 다양한 제조환경에 맞춰 활용할 수 있는 &apos;모듈형 AI(인공지능) 기반 자율작업 로봇&apos;을 개발했다고 10일 밝혔다. &apos;모듈형 AI 기반 자율작업 로봇&apos;은 생산현장에서 필요한 기능에 따라 물품의 이송이나..."
2022,"포티투마루, 디지털 뉴딜 사업 AI 분야 수행 기업으로 선정",2020.09.09.,"이주상 기자 | 인공지능(AI) 스타트업 포티투마루(42Maru, 대표 김동환)가 디지털 뉴딜 정책 사업 중 'AI 학습용 데이터 구축 사업'의 주요 수행기업으로 선정되었다고 밝혔다. 포티투마루는 총 사업비 172억원 규모의 디지털 뉴딜 사업 주관 및 참여기업으로 선정되어 협약을 완료했고, 이 중 포티투마루가..."
2023,"SKT, 'ai.x 2020 컨퍼런스' 개최 ""팬데믹 시대의 AI 역할 찾을 것""",2020.09.11.,"올해 3회째…'인간·기계·함께하는 경험' 주제로 AI 역할·발전 방향 논의 SK텔레콤이 신종 코로나바이러스 감염증(코로나19) 이후의 뉴노멀 시대, 인간과 인공지능(AI)이 함께 미래의 발전 방향을 모색한다. 9일 SK텔레콤은 국내외 저명 AI 전문가들이 참여해 AI를 활용한 현재와 미래의 위기 극복 방안을..."
2024,"광주시-애자일소다, AI 비즈니스 기반 조성 협력",2020.09.11.,"인공지능(AI) 스타트업 애자일소다는 11일 광주형 AI 비즈니스 기반 조성을 위한 업무협약을 체결했다. 광주시는 올해부터 10년간 1조원의 예산을 투입해 AI 중심 산업융합 집적단지를 조성하고, 비즈니스 생태계를 만든다. 애자일소다는 AI 인력 양성과 역량 강화를 위해 그간의 경험과 노하우를 공유할..."
2025,"광주시, S-Energy그룹과 '광주형 AI-그린뉴딜' 업무협약",2020.09.10.,"든든한 동반자를 얻은 것이다""면서""S-Energy그룹과 협력해 에너지자립 도시를 실현함으로써 광주가 가장 안전하고 깨끗한 살기 좋은 글로벌 녹색도시로 도약하여 인공지능 중심도시 광주를 통해 4차 산업혁명을 선도해 나가겠다""고 밝혔다. ©AI타임스 【에이아이타임스 aitimes 에이아이타임즈】"
2026,"중기부, AI 제조 플랫폼 사업자로 'NHN-KT 컨소시엄' 선정",2020.09.09.,"NHN 컨소시엄은 NHN과 KT가 보유한 대규모 인프라와 안정적인 운영 능력뿐만 아니라 브라이틱스 에이아이(Brightics AI), 아이센트로(AICentro), 티쓰리큐 에이아이(T3Q.ai), 아이브랩(AIBLab) 등 다양한 인공지능(AI) 플랫폼 서비스를 선택해 활용할 수 있게 제공한다는 측면을 인정받았다. 그간 중소 제조기업은..."
2027,"네이버 AI 연구원, 연세대 출강…우수인재 양성 '맞손'",2020.09.09.,네이버와 연세대가 인공지능(AI) 우수 인재를 발굴한다. 10일 네이버는 연세대학교와 AI 하드웨어 및 소프트웨어 관련 교육/산학 프로그램 협력을 위한 '네이버 클로바 AI - 연세대학교 전기전자공학부 IT 기술 혁신 및 경영 강의 교육 업무 온라인 협약식'을 진행했다고 발표했다. 이번 협약으로 네이버는...
2028,"초등 1·2학년, 오늘부터 인공지능 수학교육 받는다",2020.09.09.,"교육부는 초등학교 저학년(1, 2학년)을 대상으로 인공지능(AI)을 활용한 ‘똑똑! 수학탐험대’ 서비스를 14일부터 전국 모든 초등학교에 제공한다고 밝혔다. 또한, 내년 2학기부터 고등학교에서 ‘인공지능 기초’와 ‘인공지능 수학’ 과목을 선택할 수 있도록 지난 11일 교육과정 일부 개정안(과목 신설)을..."
2029,"LG, AI 기반 첨단소재 개발…加 토론토대·佛 토탈 협력",2020.09.09.,"LG가 친환경 촉매 및 첨단소재 분야에서 인공지능(AI)과 로봇 기술을 활용한 혁신을 선도한다. LG사이언스파크는 캐나다 토론토대학교와 맥마스터대학교, 프랑스 에너지∙석유회사 토탈(Total)과 함께 ‘AI 기반 소재 개발 컨소시엄(A3MD)을 결성, 공동연구를 추진한다고 13일 밝혔다. A3MD는 AI를 활용한 소재..."
2030,"反中 AI 연합전선 만드나…미 국방부 AI 국제회의, 한국 참가",2020.09.10.,"미국이 동맹국과 우호국을 모아 국방 인공지능(AI) 국제회의를 열었다. 미국은 부인하지만, 중국을 겨냥한 AI 연합전선을 만들려는 의도로 보인다. 미국 국방부 합동인공지능센터(JAIC)는 15~16일(이하 현지시간) ‘국방을 위한 AI 파트너십’ 회의를 연다. 신종 코로나바이러스 감염증(코로나19) 확산 우려..."
2031,"[더파워뉴스]제타미디어, 영화에 나오는 음식을 AI가 찾아주는 사물인식 서비...",2020.09.10.,제타미디어(대표 김욱)은 자사 영화 스트리밍 서비스 ‘비플릭스(BFLIX)’가 얼굴인식 기술을 활용해 영화에 나오는 음식을 인공지능(AI)이 찾아주는 커머스 연계 사물인식 서비스를 시범 오픈했다고 25일 밝혔다. 제타미디어는 한국전자통신연구원(ETRI)과 함께 AI 안면인식 원천 기술을 활용해 딥러닝 기반의...
2032,"예술작품 통해 보는 기계와 인간의 소통은 어떨까?광주문화재단, '인공 공감'...",2020.09.14.,"'기계와 인간의 소통' 예술로 만나볼까 광주문화재단 10월 23일까지 미디어338 기획전'인공 공감' 인공지능 활용 설치 작품 등 선봬 다가오는 인공지능(AI) 시대, 기계 인간과의 대화가 현실화되고 있는 상황에서 기계와 인간의 진정한 소통과 교감은 가능한가를 묻는 전시가 열린다. 광주문화재단은..."
2033,"""비 오기 직전 AI가 예측해 자동할인…물류·재고비용 낮춰""",2020.09.13.,"그에 따르면 징둥의 재고는 날씨를 인식한 인공지능(AI)의 판단에 따라 변동된다. 허우 CEO는 ""비가 오면 수요가 떨어진다""며 ""비가 오기 직전에 할인해서 재고를 최소화하는 '자동 할인' 시스템을 구축했다""고 설명했다. 이 같은 첨단 기술을 도입할 때 철저히 고객 입장에서 생각하는 시각이 중요하다고도..."
2034,"자율주행 전문기업 에티포스·테너지소프트, 인공지능 중심도시 광주와 손 잡...",2020.09.17.,"임용제 에티포스 대표이사는 ""앞으로 맞이하게 될 4차 산업혁명 시대에 광주광역시와 협력을 통해 부족한 기술 및 인적자원의 확보와 육성을 위해 최선을 다 하겠다""고 말했으며, 전춘석 테너지소프트 대표이사는 ""광주광역시가 추진하는 자율주행 AI전문기업 인공지능 중심도시에 참가할 기회를..."
2035,"한림대의료원, 국내 최초 ‘낙상·욕창 실시간 예측 AI 모델’ 개발",2020.09.11.,"한림대학교의료원은 입원환자의 낙상과 욕창 발생 가능성을 실시간으로 예측해주는 인공지능(AI) 모델을 개발했다. 낙상, 욕창 등 병원 내 안전사고 예방을 위해 고안된 머신러닝 기반 AI 모델이 나온 것은 처음이다. 낙상과 욕창은 원내감염과 더불어 병원이 환자안전을 위해 가장 중요하게 여기는 부분이다...."
