,제목,날짜,본문
683,D.N.A 정책 성과 ‘데이터 시장 15.5조·5G가입 785만명·AI매출 2900억원',2020.09.24.,"한국판 뉴딜의 일환으로 2020년 양성되는 인공지능?소프트웨어(AI?SW) 핵심인재는 1만명 규모다. 산업 전반의 디지털 전환도 빠르게 진행하고 있어, 4차산업혁명 기술 개발 및 활용 기업수는 1500개(2018년 기준)로 전년대비 47.9% 증가했다. 특히 의료산업에서 의료기관 간 진료정보 전자교류..."
684,"광주시-㈜제타뱅크·㈜헬스허브, '인공지능 비즈니스 기반 조성' 업무협약",2020.09.23.,"이용섭 시장은 ""AI기업들이 광주에서 많은 성과를 창출할 수 있도록 인공지능 생태계 기반조성에 최선을 다하고 있다. 유치된 인공지능 기업들과 지속적인 협력 네트워크를 통해 AI기업들도 크게 성장하고 지역의 새로운 일자리도 많이 창출될 수 있도록 모든 역량을 집중하겠다""고 말했다."
685,"SK㈜ C&C ""내 목소리로 AI 보이스...20분만 녹음하면 돼""",2020.09.23.,"SK㈜ C&C는 23일 라이언로켓과 ‘인공지능(AI) 텍스트 음성 변환(TTS, Text To Speech) 사업 협력 협약(MOU)’을 화상회의를 통해 체결했다고 밝혔다. 라이언로켓은 AI를 활용해 화자의 목소리와 말투를 완벽하게 모사하는 음성합성 기술을 보유한 스타트업이다. 지난 4.15총선 관련 ‘선택 2020’ MBC 개표방송에서..."
686,"과기부, AI 학습용 데이터 품질관리 강화…'품질 자문위' 운영",2020.09.23.,과학기술정보통신부는 디지털 뉴딜 '디지털 댐'의 기초이자 핵심인 인공지능(AI) 학습용 데이터 구축사업의 성공적 추진을 위한 핵심관건인 데이터 품질관리 체계를 글로벌 수준으로 대폭 강화한다고 22일 밝혔다. 인공지능(AI) 서비스 개발에 필수적인 인공지능(AI) 학습용 데이터를 대규모로 구축·개방하는...
687,"고려대 컴퓨터학과, AI 질의응답 국제대회에서 2년 연속 '1위'",2020.09.23.,"고려대 컴퓨터학과, AI 질의응답 국제대회에서 2년 연속 '1위' BioASQ 대회에서 미국 캘리포니아대학 샌디에고, 매사추세츠대학 등 제쳐 강재우 교수팀, 의학·생물학 질문에 답하는 인공지능 모델 개발 기념촬영을 하고 있는 고려대 컴퓨터학과 연구진/고려대 제공 고려대(총장 정진택)는..."
688,"고려대 컴퓨터학과, AI 질의응답 국제대회에서 2년 연속 '1위'",2020.09.27.,"고려대 컴퓨터학과, AI 질의응답 국제대회에서 2년 연속 '1위' BioASQ 대회에서 미국 캘리포니아대학 샌디에고, 매사추세츠대학 등 제쳐 강재우 교수팀, 의학·생물학 질문에 답하는 인공지능 모델 개발 기념촬영을 하고 있는 고려대 컴퓨터학과 연구진/고려대 제공 고려대(총장 정진택)는..."
689,"콤텍시스템, 글로벌 AI 스토리지 제조사 ‘베스트 데이타(VAST Data)’ 한국 ...",2020.09.23.,콤텍시스템은 인공지능(AI) 스토리지 전문 글로벌 기업 ‘베스트 데이타(VAST Data)’의 AI 전용 스토리지를 한국 시장에 독점적으로 공급하는 계약을 체결했다고 28일 밝혔다. 이번 협력은 최근 디지털 뉴딜로 국내 대형 클라우드 사업자 및 지자체들이 추진 중인 AI 데이터 센터 시장에 진출하기 위함이다....
690,"KAIST, 한국인의 감성 인식 인공지능 빅테이터 구축한다",2020.09.23.,KAIST 문화기술대학원 박주용 교수 연구팀은 한국인의 감정을 인지할 수 있는 감성 기술과 지능형 영상 요약기술 개발을 위한 인공지능 빅데이터 구축 사업을 통해 코로나 이후 새로운 인공지능산업 창출에 적극적으로 나설 계획이라고 24일 밝혔다. 현재 인공지능은 질병 진단과 자율운전 등 인간의...
691,"AI음성인식 '5G무인지게차', 산업현장 달린다...KT·현대건설기계 협력 본궤도",2020.09.24.,"이후 5G, 인공지능(AI), 빅데이터(Big Data), 클라우드(Cloud) 등 정보통신기술(ICT)을 기반으로 디지털 혁신(DX·Digital Transformation) 사업화를 위한 실증사업을 추진했다. 이번 행사에서 양사는 협업으로 공동개발 한 ▲5G 기반 무인지게차 원격관리 제어 기술 ▲AI 기반 무인지게차 긴급 음성제어 기능 ▲3차원..."
692,주담대 얼마까지 나오나요? AI가 3분 내 알려준다,2020.09.24.,"기업은행이 국내 최초로 인공지능(AI)을 활용한 부동산 담보대출 자동심사 시스템을 오는 25일부터 도입할 예정이라고 22일 밝혔다. 그동안의 부동산 담보대출 상담은 확인이 필요한 서류도 많고 관련 규정도 적지 않아 짧게는 1시간, 길게는 며칠이 필요했다. 고객 역시 몇 차례에 걸쳐 은행에 방문하는..."
693,"엔쓰리엔클라우드-배재대학교, 인공지능 인재 양성 협력",2020.09.22.,"이번 업무협약에 따라 양 기관은 인공지능(AI) 및 4차 산업혁명 혁신 목적에 부합하는 특화된 교육과정에 직간접으로 참여하게 된다. 또한 지역산업 발전과 우수한 인재 양성을 위한 교육과정 개발 및 운영 지원, 연구 프로젝트 사업지원, 교육현장 실습 및 취업지원 등을 지원할 예정이다...."
694,"AI가 작곡까지…지니뮤직, AI앨범 '신비와 노래해요' 출시",2020.09.22.,"/ 지니뮤직 인공지능(AI) 기술이 음악창작 영역으로 확장되고 있다. 지니뮤직은 국내 음악플랫폼 업계 최초로 인공지능(AI) 동요앨범 '신비와 노래해요'를 출시했다고 24일 밝혔다. 지니뮤직은 올초 AI 창작영역 진출을 위해 CJ ENM, 강소기업 업보트 엔터테인먼트와 사업제휴를 맺고 AI 작곡프로젝트를..."
695,SK그룹의 첫 AI 별도 법인… '가우스랩스' 출범,2020.09.24.,인공지능(AI) 솔루션을 통해 제조 혁신을 이끌 산업용 AI 전문회사 '가우스랩스(Gauss Labs Inc.)'가 출범했다. 가우스랩스는 지난달 미국 실리콘밸리에 본사를 설립한데 이어 이달 말 한국 사무소를 설립한다고 22일 밝혔다. 자본금은 5천 5백만 달러 규모로 2022년까지 SK하이닉스가 전액 투자한다. 그...
696,"""대한민국 AI 1등 위해 의기투합"" AI원팀 협력 성과 연내 가시화",2020.09.24.,"[사진=KT 제공] 대한민국 인공지능(AI) 1등을 위해 의기투합한 AI 원팀(One Team)의 연구성과가 이르면 올해 중 산업현장에 적용된다. 통신부터 금융, 제조업, 학계 등 다양한 산업계가 AI를 기반으로 디지털 혁신을 추진할 수 있도록 돕겠다며 출범한 AI원팀의 구상이 가시화되는 모습이다. KT는 지난 25일..."
697,"교보생명, 한층 똑똑해진 AI 챗봇 '러버스 2.0' 오픈",2020.09.22.,"언택트 시대에 발맞춰 교보생명이 한층 똑똑해진 인공지능(AI) 챗봇을 선보인다. 교보생명은 AI 전문기업 카카오엔터프라이즈와 함께 카카오 AI 챗봇 '러버스 2.0'을 개발·오픈했다고 22일 밝혔다. 포스트 코로나 시대에 대비한 '디지털 교보 2020'의 일환으로, AI 기술을 한발 앞서 보험업무에 적용하고 언택트..."
698,AI·소부장 분야 중소기업 전문인력 양성…주관 대학 모집,2020.09.22.,"중소벤처기업부는 인공지능(AI)과 소재·부품·장비 분야 중소기업 전문인력을 양성하는 '중소기업 계약학과'를 설치·운영할 주관 대학을 내일(23일)부터 다음 달 22일까지 모집한다고 오늘(22일) 밝혔습니다. 이번에 모집하는 중소기업 계약학과는 인공지능 분야에서 석·박사 학위과정 3개 학과, 소재·부품..."
699,"“내년 전 학과에 AI융합과목 개설할 것” 황준성 숭실대 총장, AI융합형 인재...",2020.09.22.,"3 숭실대 교무처장 1999~2000 독일 프라이부르크대학교 초빙교수 1996~1997 통일원 정책자문위원 1993 숭실대 경제통상대학 경제학과 교수 숭실대 경제학 학사, 베를린자유대 대학원 경제학 석·박사 [한경 잡앤조이=이진호 기자] 창학 123주년을 맞은 숭실대가 오는 10월 7일 ‘인공지능(AI) 비전 선포식’을..."
700,"AI에 예능·드라마 8주 보여주자···""개짜증"" 거친말 내뱉었다",2020.09.22.,"""오늘 유치원에서 뭐했어?"" 엄마가 아이 얼굴을 한 인공지능(AI) 캐릭터에 다정하게 말을 건넨다. 아이는 ""유치원엔 찌질한 애들뿐이라 노잼이야""라고 투덜댄다. 엄마가 ""나쁜 말 쓰면 안 된다고 했지?""라고 타이르자, 이내 아이는 ""엄마도 나쁜 말 썼잖아. 개짜증나""라고 고개를 돌려버린다. LG유플러스..."
701,광주 인공지능 종합지원 전문 멘토단이 떴다,2020.09.23.,"▲ 이용섭 광주광역시장이 25일 오후 북구 광주테크노파크 대회의실에서 열린 인공지능종합지원 멘토단 발대식에 참석해 연구원, 인공지능(AI)기업 대표 등 전문들가로 구성된 멘토단과 기념촬영을 하고 있다. 광주에 둥지를 튼 인공지능 관련 기업들이 글로벌 역량을 갖춘 강소기업으로 성장할 수 있도록 돕기..."
702,성우 영역까지 넘보는 SK㈜ C&C AI 기술…라이언로켓과 협력,2020.09.23.,20분 정도의 음성녹음 파일만 있으면 자신의 목소리를 닮은 인공지능(AI) 보이스를 만들 수 있게 된다. SK㈜ C&C는 23일 라이언로켓과 ‘AI 텍스트 음성 변환(TTS) 사업 협력 협약(MOU)’을 체결했다고 밝혔다. 코로나 19로 인한 사회적 거리두기 차원에서 화상회의로 진행된 이번 협약식에는 SK㈜ C&C 이석진 채널...
703,"서초, AI 방역로봇이 버스터미널 발열 체크",2020.09.23.,"서울 서초구가 추석 명절을 앞두고 코로나19 확산을 방지하기 위해 서울고속버스터미널, 센트럴시티터미널, 서울남부터미널에 적외선 카메라와 안면인식 기술이 탑재된 인공지능(AI) 방역로봇을 배치했다. 22일 서초구에 따르면 구는 각 터미널에 한 곳씩 AI 방역로봇을 배치하고 추석 연휴 기간 경부선과..."
704,"여수시, AI·IoT 기반 어르신 비대면 건강관리서비스 시행",2020.09.22.,여수시가 보건복지부 공모사업 선정으로 AI·IoT(인공지능·사물인터넷) 기반 어르신 건강관리서비스사업을 실시한다.시는 다음 달 7일까지 고혈압·당뇨 등 만성질환자와 건강 행태 개선이 필요한 65세 이상 어르신 668명을 모집한다. 참여자에게는 건강 상태에 따라 스마트폰과 연동되는 활동측정기...
705,"포스코, AI 아카데미 교육생 모집",2020.09.22.,"포스코는 다음달 4일까지 인공지능·빅데이터 아카데미 교육생을 모집한다. 만 34세 이하 4년제 대학 졸업자 또는 1년 이내 졸업 예정자가 대상이다. 포스텍 인공지능연구원에서 11월 2일부터 12월 30일까지 9주간 프로그래밍, 인공지능과 빅데이터 분석 이론 및 실습, 실무과제 수행 등을 집중 교육한다."
706,AI·소부장 중소기업 계약학과 5곳 새로 만든다,2020.09.22.,정부가 AI(인공지능)와 소재·부품·장비 분야 전문인력을 키우기 위한 중소기업 계약학과 주관대학 5곳을 신규 모집한다. 주관대학에는 학기당 3500만원의 학과 운영비와 학생 등록금이 지원된다. 중소벤처기업부는 중소기업 계약학과를 설치‧운영할 주관대학을 이달 23일부터 다음달 22일까지 모집한다고...
707,"한전, 인공지능 활용해 고독사 막는다",2020.09.22.,한국전력공사(대표 김종갑)는 22일 제주특별자치도 서귀포시청에서 서귀포시·SK텔레콤과 &apos;인공지능(AI) 활용 사회안전망 서비스 제공을 위한 업무협약(MOU)&apos;을 체결했다고 밝혔다. 이번 MOU는 1인 취약가구들의 사회안전망 강화를 위해 한국전력과 SK텔레콤의 빅데이터를 활용한 &apos;1인가구 안부살핌...
708,엑소브레인·자율주행 인공지능 기술…ETRI 국산 AI 연구성과 공개,2020.09.21.,"한국전자통신연구원(ETRI)은 ‘2020 인공지능연구소 테크데이’를 22일 온라인으로 개최, 인공지능(AI) 관련 중점 연구개발 성과를 발표한다고 21일 밝혔다. ETRI는 인공두뇌 엑소브레인등 인공지능연구소에서 중점적으로 연구개발 하고 있는 AI 관련 9개 분야 핵심기술에 대한 주제발표와 14개 기술개발 성과를..."
709,‘데이터 댐’을 이끌 최고 수준 AI 대학·전문기업의 도전과 경쟁,2020.09.21.,"공고문 등 자세한 내용은 정보통신기획평가원, 인공지능 그랜드 챌린지, AI허브 홈페이지에서 확인할 수 있다.이번 대회는 코로나19 확산 방지를 위해 드론 세트장이 필요한 제어지능 트랙을 제외한 나머지 7개 트랙은 11월 3주(11.16~11.20) 온라인을 통해 진행되며, 제어지능 트랙과 시상식은 현장(11.25..."
710,"KT-현대건설기계, AI 음성인식 '5G 무인지게차', 산업현장 달린다",2020.09.21.,"이후 5G, 인공지능(AI), 빅데이터(Big Data), 클라우드(Cloud) 등 ICT를 기반으로 디지털 혁신(DX, Digital Transformation) 사업화를 위한 실증사업을 추진했다. 이번 행사에서 양사는 협업으로 공동개발 한 5G 기반 무인지게차 원격관리 제어 기술 AI 기반 무인지게차 긴급 음성제어 기능 3차원 무인지게차 측위..."
711,인공지능과 인간의 창작대결 지니 창작동요 공모전 열린다!,2020.09.24.,행사이미지 음악플랫폼업계 최초 AI 동요앨범 '신비와 노래해요'를 출시한 지니뮤직(대표 조훈)은 'AI와 인간의 창작 대결 – 지니 창작동요 공모전'이 개최된다. 이번 공모전은 최근 지니뮤직이 새롭게 선보인 AI작곡 시스템으로 창작되는 동요와 인간의 창작곡이 대결을 벌이는 컨셉으로 진행된다....
712,20분이면 문자→음성 변환 뚝딱…SK㈜ C&C ‘AI보이스’ 개발,2020.09.23.,SK㈜ C&C가 문자를 음성으로 바꾸는 AI(인공지능) 기술을 개발해 콘텐츠 발굴에 적극 나선다. SK㈜ C&C는 음성합성 스타트업 라이언로켓과 ‘AI 텍스트 음성 변환(TTS) 사업’ 협약(MOU)’을 체결했다고 23일 밝혔다. 양사는 각 사가 보유한 자연어 처리 및 텍스트 음성 변환 고유 기술을 결합해 문화 및 교육 분야를...
713,"SK, 인공지능 전문회사 '가우스랩스' 출범",2020.09.23.,"SK그룹 내에서 인공지능(AI) 솔루션을 통해 제조혁신을 이끌 산업용 AI 전문회사 ‘가우스랩스(Gauss Labs Inc.)’가 출범했다. 가우스랩스는 지난달 미국 실리콘밸리에 본사를 설립한데 이어 이달 말 한국 사무소를 설립한다고 22일 밝혔다. 자본금은 5500만달러 규모로, 2022년까지 SK하이닉스가 전액..."
714,"트위그팜, '인공지능 학습용 데이터 구축' 사업 주관기관 선정",2020.09.22.,"사진제공/트위그팜 자연어 처리 연구기업인 트위그팜이 과학기술정보통신부가 주관하고 한국정보화진흥원이 추진하는 '인공지능(AI) 학습용 데이터 구축' 사업의 수행기관으로 선정됐다고 28일 밝혔다. 이번 사업은 트위그팜을 주관사로 ICT 시험인증 및 표준화 기관 '한국정보통신기술협회(TTA)', AI 통·번역..."
715,광주혁신추진위 ‘인공지능도시 광주’ 국가정책화 권고,2020.09.22.,"이에 혁신추진위에서는 ‘인공지능강국 대한민국을 선도할 인공지능중심도시 광주 조성’을 목표로 ▲정부정책을 선도하는 인공지능 정책 수립·시행 ▲기술혁신 플랫폼, 인력양성 등 AI허브 기반 강화 ▲시 미래전략산업으로 AI기반 융합산업 육성 ▲스마트공장·규제자유구역·창업·벤처 등 정책수단 활용..."
716,"'내 손 안에 AI친구'…카카오엔터, 음성인식 '미니링크' 출시",2020.09.22.,"(사진=카카오엔터프라이즈)[이데일리 유태환 기자] 이제 장소에 구애 없이 야외, 차 안, 내 방 등 내가 있는 공간 어디에서든 인공지능(AI) 친구를 만날 수 있다. 카카오엔터프라이즈(대표 백상엽)는 인공지능 플랫폼 ‘카카오 i’를 탑재한 음성 인식 컨트롤러 ‘미니링크(mini LINK)’를 출시했다고 21일 밝혔다...."
717,[스페셜 리포트] ⓛ '낯선 지능'과 함께 살아가기,2020.09.23.,인공지능(AI)의 급속한 발전은 사람들에게 새로운 세계에 대한 희망과 함께 큰 두려움도 던졌다. 조지 오웰의 '1984'가 현실화되는 것 같다는 걱정도 여기저기서 들린다. 알고리즘의 편향성에 대한 진지한 논의도 가속화되고 있다. 인간의 개입을 최소화하는 AI학습과정은 블랙박스라고 한다. 의료 및 헬스케어...
718,"한국공항공사, AI 기반 수어 안내시스템 시연회",2020.09.23.,한국공항공사는 23일 국제연합(UN)이 정한 '세계 수어의 날'을 맞아 김포공항 국내선청사에서 인공지능(AI) 기반의 수어 안내시스템 시연회를 개최했다고 밝혔다. 시연된 수어 안내시스템은 공사가 한국전자기술연구원과 나사렛 대학교가 공동으로 개발하고 있다. AI 기반의 딥 러닝 기술을 적용해...
719,SK(주) C&C “20분 녹음하면 내 목소리로 AI보이스 가능”,2020.09.23.,SK㈜C&C는 23일 라이언로켓과 ‘인공지능(AI) 텍스트 음성 변환(TTS) 사업 협력 협약(MOU)’을 체결했다고 밝혔다. 코로나 19로 인한 사회적 거리두기 차원에서 화상회의로 진행된 이번 협약식에는 SK㈜C&C 이석진 Channel & Marketing 그룹장과 정승환 라이언로켓 대표 등 관계자들이 참석했다. 라이언로켓은 AI를...
720,"'자문위원 영입' 현대·기아차, 인공지능 기술 개발 전문성 제고",2020.09.24.,Rus) 교수를 인공지능(AI) 기술 자문위원으로 영입해 다양한 프로젝트를 진행 중이라고 24일 밝혔다. 구체적으로 현대·기아차는 자문위원들을 통해 AI를 기반으로 △신사업 기획 및 기술 전략 수립 △글로벌 연구 조직 구축 △연구 인프라 확보를 위한 투자 방향 수립 등 그룹의 미래 산업 경쟁력 강화를...
721,"현대·기아차, AI 분야 석학 기술 자문위원 영입",2020.09.24.,현대·기아차가 인공지능(AI) 분야 최고 석학으로 손꼽히는 미국 메사추세츠 공과대학(MIT)의 토마소 포지오 교수와 다니엘라 러스 교수를 자문위원으로 영입해 다양한 프로젝트를 진행 중이라고 24일 밝혔다. 현대·기아차는 AI 기술 자문위원들을 통해 인공지능을 기반으로 ▲신사업 기획 및 기술 전략 수립...
722,"인텔, AI·비전 성능 강화한 차세대 IoT·산업용 프로세서 공개",2020.09.24.,"‘2020 인텔 인더스트리얼 서밋’ 행사에서 공개한 11세대 코어 프로세서와 아톰 x6000E 시리즈, 펜티엄, 셀러론 N 및 J 시리즈 프로세서는 다양한 산업 분야에서 향상된 인공지능(AI), 보안, 기능 안전, 실시간 처리 성능을 제공한다. 아톰 x6000E 시리즈와 펜티엄, 셀러론 N, J 시리즈 프로세서는 인텔..."
723,'한국판 뉴딜' 6년간 AI 융합인재 '1만9500명' 육성,2020.09.24.,(과기정통부 제공) 정부가 올해 1800명을 시작으로 오는 2025년까지 6년간 1만9500명의 '인공지능(AI) 융합인재'를 육성한다. 이를 위해 과학기술정보통신부는 산업전문인력 인공지능(AI) 역량강화사업 대상 6대분야 협·단체 및 기업을 대상으로 22일 반도체 기업인 오픈엣지테크놀로지에서 착수보고회 겸 간담회를...
724,"[AI대학원 가이드] (중) AI교수 5인이 말했다 ""AI대학원에선 이런 공부한다""",2020.09.24.,과학기술정보통신부는 지난해 9월 포스텍을 2기 ‘인공지능(AI) 대학원’으로 선정했다. AI 대학원은 AI 핵심지식과 역량을 갖춘 석박사급 전문인력을 양성하기 위해 정부 지원으로 개설되는 대학원으로 같은 해 3월 AI 대학원 1기 3곳을 선정했다. 이들 대학원에 5년간 총 90억 원을 지원한다. 향후 평가를 통해...
725,"기업은행 주담대... ""주소만 입력하면 3분안에 AI가 다 해요""",2020.09.24.,"IBK기업은행이 국내 최초로 AI(인공지능)으로 부동산 담보대출 가능 금액을 심사하는 'AI 부동산 자동심사 시스템'을 25일 도입한다. 22일 기업은행에 따르면 'AI 부동산 자동심사 시스템'은 국토교통부와 법원, 국토정보공사 등에서 수집한 공공데이터를 기반으로 AI가 서류발급, 권리분석, 규정검토 등을 통해..."
726,"철강협회, AI 전문인력 양성한다",2020.09.24.,과기부 '2020년 산업 전문 인력 AI 역량강화' 사업 선정 한국철강협회와 한국디지털융합진흥원이 철강산업 분야 인공지능(AI) 전문 인력을 양성한다.한국철강협회는 디지털융합진흥원와 함께 과학기술정보통신부가 공모한 ‘2020년 산업 전문 인력 AI 역량강화’사업에 선정됐다고 22일 밝혔다. 교육비용은...
727,"철강협회, AI 전문인력 양성한다",2020.09.22.,과기부 '2020년 산업 전문 인력 AI 역량강화' 사업 선정 한국철강협회와 한국디지털융합진흥원이 철강산업 분야 인공지능(AI) 전문 인력을 양성한다.한국철강협회는 디지털융합진흥원와 함께 과학기술정보통신부가 공모한 ‘2020년 산업 전문 인력 AI 역량강화’사업에 선정됐다고 22일 밝혔다. 교육비용은...
728,"한국공항공사, 인공지능(AI) 수어 안내 시연회 개최",2020.09.22.,"한국공항공사, 김포공항에서 AI 수어 안냎 시연회 개최 한국공항공사가 23일 국제연합(UN)이 정한 ‘세계 수어의 날’을 맞아 김포공항 국내선청사에서 인공지능(AI) 기반의 수어 안내시스템 시연회를 개최했다.시연된 수어 안내시스템은 공사가 한국전자기술연구원과 나사렛 대학교가 공동으로 개발..."
729,"현대·기아차, AI 분야 최고 석학 영입",2020.09.23.,현대·기아차가 인공지능(AI) 분야 최고 석학으로 손꼽히는 미국 메사추세츠 공과대학(MIT)의 토마소 포지오(Tomaso A. Poggio) 교수와 다니엘라 러스(Daniela L. Rus) 교수를 AI 기술 자문위원으로 영입했습니다. 작년 하반기 영입한 토마소 포지오 교수는 신경망 연구와 AI 응용 분야의 세계 최고 석학이며 현재...
730,[스마트클라우드쇼 2020] SK텔레콤 AI 스피커 '누구' 개발 주역이 그린 AI의 ...,2020.09.24.,"박명순 AI사업유닛장 ""고령자⋅장애인 등 소외계층 돕는 동반자"" ‘누구’ 사용자 2016년 1만명에서 277만명으로 급증… 생활 속으로 ""AI(인공지능) 기술의 가장 큰 가치는 시니어와 장애인 등 소외계층에게 도움을 준다는 것입니다. AI는 언제 어디서나 함께하는 동반자로 발전 중입니다."" 박명순 SK텔레콤..."
731,"SK, 美에 AI 전문기업 설립… ""미래가치 창출 이끈다""",2020.09.24.,"뉴데일리 이성진 기자 = SK하이닉스가 미국 실리콘밸리에 인공지능(AI) 솔루션을 전문으로 개발하는 자회사를 설립했다. 22일 SK하이닉스는 지난달 미국 실리콘밸리에 '가우스랩스' 본사를 설립한데 이어 이달 말 한국 사무소를 설립한다고 밝혔다. 자본금은 5500만달러 규모로, 오는 2022년까지..."
732,"KT, AI 음성인식 '5G 무인지게차' 선보인다",2020.09.22.,"양사는 5G, 인공지능(AI), 빅데이터(Big Data), 클라우드(Cloud) 등 ICT를 기반으로 디지털 혁신(DX, Digital Transformation) 사업화를 위한 실증사업을 추진해 왔다. 이번 행사에서 양사는 공동개발 한 ▲5G 기반 무인지게차 원격관리 제어 기술 ▲AI 기반 무인지게차 긴급 음성제어 기능 ▲3차원 무인지게차 측위..."
733,"뤼이드-캐플란, 글로벌 AI 튜터 교육 시장 이끈다",2020.09.22.,인공지능(AI) 튜터 솔루션 기업 뤼이드(대표 장영준)가 글로벌 AI 기술 리더십을 기반으로 전 세계 교육 시장을 움직이는 글로벌 기업과 손잡고 교육 시장 패러다임 전환을 주도해 나간다. 뤼이드는 24일 글로벌 교육 서비스 기업인 캐플란과 개인 맞춤형 학습 콘텐츠 제공을 위한 AI 모바일 학습...
734,"LG전자, ""KT와 스마트 가전 및 홈 IoT 서비스 연동한 AI서비스 발굴 중""",2020.09.22.,"AI 원팀은 국내 인공지능 산업의 경쟁력을 높이기 위한 산학연 협의체다. KT를 비롯해 LG전자, LG유플러스, 현대중공업그룹, 한국투자증권, 동원그룹 KAIST, 한양대, ETRI 등 산학연 9곳이 모여 AI 공동연구와 기술개발을 진행하고 있다. LG전자가 지난 25일 'AI 원팀 서밋 2020' 행사에 참가해 회원사들과 함께..."
