,제목,날짜,본문
2091,"LG 개발 한국어 AI 프로그램, 독해 평가서 1위",2020.07.15.,ⓒ뉴시스 LG가 개발한 한국어 인공지능(AI)이 기계독해 평가에서 1위를 차지했다. 19일 LG그룹에 따르면 LG사이언스파크가 개발한 AI 프로그램이 AI 학습용 한국어 표준데이터셋 '코쿼드(KorQuAD)1.0' 기계독해 평가에서 95.39점을 받아 1위를 기록했다. 이는 사람이 동일한 독해 문제를 풀었을 때 받은 점수...
2092,전기연구원 창원본원에 ‘KERI-워털루대 창원인공지능연구센터’ 개소,2020.07.13.,"경남 창원시(시장 허성무)는 한국전기연구원(KERI, 원장 최규하)와 ‘KERI-워털루대 창원인공지능연구센터’를 열고 세계최고를 자랑하는 캐나다 인공지능(AI) 기술을 지역 산업경제에 본격 도입한다. 창원시와 KERI는 이날 KERI 창원본원에서 지역 유관기관 및 기업 관계자들이 참석한 가운데 ‘KERI..."
2093,"삼성SDS·성균관대, AI인재 양성 '맞손'",2020.07.13.,"빅데이터 분석 기반의 통합 인공지능(AI) 플랫폼 ‘브라이틱스 AI’, 업무 자동화 솔루션 ‘브리티 로봇프로세스자동화(RPA)’ 등을 활용해 대학 행정 선진화를 추진한다는 계획이다. 성균관대는 삼성SDS의 데이터 분석 전문가 교육 및 인증 프로그램인 ‘프로DS’를 교육 과정에 도입하기로 했다. 프로DS를..."
2094,"디지털 뉴딜 선언했지만... ""AI 기술 美·中 승자독식 시작""",2020.07.22.,"전 세계 AI⋅머신러닝 소프트웨어 90% 미국이 주도 中, 민관협력으로 이미 1000개 AI 기업 생태계 구축 지난 2012년 딥러닝(Deep Learning)의 등장 이후 빠른 속도로 발전해온 인공지능(AI) 기술 분야에서 미국, 중국 두 강대국의 승자독식 양상이 뚜렷해지고 있다는 분석이 나온다. 민·관·학계 협력이 촘촘히..."
2095,"건양대 의료인공지능학과-㈜VUNO, 의료인공지능 인력개발 MOU",2020.07.21.,"이번 협약은 의료 인공지능(AI) 솔루션 개발 분야의 핵심 기술역량을 보유한 중소기업과 대학의 전문인력 자원이 결합된다는 점에서 의미가 있다. 김용석 의료인공지능학과장은 ""영상정보 기반의 의료 인공지능 프로그램 개발을 위해 적극 협력할 것""이라고 말했다. 김현준 대표는 ""건양대와 인공지능..."
2096,인공지능 미래교육 업무협약 체결,2020.07.21.,충남교육청 제공 충남교육청은 지난 15일 제1회의실에서 한국기술교육대학교와 인공지능(AI)의 4차 산업혁명시대 미래교육을 위한 상호교류 업무협약을 체결했다. 양 기관은 협약에 따라 ▲과학·기술·산업 분야의 상호협력을 위한 인적교류 및 시설 이용 ▲인공지능 분야 대학원 석사과정 운영에 관한 협력...
2097,"“인공뇌융합·원격수술로봇 등 독창적 융합R&D 나서겠다""",2020.07.21.,"‘뇌+차세대반도체+로봇’을 융합한 인공뇌융합 연구, AI(인공지능) 기반 원격수술로봇 개발, 극한환경의 미래소재 연구를 예로 들 수 있죠.” 20일부터 임기 3년의 임기를 시작하는 윤석진(61·사진) 한국과학기술연구원(KIST) 신임 원장은 19일 잠실 자택 근처 찻집에서 서울경제와 인터뷰를 갖고 “KIST가..."
2098,"광주시, 5개 업체와 '인공지능 비즈니스 기반 조성' 업무협약 체결",2020.07.21.,"㈜클라우드웍스는 인공지능 학습 데이터 수집·가공과 광주시 AI 기업과의 연계를 통한 생태계 구축을 위해 광주법인 및 지역사무소 설립을 추진하는 등 AI 생태계 조성 및 광주지역 일자리 창출에 적극적으로 협력해 나갈 계획이다. 지영호 ㈜알파도 대표이사를 비롯한 업무협약 업체 대표들은 ""광주에 구축..."
2099,코로나19 대응 의료 인공지능 컴소시엄 출범,2020.07.21.,"컨소시엄은 북미영상의학회에서 시작한 COVID 19 RICORD 컨소시엄, 유럽연합에서 시작한 COVID 19 이미징 AI 이니셔티브 등과 함께 국제 협력 활동을 펼칠 계획이며, 코로나19 대응을 위한 AI 핵심표준 개발도 목표로 하고 있다. 대한의료인공지능학회, 대한영상의학회 등 국내 관련 학회와도 적극 협력할 계획이다...."
2100,코로나19 대응 위한 ‘의료 인공지능 컨소시엄’ 출범,2020.07.21.,"컨소시엄은 북미영상의학회에서 시작한 COVID-19 RICORD 컨소시엄, 유럽연합에서 시작한 COVID-19 이미징 AI 이니셔티브 등과 함께 국제 협력 활동을 펼칠 계획이며, 코로나19 대응을 위한 AI 핵심표준 개발도 목표로 하고 있다. 아울러 대한의료인공지능학회, 대한영상의학회 등 국내 관련 학회와도 적극 협력할..."
2101,"""포스트 코로나19 대비하자"" 금융권 AI '브레인' 모인 워킹그룹 출범",2020.07.16.,"보험산업에 대해서는 혁신기술과 융합이 기대되는 분야라고 강조했다./사진=금융위원회 제공(뉴스1)핀테크(Fin-tech·금융과 IT의 결합) 기업과 금융회사, 학계 등이 참여하는 금융분야 인공지능(AI) 활성화 워킹그룹이 출범한다. 포스트 코로나19 시대를 대비해 디지털 전환을 앞당기기 위한 목적이다...."
2102,"은성수 ""금융분야 인공지능 활성화 방안 마련""",2020.07.16.,"은성수 금융위원장은 9일 ""이달부터 워킹그룹을 운영해 규제 개선, 인프라 구축, 소비자 보호의 세 가지 축으로 '금융분야 인공지능(AI) 활성화 방안'을 마련하겠다""고 밝혔다. 그는 이날 경기 이천에 위치한 보험개발원 자동차기술연구소를 방문하고 ""포스트 코로나 시대에는 경제 디지털화의 심화, 언택트..."
2103,"KT, '매드포갈릭'에 인공지능·빅데이터 적용한다",2020.07.16.,"KT의 인공지능, 빅데이터 기술을 접목, 현재 개발 중인 'M-Platform'을 고도화해 외식 산업의 디지털 혁신 모델을 제시하겠다""고 밝혔다. 김채희 KT AI·빅데이터사업본부장(상무)은 ""남다른 외식업 노하우와 솔루션을 보유하고 있는 엠에프지코리아와의 업무협약으로 외식 플랫폼에 새로운 디지털 혁신이..."
2104,"토종 AI 의사 `닥터앤서`, 글로벌 진출 첫발",2020.07.15.,"토종 AI(인공지능) 의사인 '닥터앤서'가 글로벌 진출을 위한 첫발을 뗀다. 과학기술정보통신부는 15일 '한(韓)-사우디' 간 영상회의를 열고 닥터앤서의 사우디아라비아 현지 적용을 위한 교차검증 착수 보고회를 열었다. 이번 행사는 진단정보, 의료영상, 유전체정보 등 한국인의 의료 데이터를 기반으로 개발된..."
2105,"엔비디아-플로리다대, AI 슈퍼컴퓨터 구축 계획 발표",2020.07.21.,"엔비디아가 미 플로리다대와 700페타플롭(PF)의 AI 성능을 제공하는 인공지능(AI) 슈퍼컴퓨터를 구축할 계획이라고 밝혔다. 이번 협력은 졸업생이자 엔비디아 공동 설립자인 크리스 말라초스키가 2,500만 달러를 기부하고, 하드웨어, 소프트웨어, 훈련, 서비스를 위해 엔비디아가 2,500만 달러를..."
2106,"지스트 AI대학원, 'AI 섬머 스쿨' 개최",2020.07.21.,"김종원 GIST AI대학원의 원장은 ""썸머스쿨은 인공지능 분야의 석학들을 한자리에 모시고 AI 연구 분야와 트렌드를 파악할 수 있는 훌륭한 기회의 장을 마련했다""라며 ""GIST AI대학원은 지역에 적합한 특화된 AI 융합인재 양성을 통해 지역 균형 발전과 미래 일자리 창출에 기여하겠다""라고 말했다."
2107,한국산업지능화협회 출범…'디지털 뉴딜' 본격 추진,2020.07.21.,"15일 산업통상자원부에 따르면 제조, 인공지능(AI), 데이터 관련 기업 200여개를 회원사로 둔 '한국산업지능화협회'가 이날 경기도 성남시 협회 사무실에서 현판식을 개최했다. 현판식에는 성윤모 산업부장관과 현대중공업, SK텔레콤, KT, LG CNS 등 업계 관계자 10여명이 참석했다. 이어 진행된 업계 간담회에서..."
2108,"KT, 코딩교육 전문기업과 '인공지능 코딩 교육사업' MOU",2020.07.21.,"KT가 코딩 교육 전문 기업 마르시스에듀와 서울 강남구 마르시스에듀 본사에서 ‘인공지능(AI) 코딩 교육 사업 활성화를 위한 업무협약(MOU)’을 체결했다고 21일 밝혔다. 협약식에는 KT AI/BigData사업본부장 김채희 상무, 마르시스에듀 박용규 대표이사 등 양사의 주요 관계자들이 참석했다. 이번 협약에..."
2109,"KAIST, 고성능 비선형 양자 AI 알고리즘 개발 성공",2020.07.07.,KAIST는 전기및전자공학과 이준구 교수 연구팀이 독일·남아공 연구팀과 협력연구를 통해 비선형 양자 기계학습 인공지능(AI) 알고리즘을 개발했다고 7일 밝혔다. 양자 인공지능은 양자컴퓨터 발전과 함께 현재의 인공지능을 앞설 것으로 크게 기대되고 있으나 연산방법이 전혀 달라 새로운 양자...
2110,"플랜트 설계를 AI가 척척… 현대엔지니어링, 관련 시스템 개발·특허출원",2020.07.07.,현대엔지니어링이 4차 산업혁명의 주요 기술인 인공지능(AI)이 적용된 설계 자동화 시스템을 구축하고 차별화된 설계 경쟁력 확보에 나섰다. 현대엔지니어링은 업계 최초로 AI 머신러닝을 활용한 플랜트 철골구조물 자동 설계 시스템 개발을 완료하고 관련 특허를 출원했다고 15일 밝혔다. 이번에 개발한...
2111,"네이버, 베트남의 카이스트 'HUST'와 산학협력...AI 연구 '박차'",2020.07.16.,"양측은 산학협력을 통해 검색, 이미지, 동영상 뿐 아니라 인공지능(AI), 로봇과 같은 다양한 기술 주제로 공동 산학과제를 진행한다. 호안민송 하노이과학기술대학 총장은 ""한국 최고의 IT기업 네이버에 선정을 받으며 협력하게 됐다""며 ""베트남 AI 지도자, 전문가 양성에 첫걸음이 되고, 제4차..."
2112,"""AI 교육 질 높인다""...KT·마르시슈에듀, '코딩교육 활성화' 협약 체결",2020.07.21.,"AI 코딩 교육용 로봇·앱·콘텐츠 개발, AI 코딩 교육 콘텐츠 발굴 등 추진 “국내 AI 코딩 교육 인프라 확대 및 쉽게 배우는 AI 코딩 솔루션 출시할 것” KT는 코딩 교육 전문 기업 마르시스에듀와 서울 강남구 마르시스에듀 본사에서 ‘인공지능(AI) 코딩 교육 사업 활성화를 위한 업무협약(MOU)’을..."
2113,"동화약품, AI 헬스케어기업 뷰노에 30억 지분 투자",2020.07.21.,"국내 제약사 동화약품이 의료 인공지능(AI) 헬스케어 솔루션기업 뷰노에 30억원의 지분 투자를 14일 단행했다. 뷰노는 의료 AI 기반 진단 보조와 발병 예측 소프트웨어 개발 기업이다. 의료영상 분야에서 국내 최초 AI 의료기기를 허가 받은 이후 병리, 생체신호, 의료음성 등 의료 현장에서 폭넓게 활용될 수 있는..."
2114,"광주시-SAP코리아, AI 비즈니스 기반 조성 업무협약 체결",2020.07.21.,"이용섭 시장은 ""4차 산업혁명시대에 인공지능은 국가 경쟁력의 핵심요소이며 광주는 세계일류 수준의 인공지능 생태계를 만들어 가고 있다""고 강조하고 ""많은 AI기업들이 광주에서 큰 꿈을 성취 할 수 있도록 적극 지원하겠다"" 고 말했다. 한편 광주시는 지난 5개월여 동안 글로벌 경쟁력을 가진 21개..."
2115,"건양대 의료인공지능학과, 학과 소개 챗봇 서비스 도입",2020.07.14.,"의료인공지능학과 김용석 학과장은""최근 인공지능(AI)에 대한 전 세계적 관심이 높아지고 있는 만큼 학과에 대한 다양한 문의가 들어오고 있다""며""코로나19로 인해 대면입시홍보가 불가능한 만큼 학과에 관심있는 학생 및 학부모에게 실시간으로 학과정보를 제공하기 위해 챗봇 서비스를 시작했다""고..."
2116,"상담부터 수요 예측까지…홈쇼핑업계, AI 시대 연다",2020.07.14.,사진= 롯데홈쇼핑 제공 홈쇼핑업계가 신종 코로나바이러스 감염증(코로나19) 장기화로 가속화된 언택트(비대면) 트렌드에 맞춰 4차 산업 혁명 시대 대비를 견인할 인공지능(AI)을 적극적으로 도입하고 있다. 기술혁신을 기반으로 홈쇼핑 채널을 넘어 미디어 커머스를 선도하는 기업으로 도약하겠다는 의지가...
2117,한동대- (주)네패스 '산학협력'반도체·AI 분야 업무협약 체결,2020.07.25.,"<사진> 이날 협약으로 양 기관은 △반도체 및 AI 분야 등과 관련한 학술, 기술정보의 교류 및 자문 △우수인재의 현장실습 및 채용 프로그램 운영... 한편, (주)네패스는 반도체, 인공지능, 전자재료, 에너지. 디스플레이 분야에서 두각을 나타내는 기업이다. 지난 2015년 월드클래스 300기업 선정, 지난 2018년 제1회..."
2118,"파킹클라우드, 엘시티 랜드마크타워에 AI 무인주차장 오픈",2020.07.12.,"신보훈 기자 bbang@ajunews.com 주차 플랫폼 파킹클라우드 아이파킹은 부산 해운대 초고층 타워 '엘시티 랜드마크타워'에 인공지능(AI) 무인주차장을 오픈했다고 23일 밝혔다. 엘시티 랜드마크타워는 101층, 411.6m 높이로 잠실 롯데월드타워(555m)에 이어 국내에서 두 번째로 높다. 엘시티 랜드마크타워에는 6성급..."
2119,"인사이더 코리아, 385억원 시리즈C 투자 유치... 인공지능(AI) 혁신에 투자",2020.07.12.,"인공지능 기반 통합 디지털 마케팅 솔루션 인사이더 코리아는 385억원 규모의 시리즈C 투자를 유치했다고 20일 밝혔다. 이번 투자에는 리버우드 캐피털(Riverwood Capital)를 비롯해 세콰이어캐피탈(Sequoia), 왐다(Wamda), 인데버 카탈리스트(Endeavor Catalyst) 등 총 4개의 투자사가 참여했다. 지금까지..."
2120,"GS건설, 모델하우스 내 안내 AI로봇 '자이봇' 도입",2020.07.12.,"GS건설이 국내 건설업계 최초로 아파트 모델하우스에 인공지능 로봇 안내원인 '자이봇'(Xibot)을 도입한다고 27일 밝혔다. 코로나19에 대한 우려가 커지는... 자이봇은 25m 원거리 및 0.05m 근거리 내 물체 인식이 가능해 장애물을 피할 수 있으며, AI음성인식 기술(NLP)이 적용돼 대화도 주고받을 수 있다. GS건설은..."
2121,"롯데홈쇼핑, AI 기반 한국IBM 기상 예측 시스템 도입",2020.07.12.,"롯데홈쇼핑은 지난 10일 서울 영등포구 양평동 본사에서 한국IBM과 인공지능(AI) 기반 기상 예측 시스템 도입에 관한 업무협약을 가졌다고 12일 밝혔다. 이날 협약식(사진)에는 롯데홈쇼핑 김종영 마케팅부문장, 한국IBM 코그너티브 애플리케이션부문 박송미 상무를 비롯한 관계자들이 참석했다. 양사는 △6개월..."
2122,인공지능 신약개발 심화교육 참여기업 모집,2020.07.21.,센터는 한국보건산업진흥원과 보건복지부의 국내 제약기업의 신약개발 효율성 제고의 일환으로 2020 인공지능(AI) 활용 신약개발 교육 및 홍보사업의 주관기관으로 선정된 바 있다. 이에 따라 이번 심화교육은 AI 신약개발 연구생태계 조성을 위한 전문가를 육성하자는 취지로 빅데이터 활용을 통해 제약사와...
2123,바닥조명 따라가면 상품이 ‘딱’…결제는 인공지능로봇이 ‘뚝딱’,2020.07.21.,"계산대에 위치한 인공지능(AI) 결제로봇 ‘브니’도 제 역할을 톡톡히 한다. 셀프 결제 방법과 순서 등을 알려줄 뿐만 아니라 간단한 대화도 가능하다. 시험 삼아 빨대 위치를 물어보니 “냅킨, 젓가락, 빨대는 시식대에 비치돼 있어요. 다음 사람을 위해 한제품에 하나씩 사용 부탁드릴게요”라는 답변이..."
2124,"KT, AI 안전관제 기술 선보여…한국판 뉴딜 협력",2020.07.16.,ⓒ스카이데일리 KT가 자사 인공지능(AI) 시설물 안전 관제 기술로 한국판 뉴딜의 ‘SOC 디지털화’ 사업에 협력한다. KT는 16일 한국판 뉴딜의 ‘SOC 디지털화’ 사업 협력을 위해 하남시에 구축한 KT의 시설물 안전관제 서비스 ‘KT 기가세이프 SOC 솔루션’을 지난 15일 홍남기 경제부총리 현장방문...
2125,"5G+AI 스마트공장 1000개 보급···홍남기 ""제조혁신 고도화""",2020.07.23.,투데이코리아=유한일 기자 | 홍남기 경제부총리 겸 기획재정부 장관이 5G(5세대 이동통신)와 AI(인공지능)와 AI(인공지능)을 결합한 스마트공장 1000개를 보급한다고 밝혔다. 홍 부총리는 23일 정부 서울청사에서 열린 '제11차 비상경제 중앙대책본부 회의' 겸 '제1차 한국판 뉴딜 관계장관회의'에 참석해...
2126,"'사람을 뛰어 넘다' LG, 한국어 AI 평가 1위",2020.07.14.,[데일리스포츠한국 이상민 기자] LG가 한국어 인공지능(AI) 기계독해 평가에서 1위를 차지했다. LG사이언스파크가 개발한 AI 프로그램이 AI 학습용 한국어 표준데이터셋 '코쿼드(KorQuAD)1.0' 기계독해 평가에서 95.39점을 받아 1위를 기록했다. 사람이 동일한 독해 문제를 풀었을 때 받은 점수(91.2점)를...
2127,"연이은 글로벌 1위…韓 AI, 글로벌 톱 수준인가?",2020.07.16.,"LG이어 ETRI도 세계적인 권위행사에서 1위 일부 분야 두각…글로벌 AI 인지도 상승 효과 우리나라가 글로벌 인공지능(AI) 경진대회에서 연이어 ‘우승’을 차지해, 주목된다. 우리나라 AI 수준은 미국·중국과 비교해 뒤떨어진다는 평가다. IT조선이 ‘2019 대한민국 인공지능대상 수상사’ 20여곳을..."
2128,"AI·빅데이터 전문기업 솔트룩스, 23일 코스닥 입성",2020.07.16.,인공지능(AI)·빅데이터 전문 기업 솔트룩스가 오는 23일 코스닥 시장에 상장한다. 솔트룩스는 8일 서울 여의도에서 기업공개(IPO) 간담회를 열고 상장 계획을 밝혔다. 2000년 설립된 솔트룩스는 AI와 빅데이터 기반의 소프트웨어 전문기업으로 AI 상담 챗봇(채팅 로봇 프로그램) 등의 사업을 진행하고 있다....
2129,"금융위, AI 활성화 워킹그룹 발족…연내 방안 발표",2020.07.16.,AI 규제 개선·인프라·소비자보호·레그테크 등 4개 분과 운영 금융위원회가 금융분야에서 인공지능(AI) 활성화를 위해 워킹그룹을 발족하고 연말까지 활성화 방안을 마련하기로 했다. 금융위는 16일 명동 은행회관에서 금융분야 AI 활성화 워킹그룹 킥 오프(Kick-off) 회의를 개최했다. AI 활성화 정책을...
2130,코로나19 대응 위한 '의료인공지능 컨소시엄' 출범,2020.07.21.,"준비위원회는 24일 온라인 워크숍을 개최해 코로나19 대응 연구개발 사례 발표와 의료인공지능 관련 연구동향을 살필 예정이다. 컨소시엄은 북미영상의학회에서 시작한 COVID-19 RICORD 컨소시엄, 유럽연합에서 시작한 COVID-19 이미징 AI 이니셔티브 등과 함께 국제협력도 펼칠 계획이다. 또 코로나19 대응을 위한..."
2131,"맛집 추천도 AI가…네이버 지도 ""소상공인, 고객 접점 넓힐 것""",2020.07.13.,"네이버는 자사 지도앱에 인공지능(AI) 장소 추천 서비스 '스마트어라운드'를 탑재한다고 13일 밝혔다. 스마트어라운드는 AI가 사용자의 성별·연령대, 현재 위치·시간 등을 고려해 가볼 만한 맛집·카페 등을 추천해주는 서비스다. 2018년 출시된 서비스로 네이버 모바일 첫 화면 아래쪽에 초록색으로 빛나는..."
2132,"네이버랩스-성남시, AI·자율주행 활성화 협력",2020.07.13.,"네이버랩스와 경기 성남시가 AI(인공지능)·자율주행 실증 특화도시 조성을 위해 협력한다. 네이버랩스와 성남시는 13일 AI·자율주행 산업발전을 위해 상호 협력하는 것을 골자로 한 업무 협약식을 개최했다고 밝혔다. 이날 협약식에는 은수미 성남시장, 석상옥 네이버랩스 대표 등이 참석했다. 양사는 이번..."
2133,"네이버-HUST, 글로벌 AI 연구 벨트 구축 위해 '맞손'",2020.07.13.,"네이버가 아시아와 유럽을 연결하는 글로벌 인공지능(AI) 연구 벨트를 강화한다. 네이버(대표 한성숙)는 하노이과학기술대학(HUST, Hanoi University of Science and Technology)과 IT 인재 양성을 위한 산학협력을 진행한다고 16일 밝혔다. 1956년 설립된 HUST는 매년 이공계 분야에서 탁월한 성과를 내고 있는 베트남..."
2134,"솔트룩스, 인공지능 스타트업 육석 위해 10과 MOU 체결",2020.07.13.,"그 중 상위 4개 기업은 지난 6월 코엑스에서 열린 ‘SAC(Saltlux AI Conference) 2020’에서 결선 발표를 진행하였다. 그리고 15일, 상위 10개 인공지능 스타트업 대표들이 솔트룩스에 모여 시상식 및 MOU 체결이 진행되었다. 최종 선정된 10개 스타트업은 깃플(챗봇), 뉴스젤리(빅데이터 시각화), 마인드에이아이(AI..."
2135,"하이퍼커넥트, 서울대 'AI 리트릿' 참여",2020.07.13.,"하이퍼커넥트는 서울대학교 인공지능(AI) 연구원 'AI리트릿'에 참여했다고 20일 밝혔다. 행사는 라이브 스트리밍 등을 통해 온오프라인 동시 진행됐다. 장병탁 서울대학교 AI연구원장(컴퓨터공학부)을 비롯해 연구원 소속 교수와 학생이 참석한 이번 행사에는 하이퍼커넥트와 함께 LG그룹, 네이버 등 총 3개사가..."
2136,"AI 기업 솔트룩스, 청약증거금 1.7조 모였다…23일 코스닥 상장",2020.07.21.,인공지능(AI)ㆍ빅데이터를 기반으로 하는 소프트웨어 기업인 솔트룩스가 코스닥 상장을 위한 공모 청약에서 953.53대 1의 경쟁률을 기록했다. 솔트룩스는 13~14일 일반 투자자 대상 공모청약을 진행한 결과 경쟁률이 953.53대 1을 기록해 일반 청약 증거금 약 1조7879억원이 모였다고 14일 밝혔다. 지난 7~8일...
2137,"AI 기업 솔트룩스, 청약증거금 1.7조 모였다…23일 코스닥 상장",2020.07.14.,인공지능(AI)ㆍ빅데이터를 기반으로 하는 소프트웨어 기업인 솔트룩스가 코스닥 상장을 위한 공모 청약에서 953.53대 1의 경쟁률을 기록했다. 솔트룩스는 13~14일 일반 투자자 대상 공모청약을 진행한 결과 경쟁률이 953.53대 1을 기록해 일반 청약 증거금 약 1조7879억원이 모였다고 14일 밝혔다. 지난 7~8일...
2138,"동화약품, 인공지능 헬스케어 솔루션 기업 뷰노에 지분 투자",2020.07.14.,"동화약품은 의료 인공지능(AI) 기업 뷰노에 30억원을 지분 투자했다고 14일 밝혔다. 뷰노는 의료 AI 기반 진단 보조 및 발병 예측 소프트웨어 개발 기업이다. 의료영상 분야에서 국내 최초의 AI 의료기기를 허가 받은 후 병리, 생체신호, 의료음성 등 의료현장에서 폭넓게 활용될 수 있는 인공지능 솔루션들을..."
2139,"한은, '디지털혁신실' 신설…AI·빅데이터 적용 가속화",2020.07.22.,"한국은행이 디지털 신기술 전담조직을 신설하고 AIㆍ빅데이터ㆍ블록체인 등을 업무에 도입할 계획이다. 한국은행은 22일 조직의 디지털혁신을 추진할... 한국은행은 이를 위해 지난달 23일 카카오엔터프라이즈와 인공지능 기술 협업을 위한 업무협약을 체결한 바 있으며, 향후 부문별, 기술별로 특화된 업체와..."
2140,AI·빅데이터 전문기업 솔트룩스 공모가 2만5천원 확정,2020.07.21.,코스닥 상장을 추진 중인 인공지능(AI)·빅데이터 전문 기업 솔트룩스는 기관투자자를 대상으로 한 수요예측 결과 공모가가 2만5천원으로 확정됐다고 10일 밝혔다. 솔트룩스의 주당 공모 희망가 범위는 2만4천∼3만원이었다. 총 공모 주식 수는 75만주로 공모 예정 금액은 최대 225억원 규모다....
2141,"오케스트로, ""지능형 클라우드 관리 소프트웨어 '심포니 인공지능' GS 1등급 ...",2020.07.22.,"㈜오케스트로(대표 김민준)가 지능형 클라우드 관리 소프트웨어 '심포니 인공지능(SYMPHONY A.I.) V3.0'이 한국정보통신기술협회(TTA) 소프트웨어 시험연구소로부터 GS인증 1등급을 받았다고 밝혔다. '심포니 인공지능(SYMPHONY A.I.) V3.0'은 인공지능, 빅데이터 기술을 활용하여 클라우드 환경을 지능적으로..."
2142,광주형 AI-그린뉴딜 본격화 국내 최초 ‘에너지 자립도시 광주’ 실현한다,2020.07.21.,이용섭 시장은 이날 오후 김대중컨벤션센터에서 ‘포스트 코로나 시대의 글로벌 선도도시 광주’ 비전 선포와 함께 광주형 3대 뉴딜 정책으로 ▲AI... 또한 “에너지자립도시 실현을 통해 가장 안전하고 깨끗하고 살기 좋은 글로벌 녹색도시로 도약하면서 다른 한편에서는 인공지능 중심도시 광주를...
