,제목,날짜,본문
739,"SKT, SK플래닛·화신과 AI 기반 스마트팩토리 구축 ‘맞손’",2020.07.29.,"이창현기자(chlee@skyedaily.com) 기사입력 2020-07-28 15:35:56 ▲SK텔레콤은 28일 SK플래닛, 화신과 함께 ‘인공지능(AI) 기반 스마트팩토리 사업 협력’을 위한 업무협약을 체결했다고 밝혔다. ⓒ스카이데일리 소리로 불량을 감지해 수백억을 절감할 수 있는 인공지능(AI) 기반 스마트팩토리가 열린다. SK텔레콤은..."
740,"GS25, 하늘길 드론 배송 이어 AI 로봇 통한 지상 배송 나선다",2020.07.29.,［메디컬투데이 고동현 기자］ 인공지능이 탑재된 로봇이 편의점 상품을 배송해 주는 시대가 곧 열린다. GS리테일과 LG전자가 고객이 주문한 GS25의 상품을 로봇을 통해 배송하는 서비스를 론칭하기 위해 손을 맞잡았다고 29일 밝혔다. 양사는 이를 위해 지난 21일 LG전자마곡사이언스파크에서 김성기...
741,"KAIST, 인공지능 전력망 운영관리 국제대회 1위",2020.07.29.,"KAIST는 AI대학원 김기응 교수 연구팀(홍성훈, 윤든솔 석사과정, 이병준 박사과정)이 인공지능 기반 전력망 운영관리 기술을 겨루는 국제경진대회인 `L2RPN 챌린지'에서 1위를 차지했다고 26일 밝혔다. 기계학습 연구 촉진 비영리단체 ChaLearn 등의 공동주최로 열린 이번 대회는 세계 각국 약 50팀이 참가해 지난..."
742,"호남대, AI빅데이터연구소 연구사업 '박차'",2020.07.26.,국내 유일의 AI특성화대학인 호남대학교(총장 박상철)는 4차 산업혁명 시대를 견인할 인공지능(AI) 융합인재 양성을 위해 정보통신연구소를 AI 빅데이터 연구소로 개편하면서 세미나 개최와 논문 발간 등을 통한 연구사업에 박차를 가하고 있다. 호남대학교는 지난 6월 ‘프로젝트 실습 중심 교육을 통한...
743,[최병관의 아·사·과 24] 인공지능과 딥러닝,2020.07.26.,"위기인가?' 지난 2016년 3월, 세계는 인공지능(AI, Artificial Intelligence)이라는  키워드에 휩싸였다. 구글 딥마인드가 개발한 인공지능 바둑 프로그램 알파고와 이세돌 9단의 세기의 바둑대결은 그동안 SF영화로만 봐왔던 인공지능을 실감할 수 있는 계기가 되었다. 더구나 알파고가 4대1로 승리를 거두자 많은..."
744,[뉴스워커_SKT] 시니어 특화 AI 서비스 '누구 오팔(NUGU opal)' 출시,2020.07.26.,"SK텔레콤 이현아 AI서비스단장은 ""시니어에 최적화된 인공지능 서비스 '누구 오팔'이 어르신들의 삶의 질 향상에 도움이 되길 기대한다""며, ""앞으로도 SK텔레콤의 AI기술을 통해 사용자의 삶의 질을 높일 수 있는 서비스를 지속적으로 발굴하겠다""고 전했다."
745,"LG CNS, AI 영어 교육 서비스 'AI튜터' 100만명에 무상 제공",2020.07.29.,LG CNS가 인공지능(AI) 영어 교육 서비스 'AI튜터'를 100만명 사용자 대상으로 무상 제공에 나선다. 사진 LG CNS 직원이 AI튜터를 사용하고 있는 모습. 사진=LG CNS 제공 LG CNS가 인공지능(AI) 영어 교육 서비스 'AI튜터'를 100만명 사용자 대상으로 무상 제공에 나선다고 28일 밝혔다. AI튜터 무상 이벤트는...
746,"마스크 착용해도 사람 알아보는 열화상 카메라, 스마트 농기계에 인텔 엣지 A...",2020.07.23.,"/인텔코리아 마스크를 착용해도 사람을 인식하고, 마스크를 미착용하면 알람을 보내 마스크 착용을 유도하는 코로나19 극복을 위한 인공지능(AI) 열화상 카메라에 인텔의 엣지 AI 기술이 적용돼 활용되고 있다. 또 AI 기술이 적용된 스마트 자율주행 농기계와 알고리즘을 사용한 영상 분석 기능에도 인텔의 AI..."
747,"신한DS, AI 기반 보험상품개발 공동연구 MOU 체결",2020.07.23.,"이재균 신한생명 부사장(왼쪽)이 조영서 신한DS 부사장(가운데), 조원규 스켈터랩스 대표와 함께 23일 서울 중구에 위치한 신한DS 본사에서 AI(인공지능)를 활용한 공동연구 MOU를 체결한 뒤 기념촬영을 하고 있다. 2020.7.23"
748,"에이아이매틱스, 피아트-크라이슬러 계열사와 AI 영상관제 솔루션 공급 업무협...",2020.07.23.,유니퀘스트 자회사 에이아이매틱스는 브라질 전기트럭 제조사 에프엔엠 일레트리코스(FNM eletricos)와 인공지능(AI) 영상관제 솔루션이 적용된 스마트 트럭 개발 업무협약을 체결했다고 30일 밝혔다. 이번 업무협약으로 올해 11월부터 양산되는 에프엔엠 일레트리코스의 스마트 전기 트럭에...
749,"셀바스AI, 엑셀금융서비스와 '인공지능 보험설계 업무협약'",2020.07.26.,"인공지능(AI) 보험 설계 솔루션 협업을 위한 업무협약식. 왼쪽부터 엑셀금융서비스 류상호 영업부문총괄, 셀바스 AI 영업총괄 윤승현 부사장. [사진=엑셀금융서비스] 인공지능 코스닥 기업 셀바스 AI가 지난 23일 엑셀금융서비스와 'AI 보험 설계 솔루션 협업을 위한 업무협약'을 체결했다고 27일 밝혔다. 이번..."
750,"신한카드 ""상담전화 품질관리도 AI가 실시간으로""",2020.07.26.,신한카드가 고객센터 전화 상담을 실시간으로 분석해 자동으로 모든 상담서비스의 품질을 관리하는 인공지능(AI) 시스템 ‘큐 시그널(Q-Signal)’을 구축했다고 26일 밝혔다. Q-시그널은 상담사와 고객 간 전화상담 중에 발생하는 모든 음성 정보를 실시간 분석해 매너·톤·성량·설명능력·경청태도 등으로 자동...
751,"기술보증기금, 인공지능 기반 신 기술평가모형 구축",2020.07.26.,기술보증기금(이사장 정윤모)은 그 동안 기술평가에 적용하던 기술평가모형에 대한 자체적인 진단을 통해 인공지능(AI) 기반 신 기술평가모형의 개발을 완료하고 하반기부터 순차적으로 기술평가에 적용한다고 23일 발표했다. 기보는 기술금융에 4차산업 기술 도입을 위한 선제적 연구를 바탕으로...
752,"KAIST, AI 전력망 운영관리 국제대회에서 우승",2020.07.27.,"사진제공=KAIST KAIST는 인공지능(AI) 대학원 김기응 교수 연구진이 AI 기반 전력망 운영관리 기술을 겨루는 국제경진대회인 `L2RPN 챌린지 2020'에서 우승했다고 26일 밝혔다. 각종 경진대회를 주관하는 비영리단체 ChaLearn, 유럽 최대 전력망을 운영관리하는 프랑스 전력공사 자회사 RTE 등이 공동주최한..."
753,"현대해상, 국내 최초 ‘AI음성봇’ 보험계약대출 시행",2020.07.27.,현대해상은 인공지능(AI) 음성인식과 지능형 대화기술을 접목한 ‘AI음성봇’으로 보험계약대출과 완전판매모니터링 서비스를 도입한다고 27일 밝혔다.완전판매모니터링이란 신규 보험계약 체결 시 충분한 설명과 주요 서류 등을 전달 받았는지 확인해 고객의 권리를 보호하는 모니터링 업무다. 이번 서비스로...
754,"인간은 91.2점, LG 인공지능은 95.39점...더 똑똑하네요",2020.07.29.,"지난달엔 아마존, 도쿄대 제쳐 LG가 개발한 인공지능(AI) 프로그램이 독해 평가에서 1위에 올랐다. LG는 19일 LG사이언스파크가 개발한 AI 프로그램이 AI 학습용 한국어 표준데이터셋 ‘코쿼드(KorQuAD)1.0’ 기계독해 평가에서 95.39점을 받아 1위를 기록했다고 밝혔다. 사람이 동일한 독해 문제를 풀었을 때..."
755,"SWEET사업, SW·AI교육 교사지원단 위촉식 진행",2020.07.27.,"SW·AI교육 교사지원단은 예비교사의 소프트웨어 및 인공지능 교육 역량을 강화하기 위한 학교 현장 교사로 구성된 SW·AI교육 전문가 인력풀로, 6월 26일 모집 완료했다. 부산교대 SWEET사업의 SW·AI교육 교사지원단은 총 19명의 교사가 선정되었으며, 부산과 울산에서 AI교육을 선도하는 교사로서..."
756,"생산성본부, 블록체인 기반 AI 일자리 플랫폼 '내:일' 오픈",2020.07.27.,"한국생산성본부는 29일 블록체인 기반 인공지능(AI)일자리 플랫폼 '내:일'을 오픈했다고 밝혔다. '내:일'은 AI 매칭과 블록체인 이력등록기술로 일자리를 쉽고 빠르게 찾아주는 플랫폼이다. 내:일 플랫폼은 자동매칭 시스템을 통해 일자리와 인재를 맞춤형으로 추천해준다. 기업이 채용정보를 구체적으로 제시, 이..."
757,AI가 추천한 하반기 투자전망은…주식 60%·채권 30%,2020.07.27.,"모바일 간편투자 서비스 `핀트(Fint)`를 운영하는 디셈버앤컴퍼니자산운용은 인공지능(AI)이 추천하는 올해 하반기 글로벌 자산배분 비중은 주식 60%, 채권 30%, 원자재 10%로 분류했다고 27일 밝혔다. 디셈버앤컴퍼니자산운용의 AI 로보어드바이저 `아이작(ISAAC)`은 올 하반기 주식 60%(미국 26%, 선진국 17%, 신흥국 17..."
758,"티맥스AI, 과기정통부 산하 지능정보산업협회 가입",2020.07.23.,인공지능(AI) 플랫폼?서비스 전문기업 '티맥스AI'는 과학기술정보통신부 산하 사단법인 '지능정보산업협회'에 가입해 AI 수요 기업과 AI 공급 기업 간의 시너지를 확대하고 AI 분야 생태계 조성에 적극 나선다고 27일 밝혔다. 티맥스AI는 티맥스A&C의 자회사다. 올해 1월 티맥스오에스가 티맥스A&C로 사명을...
759,"기보, '인공지능(AI)기반 신기술평가모형' 구축",2020.07.23.,"기술보증기금은 그 동안 기술평가에 적용하던 기술평가모형에 대한 자체적인 진단을 통하여 인공지능(AI) 기반 신기술평가모형의 개발을 완료, 올해 하반기부터 순차적으로 기술평가에 적용한다고 23일 밝혔다. 기보는 기술금융에 4차산업 기술 도입을 위한 선제적 연구를 바탕으로 전문평가자의 평가 패턴을..."
760,"중진공, AI 챗봇 도입…비대면 상담서비스 제공",2020.07.27.,챗봇의 주요 기능은 ▲정책자금 맞춤형 상담 ▲시나리오 기반 상담 ▲AI 기반 대화형 상담 서비스 제공이며 고객 수요에 따라 정책자금 신청절차 안내와 자주 묻는 질문과 답변 등을 추가할 예정이다. 챗봇의 장점은 40년간의 중소기업 정책자금 지원을 통해 얻은 빅데이터에 있다. 챗봇은 빅데이터와 인공지능...
761,"GS건설, 국내 최초로 견본주택에 AI로봇 안내원 도입",2020.07.26.,"특히 25m 원거리 및 0.05m 근거리 내 물체 인식이 가능해 장애물을 피할 수 있으며 인공지능(AI) 음성인식 기술(NLP)이 적용돼 대화도 주고받을 수 있다. 자이봇은 DMC아트포레자이, DMC파인시티자이, DMC센트럴자이 모델하우스 내에서 단지의 개요 및 위치, 입지, 단지배치, 동호수배치, 평면, 모델하우스 공간 안내..."
762,"LG전자, 대화하는 로봇청소기 내놓는다…음성인식 AI 진화",2020.07.26.,29일 관련 업계에 따르면 LG전자는 사용자에게 먼저 말을 걸 수 있는 한 단계 진화한 인공지능(AI) 대화형 로봇청소기를 개발하고 있다. 아직 음성인식은 기기 제어 수단으로만 이용하는 데 그치고 있다. 이번에 LG전자가 개발 중인 기술은 로봇 청소기가 능동적으로 말을 하며 사용자에게 다양한 정보와 상황을...
763,"KT, 인공지능에 마음을 담았다…“목소리로 전하세요”",2020.07.26.,참가자의 목소리는 가족들의 노력과 KT의 인공지능(AI) 기술로 완성됐다. 목소리 찾기는 청력을 잃었거나 사고나 질병 등으로 후천적으로 목소리를 잃은 농인의 목소리를 만들어 주는 프로젝트다. 이 프로젝트는 삶에 도움이 되는 기술로 일상의 불편함을 덜고자 하는 고민에서 출발했다. KT는 지난 4월...
764,"캐리어에어컨, 에어컨 한국표준협회 'AI+' 인증 획득…알아서 온도부터 습도까...",2020.07.26.,"'프리미엄 AI 에어케어(PMV)', '스마트 공기청정' 탑재로 사용자 설정 필요없어 류혜경 기자 rews@ajunews.com 캐리어에어컨이 '프리미엄 에어로 18단 에어컨'이 인공지능(AI) 품질을 증명하는 한국표준협회 'AI+' 인증을 획득했다고 30일 밝혔다. 프리미엄 에어로 18단 에어컨은 빅데이터와 인공지능 알고리즘을..."
765,"SAP-광주시, AI 산업 육성 MOU",2020.07.26.,SAP코리아는 광주광역시와 '인공지능(AI) 중심 도시 광주 만들기 및 국가 AI 산업 육성'을 위한 업무협약(MOU)을 체결했다고 24일 발표했다. SAP코리아는 광주 AI 클러스터 생태계 조성 등을 위한 기술·정책 자문을 수행하게 된다. 특히 AI 기술 및 혁신 분야 일자리 창출을 위해 'SIDG(SAP Institute for...
766,"생산성본부, AI 일자리 플랫폼 '내:일' 오픈",2020.07.26.,한국생산성본부가 29일 블록체인 기반의 인공지능 일자리 플랫폼 '내:일'을 선보였다. 생산성본부는 일자리 미스매칭 해소와 일자리 창출 등 사회적 가치를 창출할 수 있을 것으로 기대한다. 기존 채용 플랫폼은 직무 기술이나 구인 요건 등이 데이터화되지 않아 특정 직무에 적합하게 추천하기 어려운 데다...
767,"LG CNS, AI 영어 교육 서비스 ‘AI튜터’ 100만 무상 제공",2020.07.28.,이창현기자(chlee@skyedaily.com) 기사입력 2020-07-28 15:33:36 ▲LG CNS가 인공지능(AI) 영어 교육 서비스 ‘AI튜터’를 100만명 사용자에 무상 제공한다. LG CNS는 28일 AI튜터 무상 이벤트는 캐럿글로벌 홈페이지에서 다음 달 말일까지 신청할 수 있다고 밝혔다. [사진=뉴시스] LG CNS가 인공지능(AI) 영어 교육...
768,"건양대병원, AI 활용 축농증 조기진단 기술 개발 추진",2020.07.28.,건양대병원은 30일 과학기술정보통신부의 '인공지능 학습용 데이터 구축사업'의 '질병 진단용 인공지능 이미지 데이터 구축' 과제에 선정됐다고 밝혔다. 이번 사업은 기존 국내에 구축돼 있지 않았던 데이터를 선도적으로 공개함으로써 더욱 폭넓은 AI 인프라를 구축하기 위해 마련됐으며 총 17억원의...
769,'AI 영상분석'으로 코로나 막는다…마스크 미착용도 감지,2020.07.28.,영상보안 솔루션 기업 '한화테크윈'이 전세계적으로 유행하고 있는 신종 코로나 바이러스 감염증(코로나19) 확산을 막기 위해 첨단 인공지능(AI) 기술을 활용한 영상보안 솔루션을 출시했다. 23일 한화테크윈에 따르면 새로 선보이는 코로나19용 솔루션은 '실내 적정인원 관리'와 '마스크 착용 감지' 등 2종으로...
770,"KT, AI 기반 스마트빌딩 서비스 돌입",2020.07.28.,"KT는 28일 ""첨단 정보통신기술(ICT)로 빌딩을 효율적으로 관리할 수 있는 KT 스마트빌딩 서비스를 출시했다""면서 ""스마트빌딩 센싱, 스마트빌딩 BEMS(빌딩 에너지 관리 시스템), 스마트빌딩 AI(인공지능) 등 3개 상품으로 구성된다""고 밝혔다. KT 측은 ""스마트빌딩 센싱은 보일러, 저수조, 모터 등 빌딩의 중요..."
771,"AI 기반 OCR 스타트업 로민, KB국민카드 문자 자동인식 도입 사업 우선협상대...",2020.07.23.,텍스트스코프 OCR 기능과 특징(이미지:로민) 인공지능(AI) 기반 컴퓨터비전 및 문자인식(OCR) 솔루션 기업 로민(대표 강지홍)이 KB국민카드의 서버형 문자 자동인식(OCR) 자원 도입 사업 우선협상대상자로 선정됐다고 30일 밝혔다. 로민은 데이터 정보보안 기업 미네르바소프트와의 컨소시엄으로 이번 입찰에...
772,"LG, AI·빅데이터 활용해 2차 협력사까지 생산자동화",2020.07.23.,"올해는 2차 협력사까지 대상을 확대해 약 100개 협력사에 인공지능(AI), 빅데이터 등을 활용해 스마트 팩토리 솔루션과 자동화 시스템을 구축하도록 지원한다. 생산기술 전문가를 협력사에 파견해 노하우를 전수하고, 협력사 직원을 위해 로봇 자동화 교육과정을 신설해 로봇 조작과 운영, 생산라인 적용..."
773,"삼성SDS-서울대, AI·데이터 분석 분야 산학협약 체결",2020.07.26.,"삼성SDS는 29일 서울대 데이터사이언스대학원과 인공지능(AI)·데이터 분석 분야 산학협약을 체결했다고 밝혔다. 양측은 AI·데이터 분석 분야 공동 연구 및 인적 교류, 우수 대학원생 연구활동 지원 등에 힘을 합칠 계획이다. 대학원생들이 연구 중인 최신 AI 기술이 삼성SDS의 해당 분야 연구개발 과제에 적용..."
774,'AI튜터' 100만명에 무료 제공,2020.07.28.,LG CNS는 인공지능(AI) 영어 교육 서비스 ‘AI튜터’를 100만 명에게 무료로 제공한다고 28일 발표했다. AI튜터는 수십만 개의 영어 문장을 학습한 AI를 통해 스마트폰으로 영어회화를 공부하는 서비스다. AI튜터를 공동 개발한 캐럿글로벌 홈페이지에서 다음달까지 신청을 받는다. LG CNS는 무료 학습자...
775,"SKT, 소리로 불량품 잡아내는 'AI 스마트팩토리' 구축",2020.07.28.,"투데이코리아=이정민 기자 | SK텔레콤은 SK플래닛, 화신과 함께 인공지능(AI) 기반 스마트팩토리 사업에 협력하기로 했다. SK텔레콤은 28일 화신의 모든 생산라인에 소리로 불량을 분석하는 'AE(Acoustic Emission) 솔루션'을 도입하기 위해 SK플래닛, 화신과 업무협약을 체결했다고 밝혔다. 3사는 올 하반기 화신의..."
776,"KT, AI가 알아서 건물 관리해 주는 '스마트빌딩 서비스' 출시",2020.07.28.,"KT 스마트빌딩 서비스는 △스마트빌딩 센싱 △스마트빌딩 BEMS △스마트빌딩 인공지능(AI) 3개 상품으로 구성된다. 스마트빌딩 센싱은 보일러, 저수조, 모터 등 빌딩의 중요 설비에서 발생하는 고장 등의 이상 상황을 KT IoT 관제센터에서 실시간으로 24시간 원격 모니터링해 관리자에게 알려주는..."
777,"2020년 인공지능 전력망 운영관리 국제대회, KAIST 1위 수상 쾌거",2020.07.28.,"국가 수도 규모 복잡한 전력망에도 적용 가능한 인공지능 에이전트 개발AI대학원 김기응 교수 연구팀, 개방형 에너지 클라우드 플랫폼 연구단 과제로 수행[보안뉴스 권 준 기자] KAIST(총장 신성철)는 AI대학원 김기응 교수 연구팀(홍성훈, 윤든솔 석사과정, 이병준 박사과정)이 인공지능 기반..."
778,"GS건설, 업계 최초 모델하우스 내 AI로봇 안내원 '자이봇' 도입",2020.07.28.,"고객 상담·모델하우스 안내… 자율주행 형태 안내 로봇 자이봇, DMC아트포레자이 등 모델하우스 3곳에 배치 GS건설은 국내 건설업계 최초로 아파트 견본주택(모델하우스)에 인공지능(AI) 로봇 안내원 '자이봇(Xibot)'을 도입한다고 27일 밝혔다. 자이봇은 신종 코로나바이러스감염증(코로나19)에 대한 우려가..."
779,'2020 인공지능 그랜드 챌린지' 개막,2020.07.26.,7월 40억원 규모의 온라인 대회를 시작으로 11월 120억원 규모의 대형 챌린지 개최 과학기술정보통신부(이하 과기정통부)는 인공지능(AI) 기술을 통해 생활 속 문제해결을 위한 '2020년 인공지능 그랜드 챌린지' 대회를 이달 27일(월)부터 개최한다. '인공지능 그랜드 챌린지' 대회는 제시된 문제를 해결하기...
780,"에너지 인공지능 스타트업 크로커스, 35억 투자 유치",2020.07.26.,에너지 인공지능(AI) 스타트업 크로커스에너지가 35억원 규모의 시리즈 A 투자를 유치했다고 28일 밝혔다. 2016년 미국 실리콘밸리에서 창업한 크로커스에너지는 한국과 미국을 무대로 기업의 에너지 효율화와 전기 요금 절감을 이끄는 AI기반 에너지 연결 플랫폼 ‘아셀로’를 제공하고 있다. 이번 투자에...
781,세계최초 AI 중소벤처 제조플랫폼 나온다…데이터기반 혁신 전략,2020.07.27.,중소·벤처기업 스마트공장 데이터를 활용해 제조공정을 개선하고 생산성도 높이는 세계최초의 민관협력 인공지능(AI) 중소벤처 제조 플랫폼(KAMP)이 조성된다. 중소벤처기업부(중기부)는 23일 오전 제11차 비상경제 중앙대책본부 회의 겸 제1차 한국판 뉴딜 관계장관회의에서 이같은 내용의 인공지능(AI)...
782,"기보, 인공지능(AI)기반 新기술평가모형 구축해 예측정확도 9% 향상",2020.07.27.,기술보증기금이 그 동안 기술평가에 적용하던 기술평가모형에 대한 자체적인 진단을 통하여 인공지능(AI) 기반 新기술평가모형의 개발을 완료하고 하반기부터 순차적으로 기술평가에 적용한다고 23일 밝혔다. 기보는 기술금융에 4차산업 기술 도입을 위한 선제적 연구를 바탕으로 전문평가자의 평가 패턴을...
783,"현대해상, 국내 첫 ‘AI음성봇’ 보험계약대출 시행",2020.07.23.,현대해상은 AI음성인식과 지능형 대화기술을 접목한 '인공지능(AI) 음성봇'을 통해 보험계약대출 서비스와 완전판매모니터링을 시행한다고 27일 밝혔다. 앞으로 현대해상 보험 가입 고객은 원하는 시간에 실제 콜센터 상담원과 통화하는 것처럼 대출을 신청할 수 있다. 이 서비스는 지난해 3월 금융위원회의...
784,"카이스트, 2020년 인공지능 전력망 운영관리 국제대회 1위 달성",2020.07.26.,"KAIST는 AI대학원 김기응 교수 연구팀이 인공지능(AI) 기반 전력망 운영관리 기술을 겨루는 국제경진대회인 'L2RPN 챌린지'에서 최종 1위를 차지했다. 사진은 챌린지 우승 상장. /KAIST KAIST는 AI대학원 김기응 교수 연구팀(홍성훈, 윤든솔 석사과정, 이병준 박사과정)이 인공지능(AI) 기반 전력망 운영관리 기술을..."
785,인공지능 등 4차 산업 혁명기술 스타트업 참가기업 모집,2020.07.29.,"인공지능 등 4차 산업 혁명기술 스타트업 참가기업 모집 인천지역의 스마트시티, 정보통신기술(ICT), 인공지능(AI), 바이오 헬스케어 등 4차 산업 혁명 기술 분야 스타트업 참가기업을 모집 한다인천경제청과 인천테크노파크는 다음달 4일까지 ‘인천 스타트업 성장 사업’의 참가기업 70여개사를 모집한다고 27일..."
786,'소부장 스타트업 100' 2차 통과 60개사 선정…스마트엔지니어링·AI 분야 뽑...,2020.07.23.,"제조혁신의 핵심인 스마트엔지니어링 분야에서 부터 인공지능·사물인터넷(AI·IoT), 신소재 분야 기술기업이 주를 이뤘다. 정부는 수요 대기업과 함께 비즈니스모델을 정비하고 오는 10월 대국민 대상 행사를 통해 최종 20개사를 선정한다. 중소벤처기업부는 소재·부품·장비 분야 혁신 스타트업을..."
787,"GIST AI대학원, 온·오프라인 썸머 스쿨 성황리 개최",2020.07.23.,광주과학기술원(GIST) 인공지능(AI)대학원(원장 김종원)은 지난 22~23일 이틀간 지스트 해림홀에서 AI대학원 신입생 및 재학생 대상 온·오프라인 썸머 스쿨 프로그램을 개최했다. 이번 행사는 7월 6일부터 8월 14일까지 열리는 'AI대학원 악셀(AXEL) 썸머 캠프' 프로그램 가운데 하나로 지난해 말 GIST와...
788,"네이버 AI, 세계 톱 학회에 논문 무더기 승인 '쾌거'",2020.07.28.,세계 톱 클래스 인공지능(AI) 학회가 네이버 논문을 대거 채택했다. 네이버 AI 기술력을 세계에 입증했다. 네이버는 인터스피치2020에 클로바 사내기업(CIC) 논문 10편이 승인됐다고 30일 밝혔다. 인터스피치는 ICASSP와 함께 음성신호처리 분야에서 세계 최대·최고 수준으로 인정받는 음성 및 신호처리 학회다....
789,광주 AI종합지원센터 테크노파크에 문 열어,2020.07.28.,"■ CMB뉴스 광주 인공지능종합지원센터가 테크노파크에 문을 열면서 광주형 AI 비즈니스 모델 구현이 탄력을 받을 전망입니다. 인공지능종합지원센터는 관련 기업에 입주 공간을 제공하고 투자 유치와 기술 개발 등을 지원하는 원스톱 서비스를 운영합니다. 또 기술과 창업, 법률 전문가로 구성된..."
790,"소프트뱅크 로보틱스 코리아, AI 자율 주행 청소 로봇 위즈 국내 출시",2020.07.28.,소프트뱅크 로보틱스 코리아 (SoftBank Robotics Korea)가 인공지능(AI) 기반의 상업용 바닥 관리 자율 주행 로봇 위즈(Whiz)를 국내 공식 출시했다. ? 위즈는 브레인(Brain Corp)에서 개발한 상업적으로 인증된 클라우드 기반의 자율 주행 로봇 운영체제 브레인OS(BrainOS)로 구동된다. 간편한 설정 및 사용법을...
791,"AI로 되찾은 청각장애인의 목소리…KT, '마음톡' 개발",2020.07.26.,"이 프로젝트에는 AI(인공지능) 딥러닝 기술로 농인 가족의 목소리를 합쳐 새로운 목소리를 만드는 ‘개인화 음성합성기술’이 활용됐다. 농인 본인의 목소리 데이터 없이 새로운 목소리를 만들어냈다는 것이다. KT측은 “참가자 가족의 목소리 데이터와 참가자 성별, 나이, 구강구조 등 개인의 특성을 AI로..."
