,제목,날짜,본문
1361,"철강협회, 디지털융합진흥원과 ‘AI 전문 인력’ 양성",2020.09.22.,한국철강협회와 한국디지털융합진흥원이 철강 산업 분야 인공지능(AI) 전문 인력을 양성한다. 한국철강협회는 디지털융합진흥원와 함께 과학기술정보통신부가 공모한 ‘2020년 산업 전문 인력 AI 역량강화’사업에 선정됐다고 22일 밝혔다. 교육비용은 과기정통부가 전액 부담한다. 이번 사업의 목표는 AI를...
1362,"광주시, 인공지능사관학교 ‘끝장 개발대회’",2020.09.22.,“대한민국을 인공지능 4대 강국으로 견인하는데 구체적 비전을 제시하고 실현시키는 주인공이 될 것이다”고 격려했다. 이 시장은 또 “우리시는 전국 최초 AI 전문교육기관인 사관학교가 대한민국 최고의 AI 인재양성 산실로 자리매김할 수 있도록 지원과 협조를 아끼지 않겠다”고 말했다.
1363,"LG, 加토론토·맥마스터대, 佛토탈과 손잡고 'AI 연합' 결성",2020.09.24.,"LG가 친환경 촉매, 차세대 소재 등 화학소재 개발 분야에서 인공지능(AI)와 로봇 기술을 활용한 혁신을 가속화한다. LG사이언스파크는 지난 11일 캐나다의 토론토대학교와 맥마스터대학교, 프랑스 에너지·석유회사 토탈(Total)과 함께 'AI 기반 소재 개발 콘소시엄(A3MD)'을 결성해 공동연구를 추진한다고 13일..."
1364,"서울시, 응답소 민원 천만건 AI로 분석…""시정에 활용""",2020.09.24.,서울시는 스마트 민원분석 체계를 구축하고 예측 기반의 선제적 행정서비스로의 패러다임을 전환하고자 '인공지능(AI) 기반 응답소 민원분석 시스템'을 구축했다고 17일 밝혔다. 응답소는 서울시가 신속하고 투명한 민원처리를 위해 2014년부터 운영 중인 통합민원시스템으로 지난 6년간 1000만 건의 데이터가...
1365,"삼성전자, 그랑데 AI 소용량 출시…10㎏ 세탁기·9㎏ 건조기",2020.09.13.,"이번에 출시하는 신제품은 10㎏ 세탁기와 9㎏ 건조기로 그랑데 AI만의 차별화된 인공지능 기능은 그대로 유지하면서 심플한 컨트롤 패널, 컴팩트한 디자인 등을 강화했다는게 삼성전자의 설명이다. 삼성전자는 1인 가구가 빠르게 증가하고 있는 추세와 협소한 공간에도 설치 가능한 소형 프리미엄 제품에..."
1366,한화생명 '보험금 AI 자동심사 시스템' 기술특허 획득,2020.09.17.,포쓰저널 김지훈 기­자 4th.hun.gmail.com 한화생명이 개발한 보험금 AI(인공지능) 자동심사 시스템이 독창성을 인정받아 업계 최초로 특허청에서 2건의 기술특허를 획득했다고 21일 밝혔다.특허를 획득한 것은 ‘실손보험금 자동지급심사 시스템 및 그 방법’과 ‘새플리 값을 이용한 실손보험금 자동지급심사...
1367,추석 앞두고 고속버스터미널에 설치된 AI방역로봇,2020.09.16.,22일 오후 서울 서초구 고속버스터미널에 적외선 카메라와 안면인식 기술이 탑재된 인공지능(AI) 열화상 카메라 로봇이 설치돼 있다. 서초구는 민족 대명절 추석을 앞두고 신종 코로나바이러스 감염증(코로나19) 확산 방지를 위해 서울고속버스·센트럴시·서울남부터미널에 해당 로봇을 설치했다고...
1368,"삼성전자, 좁은 공간서도 설치 가능한 `그랑데 AI` 세탁기·건조기 출시",2020.09.16.,"삼성 그랑데 AI는 진화된 인공지능 기술로 사용자의 세탁 습관과 환경에 맞게 최적의 세탁·건조를 해주는 프리미엄 제품이다. 이번 신제품은 10kg 세탁기와 9kg 건조기로 그랑데 AI만의 차별화된 인공지능 기능은 그대로 유지하면서 심플한 컨트롤 패널, 컴팩트한 디자인 등을 강화했다. 삼성전자는 1인..."
1369,AI방역로봇 '추석 연휴 코로나19 확산 방지에 총력',2020.09.22.,22일 오후 서울 서초구 고속버스터미널에 적외선 카메라와 안면인식 기술이 탑재된 인공지능(AI) 열화상 카메라 로봇이 설치돼 있다. 서초구는 민족 대명절 추석을 앞두고 신종 코로나바이러스 감염증(코로나19) 확산 방지를 위해 서울고속버스·센트럴시·서울남부터미널에 해당 로봇을 설치했다고...
1370,"삼성전자, 좁은 공간서도 설치 가능한 `그랑데 AI` 세탁기·건조기 출시",2020.09.16.,"삼성 그랑데 AI는 진화된 인공지능 기술로 사용자의 세탁 습관과 환경에 맞게 최적의 세탁·건조를 해주는 프리미엄 제품이다. 이번 신제품은 10kg 세탁기와 9kg 건조기로 그랑데 AI만의 차별화된 인공지능 기능은 그대로 유지하면서 심플한 컨트롤 패널, 컴팩트한 디자인 등을 강화했다. 삼성전자는 1인..."
1371,"유버, ‘코로나19’ 차단하는 AI 워크스루 대인 살균 시스템 개발",2020.09.16.,자외선 시스템 전문 기업 유버가 오는 월 일금 인공지능AI 기술이 접목된 워크스루Walk through 대인 살균 시스템 개발에 성공했다고 밝혔다 기존 워크스루 살균법은 lsquo분무 방식rsquo과 lsquo자외선램프를 고정한 상태에서 살균하는 방식rsquo 둘 중 하나였다 하지만 두 방법 모두 인체에 무분별하게 분사될...
1372,[천지포토] 추석 앞두고 AI방역로봇 설치된 고속버스터미널,2020.09.23.,"추석을 일주일가량 앞둔 23일 오전 서울 서초구 고속버스터미널에서 인공지능(AI) 방역로봇이 탑승객들의 온도 등을 자동 측정하고 있다. 서초구에 따르면 추석 명절을 앞두고 코로나19 확산 방지를 위해 고속버스터미널, 남부터미널 등에 적외선 카메라와 안면 인식 기술이 탑재된 방역로봇을 배치한다. 이..."
1373,2025년까지 인공지능‧소프트웨어 지역 인재 3만7000명 양성한다,2020.09.23.,"ICT콤플렉스는 권역별 1개소가 구축되며, 인공지능(AI) 교육공간은 15개 시도에 전체 18개가 분산되어 구축된다. [과학기술정보통신부 제공] ICT콤플렉스는 인공지능 학습·개발에 관심있는 누구나 사용할 수 있는 개방형 공간으로 머신러닝이 가능한 고성능 PC 및 테스트용 스마트 기기 등 시설·장비 기반을..."
1374,"한국전력, 인공지능 활용 1인가구 안부 살펴",2020.09.18.,"한국전력은 지난 22일 서귀포시청에서 서귀포 SK텔레콤과 『인공지능 활용 사회안전망 서비스 제공을 위한 MOU』를 체결했다. 이번 MOU 체결은 1인... 안전에 도움이 됐으면 좋겠다“며 ”한전은 앞으로도 빅데이터, AI, IoT 등 디지털 신기술을 활용하여 다양한 공공서비스를 발굴하겠다“고 소감을 밝혔다."
1375,AI 활용 신약개발 전문교육과정,2020.09.16.,한국제약바이오협회(회장 원희목) 인공지능신약개발지원센터가 오는10월 13일까지 'AI 활용 신약개발 전문교육과정' 교육생을 모집한다고 28일 밝혔다. 이번 교육과정은 한국보건산업진흥원이 국내 신약개발 효율성을 높이기 위해 한국제약바이오협회를 '2020 AI 활용 신약개발 교육 및 홍보사업...
1376,"광주 북구, 인공지능 실무인재 양성 온라인 프로그램 개설·운영",2020.09.22.,"이번 사업은 4차 산업혁명 시대에 맞춰 인공지능 분야의 실무인재를 양성하고자 마련됐다. 교육기간은 내달부터 내년 2월까지이며 ▲입문(AI기초수학, AI기초프로그래밍) ▲공통(심층학습, 기계학습입문) ▲심화·응용(영상처리, 자연어처리, 음성인식) 과정으로 운영된다. 수강생이 70% 이상 학습한 경우..."
1377,"삼성전자, 소용량 '그랑데 AI'로 1인 가구 공략",2020.09.22.,"삼성 그랑데 AI는 진화된 인공지능 기술로 사용자의 세탁 습관과 환경에 맞게 최적의 세탁·건조를 해주는 프리미엄 제품이다. 이번 신제품은 10kg 세탁기와 9kg 건조기로, 그랑데 AI만의 차별화된 인공지능 기능은 그대로 유지하면서 심플한 컨트롤 패널, 컴팩트한 디자인 등을 강화했다. 삼성전자는 1인..."
1378,"한국철강협회, 철강 산업분야 'AI' 전문 인력 양성",2020.09.22.,한국철강협회와 한국디지털융합진흥원이 철강산업 분야 인공지능(이하 AI) 전문 인력을 양성에 나선다. 한국철강협회와 디지털융합진흥원은 과학기술정보통신부가 공모한 '2020년 산업 전문 인력 AI 역량강화' 사업에 선정됐다고 22일 밝혔다. 이 사업은 철강 산업 지능화를 위한 Steel-AI 융합 전문 인력 양성을...
1379,"한국철강협회, 철강 산업분야 'AI' 전문 인력 양성",2020.09.22.,한국철강협회와 한국디지털융합진흥원이 철강산업 분야 인공지능(이하 AI) 전문 인력을 양성에 나선다. 한국철강협회와 디지털융합진흥원은 과학기술정보통신부가 공모한 '2020년 산업 전문 인력 AI 역량강화' 사업에 선정됐다고 22일 밝혔다. 이 사업은 철강 산업 지능화를 위한 Steel-AI 융합 전문 인력 양성을...
1380,"중소기업스마트제조혁신기획단 김일호 단장 ""스마트공장 고도화 'AI·데이터'...",2020.09.22.,"데이터 활용 및 인공지능 등을 기반으로 한 국내 공급기업의 경쟁력 강화 방안은? 스마트공장에서 생성되는 데이터를 저장·분석·활용해 중소기업의 AI 스마트공장화를 지원하는 'AI 중소벤처 제조 플랫폼(KAMP)'을 구축에 집중할 계획이다. 이를 통해 중소기업의 생산성을 향상시키고, 제조데이터 활용에..."
1381,"LG, AI로 화학소재 개발 나선다",2020.09.22.,"LG가 화학소재 개발 분야에서 인공지능(AI)과 로봇 기술을 활용한 혁신을 가속화한다. LG사이언스파크는 캐나다의 토론토 대학교와 맥마스터 대학교, 프랑스 에너지, 석유회사 토탈과 함께 ‘AI 기반 소재 개발 컨소시엄(A3MD, The Alliance for AI-Accelerated Materials Discovery)’을 결성해 공동연구를 추진한다고 13일..."
1382,"[스마트클라우드쇼 2020] LG전자 ""인지노동 줄여주는 AI… 2029년 초생산성 시...",2020.09.25.,"인지노동을 경감시켜주는 인공지능(AI)을 제품·서비스에 구현해나가는 게 목표입니다."" 이철배 LG전자 디자인경영센터 선행디자인연구소장(전무)은 24일 국내 최대 테크 콘퍼런스 ‘스마트클라우드쇼 2020’ AI 세션에 참석해 ""청소기·세탁기가 인간의 물리적 노동을 줄였듯, AI가 사람들의 인지노동을..."
1383,"광주시, 인공지능사관학교끝장개발대회개최",2020.09.16.,"광주 실현의 핵심동력이다""면서 ""대한민국을 인공지능 4대강국으로 견인하는데 구체적 비전을 제시하고 실현시키는 주인공이 될 것이다""고 격려했다. 이어 ""우리시는 전국 최초의 AI 전문교육기관인 사관학교가 대한민국 최고의 AI 인재양성 산실로 자리매김할 수 있도록 지원과 협조를 아끼지 않겠다""고 말했다."
1384,"코리아세븐, AI접목 `편의점` 밤에도 철통보안",2020.09.16.,"◆ 디지털경영혁신대상 / 과기부장관賞 ◆ 편의점 세븐일레븐(대표 최경호)은 스마트 편의점 모델 '시그니처'와 세계 최초 핸드페이를 탑재한 인공지능(AI) 결제 로봇 '브니', 스마트 자판기형 편의점 '익스프레스', AI 기반 가맹점 실시간 소통 메신저 '챗봇 브니' 등 디지털 전환에 기반해 편의점의 4차..."
1385,"ETRI-서울대, 차세대 AI 반도체 R&D 맞손",2020.09.23.,차세대 먹거리로 급부상하고 있는 인공지능(AI) 반도체 분야 기술 공유와 개발 협력으로 연구에 탄력이 붙을 전망이다. 한국전자통신연구원(ETRI)은 서울대 반도체공동연구소와 기관 간 반도체 연구시설을 공동 플랫폼으로 활용키로 하는 등 차세대 AI 반도체 분야 협력기반을 마련했다고 16일 밝혔다. 지난...
1386,"인천중부경찰서, 전국 최초 '인공지능(AI) 기반 영상검지기' 구축",2020.09.23.,인천중부경찰서는 지난 8월 말부터 지역 내 주요도로인 서해대로의 가장 혼잡한 교차로인 수인사거리에 '인공지능(AI) 기반 영상검지기'를 전국 최초로 설치해 현재까지 시범운영하고 있다고 23일 밝혔다. '인공지능(AI) 기반 영상검지기'는 기존 도로에 검지선을 매설하고 교통정보를 수집하는 방식과 다르게...
1387,"KETI, 청각장애인 안내 돕는 AI 동반자 기술 선보여",2020.09.23.,"한국전자기술연구원(KETI, 원장 김영삼)이 세계 수어의 날을 맞아 김포 국제공항에서 인공지능 기반 수어 인식 기술이 적용된 공항 내 시설 안내 시스템을 개발하고 성능 검증을 위한 시연회를 개최했다. 오늘(9월 23일)은 유엔이 지정한 ‘세계 수어의 날’이다. 공항과 같이 복합 시설에 설치된 기존의 유..."
1388,"KT-현대건설기계, AI 음성인식 ‘5G 무인지게차’ 선보인다",2020.09.16.,"이후 5G, 인공지능(AI), 빅데이터(Big Data), 클라우드(Cloud) 등 ICT를 기반으로 디지털 혁신(DX, Digital Transformation) 사업화를 위한 실증사업을 추진했다. 이번 행사에서 양사는 협업으로 공동개발 한 5G 기반 무인지게차 원격관리 제어 기술, AI 기반 무인지게차 긴급 음성제어 기능, 3차원 무인지게차 측위..."
1389,"ETRI, 서울대와 차세대 AI 반도체 협력",2020.09.22.,인공지능(AI) 분야 연구에 주력하는 한국전자통신연구원(ETRI·원장 김명준)이 서울대와 AI 반도체 분야 기술 공유 및 개발 협력에 나선다. 차세대 AI 반도체 관련 원천기술을 확보하고 관련 분야 기술의 글로벌 경쟁력을 확보하는데 큰 도움이 될 전망이다. ETRI는 서울대 반도체공동연구소와 기관 간...
1390,"교보생명, AI 챗봇 '러버스 2.0' 오픈으로 언택트 서비스 활성화",2020.09.23.,교보생명이 인공지능(AI) 전문기업 카카오엔터프라이즈와 함께 카카오 AI 챗봇 '러버스 2.0'을 개발·오픈했다고 22일 밝혔다. 이는 포스트 코로나 시대에 대비한 '디지털 교보 2020'의 일환으로 AI 기술을 한발 앞서 보험업무에 적용하고 비대면 고객 서비스를 활성하기 위한 것이다. 또 보험업계에서...
1391,제조업 生死…AI·친환경 기술 트렌드 적응에 달렸다,2020.09.16.,"권 전 회장은 ""팬데믹 이후 비대면 접촉이 증가하게 된 만큼 공장 운영도 자동화하는 시대가 올 것""이라며 ""IoT(사물인터넷), 빅데이터, AI(인공지능) 등과 같은 ICT(정보통신기술)를 활용한 스마트팩토리 구축은 제조업 경쟁력 향상에 핵심 요소가 되고, 기업 경쟁력의 지속적인 향상과 새로운 비즈니스 기회를..."
1392,"디쉐어, AI 내신 솔루션 '내신의 모든 것' 출시",2020.09.21.,"후 인공지능 추천 알고리즘을 적용한 서비스다. 학교별 기출 경향에 맞춰 출제 가능성이 높은 문제를 선별함은 물론, 학습 상태 및 결과를 계속 분석하여 개개인에 최적화된 문제들을 자동 추천하는 방식으로 운영된다. 학생의 시험 일정과 범위가 확정되면 시험 20일 전부터 AI가 추천하는 문제와 풀이가 매일..."
1393,"당진교육지원청, 인공지능·상상이룸 교육 관리자 연수",2020.09.21.,"박혜숙 교육장은 ""코로나 상황과 포스트 코로나 시대에도 인공지능교육의 중요성은 더 강조될 것""이라며 ""당진교육지원청은 1학기에 소프트웨어교육 연수, AI교육 담당교원 역량강화 연수, AI교육 초등학교 관리자 연수 등을 실시함으로써 포스트 코로나 시대 교원의 전문성 신장을 위해 노력하고 있다""고..."
1394,"삼성, 그랑데 AI 세탁기·건조기 소용량 신제품 출시",2020.09.22.,삼성 그랑데 AI는 인공지능 기술을 탑재해 소비자의 세탁 습관·환경에 맞춰 최적의 세탁·건조를 돕는 프리미엄 제품이다. 이번 신제품은 10㎏ 세탁기와 9㎏ 건조기다. 삼성전자는 빠르게 증가하는 1인 가구와 협소한 공간에도 설치할 소형 프리미엄 제품을 원하는 소비자 수요를 반영해 그랑데 AI 소용량...
1395,"현대·기아차, AI 기술자문 영입…스마트공장·로봇 신사업 추진 박차",2020.09.22.,현대·기아차가 인공지능(AI) 자문위원을 영입해 신사업 전략을 짜고 있다. 현대·기아차는 AI 최고 석학으로 꼽히는 미국 메사추세츠 공과대학(MIT) 토마소 포지오 교수와 다니엘라 러스 교수를 자문위원으로 영입해 다양한 프로젝트를 진행 중이라고 24일 밝혔다. 이들은 AI에 기반한 ▲차량 품질 향상...
1396,"에이젠글로벌, 인텔 AI빌더 프로그램 선정",2020.09.22.,인공지능(AI) 금융 기업 ㈜에이젠글로벌(AIZEN)은 지난 21일 '인텔 AI 빌더 프로그램'에 선정됐다고 23일 밝혔다. 인텔은 우수한 AI기업 대상으로 기술적 최적화 및 마케팅 파트너십을 제공하는 'AI Builders Program' (AI 빌더 프로그램)을 운영하고 있다. 인텔 AI빌더에 선정된 기업은 인텔과 함께 ▶인텔 AI...
1397,'지역ICT이노베이션스퀘어'준비 착착…AI·SW 교육생 모집,2020.09.23.,"이 사업은 2025년까지 총 1650억 원을 투입해 인공지능(AI)과 소프트웨어(SW) 핵심 인재 3만 7000명 양성을 목표로 한다. 착수보고회에는 장석영 과기정통부 2차관과 13개 지방자치단체 관계자, 수행 기관장, 정보통신산업진흥원 등 관계자 30여 명이 영상회의 방식으로 참여해 이노베이션스퀘어의..."
1398,"[비즈톡톡] '두뇌'부터 공개된 아이폰12… ""AI 성능 향상에 '올인'한듯""",2020.09.23.,"미세공정 향상에 따라 칩 다이(die) 내에 남는 공간에 별도의 캐시 메모리를 넣어 성능을 늘릴수도 있고, 최근에는 뉴럴엔진(Neural Engine)을 배치해 인공지능(AI) 추론 연산 기능을 강화하기도 합니다. 반면 애플 A14 바이오닉은 최신 반도체 공정에 따른 트랜지스터 숫자와 집적도는 '역대급'이지만 정작..."
1399,코로나19 이후 인공지능 역할은…SKT ai.x 콘퍼런스 개최,2020.09.17.,올해 3회째인 이 행사에는 국내외 저명 인공지능(AI) 전문가가 참여한다. 행사는 신종 코로나바이러스 감염증(코로나19) 확산 방지를 위해 비대면으로 열린다. '인간. 기계. 함께 하는 경험(Human. Machine. Experience Together)'을 주제로 코로나19 상황에서의 다양한 변화를 중심으로 AI의 역할과...
1400,인공지능 도입하는 대전도시철도,2020.09.17.,대전시와 대전도시철도공사는 과학기술정보통신부 주관 '디지털 뉴딜 사업' 인공지능(AI) 분야에서 2건의 사업이 선정돼 국비 53억 원을 확보했다고 21일 밝혔다. 사업 선정으로 시는 전국 최초로 도시철도에 인공지능을 도입한다. 인공지능은 안전사고를 예방하고 불법촬영 등을 감시하며 기계시설물 고장을...
1401,"그래프코어, AI 플랫폼 확산 위한 &apos;엘리트 파트너 프로그램&apos; 공개",2020.09.22.,그래프코어가 자사 인공지능(AI) 컴퓨팅 플랫폼 확산을 위해 파트너 지원 프로그램 &apos;엘리트 파트너 프로그램&apos;을 23일 공개했다. 엘리트 파트너 프로그램은 스케일아웃 및 슈퍼컴퓨팅을 지원하는 그래프코어의 AI 컴퓨팅 플랫폼인 &apos;IPU-M2000&apos;과 &apos;IPU-POD&apos;에 대한 요구사항을 충족하기...
1402,"초등 컴퓨팅 전문가 홍지연 교사, '인공지능 엔트리를 만나다' 발간",2020.09.22.,"초등 컴퓨팅 교육 전문가로 소프트웨어(SW) 및 인공지능(AI) 교육 활성화에 힘쓰고 있는 홍지연 교사(경기 용인석성초)가 인공지능 활용 워크북 '인공지능, 엔트리를 만나다'를 펴냈다. '인공지능, 엔트리를 만나다'는 블록형 프로그래밍 언어인 엔트리를 활용해 인공지능을 재미있게 탐험할 수 있도록 구성한 것이..."
1403,"현대·기아차, AI 분야 세계 최고 석학 기술 자문위원 영입",2020.09.22.,"성열휘 기자 | 현대·기아차가 인공지능(AI) 분야 최고 석학으로 손꼽히는 미국 메사추세츠 공과대학(MIT)의 토마소 포지오 교수와 다니엘라 러스 교수를 자문위원으로 영입했다고 24일 밝혔다. 현대·기아차는 AI 기술 자문위원들을 통해 인공지능을 기반으로 신사업 기획 및 기술 전략 수립, 글로벌 연구 조직..."
1404,"IBK기업은행, 국내 최초 ‘AI 부동산 자동심사 시스템’ 도입",2020.09.22.,"IBK기업은행은 국내 최초로 인공지능(AI)을 활용해 부동산 담보대출 가능 금액을 심사하는 ‘AI 부동산 자동심사 시스템’을 25일부터 도입할 예정이라고 22일 밝혔다. 국토교통부, 법원, 국토정보공사 등에서 수집한 공공데이터를 바탕으로 AI가 서류발급, 권리분석, 규정검토 등을 수행해 대출가능 여부, 금액..."
1405,"서울 강동구, AI 재활용품 무인회수기 확대",2020.09.18.,서울 강동구는 인공지능(AI) 재활용품 무인회수기 '네프론'을 확대 운영한다고 18일 밝혔다. 구는 암사동 유적 관리사무소 앞에 네프론 3호를 설치하고 이달부터 운영에 들어갔다. 네프론은 인공지능(AI)과 사물인터넷(IoT) 기술을 적용한 자판기 형태의 재활용품 회수기다. 캔이나 페트병을 투입구에 넣으면...
1406,[천지포토] '코로나19 방역 강화' 안면인식 기술 탑재된 AI방역로봇,2020.09.22.,"추석을 일주일가량 앞둔 23일 오전 서울 서초구 고속버스터미널에서 인공지능(AI) 방역로봇이 탑승객들의 온도 등을 자동 측정하고 있다. 서초구에 따르면 추석 명절을 앞두고 코로나19 확산 방지를 위해 고속버스터미널, 남부터미널 등에 적외선 카메라와 안면 인식 기술이 탑재된 방역로봇을 배치한다. 이..."
1407,"리치앤코, 광주광역시와 AI생태계 조성 앞장",2020.09.22.,[사진=리치앤코] 법인보험대리점(GA) 리치앤코가 지난 21일 광주광역시와 함께 광주형 인공지능(AI) 비즈니스 기반 조성을 위한 업무협약을 체결했다고 22일 밝혔다. 이번 협약은 광주시가 향후 10년 동안 약 1조원의 예산을 투입해 조성 예정인 '광주 인공지능 클러스터' 사업에 리치앤코가 적극 참여하고 상호...
1408,"AI 스타트업 블루프린트랩, 美 MASQ와 솔루션 공급 계약 체결…얼굴인식 및 A...",2020.09.17.,사진:MASQ 홈페이지 캡처 및 편집 인공지능(AI) 안경추천 및 AR 가상피팅 솔루션 개발 업체 블루프린트랩(대표 신승식)이 미국의 안경 프랜차이즈 업체 MASQ(대표 Paul Kim)와 솔루션 공급을 위한 계약을 체결했다. 블루프린트랩은 이번 계약을 통해 자사가 개발한 검안의용 매장 솔루션 'SEEOSk'가 미국...
1409,[AI와 헬스케어가 바꾸는 미래사회] AI 헬스케어의 현주소는?,2020.09.17.,각 산업분야에서 인공지능(AI)과 빅데이터에 대한 관심은 날이 갈수록 높아지고 있다. 특히나 의료계는 첨단기술을 도입해 빠르고 정확한 진단·예측·수술 3박자가 이뤄지는 의료혁신을 꿈꾸고 있다. 인간 의사를 대신해 로봇이 환자 몸에 메스를 갖다 대는 모습이 머지않은 현실에서 이뤄질 것이다. AI와...
1410,"LG, AI로 화학소재 개발 나선다…다국적 컨소시엄 결성",2020.09.13.,"캐나다 토론토대·맥마스터대·프랑스 토탈사와 공동 연구 LG가 인공지능(AI)과 로봇 기술을 활용해 친환경 촉매, 차세대 소재 등 화학소재 개발에 나선다. LG사이언스파크는 11일 캐나다의 토론토대와 맥마스터대, 프랑스 에너지·석유회사 토탈(Total)과 함께 'AI 기반 소재 개발 컨소시엄(A3MD, The Alliance..."
1411,"스타키, 추석맞이 AI보청기 할인 이벤트 진행",2020.09.13.,국내 대표 청각전문기업 스타키그룹(대표 심상돈)의 보청기 전문케어 서비스 '스타키라이프'에서 추석을 맞아 신제품 충전식 귓속형 인공지능 보청기 리비오 AI 할인 이벤트를 진행한다고 밝혔다. 코로나 19로 마스크 착용이 일상화된 요즘 부정확한 말소리와 입모양을 볼 수 없어 난청인들은 듣는데 더...
1412,"철강협회, 철강산업 분야 AI 전문 인력 양성",2020.09.22.,Steel-AI 융합 인력양성 교육과정 구성도 한국철강협회는 한국디지털융합진흥원과 철강산업 분야 인공지능(AI) 전문 인력을 양성한다고 22일 밝혔다. 한국철강협회와 디지털융합진흥원은 과학기술정보통신부가 공모한 '2020년 산업 전문 인력 AI 역량강화' 사업에 선정됐다. '철강 산업 지능화를 위한 Steel-AI...
