,제목,날짜,본문
1302,"광주시, AI전문기업 3곳과 업무협약 체결",2020.11.23.,"광주시, AI전문기업 3곳과 업무 협약 체결 럭스로보ㆍ로보케어ㆍ얍컴퍼니 ""인공지능 산업생태계 조성 협력"" 광주시, AI 유치기업과 업무협약 이용섭 광주광역시장이 25일 시청 비즈니스룸에서 AI 유치기업인 ㈜럭스로보, ㈜로보케어, ㈜얍컴퍼니 등 3개 업체와 광주형 인공지능 비즈니스 기반 조성을 위한..."
1303,"인제대, AI튜터 활용 '영어 인터뷰 이벤트' 진행",2020.11.20.,"인제대 대학일자리센터는 인공지능을 활용한 AI튜터 프로그램을 사용해 생활, 비즈니스 영어를 학습하는 재학생 2500명에게 커피 쿠폰을 증정한다. 우수 수료자 3명에게는 아이패드를 지급한다. 이번 이벤트는 파고다교육그룹 및 LG CNS의 지원을 받아 진행하며, 파고다교육그룹은 작년에 이어 올해도 인제대에..."
1304,"네이버, 동양생명 이어 미래에셋생명에도 'AI 상담사' 투입",2020.11.23.,네이버클라우드가 미래에셋생명과 클라우드 기반 보험 시스템 구축 및 인공지능(AI) 서비스 도입을 위한 업무협약을 체결했다고 16일 밝혔다. 앞서 네이버클라우드는 이달 초 동양생명과 업무협약을 맺고 동양생명의 보험·퇴직연금 서비스에 내년 상반기 중 AI 상담 서비스를 접목하기로 한 바 있다....
1305,"모두의연구소, AI 전문 교육과정 ‘아이펠 대전’ 오픈",2020.11.23.,"인공지능(AI) 자립형 연구소인 모두의연구소(대표 김승일)가 대전시, 고용노동부와 함께 AI 개발자 양성을 위한 ‘아이펠(AIFFEL) 대전’ 교육과정을 설립했다고 26일 밝혔다. ‘아이펠 대전’은 고용노동부에서 에듀테크 기업들을 대상으로 진행하는 K-디지털 사업을 통해 수강료가 전액 지원된다. 총 6개월..."
1306,유·초·중·고 과정에 AI 교육 도입…고교는 내년 2학기에 신설,2020.11.18.,"앞으로 유·초·중·고교 과정에 인공지능(AI) 교육이 도입된다. 내년 2학기부터는 고등학교에 AI 과목이 신설되고, 유치원과 초·중학교에도 내년부터 AI 수업·학습자료가 개발돼 보급된다. 유은혜 부총리 겸 교육부장관은 20일 정부서울청사에서 사회관계장관회의 겸 사람투자인재양성협의회를 개최하고 'AI..."
1307,"광주시, AI산업 성공여부, 인재확보에 달려",2020.11.23.,"광주광역시는 23일 서울 롯데호텔에서 인공지능(AI)사업과 관련한 정부, 법조‧금융‧산업‧학계 등 각계각층 인사들이 대거 참석한 가운데 '초인 AI가 온다' 보고대회를 개최했다. 이날 행사는 AI가 바꿔놓을 미래를 전망하며, 인공지능 강국 대한민국 실현을 위한 인재 양성과 기술 확보, 제도 마련 등에..."
1308,KT 주도 ‘AI원팀’ 인재양성 본격 나선다!,2020.11.20.,"KT 등이 포함된 ‘AI(인공지능) 원팀(One Team)’이 기업 실무형 AI 인재양성 교육과정을 개발하며 AI인재를 본격 양성한다고 18일 밝혔다. AI원팀은 KT를 비롯해 현대중공업그룹, LG전자, LG유플러스, 한국투자증권, 동원그룹, KAIST, 한양대, ETRI 등 9곳의 산업계, 학계, 연구 분야의 대표 기관들로 이루어진..."
1309,"흥국화재, 'AI 서비스 확대' 위해 네이버클라우드와 맞손",2020.11.20.,"양사는 우선적으로 AI OCR(인공지능 기반 광학문자판독), AI 기반 신분증 진위여부 판독, AI 컨택센터 등 다양한 분야에서의 사업 협력을 시작했다. 현재는 보험금청구 접수서류인 입통원영수증 처리 업무에 AI OCR을 추진하고 있다. 흥국화재 기획마케팅본부장 이종수 전무는 ""보험산업에 AI기술을 활용하여 신사업..."
1310,AI 학습 데이터 시장 활성화 업무협약,2020.11.20.,㈜유클리드소프트 제공 빅데이터 기반의 인공지능(AI) 분야 전문기업 ㈜유클리드소프트가 인공지능 학습 데이터 시장 활성화를 위해 고경력과학기술인·지역 청년과 맞손을 잡는다. 24일 대덕특구비즈센터(TBC)에서 고경력과학기술인사업화위원회·대전청년협동조합연합회와 상호 업무협약을 체결하고...
1311,"농협은행-AI양재허브, 'AI혁신기업 육성 지원' 협약",2020.11.20.,농협은행은 지난 19일 서울 서초구 소재 NH디지털혁신캠퍼스에서 AI양재허브와 인공지능(AI) 혁신기업 육성 지원을 위한 업무협약을 체결했다고 20일 밝혔다. 서울시가 운영하는 AI양재허브는 인공지능 관련 전문 인재를 양성하고 AI 특화 기업을 발굴·육성하며 개방형 연구 문화와 AI 전문가 간의 소통...
1312,"이글루시큐리티, `전이학습 효율성 증대` AI 특허 취득",2020.11.19.,이글루시큐리티(067920)는 전이 학습의 효율성을 높이는 인공지능(AI) 관련 특허를 취득했다고 19일 밝혔다. 이번 특허기술을 AI 보안관제 솔루션인 `스파이더 티엠 에이아이 에디션(SPiDER TM AI Edition)`에 적용해 고도화된 사이버침해 시도에 대한 대응 능력을 강화할 전략이다. 지도학습 머신러닝 알고리즘의...
1313,포스텍-SK 하이닉스 인공지능협력센터 개소,2020.11.23.,"포스텍-SK하이닉스 인공지능협력센터(AI Collaboration Center, 이하 AICC)는 산업 현장에서 발생하는 데이터를 분석하고 이를 기반으로 난제를 해결할 최적의 솔루션을 찾을 수 있는 AI 기술을 연구한다. 센터 개소로, SK하이닉스가 가공되지 않은 데이터를 제공하면 포스텍 인공지능대학원..."
1314,"KAIST, 메모리-중심 인공지능 가속기 시스템 개발",2020.11.24.,"인공지능 기술을 기반으로 고안된 추천시스템 알고리즘은 구글(Google), 페이스북(Facebook), 유튜브(YouTube), 아마존(Amazon) 등 빅테크 기업들이 콘텐츠 추천 및 개인 맞춤형 광고를 제작하는데 기반이 되는 핵심 인공지능 (AI) 기술이다. 온라인 광고를 통한 수입은 구글과 페이스북과 같은..."
1315,"'천재의 몰락'…바둑 신동 김은지, AI 부정행위로 1년 자격정지",2020.11.17.,한국기원이 '천재 바둑소녀'로 불리며 한국 바둑계의 기대를 한 몸에 받았던 김은지 2단(13)에게 인공지능(AI)을 사용한 부정행위로 1년간의 자격 정지 처분을 내렸다. 20일 열린 한국기원의 징계위원회에서는 AI를 사용한 부정행위로 소속기사 내규와 전문기사 윤리규정을 위반한 김 2단에게 자격정지...
1316,"AI기반 핀테크 업체 콰라소프트, 35억 시리즈 A 투자유치",2020.11.17.,"B2C 서비스로 11개국에서 활용 가능한 인공지능 주가예측 로보어드바이저 애플리케이션인 코쇼(KOSHO) 및 키워드 검색만으로 관련된 주식, 뉴스, 공시자료와 종목 비교를 한눈에 할 수 있는 인공지능 애널리스트 왓이즈펀드(Whatisfund.ai)를 제공하고 있다. 콰라소프트는 지난해 가트너 핀테크 AI 부문 ‘2019 쿨..."
1317,"네이버, 지능형 로보틱스 핵심 인프라 '아크(ARC)' 정식 공개",2020.11.19.,"인공지능(AI)과 클라우드, 로봇을 실시간으로 연결해 실제 공간에서 로봇이 보다 효율적으로 사람에게 서비스를 제공할 수 있도록 설계됐다. 네이버는 ARC를 내년 완공을 앞둔 제2사옥에 접목하는 것을 시작으로 향후 기술 연구를 넘어 실제 로봇 서비스의 대중화 시점을 앞당기겠다는 전략이다...."
1318,"경북도, '비전 인공지능'로 고품질 한우 수정란 판별 사업 추진",2020.11.19.,경북도가 '비전 인공지능(AI)'을 축산업에 도입해 고품질 한우 수정란을 골라 이식하고 소의 비문(鼻紋)으로 축산물이력제의 신뢰도를 높이는 사업을 추진하고 있어 관심을 끌고 있다. 경북도는 19일 도청 회의실에서 라온피플㈜(대표 이석중)과 첨단 '비전 인공지능(AI)'을 이용해 스마트 축산기반을 조성하기...
1319,"ETRI, '자폐스펙트럼장애' 선별 인공지능 개발 나서",2020.11.23.,국내 연구진이 자폐스펙트럼장애(ASD)를 조기에 알아내는데 도움을 줄 수 있는 인공지능(AI) 기술 연구를 수행 중이다. 본 기술을 통해 세계적 증가 추세에 있는 자폐스펙트럼장애를 이른 시기에 선별하는 데 큰 도움이 될 전망이다. 한국전자통신연구원(ETRI)은 '영유아·아동의 발달장애 조기선별을 위한 행동...
1320,"인공지능 핀테크 '콰라', 35억 규모 시리즈A 투자 유치",2020.11.17.,"B2C 서비스로 11개국에서 활용 가능한 인공지능 주가예측 로보어드바이저 애플리케이션인 코쇼(KOSHO) 및 키워드 검색만으로 관련된 주식, 뉴스, 공시자료와 종목 비교를 한눈에 할 수 있는 인공지능 애널리스트 왓이즈펀드(Whatisfund.ai)를 제공하고 있다. 한편 콰라소프트는 지난해 가트너 핀테크 AI 부문 '2019 쿨..."
1321,"이글루시큐리티, 전이 학습 효율 높이는 AI 특허 취득",2020.11.19.,"㈜이글루시큐리티는 전이 학습의 효율성을 높이는 AI(인공지능) 관련 특허를 취득했다고 19일 밝혔다. 이글루시큐리티는 본 특허기술을 AI 보안관제 솔루션인 'SPiDER TM AI Edition(스파이더 티엠 에이아이 에디션)'에 적용, 고도화된 사이버 침해 시도에 대한 대응 능력을 강화할 전략이다. 지도학습 머신러닝..."
1322,"광주광역시, MBN‧광주과기원 공동주최 AI보고대회 개최",2020.11.17.,"광주광역시는 23일 서울 롯데호텔에서 인공지능(AI)사업과 관련한 정부, 법조‧금융‧산업‧학계 등 각계각층 인사들이 대거 참석한 가운데 ‘초인 AI가 온다’ 보고대회를 개최했다. 이날 행사는 AI가 바꿔놓을 미래를 전망하며, 인공지능 강국 대한민국 실현을 위한 인재 양성과 기술 확보, 제도 마련 등에..."
1323,"인공지능, 망막 분석하는 파킨슨병 진단법 개발",2020.11.17.,미국 플로리다대 과학자들이 망막의 두께와 미세혈관 구조를 AI(인공지능) 알고리즘으로 분석해 파킨슨병을 찾아내는 조기 진단법을 개발했다. 이 대학 연구진은 오는 29일(현지시간) 개막하는 북미영상의학회(RSNA) 연차 총회에 이런 내용의 보고서를 제출할 예정이다. 1915년 설립된 RSNA엔 전 세계 방사선...
1324,"정부, 공공연구 연계 신산업 선도 모델 구축...AI분야 ETRI 산학법인 선정돼",2020.11.26.,한국전자통신연구원(ETRI) 산학연공동연구법인은 '인공지능(AI) 자동화 및 실시간 데이터처리구조(파이프라인)를 지원하는 인공지능 표준공정(플랫폼)' 상용화를 계획하고 있다. 이 기술의 경우 AI 서비스 전 분야에 적용이 가능하다. 울산과학기술원(UNIST) 산학연공동연구법인은 이산화탄소에 따른 기후 변화...
1325,"SK건설, 스마트홈 시스템 'AI스카이' 신규건축부터 도입",2020.11.18.,▲ SK건설 인공지능 스마트홈 ‘SK VIEW AI Home Service’.(사진=SK건설) 다산이앤지와 SK건설이 손잡고 만든 인공지능(AI) 기술이 신규 SK뷰단지부터 적용된다. SK건설은 다산지앤지와 공동개발한 SK뷰 AI 홈서비스(이하 스카이)를 신규건축단지부터 도입된다고 23일 밝혔다. 스카이는 재실감지·자동제어·음성인식...
1326,"네이버‧카카오‧통신사 총출동, 대한민국 인공지능을 만나다",2020.11.23.,"정부가 인공지능(AI) 기본구상 및 국가전략을 수립한 후 1년간의 성과와 미래비전을 공유하고 기업 도전을 격려하는 자리를 마련했다. 25일 경기도 일산 킨텐스에서 열린 ‘한국판 뉴딜, 대한민국 인공지능을 만나다’ 행사에는 네이버와 카카오를 비롯해 삼성전자, SK텔레콤, KT 등 주요 정보통신기술(ICT)..."
1327,"""AI를 따르라?""···한화시스템, 국내 첫 軍 AI참모 개발 착수",2020.11.17.,한화시스템(272210)이 인공지능(AI)을 적용한 국방 지휘통제 지능화 서비스 개발에 나선다. 공상과학 영화에서나 볼 수 있던 이른바 ‘AI 참모’의 등장을 예고한 것이다. 한화시스템은 ‘지능형 전장 인식 서비스 및 플랫폼 서비스 통합 기술’ 과제 우선협상 대상자로 선정됐다고 13일 밝혔다. AI를 군...
1328,"야나두, AI 기능으로 고도화한 2.0 버전 출시…교육 포털 본격화",2020.11.17.,"카카오 에듀테크 계열사 야나두(공동대표 김정수, 김민철)가 인공지능(AI) 기능으로 고도화한 '야나두 2.0' 버전을 선보인다고 23일 밝혔다. 야나두 2.0 버전은 모든 강좌에 AI 트레이닝 기능을 적용해 고도화하고, 학습패턴 분석결과를 활용한 자동 학습 큐레이션 기능으로 개인 맞춤형 서비스를 강화했다. 이번..."
1329,"과학기술정보통신부 ""온라인 코딩파티에 66만명 참가…AI교육에 기여""",2020.11.20.,온라인 코딩파티는 소프트웨어(SW)와 인공지능(AI)이 만들어지는 원리를 게임처럼 익히고 컴퓨팅 사고력을 향상할 수 있는 체험 행사다. 올해에는 AI와 창업 체험 등 새로운 프로그램 19개를 도입했다. 과기정통부는 특히 어린이들이 쉽게 코딩을 접할 수 있도록 한 블록코딩 '달려라 펭수'와 '뚜앙과...
1330,"KT ‘AI 원팀’, 인공지능 인재양성 돌입",2020.11.20.,"인공지능(AI) 역량 강화를 위해 모인 ‘AI 원팀(One Team)’이 AI 인재양성에 본격 돌입한다. 18일 KT는 AI 원팀에서 기업 실무형 AI 인재양성 교육과정을 개발했다며 이 같이 밝혔다. AI 원팀은 KT를 비롯해 현대중공업그룹, LG전자, LG유플러스, 한국투자증권, 동원그룹, KAIST, 한양대, ETRI 등 9곳이 참여하는..."
1331,'SKT AI 아리아' 부르고 지구촌 어린이 돕는다,2020.11.20.,"이번 협력으로 양사는 지난 3월부터 공동 개발해 온 인공지능 스피커를 활용한 신개념 기부 프로그램 'AI 기브유'를 처음으로 선보이고 본격 운영에 나선다. 'AI 기브유'는 AI 스피커 '누구(NUGU)'로 기부할 수 있는 프로그램이다. 이용자가 누구 호출어인 ""아리아""를 부르고 ""기브유에서 유니세프로 기부해줘..."
1332,"현대건설, 全 현장에 재해예측 AI 도입",2020.11.20.,현대건설이 전 건설현장에 '재해 예측 인공지능(AI)'을 도입해 AI를 활용한 선제적인 안전관리에 나선다. 현대건설은 지난 10월부터 '재해 예측 AI'를 가동 중이라고 고 17일 밝혔다. 현대건설의 모든 건설현장에 적용되는 '재해 예측 AI'는 작업 당일 예상되는 재해위험 정보를 제공해 선제적 안전관리가...
1333,"NH농협銀, AI혁신기업 육성 업무협약 체결",2020.11.17.,서울시가 운영하는 AI양재허브는 인공지능 관련 전문 인재를 양성하고 AI 특화 기업을 발굴·육성하는 인공지능 분야 전문 지원 기관이다. 양사는 △AI기반 혁신기업들과의 업무 협력체계 구축 및 신사업 발굴 △AI역량 강화 교육프로그램 개발 △인공지능을 테마로 한 데모데이·해커톤 공동 개최 △AI기술...
1334,"KT, GS리테일과 ‘AI 플랫폼 통한 디지털 물류혁신’ 제휴",2020.11.17.,"KT가 GS리테일과 인공지능(AI), 빅데이터 등 최첨단 정보통신기술(ICT)로 국내 물류 산업의 혁신을 주도하기 위해 협력한다. KT(대표이사 구현모)는 GS리테일과 ‘디지털물류 사업’을 공동으로 추진한다고 17일 밝혔다. 이날 양사는 서울시 강남구 GS타워에서 사업협력을 위한 업무협약(MOU)을 맺었다. 이날 KT..."
1335,AI로 예측해본 中企 미래유망기술…재난예측·에너지관리 기술 뜬다!,2020.11.23.,"정보를 인공지능으로 수치화하여, 딥러닝 예측모형을 완성하고 7년 뒤의 고성장 기술군을 도출했다. 연구진은 최종 도출된 미래 고성장 과학기술 100선의 키워드 분석을 통해 ▷지구온난화-데이터/AI-소재연구의 3대 중심축 형성 ▷지구를 이해하는 감시센싱모니터링 기술 ▷데이터와 소재연구가 의료분야..."
1336,"엔씨소프트 유니버스로 엔터테인먼트 도전, 김택진 인공지능 내세워",2020.11.20.,인공지능(AI) 기술력을 내세우면서 해외 이용자 확보도 염두에 두고 있다. 김택진 엔씨소프트 대표이사 사장. 24일 엔씨소프트에 따르면 2021년 초에 출시될 예정인 유니버스는 인공지능기술과 엔터테인먼트의 결합에 중점을 두고 있다. 유니버스의 '프라이빗' 서비스는 이용자가 아티스트의 목소리를 기반 삼아...
1337,"[2020 AI대상] AI도 어려운 금융 용어, KB-ALBERT가 쉽게 설명",2020.11.20.,"국민은행, 인공지능대상 금융 부문 대상 수상 ‘대화는 기본, 금융도 척척’ KB, 금융 분야 AI모델 구축 국민은행이 금융을 위한 인공지능(AI) ‘KB-ALBERT(KB알버트)’를 개발해 금융분야 AI산업을 선도하고 있다. 금융 지식이 없는 일반인은 은행 업무 처리에서 어려움을 겪는다. AI도 별반 다르지 않다...."
1338,"대구대, AI면접 지원 프로그램 운영",2020.11.20.,인공지능을 활용한 기업들의 채용 면접 방식이 확대되면서 지역 대학도 AI면접을 대비하기 위한 새로운 취업 지원 프로그램을 도입하고 있다. 대구대 진로취업처는 최근 'AI면접 완전정복 전략UP 프로젝트'란 이름으로 취업 지원 프로그램을 진행했다. 이번 프로그램은 코로나 19 확산으로 국내 400여 개...
1339,"NH농협은행, AI양재허브와 AI혁신기업 육성 지원 위한 업무협약 체결",2020.11.20.,"서울시가 운영하는 AI양재허브는 인공지능(AI) 관련 전문 인재를 양성하고 AI 특화 기업을 발굴·육성하며, 개방형 연구 문화와 AI 전문가 간의 소통·교류를 촉진하는 인공지능 분야의 전문 지원 기관이다.이번 협약으로 양사는 △AI기반 혁신기업들과의 업무 협력체계 구축 및 신사업 발굴 △AI역량 강화..."
1340,"박물관, 인공지능을 만나다…제1회 세계박물관포럼 온라인 개최",2020.11.26.,"'박물관과 인공지능(Museums and AI)'을 주제로 하는 이번 포럼에서는 세계적인 연사 30여 명이 4개 대주제를 중심으로 토론을 펼친다. 24일에는 '인공지능과 인간'을 주제로 인공지능에 대한 이해를 다룬다. 인공지능의 의미, 인공지능과 인간의 관계, 박물관을 위한 인공지능 등 과학적·인문학적 측면을..."
1341,"한국투자증권, ‘AI원팀’ 기업실무형 AI 교육 실시",2020.11.26.,한국투자증권은 국내 인공지능(AI) 역량 강화를 위한 산·학·연 협력체인 ‘AI원팀’의 인재양성 프로그램 일환으로 KT와 함께 기업 실무형 AI 인재양성 교육과정을 시작했다고 18일 밝혔다. 이번 교육은 한국투자증권 DT본부 등 관련 부서 핵심인력을 대상으로 3주간 진행되며 금융 분야에서 필요로 하는...
1342,"네이버클라우드, 신규 AI 상품 2종 출시…""음성 인식 기술 향상해 콜센터 업무...",2020.11.26.,"클로바 Ai콜은 높은 수준의 음성인식과 합성 및 자연어 처리 등의 인공지능 기술이 적용돼 다양한 고객지원 업무에 활용할 수 있다. 실제 네이버 고객센터에 적용된 클로바 Ai콜은 콜센터 상담사의 기본 업무를 지원한다. 고객의 감정 분석, 문서 요약, 상담 내 키워드 추출 등의 기능도 함께 제공해 보다..."
1343,"AI원팀, AI 인재양성 본격화...KT 노하우 커리큘럼에 적용",2020.11.18.,"KT는 AI One Team(이하 AI원팀)이 기업 실무형 인공지능(AI) 인재양성 교육과정을 개발하고 국내 AI 역량 강화를 위한 AI 인재양성 활동을 본격화한다고 18일 밝혔다. AI원팀은 KT를 비롯해 현대중공업그룹, LG전자, LG유플러스, 한국투자증권, 동원그룹, KAIST, 한양대, ETRI 등 9곳의 산업계, 학계, 연구..."
1344,"ETRI, 자폐스펙트럼장애 선별 AI 개발 박차",2020.11.18.,국내 연구진이 자폐스펙트럼장애(ASD)를 조기에 알아내는 데 도움을 줄 수 있는 인공지능(AI) 기술 연구에 박차를 가하고 있다. 이 기술은 세계적 증가 추세에 있는 자폐스펙트럼장애를 이른 시기에 선별하는 데 큰 도움이 될 전망이다. 한국전자통신연구원(ETRI)은 '영유아·아동의 발달장애 조기선별을 위한...
1345,AI 반도체칩 전달받는 문재인 대통령,2020.11.19.,문재인 대통령이 25일 오후 경기 고양시 일산 킨텍스에서 열린 '한국판 뉴딜 대한민국 인공지능을 만나다' 행사에 참석해 김윤 SKT 부사장으로부터 국내 최초 개발한 인공지능 반도체칩을 전달받고 있다. 2020.11.25. scchoo@newsis.com 공감언론 뉴시스가 독자 여러분의 소중한 제보를 기다립니다. 뉴스...
1346,"동의대 디그니타스교양교육연구소, AI 명사 초청 특강 개최",2020.11.20.,"특강에 참석한 광고홍보학과 4학년 양석환 씨는 “뉴노멀 시대의 인공지능에 대해 다각적인 차원에서 이해할 수 있는 뜻 깊은 시간이었습니다”고 말했으며, 영어학과 3학년 박가슬 씨는 “딥리딩을 진행하면서 그동안 이해하기 어려웠던 AI 명저 속의 신기술과 인간과의 관계 그리고 인공지능과의 협업과..."
1347,2025학년도부터 유치원·초·중·고 '인공지능 교육' 과목 도입,2020.11.19.,사진=교육부 제공 시범 단계에 머물러 있던 AI(인공지능) 교육이 유치원· 초·중·고교에 단계적으로 도입된다. 고교에서는 내년 2학기부터 진로 선택과목에 인공지능 관련 과목이 포함된다. 아울러 교원 역량 강화를 위해 AI 재교육도 실시된다. 교육부는 20일 열린 제19차 사회관계장관회의 겸 제7차...
1348,UNIST에 인공지능기술 이끌 인재 양성소 문 열었다,2020.11.19.,동남권의 디지털 뉴딜을 이끌 UNIST 인공지능(AI)대학원이 개원식을 열고 본격 운영에 들어간다. UNIST(총장 이용훈)는 19일 제4공학관 U110호에서 '인공지능대학원 개원 기념식'을 개최했다. UNIST는 과학기술정보통신부가 국가 차원의 인공지능 핵심 고급인재 육성을 위해 추진하고 있는 인공지능대학원 지원...
1349,"대구대, 기업 AI면접에 완벽 대비…맞춤형 취업프로그램 호응",2020.11.23.,"대구대가 코로나19 시대에 인공지능(AI) 면접을 확대하고 있는 기업 채용 프로세스 변화에 따라 맞춤형 취업 지원 프로그램을 운영했다.최근 채용시장에서 대세로 자리 잡아 가고 있는 AI면접은 코로나19 확산으로 비대면 면접 선호 현황에 따라 증가하고 있으며, 국내 400여 기업에서 도입해 활용하고 있다...."
1350,"SK건설, 'SK뷰 AI 홈서비스' 개발",2020.11.23.,SK건설 인공지능 스마트홈 'SK 뷰 AI 홈 서비스' 이미지/SK건설 SK건설은 스마트홈 솔루션 기업 다산지앤지와 인공지능 스마트홈 기술인 SK뷰 AI 홈서비스(SKAI)를 개발해 공동 특허출원을 완료했다고 23일 밝혔다. 스카이는 재실감지·자동제어·음성인식 기술 등을 딥러닝 서버에 결합시킨 스마트홈 기술이다....
1351,"네이버클라우드·흥국화재, AI 기반 보험 서비스 확대 맞손",2020.11.20.,"흥국화재는 네이버 클로바의 다양한 인공지능 기술을 활용, 보험업에서 필요한 업무 시스템 및 고객 서비스의 디지털 고도화를 진행할 예정이다. 양사는 우선적으로 AI OCR, AI 기반 신분증 진위여부 판독, AI 컨택센터 등 다양한 분야에서의 사업 협력을 진행 중이다. 뉴데일리 신희강"
1352,"""폴리텍대학, ETRI와 손잡고 AI 기술 인재 양성한다""",2020.11.20.,한국폴리텍대학(이사장 이석행)이 한국전자통신연구원(원장 김명준)과 손잡고 디지털 뉴딜을 뒷받침할 인공지능(AI) 인재 양성에 본격적으로 나선다. 폴리텍은 23일 ETRI 대전 본원에서 ETRI와 '기술 사업화 및 AI 산업 생태계 강화를 위한 업무협약'을 체결했다. 양 기관은 산업 현장의 디지털 전환을...
1353,"NH농협은행, AI혁신기업 육성 지원 협약 체결",2020.11.20.,"서울시가 운영하는 AI양재허브는 인공지능 관련 전문 인재를 양성하고 AI 특화 기업을 발굴·육성하며, 개방형 연구 문화와 AI 전문가 간의 소통·교류를 촉진하는 인공지능 분야의 전문 지원 기관이다. 이번 협약으로 두 회사는 AI기반 혁신기업들과의 업무 협력체계 구축 및 신사업 발굴, AI역량 강화..."
