,제목,날짜,본문
1978,"한화시스템, 국내 최초 국방 AI 참모 개발···軍 첨단화 가속",2020.11.13.,▲AI지휘결심지원체계 운용 예상 이미지.(사진제공=한화시스템) 한화시스템이 국내 최초로 인공지능(AI)을 적용한 국방 지휘 통제 지능화 서비스 개발에 나서며 우리 군의 첨단화에 앞장서고 있다. 한화시스템은 선도형 핵심기술 과제인 '지능형 전장 인식 서비스 및 플랫폼·서비스 통합 기술' 과제의 우선협상...
1979,"마이크로소프트연구소-한국인공지능학회, AI 기술 발전 위한 공동학술대회 개...",2020.11.13.,"마이크로소프트연구소와 한국인공지능학회가 오는 19일부터 21일까지 3일간 인공지능(AI) 기술 발전을 위한 공동학술대회를 진행한다. NLP(자연어처리), 머신러닝, 컴퓨터 비전 등 AI를 주제로 열리는 이번 학술대회는 한국인공지능학회와 마이크로소프트연구소가 공동으로 개최하며, 마이크로소프트..."
1980,"광주서 AI창업 붐, '베이스캠프' 열어…35개 스타트업 둥지",2020.11.17.,AI(인공지능) 기업들이 앞다퉈 광주에 둥지를 틀고 AI창업 붐까지 일면서 창업 공간 부족 현상이 빚어지고 있다. 이에 광주시는 과학기술정보통신부(인공지능산업융합사업단)와 함께 'AI창업캠프 1호'를 마련해 11일 개관식을 가진 데 이어 중소벤처기업부와 함께 내년 7월 개관을 목표로 'AI창업캠프 2호'를 준비...
1981,"‘AI·양자보안’ 성과 공유…삼성SDS, 개발자 콘퍼런스 ‘테크토닉 2020’ 개...",2020.11.12.,제공 | 삼성SDS 삼성SDS가 인공지능(AI)·양자보안 기술 성과 등 디지털 혁신기술 사례를 공유하는 개발자 콘퍼런스 ‘Techtonic(테크토닉) 2020’을 12일 온라인 개최했다. 지난 2018년 시작해 올해로 3회째를 맞는 테크토닉은 개발자 생태계 확장을 위해 최신 IT기술과 개발 노하우 등을 공유하는 자리다....
1982,"경기도, 인공지능(AI) 기술 기반 융합서비스 발굴 나서",2020.11.15.,"경기도청 경기도와 경기도경제과학진흥원은 도민에게 인공지능(AI) 기술 기반 융합서비스를 제공하기 위해 '2021년 경기도 인공지능(AI) 실증사업 수요조사'를 실시한다고 15일 밝혔다. '경기도 인공지능 실증사업'은 경기도, 도내 공공기관·기초지자체와 기술개발이 가능한 도내 기업을 연계해 인공지능(AI)..."
1983,"[기고] 超지능화사회, AI인프라에 달렸다",2020.11.16.,"인공지능이란 용어가 1950년대 앨런 튜링과 1956년 다트모스 회의에서 AI(Artficial Intelligence)라는 용어가 출현된 이래 몇 번의 암흑기를 거쳐 1980년대 인공신경망(ANN)과 심층신경망(DNN), 그리고 2006년 제프리 힌톤에 의해 컨볼루선 신경망(CNN)이 등장하면서 컴퓨팅 파워가 기하급수적으로 향상돼 제4차 산업혁명의..."
1984,"“전이학습 효율성 높인다”…이글루시큐리티, AI 관련 특허 취득",2020.11.13.,"김경희 기자 | 이글루시큐리티가 전이 학습의 효율성을 높이는 AI(인공지능) 관련 특허를 취득했다고 밝혔다. 이글루시큐리티는 본 특허기술을 AI 보안관제 솔루션인 ‘SPiDER TM AI Edition(스파이더 티엠 에이아이 에디션)’에 적용하여, 고도화된 사이버 침해 시도에 대한 대응 능력을 강화할 전략이다...."
1985,"""코로나19 사태에서 AI 한계 드러나...데이터 실시간 수집 인프라 필요""",2020.11.13.,“빠르게 확산하고 변이를 일으키는 바이러스를 인공지능(AI) 솔루션 개발속도가 따라잡지 못하고 있습니다.” 쿵샹중(孔祥重) 미국 하버드대 컴퓨터공학과 교수는 삼성SDS가 12일 연 개발자 행사 ‘테크토닉(Techtonic) 2020’ 기조연설에서 이 같이 지적했다. 쿵 교수는 “신종 코로나바이러스 감염증...
1986,"[2020 대구국제기계산업대전] 스프링클라우드, 인공지능기반 자율주행 플랫폼...",2020.11.13.,"송기석 스프링클라우드 매니저는 ""자사는 인공지능기반 자율주행을 서비스를 제공하는 회사다. 모빌리티 서비스와 데이터 서비스, 자율주행 AI 솔루션 등을 소개하기 위해 이번 전시회에 참가하게 됐다.""고 밝혔다. 이어, ""이번 전시회에서 많은 협력사를 만나 기술 발에 함께 힘쓰고 싶다.""고 전했다...."
1987,"[이슈분석] 삼성과 TSMC 간 파운드리 경쟁 치열…SKT, AI반도체 대만기업 선택...",2020.11.10.,이런 가운데 전날 SK텔레콤은 데이터센터용 인공지능(AI) 반도체 '사피온(SAPEON) X220'을 공개했다. AI 반도체는 AI 학습과 추론 등에 이용하는 시스템반도체다. 이번에 생산된 AI 반도체는 정부의 'AI 데이터 가공 바우처 사업'과 '모바일엣지컴퓨팅(MWC) 기반 5G 공공부문 선도적용 사업'에 공급된다....
1988,"카카오엔터프라이즈·BNK금융, 인공지능 활용 MOU",2020.11.13.,"카카오엔터프라이즈는 BNK금융그룹과 인공지능(AI) 기술 활용을 위한 전략적 업무협약을 체결했다고 10일 발표했다. 카카오엔터프라이즈는 카카오톡 채널, 챗봇 등을 활용해 BNK금융그룹의 비대면 고객 플랫폼 개발을 돕는다. 내년 상반기 중 챗봇 솔루션을 도입해 모바일 금융 상품 가입절차를 간소화하며..."
1989,"BNK금융, AI 위해 카카오엔터프라이즈와 MOU 체결",2020.11.13.,"(사진제공=BNK금융그룹) BNK금융그룹은 9일 부산은행 본점에서 인공지능 기반 플랫폼 카카오엔터프라이즈와 ‘인공지능(AI) 기술 활용을 위한 전략적 업무 협약’을 체결했다고 10일 밝혔다. BNK금융은 이 협약으로 카카오엔터프라이즈의 AI 기술과 플랫폼을 활용해 비대면 금융 제공, 모바일 영업 활성화..."
1990,"웅진씽크빅, 수학자 김민형 교수 영입…""AI수학 교육 전문성 강화""",2020.11.10.,웅진씽크빅은 세계적 수학자인 김민형 교수를 수학 자문으로 영입해 인공지능(AI)교육 전문성 강화에 나선다고 17일 밝혔다. 웅진씽크빅은 AI수학 교육 전문성과 가치를 높이기 위해 김민형 교수를 영입했다고 전했다. 웅진씽크빅은 업계 최초로 AI기반 수학학습 'AI수학'을 선보인 바 있다. 웅진씽크빅...
1991,수학 좋아하던 공대생… 주식 AI로 월가에 도전장,2020.11.10.,"그의 대답은 AI(인공지능)였다. 김 대표는 “자체 개발한 AI가 배당, 시가총액, 영업이익 등 수백 개의 요인을 정밀하게 계산한 다음, 남들보다 초과 수익을 낼 수 있는 포트폴리오를 찾아낸다""고 말했다. 서울과학고, 서울대 전기공학부 출신인 김 대표는 난해한 수학 문제 풀기를 좋아하던 공대생이었다...."
1992,"모두의연구소, '아이펠 대전' 오픈…지역 거점 AI 인재 양성",2020.11.17.,모두의연구소가 설립한 AI 혁신학교 아이펠은 기존 AI 교육시장의 가장 큰 문제로 지적돼 온 수준 높은 강사 부족 문제를 자체 개발한 온라인 학습 플랫폼으로 대체해 강사가 없는 인공지능 교육을 제공한다. 현재 16명의 현업 AI 개발자로 구성된 AI 콘텐츠 크리에이터 그룹이 실무적인 내용으로 개발한...
1993,"김영한 가우스랩스 대표 ""반도체 제조 현장 난제, AI로 푼다""",2020.11.16.,"산업 AI(인공지능) 분야에서 특히 반도체가 매력적인 이유이기도 합니다."" 지난 8월 미국 실리콘밸리에서 SK그룹의 산업 AI 전문기업으로 출범한 가우스랩스를 이끌고 있는 김영한 대표는 16일 SK하이닉스 뉴스룸과의 인터뷰에서 이렇게 말했다. SK하이닉스는 2022년까지 가우스랩스의 자본금 5500만달러(약..."
1994,"셀바스 AI, AI 고객센터 첫 공개",2020.11.23.,"인공지능 전문기업 셀바스 AI는 최근 신규 AI 고객센터 ‘Selvy AI for Contact Center(셀비 에이아이 컨택센터)’를 공개했다고 밝혔다. ‘Selvy AI for Contact Center’는 고객들의 제품 주문, 결제, 배송, 환불 등에 대한 주요 질의 대응뿐만 아니라 보험, 은행 등 완전판매 여부 확인을 위한 아웃바운드 전화..."
1995,"[SR경제&라이프] SKT, AI스피커 기반 신개념 기부 프로그램 'AI기브유' 운영",2020.11.23.,"이번 협력으로 양사는 지난 3월부터 공동 개발해 온 인공지능 스피커를 활용한 신개념 기부 프로그램 'AI 기브유'를 처음으로 선보이고 본격 운영에 나선다. 'AI 기브유'는 AI 스피커 '누구(NUGU)'로 편리하게 기부할 수 있는 프로그램이다. 이용자가 누구 호출어인 ""아리아""를 부르고 ""기브유에서 유니세프로..."
1996,인공지능 투자 '파운트' 운용자산 규모 8000억 돌파,2020.11.12.,"이후 10월말 기준 20여개 글로벌 금융기관에서 파운트 인공지능(AI) 솔루션으로 운용되는 금액 규모만 3조 원에 이르며, 개인이 직접 투자 가능한 파운트 앱의 누적다운로드는 22만 건, 누적회원 수 5만8000여명, 누적계좌 수는 1만5000건이다. 파운트의 이 같은 가파른 성장세는 대형 금융기관에서 인정한 AI..."
1997,"[게시판] 숙명여대-KISTI, AI 인재양성 업무협약",2020.11.01.,"▲ 숙명여대가 한국과학기술정보연구원(KISTI)과 과학기술·학술 인프라 활용을 통해 인공지능(AI)·빅데이터·슈퍼컴퓨팅 연계융합 인재를 양성하는 데 협력하기로 했다고 밝혔다. 두 기관은 우수 인재 육성을 위한 공동 교과과정과 인턴십·멘토링, 인프라·데이터 등 공동활용, 공동 연구개발사업과..."
1998,"서울대병원, '의료 인공지능 경진대회' 개최",2020.11.16.,"이를 토대로 의료 인공지능 경진대회 플랫폼(MAIC, Medical AI Challenges)을 개발하고 올해 경진대회를 개최했다. 서울대병원이 서울대학교와 공동 주최한 ‘제1회 2020 의료인공지능 경진대회’는 83개 팀, 250여 명이 참가했다. 본선에 오른 다섯 팀은 지난 6일부터 9일까지 치열한 경합을 벌였다. 대회 주제는..."
1999,"한화시스템, 국내 최초 ‘국방 AI참모’ 개발… 지능형 지휘통제체계",2020.11.16.,뉴데일리 유호승 기자 = 한화시스템이 국내 최초로 인공지능(AI)을 본격 적용한 ‘국방AI참모’를 개발했다. 지휘통제체계에 AI를 융합한 것이다. 한화시스템은 선도형 핵심기술 과제인 ‘지능형 전장인식 서비스 및 플랫폼?서비스 통합 기술’ 과제의 우선협상 대상자로 선정됐다고 13일 밝혔다. 미래 핵심...
2000,"KAIST, 메모리-중심 인공지능 가속기 시스템 개발",2020.11.16.,"이번 추천시스템 알고리즘은 구글, 페이스북, 유튜브, 아마존 등 빅테크 기업들이 콘텐츠 추천 및 개인 맞춤형 광고를 제작하는데 기반이 되는 핵심 인공지능 (AI) 기술이다. 온라인 광고를 통한 수입은 구글과 페이스북과 같은 실리콘밸리의 빅테크 기업의 주 수익 모델인 만큼 고도화된 추천 인공지능..."
2001,LG전자 'AI 포럼' 개최,2020.11.16.,"LG전자가 지난달 28일부터 3일 동안 AI 전문가들과 함께 인공지능의 발전 방향을 논의하는 'AI 포럼 앤 디스커버리 워크숍'을 열었다. 사진은 LG전자, 토론토대학교, 캐나다고등연구원 소속의 AI 전문가들이 온라인 화상회의 형식으로 진행된 포럼에 참여하는 모습. 2020.11.1"
2002,삶에 도움주는 AI 기술은?…'삼성 AI 포럼 2020' 개최,2020.11.02.,"삼성전자가 인공지능(AI) 기술을 통해 인간의 삶에 도움을 주겠다는 비전을 제시했다. 코로나19와 같은 팬데믹, 자연재해 등 인류 삶에 영향을 주는 문제에 관심을 갖고 이를 해결하기 위한 AI를 만들겠다고 발전 방향을 제시했다. 반도체, 스마트폰, 가전, TV 등 삼성전자의 다양한 제품에 인간 중심의 AI를..."
2003,"인간과 AI의 이색대결…지니뮤직, 창작 동요 공모전 투표",2020.11.12.,"/지니뮤직 지니뮤직은 오는 25일까지 인간과 인공지능(AI)이 창의성을 겨루는 '지니 창작 동요 공모전' 본선 투표를 진행한다고 16일 밝혔다. 지니뮤직이 AI창작영역에 뛰어들면서 마련한 'AI vs 인간의 빅매치-지니 창작 동요 공모전'은 20 대 1의 참여 경쟁률을 보였다. 총 지원곡수는 90여 곡으로 동요, 아동용..."
2004,"네이버클라우드·흥국화재, AI 기반 보험 서비스 확대 '맞손'",2020.11.12.,"흥국화재는 네이버클라우드 플랫폼 상에서 제공되는 네이버 클로바의 다양한 인공지능 기술을 활용해 보험업에서 필요한 업무 시스템 및 고객 서비스의 디지털 고도화를 진행할 예정이다. 양사는 우선적으로 AI OCR, AI 기반 신분증 진위여부 판독, AI 컨택센터 등 다양한 분야에서의 사업 협력을 진행 중이다...."
2005,"SK텔레콤, 유니세프한국위원회와 함께 AI스피커 기반 기부 프로그램 'AI기브유...",2020.11.23.,"이번 협력으로 양사는 지난 3월부터 공동 개발해 온 인공지능 스피커를 활용한 신개념 기부 프로그램 'AI 기브유(GiveU)'를 처음으로 선보이고 본격 운영에 나선다. 'AI 기브유'는 AI 스피커 '누구(NUGU)'로 편리하게 기부할 수 있는 프로그램이다. 이용자가 누구 호출어인 ""아리아""를 부르고 ""기브유에서..."
2006,"미래에셋생명, 네이버클라우드 기반 AI 서비스 도입한다",2020.11.16.,네이버클라우드는 미래에셋생명과 클라우드 기반 보험 시스템 구축과 AI(인공지능) 서비스를 도입하기 위해 지난 12일 네이버클라우드 강남오피스에서 업무협약을 체결했다고 16일 밝혔다. 양사는 협약을 통해 미래에셋생명의 금융서비스 전반에 클라우드를 도입하고 AI콜센터 등 고객 접점 영역의 서비스...
2007,"[뉴스투데이 L] 한림대춘천성심병원, 수면 질 AI 데이터 구축 국책사업 선정",2020.11.16.,이는 과학기술정보통신부가 주최하고 한국정보화진흥원이 주관하는 ‘인공지능(AI) 학습용 데이터 구축 사업’ 가운데 하나다. 한림대춘천성심병원과 한림대산학협력단이 서울대학교병원 등 외부 기관과 컨소시엄을 구성하여 진행하는 이번 사업은 2020년 12월 31일까지 수면 산업에 적용 가능한 데이터 구축과...
2008,LG유플러스 지능형 CCTV 한국인터넷진흥원 인증완료,2020.11.19.,기업 및 소상공인 전용 U+지능형CCTV 서비스는 AI(인공지능) 영상분석으로 매장 내/외부 촬영 영상을 분석해 사람과 사물을 구별하고 이상 상황이 발생했는지 감지한다. 고객은 이상상황으로 감지된 영상을 확인해 앱으로 긴급출동 등을 요청할 수 있다. KISA 인증과 더불어 LG유플러스는 고객에게 보다...
2009,"KIST, AI로 차세대 메모리 MRAM 개발 앞당긴다",2020.11.10.,"메모리에 적합한 소재 탐색, 수십시간 걸리던 사람 대신 AI가 실시간으로 국내 연구진이 인공지능(AI)을 활용해 차세대 메모리로 주목받고 있는 ‘자성 메모리(MRAM)’ 개발을 앞당길 계획이다. 한국과학기술연구원(KIST)은 권희영·최준우 스핀융합연구단 박사 연구팀이 원창연 경희대 교수와 함께 MRAM..."
2010,"과기정통부, 인공지능(AI) 반도체 기술 인력 확보한다",2020.11.13.,"'2020 AI 반도체 설계 경진대회' 포스터 정부가 마스크 미착용자 탐지용 인공지능(AI) 반도체 설계 경연을 열고 관련 분야 인재 지원에 나선다. 과학기술정보통신부(장관 최기영)는 AI 반도체 분야 우수 인력과 창의적 아이디어 발굴을 목표로 '2020 AI 반도체 설계 경진대회'를 개최, 17일부터 참가접수를..."
2011,"두산, 전자통신硏과 5G·AI 등 미래 기술 발굴 ‘맞손’",2020.11.16.,12일 ‘ICT 미래기술 발굴 및 협력’ 업무협약 체결 ㈜두산은 한국전자통신연구원(ETRI)과 지난 12일 ‘정보통신기술(ICT) 분야 미래기술 발굴 및 협력’을 위한 업무협약(MOU)을 체결했다고 13일 밝혔다.두 기관은 이번 협약에 따라 △5G 무선통신 △ICT 소재 부품 △자율무인이동체 △인공지능(AI)...
2012,메모리-중심 인공지능 가속기 시스템 개발,2020.11.16.,"인공지능 기술을 기반으로 고안된 추천시스템 알고리즘은 구글, 페이스북, 유튜브, 아마존 등 빅테크 기업들이 콘텐츠 추천 및 개인 맞춤형 광고를 제작하는데 기반이 되는 핵심 인공지능 (AI) 기술이다. 온라인 광고를 통한 수입은 구글과 페이스북과 같은 실리콘밸리의 빅테크 기업의 주 수익 모델인 만큼..."
2013,"셀바스 AI, 서비스질 높여주는 '셀비 에이아이 컨택센터' 공개",2020.11.13.,"셀비 에이아이 컨택센터는 고객 제품 주문, 결제, 배송, 환불 등에 대한 주요 질의 대응뿐만 아니라 보험, 은행 등 완전판매 여부 확인을 위한 아웃바운드 전화 업무를 자동화하는 인공지능(AI) 고객센터이다. 고객센터에서 가장 많이 사용하는 기본적인 대화형 AI 기능을 기반으로 고객 특성에 따라 주문..."
2014,“AI·빅데이터·클라우드 집중”…LGU+ 지속가능보고서 발간,2020.11.10.,"“인공지능(AI), 빅데이터, 클라우드 등 새로운 핵심 인프라에 집중해 B2B와 B2G 영역에서 선제적으로 고객 가치를 발굴해 나가겠다.” 하현회(사진) LG유플러스 부회장이 국내 통신사 최초로 발간된 인터랙티브 지속가능경영보고서에서 이 같이 밝혔다. 하 부회장은 “증강현실(AR)과 VR(가상현실)을 결합한..."
2015,"하이퍼커넥트, 'AI 휴먼' 적용한 SNS 내년 출시 목표",2020.11.10.,"인공지능(AI)과 증강현실 그래픽 기술의 결합으로 만들어진 AI 휴먼은 궁극적으로는 인간처럼 자연스럽게 보고 듣고 말할 수 있는 지능형 가상 인간으로, 인공지능 두뇌를 가진 아바타로 설명할 수 있다. AI 휴먼은 고객 서비스, 소셜미디어 등 다양한 분야에서 사람들과 감성적인 소통까지 가능할 것으로..."
2016,"""직장에서 매번 다른 일 하는 사람, AI와 경쟁서 살아남는다""",2020.11.15.,“인공지능(AI) 기술이 보편화되면 자칫 근로자 간 불평등과 격차가 심해질 가능성이 있습니다. 지금부터 직무 및 작업 환경 변화에 대비해 부작용을 최소화하고 인간의 역량을 강화할 방안 마련이 필요합니다.” 고노 마사미치 경제협력개발기구(OECD) 사무차장은 11일 서울 광장동 그랜드워커힐호텔에서...
2017,"현대건설, 모든 건설현장에 '재해예측 AI' 도입",2020.11.16.,현대건설이 모든 건설현장에 '재해 예측 AI'를 도입하고 인공지능을 활용한 선제적인 안전관리에 나선다고 17일 밝혔다. 현대건설은 지난 10월부터 '재해 예측 AI'를 가동 중이다. 현대건설의 모든 건설현장에 적용되는 '재해 예측 AI'는 작업 당일 예상되는 재해위험 정보를 제공해 선제적 안전관리가 가능하도록...
2018,"한림대춘천성심병원, 수면 질 AI 데이터 구축 국책사업 선정",2020.11.11.,한림대학교춘천성심병원 제공 한림대학교춘천성심병원과 한림대학교산학협력단은 최근 과학기술정보통신부가 주최하고 한국정보화진흥원이 주관하는 '인공지능(AI) 학습용 데이터 구축 사업' 가운데 '인공지능 기술의 수면 산업 적용 활성화를 위한 수면다원검사 데이터 공개 사업' 수행기관으로 선정됐다고...
2019,KT AI/DX 데이,2020.11.11.,KT가 10일 서울 종로구 광화문 KT스퀘어에서 B2B를 중심으로 인공지능 및 클라우드 사업전략과 성과를 임직원과 공유하는 ‘AI/DX 데이’를 개최했다. AI/DX 데이 세션2가 끝난 후 질의응답에서 KT 클라우드 담당 임원들이 랜선 중계로 현장 직원의 질문에 답변하고 있다. 왼쪽부터 KT 이대형...
2020,AI로 ‘약물 부작용’ 예방하는 시대 온다,2020.11.19.,"제이엘케이, 약물 부작용 예측하는 AI 플랫폼 개발 국내 인공지능(AI) 1호 상장기업 제이엘케이가 AI를 활용해 유전자 기반 약물의 부작용을 예측할 수 있는 플랫폼을 개발했다고 18일 밝혔다. 최근 투자를 집행한 닥터노아바이오텍의 약물 분석 기술을 응용하면서 제이엘케이의 지분투자가 성과를 내고..."
2021,"현대엔지니어링, 국내 최초 'AI 미장 로봇' 개발",2020.11.19.,현대엔지니어링은 콘크리트 바닥을 자동으로 평탄하게 하는 AI(인공지능) 미장 로봇이 개발했다고 11일 밝혔다. 이 로봇은 작업자의 별도 추가 조작 없이 콘크리트 바닥면 평탄화 작업을 수행한다. 현대엔지니어링은 이 로봇을 활용한 바닥 평탄화 방법에 대한 특허 역시 출원했다. 현대엔지니어링과...
2022,"""5천 단어를 21단어로"" ...AI로 긴 논문을 순식간에 요약하는 시스템 나왔다",2020.11.13.,"방대한 양의 긴 논문들을 읽고 요약해주는 인공지능(AI)이 나왔다. 보통 시간을 들여 읽기에 너무 긴 논문들의 경우 'tl;dr'이라고 표시해 걸러내기도 한다. 'tl;dr'는 '너무 길어서 읽지 않음(Too long, didn't read)'의 줄임말로 흔히 ""글이 너무 장황하고 읽기 힘드니까 좀 간결하게 써봐라""라는 비난의..."
2023,"""인공지능, 무엇이든 물어보세요"" SKT, 'AI커리큘럼 라이브' 진행",2020.11.13.,"구체적으로 인공지능 분야의 화두인 윤리 문제와 SKT의 실천 방안을 소개하는 'AI 윤리', 보이스 UX 개념과 실제 현업에서 수행하는 업무 사례를 다룬 'AI 서비스 UI/UX', NUGU(누구)의 지식 기반 질의응답 시스템에 적용된 언어 이해 기술을 설명하는 'AI 언어이해 기술 개발'이 소개될 예정이다. 릴레이..."
2024,"SKT-유니세프한국위원회, AI스피커 기부 프로그램 'AI기브유' 운영",2020.11.23.,"이번 협력으로 양사는 지난 3월부터 공동 개발해 온 인공지능 스피커를 활용한 신개념 기부 프로그램 'AI 기브유(GiveU)'를 처음으로 선보이고 본격 운영에 나선다. 'AI 기브유'는 AI 스피커 '누구(NUGU)'로 편리하게 기부할 수 있는 프로그램이다. 이용자가 누구 호출어인 ""아리아""를 부르고 ""기브유에서..."
2025,사람 두뇌 닮은 ‘AI 반도체’ 나온다,2020.11.17.,국내 연구진이 방대한 양의 빅데이터 처리나 인간의 두뇌를 모방한 뉴로모픽 칩 뉴로모픽 칩과 같은 인공지능(AI) 개발을 위한 차세대 지능형반도체 소자기술을 개발했다. 대구경북과학기술원(DGIST)은 나노융합연구부 이명재 박사 연구팀이 2차원 반도체 소재인 이황화텅스텐(WS2)과 육방정 질화붕소(hBN)를...
2026,"ETRI, 자폐 조기 선별 AI 개발 나서",2020.11.17.,"자폐증과 서번트증후군, 아스퍼거증후군 등 자폐 스펙트럼 장애를 조기에 알아낼 수 있는 인공지능 기술 연구가 시작됐습니다. 한국전자통신연구원은 영유아의 영상을 실시간으로 서버에서 전송받아 자폐 스펙트럼 장애의 다양한 패턴을 활용해 자동 분석하고 증상을 찾아낼 수 있는 언택트 인공지능 연구를..."
2027,"이투스교육, AI 알고리즘 기반 모의지원 서비스 선보인다",2020.11.17.,"인공지능 기술 적용 `합격예측`…수능 직후 모지(MOJI) 출시 회사 측 ""IT 기반 사업 강화…에듀테크 서비스 속속 내놓을 것"" 이투스교육이 인공지능(AI) 합격예측 알고리즘에 기반한 신개념 모의지원 서비스 '모지(MOJI)'를 선보인다. 이투스교육은 ""오랜기간 누적된 입시 관련 데이터와 노하우를 바탕으로 개발한..."
2028,"광주시, ETRI·(주)KOC파트너스와 '인공지능 비즈니스 기반 조성' 협약",2020.11.12.,"한국전자통신연구원(ETRI)은 SW콘텐츠, 초 연결통신, 초 성능컴퓨팅, 방송미디어, 정보통신기술(ICT) 소재부품 등을 융합해 새로운 AI 서비스를 창출하는 지능화 혁명의 기술 선구자로서 우리나라가 국가지능화를 통해 인공지능(AI)를 가장 잘 다루는 나라가 되도록 주도적인 역할을 수행하고 있는 국내 최대..."
2029,[윤휘종의 잠시쉼표] AI와 빅데이터에 우리 미래가 달려 있다,2020.11.10.,"반면, 인공지능(AI)은 직원들과 매장 곳곳에 설치된 센서를 통해 수집한 데이터를 분석해 '고관여지점'을 찾아낸 뒤 그곳에 직원들을 집중 배치했다. 말이 집중 배치지, 실제로는 직원들에게 특정 장소에서 몇분 정도만 더 있으라는 지시 정도였다. 하지만 결과는 놀라웠다. 슈퍼마켓 매출이 15%, 영업이익이 5..."
