,제목,날짜,본문
627,"디이벤티스트, 홈파티 수요 겨냥한 AI 파티 용품 추천 서비스 ‘핀스’ 출시",2020.11.27.,"현재 모바일 웹 기반의 서비스인 '핀스'는 사용자가 사진을 업로드하면 AI 이미지 기술로 취향을 분석해 파티 종류에 맞는 관련 용품을 추천해 주는... 똑똑한 인공지능 서비스""라고 소개하며 ""앞으로 맞춤형 파티 연출, 음식, 음악, 의상 등을 위한 추천 서비스를 계속해서 확대해 나갈 예정""이라고 말했다. 한편..."
628,"닥터노아바이오텍·SK케미칼, ‘AI기반 신약 개발’ 공동연구",2020.11.27.,인공지능(AI)기반 신약개발 전문기업인 닥터노아바이오텍은 SK케미칼과 ‘AI 기반의 신약개발 공동 연구·개발 협약’을 체결했다고 27일 밝혔다. 협약에 따라 양사는 닥터노아바이오텍이 보유한 AI 플랫폼을 기반으로 차세대 후보물질 발굴 및 복합신약을 개발할 예정이다. 닥터노아바이오텍은 인공지능...
629,"[AI업계 12월 동향] ② ""AI 활성화하려면 정부 투자 늘리고 규제 줄여야"" APE...",2020.11.27.,"APEC 기업인 자문위, AI 정책 활성화 위한 제언 투자 확대, 규제 최소화, 인재 육성 필요성 강조 강일용 기자 zero@ajunews.com [사진=게티이미지뱅크 제공] APEC 기업인 자문위원회(APEC Business Advisory Council)가 APEC CEO Dialogues에서 'APEC 인공지능(AI) 보고서'를 발표했다. APEC 기업인 자문위원회는 APEC 회원국..."
630,우주여행사와 AI에게 베토벤의 의미는?,2020.11.27.,"1977년 미국 휴스턴 우주선 발사대에서 지구를 대표하는 음악으로 베토벤의 어떤 작품을 고를지 고민하는 승무원이나, 베토벤 탄생 300주년을 맞은 2070년 인류가 멸종한 지구의 주인공이 된 인공지능(AI) 등을 통해 베토벤의 여러 얼굴을 고찰한다. 베토벤의 탄생부터 죽음까지 여정을 따라가지만, 통시적인..."
631,"닥터노아바이오텍, SK케미칼과 AI기반 신약 개발 공동연구 협약",2020.11.27.,뉴스토마토 = 정기종 기자 | 인공지능(AI)기반 신약개발 전문기업인 닥터노아바이오텍은 SK케미칼(285130)과 AI 기반의 신약개발 공동 연구·개발 협약을 체결했다고 27일 밝혔다. 이번 협약의 주요 목적은 닥터노아바이오텍이 보유한 AI 플랫폼을 기반으로 양사 간 상호 협력 및 공동연구를 통해 차세대 신약...
632,"뉴패러다임인베스트먼트, 의료용 AI 스타트업 '피노맥스'에 투자",2020.11.27.,"2020년 3월에 설립된 피노맥스는 인공지능(AI) 의료 솔루션 스타트업으로 설립시부터 한국과 미국 시카고에 사무소를 두고 있다. 딥러닝 기반 의료 이미지 분석과 인공지능 기술을 통해 헬스케어 진단 제품 개발과 치료 혁신 A.I 솔루션 서비스를 제공하고 있다. 특히 의료 이미지(XRay, CT, MRI 등)로부터..."
633,"[종합] 文 ""사회 전분야 AI 기술 접목""…AI 강국 비전 제시",2020.11.27.,"""사람 중심의 사회를 지향하며, 사회 전 분야에 인공지능(AI) 기술을 접목하겠다."" 문재인 대통령은 25일 일산 킨텍스 6홀에서 개최된 '한국판 뉴딜, 대한민국 인공지능을 만나다' 행사에서 이같이 강조했다. 이 자리는 지난해 10월 28일 인공지능 기본구상, 같은해 12월 17일 국가전략 수립 이후 1년간의 성과와..."
634,"AI 코딩수업에 프라이빗 영화관…KT, ICT로 청년 농촌 정착 지원",2020.11.27.,"우선 KT는 청년들의 자녀 교육을 위해 안계초등학교를 '10GiGA AI(인공지능)스쿨'로 변모시켰다. 안계초등학교 학생들은 AI·가상현실(VR)·10기가 네트워크 기술을 활용할 수 있다. 학생들에게는 소프트웨어 코딩 수업이 가능한 AI 학습교구, 천재교육의 교과 학습 콘텐츠가 탑재된 KT 슈퍼 VR, 교육형 스크린..."
635,"""인간성 담은 AI가 목표"", 정부 AI 윤리 기준안 공개",2020.11.27.,"투데이코리아=김성민 기자 | 정부가 인공지능(AI)을 사용하는 정부·공공기관, 기업, 이용자 등 모든 사회구성원이 지켜야 할 '국가 AI 윤리기준안'을 27일 공개했다. 과학기술정보통신부(과기부)와 정보통신정책연구원은 그간 인공지능·윤리 전문가로 구성된 인공지능 윤리연구반을 통해 국내외 주요..."
636,"SKT, 50兆 AI 반도체 시장 선점 나선다…국내 최초 AI 반도체 출시",2020.11.25.,"/ SK텔레콤 SK텔레콤이 50조원 규모의 성장이 예상되는 글로벌 인공지능(AI) 반도체 시장 선점에 나선다. 이를 위해 국내 최초로 자체 개발한 AI 반도체를 출시하고, AI 반도체 브랜드 '사피온(SAPEON)'을 론칭했다. ◆AI 반도체 국내 최초 출시…GPU 대비 성능 우수 SK텔레콤은 25일 일산 킨텍스에서 열린..."
637,"전홍범 KT 부사장 ""힘 합쳐야 한국 AI 역량 커진다""",2020.11.27.,"KT가 25일 오후 일산 킨텍스에서 열린 '한국판 뉴딜, 대한민국 인공지능을 만나다' 행사에서 인공지능(AI) 원팀 성과를 발표하고 향후 AI 전략에 대해 소개했다. 이번 행사에서 전홍범 KT 부사장은 발표자로 나서 AI 1등 대한민국을 위해 '모두가 함께하는 인공지능 AI'를 제안했다. 기업간, 분야간 경쟁에서..."
638,세라믹 제조공정에도 인공지능 적용한다,2020.11.27.,세라믹 제조에 인공지능(AI)을 적용해 공정을 혁신하는 ‘i-Ceramic 제조혁신 플랫폼 서비스’가 개통한다. 산업통상자원부는 24일 오후 대전컨벤션센터에서 세라믹 산업 제조혁신을 위한 ‘2020 세라믹의 날 & 세라믹 제조혁신 플랫폼 오픈식’을 개최한다. 행사에서는 ‘2020 세라믹의 날’을 맞아 세라믹 산업...
639,"전홍범 KT 부사장 ""힘 합쳐야 한국 AI 역량 커진다""",2020.11.25.,"KT가 25일 오후 일산 킨텍스에서 열린 '한국판 뉴딜, 대한민국 인공지능을 만나다' 행사에서 인공지능(AI) 원팀 성과를 발표하고 향후 AI 전략에 대해 소개했다. 이번 행사에서 전홍범 KT 부사장은 발표자로 나서 AI 1등 대한민국을 위해 '모두가 함께하는 인공지능 AI'를 제안했다. 기업간, 분야간 경쟁에서..."
640,세라믹 제조공정에도 인공지능 적용한다,2020.11.25.,세라믹 제조에 인공지능(AI)을 적용해 공정을 혁신하는 ‘i-Ceramic 제조혁신 플랫폼 서비스’가 개통한다. 산업통상자원부는 24일 오후 대전컨벤션센터에서 세라믹 산업 제조혁신을 위한 ‘2020 세라믹의 날 & 세라믹 제조혁신 플랫폼 오픈식’을 개최한다. 행사에서는 ‘2020 세라믹의 날’을 맞아 세라믹 산업...
641,"과기정통부, 국가 인공지능 윤리기준 공개",2020.11.27.,"과학기술정보통신부는 인공지능(AI)에 대한 윤리 기준을 마련했다고 27일 밝혔다. 이날 과기정통부는 AI는 사람 중심이어야 한다는 내용의 '국가 AI 윤리기준'을 발표했다. 개발과 활용 과정에서 인간의 존엄성, 사회의 공공선, 기술의 합목적성을 지켜야 한다는 내용이다. 과기정통부는 내달 15일까지 국민..."
642,한국소비자연맹 지능정보사회(AI) 소비자 권리장전 선언,2020.11.25.,이에 한국소비자연맹은 미래 사회의 핵심요소인 인공지능이 인간성을 존중하고 함께 발전해갈 수 있도록 하고자 지능정보사회(AI) 소비자 권리장전'을 선언했다. 한국소비자연맹은 한준호 의원(더불어민주당)과 함께 27일 국회의원회관 제3세미나실에서 '지능정보사회(AI) 소비자 권리장전' 선포식을 진행했다....
643,“인간 존엄성 우선시”…‘국가 AI 윤리기준’ 마련,2020.11.25.,"인공지능, AI는 인간의 존엄성과 사회의 공공선을 우선시해야 한다는 내용의 윤리 기준이 마련됐습니다. 과학기술정보통신부는 오늘 AI는 사람 중심이어야 하며, 개발과 활용 과정에서 인간의 존엄성, 사회의 공공선, 기술의 합목적성 등 3대 원칙이 지켜져야 한다는 내용이 담긴 '국가 AI 윤리기준'을..."
644,"SKT 국내 최초 데이터센터용 AI반도체 출시…""미래 반도체 시장 선점""",2020.11.25.,"AI 반도체란 인공지능 서비스의 구현에 필요한 대규모 연산을 초고속, 저전력으로 실행하는 효율성 측면에서 특화된 비메모리 반도체로 인공지능의 핵심 두뇌에 해당한다. ■ 세계 톱 수준 AI 반도체 국내 최초 출시… GPU 대비 성능 우수하고 가격 저렴 이날 행사에서 SKT는 데이터센터에 즉시..."
645,"메트라이프생명, ""식단과 운동 추천을 AI로""…앱 출시",2020.11.25.,메트라이프생명은 기존 모바일 건강관리 애플리케이션(앱)의 인공지능(AI) 기능을 확장해 식단과 운동관리가 가능한 ‘360Health 앱 2.0’을 출시했다고 25일 밝혔다. 해당 앱을 통해 건강상태를 체크하고 AI 분석을 통한 다양한 건강증진 솔루션을 제공할 뿐만 아니라 보다 빠르고 간편하게 헬스케어서비스를...
646,"부산교육청, 인공지능 교육 길라잡이'콕! 찝! AI!'발간",2020.11.25.,"4차 산업혁명 시대를 맞아 교육현장에 적용할 인공지능(AI) 교육 길라잡이가 개발됐다. 부산교육청(교육감 김석준)은 미래사회를 살아갈 학생들을 위한 인공지능(AI) 교육 길라잡이인'콕! 찝! AI!'를 발간, 각급 학교에 배포한다고 23일 밝혔다. 이 길라잡이는 부산대학교와 동의대학교, 한국교육과정평가원..."
647,"문대통령, 인공지능 현장 방문… ""위기극복 핵심 동력""",2020.11.25.,"문재인 대통령은 25일 한국판뉴딜 행보의 일환으로 인공지능(AI) 산업 현장을 찾았다. 문 대통령은 이날 오후 경기도 고양시 킨텍스에서 열린 '한국판뉴딜, 대한민국 인공지능을 만나다' 행사에 참석했다. 이는 지난 7월 한국판 뉴딜 종합계획 발표 전후 △데이터댐(6월18일) △그린에너지·해상풍력(7월17일)..."
648,"""AI가 국가 명운 좌우할 것""…국내외 석학·전문가들 AI시대 전략 공유",2020.11.25.,"""인공지능(AI)은 국가의 명운을 좌우할 핵심 요소다.""(최기영 과학기술정보통신부 장관) ""데이터와 기술이 주는 혜택과 위험성 사이에서 균형을 맞추는 것이 정부의 역할이다.""(미래학자 제이슨 솅커) AI 국가전략 발표 1주년을 기념해 국내외 석학, 전문가들이 AI 시대 대응전략을 논의하는 자리가..."
649,"SKT, 반도체 팹리스 시장 진출...AI반도체도 출시",2020.11.25.,사진제공=SKT SK텔레콤이 자체 설계한 인공지능(AI) 반도체를 공개하고 AI 반도체 산업에 진출할 뜻을 밝혔다. SKT가 반도체 설계 전문회사(팹리스)로서 시장에 진출하면서 삼성전자와 SK하이닉스 중심의 국내 반도체 산업 생태계가 더욱 다양해질 전망이다. SK텔레콤은 25일 일산 킨텍스에서 열린...
650,"삼성전기, 'KPCA Show 2020' 참가…AI·전장용 등 첨단기판 전시",2020.11.25.,"어드밴스드 솔루션스에서는 5G통신, 인공지능(AI), 전장 등 반도체의 고성능화와 슬림화에 대응하기 위한 다수의 제품을 전시했다. 특히 초고속 5G통신에 필수인 안테나용 기판은 인쇄회로기판에 안테나와 RF모듈을 일체화해서 고주파 신호 감도 향상과 사이즈 소형화를 구현했다. 또, 수동소자인..."
651,"뉴패러다임인베스트먼트, 의료용 AI 스타트업 `피노맥스`에 투자",2020.11.25.,뉴패러다임인베스트먼트는 의료용 인공지공(AI) 스타트업 '피노맥스'에 투자했다고 27일 밝혔다. 올 3월 설립된 피노맥스는 딥러닝 기반 의료 이미지 분석과 인공지능 기술을 통해 헬스케어 진단 제품 개발과 치료 혁신 A.I 솔루션 서비스를 제공하는 인공지능(AI) 의료 솔루션 스타트업이다.
652,"SKT, AI 반도체 브랜드 '사피온' 론칭…글로벌 시장 진출 선언",2020.11.25.,"'사피온'은 인류를 뜻하는 '사피엔스(SAPiens)'와 영겁의 시간을 뜻하는 '이온(aEON)'의 합성어로, 인류에게 AI 반도체 기반 인공지능 혁신의 혜택을 지속 제공하겠다는 의지를 담았다. SK텔레콤은 선제적 연구 개발을 통해 확보한 앞선 AI 반도체 핵심 코어 설계 역량을 바탕으로 정부, 반도체 관련 대..."
653,유·초·중·고 AI 과목 신설…2025년부터 본격화,2020.11.27.,유·초·중·고교에 ‘인공지능(AI) 교육’이 도입된다. 교육부는 20일 정부서울청사에서 유은혜 부총리 겸 교육부 장관 주재로 관계부처와 함께 제19차 사회관계장관회의 겸 제7차 사람투자인재양성협의회를 개최하고 ‘AI 시대 교육정책방향과 핵심과제’를 논의했다고 밝혔다. 교육부는 내년부터 초·중...
654,"문 대통령 ""AI 반도체, 제2의 D램으로 키우겠다""",2020.11.27.,"문재인 대통령은 25일 ""인공지능(AI) 기술 혁신의 속도를 높이겠다""며 ""핵심 제품인 인공지능 반도체를 제2의 D램으로 키우겠다""고 밝혔다. AI 반도체는 인공지능 서비스 구현에 필수적인 대규모 연산을 초고속·저전력으로 실행하는 반도체다. 문 대통령은 이날 고양시 킨텍스에서 네이버, 삼성전자 등 AI 관련..."
655,"네이버클라우드, 신규상품 출시로 AI 서비스 라인업 강화",2020.11.25.,네이버클라우드(대표 박원기)가 클라우드 기반의 AI 컨택센터를 구축할 수 있는 ‘CLOVA AiCall’과 길고 복잡한 문장도 정확히 인식하는 ‘CLOVA Speech’상품을 오픈했다. 이번에 출시된 ‘CLOVA AiCall’은 국내 최고 수준의 음성인식과 합성 및 자연어 처리 등의 인공지능 기술이 적용되어 다양한 고객지원...
656,"[오마이 특징주] AI 시스템 포착을 통해 오늘의 핫한 종목! '에치에프알, 태림...",2020.11.25.,오전장 시황과 AI에 포착된 테마와 종목! 인공지능의 종목으로 초보투자자들의 기준을 잡아드립니다! 김다은 머니투데이방송 앵커 (출연) 조인원 이사 타라시스템 Q. AI 포착 종목 - 소프트센 5.27% 부분청산 후 보유 - 올릭스 2.57% 수익 청산 Q. 오버나잇 예상종목 - 소프트센·에치에프알·포스코ICT Q. AI...
657,"[최우수법률상]'대상' 김병욱 ""데이터-AI로 세계 이끌자""",2020.11.25.,"[[the300]머니투데이 더300·법률앤미디어 '2020 최우수법률상 및 국감 스코어보드 대상' 시상식] ""데이터를 가장 많이 활용하고 AI(인공지능)와 결합해서 세계를 선도해야만 우리의 미래가 있다"" 신용정보법 개정안으로 최우수 법률상 대상을 수상한 김병욱 더불어민주당 의원이 '데이터 경제'를 거듭 강조했다. 김..."
658,"네이버클라우드-흥국화재, 인공지능 기반 보험 서비스 `맞손`",2020.11.25.,네이버클라우드와 흥국화재는 지난 20일 서울 종로구 소재 흥국화재 본사에서 AI(인공지능) 기반의 보험 서비스 확대를 위한 업무협약을 체결했다고 23일 밝혔다. 이번 협약을 통해 양사는 흥국화재의 퍼블릭 클라우드 기반 보험업 시스템 및 서비스 구축과 신규 비즈니스 사업 발굴 등을 공동 협력하기로 했다....
659,"SKT, AI 반도체 '사피온 X220'으로 글로벌 반도체 시장 선점 나선다",2020.11.25.,"AI 반도체는 인공지능 서비스의 구현에 필요한 대규모 연산을 초고속, 저전력으로 실행하는 비메모리 반도체로 인공지능의 핵심 두뇌에 해당한다. 사피온 X220은 인류를 뜻하는 '사피엔스'와 영겁의 시간을 뜻하는 '이온'의 합성어로 인류에게 AI 반도체 기반 인공지능의 혜택을 제공하겠다는..."
660,"네이버클라우드-흥국화재, 인공지능 기반 보험 서비스 `맞손`",2020.11.25.,네이버클라우드와 흥국화재는 지난 20일 서울 종로구 소재 흥국화재 본사에서 AI(인공지능) 기반의 보험 서비스 확대를 위한 업무협약을 체결했다고 23일 밝혔다. 이번 협약을 통해 양사는 흥국화재의 퍼블릭 클라우드 기반 보험업 시스템 및 서비스 구축과 신규 비즈니스 사업 발굴 등을 공동 협력하기로 했다....
661,"닥터노아바이오텍-SK케미칼, 'AI기반 신약 개발' 공동연구 협약",2020.11.25.,인공지능(AI)기반 신약개발 전문기업인 닥터노아바이오텍(대표 이지현)은 SK케미칼과 'AI 기반의 신약개발 공동 연구∙개발 협약'을 체결했다고 27일 밝혔다. 이번 협약의 주요 목적은 닥터노아바이오텍이 보유한 AI 플랫폼을 기반으로 양사 간 상호 협력 및 공동연구를 통해 차세대 신약 파이프라인을...
662,"한국·프랑스, '가동 중 원자로 AI 예측 연구' 협력한다",2020.11.25.,"과기정통부는 ""신규 의제로 합의된 '인공지능(AI)을 활용한 가동 중 원자로 이상진단 예측 알고리즘 연구'는 전 세계적으로 초기 단계에 있는 연구 분야""라며 ""양국 간 협력을 통해 원전 안전을 크게 증대시키는 계기가 될 것으로 기대한다""고 밝혔다. 원자력 연구개발 분야에서는 안전연구, 미래원자력기술(SFR..."
663,"문대통령 ""AI 반도체, 제2의 D램으로 키울 것…2029년까지 1조 투자""",2020.11.23.,"문재인 대통령은 25일 경기도 고양시 킨텍스를 방문해 네이버·KT·카카오·삼성전자·SK텔레콤 등과 미래 먹거리인 인공지능(AI)의 비전을 살폈다. 문 대통령은 특히 ""인공지능 '기술 혁신'의 속도를 높이겠다""며 ""핵심 제품인 인공지능 반도체를 제2의 D램으로 키우겠다""고 했다. 문 대통령은 이날 오후..."
664,"""전세계 연구자들과 잇단 협력… 美· 中 대항 AI 연구벨트 조성""",2020.11.23.,"석상옥 네이버랩스 대표 강조 ""연내 네이버 데이터박스 공개"" 네이버가 AI(인공지능) 시대 국내 대표 기술 기업으로 확고한 자리매김을 이어간다. 전 세계 AI 연구자 및 로봇 공학자들과의 협력을 주도해 관련 분야의 연구를 가속화해 나가겠다는 전략이다. 이를 위해 연내 AI 연구의 핵심이라 할 수 있는 양질의..."
665,"광주시, 서울서 AI보고대회…""'AI산업 성공여부, 인재확보에 달려""",2020.11.27.,"광주시는 23일 서울 롯데호텔에서 인공지능(AI)사업과 관련한 정부, 법조·금융·산업·학계 등 각계각층 인사들이 대거 참석한 가운데 '초인 AI가 온다' 보고대회를 개최했다. AI가 바꿔놓을 미래를 전망하고 인공지능 강국 대한민국 실현을 위한 인재 양성과 기술 확보, 제도 마련 등을 논의하기 위해..."
666,"안국약품, 인공지능 기반 영업사원용 챗봇 서비스 도입",2020.11.27.,"안국약품이 인공지능(AI) 기반 영업사원용(MR) 챗봇 서비스를 도입했다. 챗봇(CHATBOT)은 온라인상의 대화를 뜻하는 채팅(Chatting)과 로봇(Robot)의 합성어로, 메신저를 통해 인공지능(AI)과 대화를 나눌 수 있게 한 서비스다. 최근 다양한 산업계에서 활발히 도입하고 있다. 안국약품이 '영업사원용 챗봇' 서비스를..."
667,"[전문] 문 대통령 ""AI 편리함과 동시에 어두운 측면도 고민해야""",2020.11.27.,"문재인 대통령은 25일 ""우리는 인공지능(AI)이 가져올 편리함과 동시에 사람의 소외를 초래할지도 모를 어두운 측면도 무겁게 고민해야 한다""고 말했다. 문 대통령은 이날 경기 일산 킨텍스에서 열린 '대한민국 인공지능을 만나다' 행사장을 찾았다. 앞서 7월 한국판 뉴딜 종합 계획을 발표한지 4개월만의 현장..."
668,"SKT, 인공지능 반도체 '사피온 X220' 출시···글로벌 출사표",2020.11.27.,"사진 = SK텔레콤 SK텔레콤이 인공지능(AI) 반도체를 출시하고 글로벌 시장에 출사표를 던졌다. 25일 SK텔레콤은 일산 킨텍스에서 열린 '한국판 뉴딜, 대한민국 인공지능을 만나다'에서 자체 개발한 데이터센터용 AI 반도체를 선보이고 AI 반도체 사업 비전을 밝혔다. AI 반도체는 인공지능 서비스..."
669,"SKT, 국내 최초 데이터센터용 AI반도체 'SAPEON X220' 출시",2020.11.27.,"AI 반도체는 인공지능 서비스의 구현에 필요한 대규모 연산을 초고속, 저전력으로 실행하는 효율성 측면에서 특화된 비메모리 반도체로 인공지능의 핵심 두뇌에 해당한다. 이날 SK텔레콤이 선보인 SAPEON X220은 기존 GPU 대비 딥러닝 연산 속도가 1.5배 빠르기 때문에 데이터센터에 적용 시..."
670,"닥터노아바이오텍-SK케미칼, 'AI기반 신약 개발' 공동연구 협약 체결",2020.11.27.,투데이코리아=김성민 기자 | 인공지능(AI)기반 신약개발 전문기업인 닥터노아바이오텍(대표 이지현)은 SK케미칼과 'AI 기반의 신약개발 공동 연구∙개발 협약'을 체결했다고 27일 밝혔다. 이번 협약의 주요 목적은 닥터노아바이오텍이 보유한 AI 플랫폼을 기반으로 양사 간 상호 협력 및 공동연구를 통해...
671,SKT AI 스피커로 ‘아리아’ 부르면 지구촌 어린이 돕는다,2020.11.27.,"이번 협력으로 양사는 지난 3월부터 공동 개발해 온 AI(인공지능) 스피커를 활용한 신개념 기부 프로그램 ‘AI 기브유(GiveU)’를 처음으로 선보이고 본격 운영에 나선다. AI 기브유는 AI 스피커 ‘누구(NUGU)’로 편리하게 기부할 수 있는 프로그램이다. 이용자가 누구 호출어인 ""아리아""를 부르고 ""기브유에서..."
672,네이버클라우드 '말귀 밝은 AI'로 서비스 라인업 강화,2020.11.23.,"네이버클라우드는 클라우드 기반의 인공지능(AI) 컨택센터를 구축할 수 있는 '클로바 Ai콜(CLOVA AiCall)'과 길고 복잡한 문장도 정확히 인식하는 '클로바 스피치(CLOVA Speech)'상품을 오픈했다고 26일 밝혔다. 이번에 출시된 클로바 Ai콜은 음성 인식 및 합성, 자연어 처리 등의 AI 기술이 적용돼 다양한 고객지원..."
673,"뷰노, RSNA2020서 최신 연구 성과 및 의료 AI 솔루션 공개",2020.11.26.,이번 행사에서 뷰노는 영상의학 분야에 AI(인공지능) 기술을 적용한 다양한 연구결과를 발표하고 유수 국가의 판매 허가를 받은 의료 AI 솔루션을 전시한다. 이번에 소개할 의료 AI 솔루션은 △뷰노메드 흉부CT AI™ △뷰노메드 체스트 엑스레이™ △뷰노메드 딥브레인™ △뷰노메드 본에이지™ 등이다....
674,"SK건설, 인공지능 스마트홈 'SK뷰 AI 홈 서비스' 개발",2020.11.23.,SK건설은 스마트홈 솔루션 기업 다산지앤지와 인공지능 스마트홈 기술인 'SK 뷰 AI 홈 서비스'(SKAI·스카이)를 기발해 공동 특허출원을 완료했다고 23일 밝혔다. 스카이는 재실감지·자동제어·음성인식 기술 등을 딥러닝 서버에 결합시킨 스마트홈 기술이다. 스카이의 인공지능은 사용자 생활패턴을 학습해...
675,"ICT 업계 ""미래 국가대표 먹거리 AI, 함께 키워나가자""",2020.11.23.,"국내 ICT 산업을 주도하는 SK텔레콤·KT·네이버·카카오 등이 AI(인공지능)·개발자 컨퍼런스에 참석해 AI(인공지능) 사업을 통한 미래 먹거리 사업계획을 발표했다. 25일 SK텔레콤·KT·네이버·카카오 등 국내 주요 ICT 기업들은 일산 킨텍스에서 열린 '한국판 뉴딜, 대한민국 인공지능을 만나다'에서..."
676,"""AI가 부동산 시세 예측""... 탱커펀드, 서울금융위크 2관왕 영예",2020.11.23.,사진=탱커펀드 제공 부동산 인공지능기업 (주)탱커펀드가 지난 4일과 6일 '서울금융위크 & 국제금융컨퍼런스'의 사업계획서(IR) 및 지적재산권(IP)... 탱커펀드는 2016년부터 다양한 데이터 분석을 통해 국내 부동산 시세예측 AI 알고리즘을 개발해 왔다. 이번 경연에 제출한 'AI 부동산자동심사시스템'은 비대면...
677,"문 대통령, 한국판 뉴딜 행보로 ‘인공지능’ 현장 방문…“AI, 위기극복 핵심...",2020.11.25.,AI기본구상 및 국가전략 1년 성과와 미래비전 조망 문재인 대통령이 25일 한국판 뉴딜 행보의 일환으로 인공지능(AI) 산업 현장을 찾아 기업들의 도전을 격려했다. 지난 7월 한국판 뉴딜 종합계획 발표 전후 Δ데이터댐(6월18일) Δ그린에너지·해상풍력(7월17일) Δ그린 스마트스쿨(8월18일) Δ스마트그린 산업단지...
678,"전홍범 KT 부사장 ""'AI 1등 대한민국' 모두 함께해야""",2020.11.25.,"KT가 인공지능(AI) 1등 대한민국을 위해 '모두가 함께하는 AI'를 제안했다. 전홍범 KT AI/DX융합사업부문장 부사장은 25일 일산 킨텍스에서 열린 '한국판 뉴딜, 대한민국 인공지능을 만나다' 행사에서 ""AI가 글로벌 경쟁력을 갖추기 위해 기업 혼자서는 아무것도 할 수 없다""며 ""1등 대한민국이 되기 위해..."
