,제목,날짜,본문
624,SKT-충남대와 동물 AI 영상진단 보조 솔루션 개발,2021.06.28.,"SK텔레콤은 충남대학교 수의과대학과 동물을 촬영한 엑스레이를 인공지능(AI)이 판독해 수의사의 진단을 도울 수 있도록 하는 솔루션 개발에 나섰다. 사진=SK텔레콤 제공 충남대는 수의과대학 부속동물병원에 보유 중인 수만 건의 영상 빅데이터를 비식별 정보화하고, 수의영상진단 전공 수의사는 이에..."
625,"현대차증권, 파운트와 AI 솔루션 금융혁신사업 확대 위한 MOU 체결",2021.06.28.,파운트는 고도화된 인공지능(AI) 기술을 기반으로 다양한 형태의 로보어드바이저 솔루션을 제공하는 국내 1위 로보어드바이저 업체다. 국내 유수의 금융기관들과의 성공적인 협업을 통해 기술력을 인정받고 있다. 현대차증권은 파운트가 제공하는 빅데이터·시장분석 엔진 등을 활용해 고객 맞춤형 포트폴리오...
626,"SK텔레콤, 충남대와 AI 기반 수의용 영상진단 보조 솔루션 개발 나선다",2021.06.28.,"SKT는 또 자사가 보유하고 있는 5G MEC 기술을 적용하고, 자체 클라우드 플랫폼을 통해 수의사들이 언제 어디서나 AI가 제시하는 영상진단 판독 결과를 받아볼 수 있도록 구현할 예정이다. 충남대학교 수의과대학 부속동물병원 이해범 원장은 ""이번 협약을 통해 수의분야에서도 인공지능을 활용한 의료 분석..."
627,"'AI·음성인식 탑재' 현대엘리베이터-KT, 엘리베이터 DX 확장 사업 MOU 체결",2021.06.28.,"엘리베이터와 AI, 음성인식, 자율주행 로봇을 연계한 신사업을 추진한다고 29일 밝혔다. 이날 협약식에는 송승봉 현대엘리베이터 대표이사와 박종욱 KT 경영기획부문장(사장)을 비롯해 양사 주요 관계자가 참석했다. 엘리베이터 산업은 인공지능을 비롯한 4차 산업혁명 기술의 발달과 함께 e..."
628,"임혜숙 장관 “양자기술, 반도체·AI 이은 미래 전략기술 핵심”",2021.06.28.,"임혜숙 과기정통부 장관은 “양자 기술은 산업‧안보적 파급력으로 반도체‧인공지능(AI) 등에 이어 미래 전략기술의 핵심으로 부상하고 있는 분야”라며 “연구개발(R&D)후발국인 우리나라의 경우, 미국‧중국 등 선도국과의 기술격차를 조기 극복하기 위한 국가 차원의 전방위 노력이 필요하다”고 말했다...."
629,"한컴아카데미, AI 양재 허브와 'AI 융합 교육과정' 모집",2021.06.28.,"한컴아카데미가 서울시 인공지능 전문 기관인 AI 양재 허브와 AI융합 전문인력 양성을 위한 'AI+X 융합 교육'을 운영한다. 이번 교육은 기획자, 디자이너, 개발자 등이 팀을 구성해 산업별로 AI 활용 방법을 익히고 비즈니스 이해 및 사례 분석, AI 활용 서비스 설계 등을 통해 실제 서비스 구현까지 가능하도록..."
630,"창원시, 2021년 데이터 청년 캠퍼스 ‘창원 빅리더 AI 아카데미’ 개최",2021.06.27.,"단순히 교육 운영 지원에 그치지 않고 프로젝트에 직접 참여하여 교육생들과 머리를 맞대고 지역 사회 문제를 인공지능(AI) 기술을 통해 해결할 수 있는 혁신 서비스를 창출해 사회 안전망 강화, 시민 편의 증진에 그 목적이 있다. 또한, 데이터는 있지만 그것을 활용하여 문제를 해결하는 데 인력, 재정적 여건의..."
631,"'인공지능·증강현실 한 번에' 조선대, 첨단기술 활용공간 개소",2021.06.27.,"조선대학교가 인공지능(AI)과 증강현실(AR)·가상현실(AR) 등 첨단기술을 한 번에 체험하고 교육할 수 있는 개방형 창의공간을 조성했다. 24일 조선대에 따르면 인공지능 분야에 대한 학생들의 관심을 유도하고, 자유로운 창작 공간으로 활용할 수 있는 씨유 이노 스페이스(CU INNO SPACE)를 만들었다...."
632,"경북도, 한글AI 데이터구축 사업 선정… 국비 19억원 확보",2021.06.27.,"경북 도내 1000만 이상 옛한글 자료를 학습시켜 획, 크기, 형태가 모두 다른 옛한글을 식별해낼 수 있는 AI(인공지능)학습용 데이터를 구축하는 사업인 것. 이로써 경북의 새로운 문화콘텐츠 산업을 선도하고 청년 일자리를 창출하게 된다. 이 사업은 도와 안동대를 거점으로 포스텍, 한국국학진흥원, ㈜인플랫..."
633,"AI혁신허브사업, 산학연 100여개 참여하는 그랜드 컨소시엄 출사표 ... '경쟁...",2021.06.27.,"대학 주도 대형 인공지능(AI) 연구개발(R&D) 프로젝트로 관심을 모은 'AI 혁신 허브' 사업에 고려대를 주축으로 하는 그랜드 컨소시엄이 단독 응모했다. 애초 대학 간 치열한 경쟁이 예상됐지만 주요 대학이 거대 AI 연구 생태계를 조성하자는 데 공감, 단일 컨소시엄을 구성했다. 다양한 AI 혁신 주체가 참여..."
634,"제주폴리텍대학-㈜타미코퍼레이션, AI인재 양성 MOU",2021.06.29.,"AI+X는 AI 기술과 산업(X)을 접목해 해당 산업의 생산성과 경쟁력을 높이기 위한 인공지능 융합 프로젝트다. 이번 협약은 AI+X 우수인력 양성, 인적자원의 능력개발과 상호협력 등을 통해 시대변화에 대응하고 새로운 가치를 창출키 위해 마련됐다. 두 기관은 협약을 통해 △인력, 장비, 시설, 교육, 취업정보 등..."
635,"솔트룩스, 지난해 이어 올해 236억원 대규모 AI 데이터 댐 사업 수주... 금년...",2021.06.28.,"이경일 대표(사진:본지DB) 인공지능·빅데이터 전문기업 솔트룩스(대표 이경일)가 지난해에 이어 '인공지능(AI) 학습용 데이터 구축' 및 'AI 바우처', '데이터바우처' 사업 등 총 236억 원 규모의 디지털 뉴딜 사업 주관 및 참여기업으로 선정되었다고 밝혔다. 솔트룩스는 지난해, 디지털 뉴딜의 가장 성공적인..."
636,"통신사·포털, 코로나19 백신 접종 돕는 AI 보이스봇 콜센터 본격 '경쟁'",2021.06.28.,"/SKT 통신사와 포털들이 코로나19 백신 접종을 돕는 '인공지능(AI) 보이스봇 콜센터' 서비스 경쟁에 나서고 있다. 네이버가 이 달부터 전북 전주시에서 AI 기반 '클로바 케어콜'을 활용해 코로나19 백신 예방 접종자의 이상여부를 모니터링하는 서비스를 선보인 데 이어, SK텔레콤은 28일 코로나19 백신 접종을..."
637,"인천 폴리텍대, 글로벌 AI기술(AI+x) 인재양성 프로젝트 출범",2021.06.28.,학교법인 주관 하에 AI융합소프트웨어과 24명의 재학생(1학년)을 대상으로 진행되는 이번 교육은 정부의 2019년 인공지능 국가전략 2020년 한국판 뉴딜 종합계획 발표에 따른 속도감 있는 AI+x 교육 확산이 주된 목적이다. 대상은 AI융합소프트웨어과 24명의 재학생(1학년)을 대상으로 했다. 총 16시간의...
638,세운상가 공중보행길 10월 완공… 한강교량 AI기반 CCTV로 사고 예방,2021.06.28.,"10월 구축 예정인 '한강교량 통합관제센터'에 인공지능(AI) 기반 CCTV 관제기술을 시범 적용해 한강교량에서 발생하는 투신 사고를 미연에 방지하는 등 사전 대응력을 높일 계획이다. 황보연 서울시 기획조정실장 직무대리는 ""'2021 하반기 달라지는 서울생활'에는 시민 일상에 실질적인 도움이 될 정보를 담기..."
639,"SKT, 中企 3곳 손잡고 호텔서빙 AI로봇 상용화",2021.06.27.,"SK텔레콤이 호텔 인공지능(AI) 서빙 로봇 상용화를 위해 중소기업 세 곳과 손잡았다. SK텔레콤은 우리로봇, 코가플렉스, 영우디에스피와 AI 서빙 로봇을 대구 인터불고호텔에 시범 투입하기로 업무협약(MOU)을 맺었다고 27일 밝혔다. 이들이 함께 개발한 AI 서빙 로봇의 이름은 ‘서빙고’다. 오는 8월부터..."
640,"현대차증권-파운트, AI 솔루션 금융혁신사업 확대 위한 MOU",2021.06.28.,현대차증권이 서울 여의도 현대차증권 본사에서 파운트와 인공지능(AI) 솔루션 금융혁신사업 확대를 위한 제휴 협약(MOU)을 체결했다고 28일 밝혔다. 현대차증권은 파운트의 로보어드바이저 기능을 통해 ▲고객 맞춤형 포트폴리오 ▲시장 전망 및 리포트 ▲리밸런싱 사후관리 ▲마이데이터 애플리케이션...
641,[세계 속 AI ② 네덜란드] '정부 AI 준비 지수' 전 세계 10위권 AI 강소국,2021.06.23.,"ICAI 산하의 문화 인공지능 연구소(Cultural AI Lab)는 네덜란드 왕립도서관(National Library of the Netherlands), 암스테르담 대학교(University of Amsterdam)와 암스테르담 자유대학(VU University of Amsterdam) 등의 공동 작업으로 개설됐다. 문화 AI 연구소는 기술의 데이터 편향 처리 방식, 다양한 관점 및 주관적인 해석..."
642,[이상직 변호사의 AI 법률사무소](26)EU 인공지능법(안)의 시사점과 대응전략,2021.06.23.,"지난 4월 21일 유럽연합(EU)집행위원회는 인공지능(AI) 법안을 내놓았다. 유럽의회 투표와 회원국 승인이 필요하기 때문에 순조롭게 진행돼도 최종 입법까지는 2년 이상 소요된다. 법안은 AI가 사람에 미치는 위험 정도에 따라 용납할 수 없는 위험(unacceptable risk), 고위험(high risk), 저위험(limited risk), 최소..."
643,미래차·조선 등 제조현장 AI 기술인력 5년간 1만3천명 양성,2021.06.27.,"'AI 융합형 산업현장기술인력' 사업 본격 시행 미래차, 반도체, 조선 등 제조 산업현장에서 2025년까지 인공지능(AI) 기술인력 1만3천여명이 배출된다. 산업통상자원부는 'AI 융합형 산업현장기술인력 혁신역량강화' 사업을 본격적으로 시행한다고 23일 밝혔다. 이번 사업은 최근 신산업 분야의 글로벌 시장..."
644,"경북도, 한글AI 데이터 구축 사업으로 국비 19억 확보",2021.06.27.,"연말까지 총 21억원(국비 19억원, 도비 2억원)을 투입해 경북 도내 1천만 이상의 옛한글 자료를 학습시켜 획, 크기, 형태가 모두 다른 옛한글을 식별해낼 수 있는 AI(인공지능)학습용 데이터를 구축하게 된다. 사업은 경북도와 안동대학교를 거점으로 포스텍, 한국국학진흥원, ㈜인플랫 5개 기관이 컨소시엄을..."
645,"볼보, 차세대 순수 전기차에 라이다 기술·AI기반 슈퍼 컴퓨터 탑재",2021.06.27.,"볼보자동차는 차세대 충돌 방지 기술을 위해 새롭게 개발되는 순수 전기차에 라이다(LiDAR) 기술과 AI(인공지능) 기반 슈퍼컴퓨터를 표준으로 탑재한다고 25일 밝혔다. 이는 자체 개발 소프트웨어와 볼보의 자율주행 소프트웨어 개발 자회사, 젠스엑트 및 루미나의 소프트웨어를 결합한 것으로, 차세대 충돌 방지..."
646,"""AI가 백신 일정 알려주고 모니터링""… SKT '누구 백신 케어콜' 상용화",2021.06.27.,"SK텔레콤이 신종 코로나바이러스 감염증(코로나19) 백신접종 일정을 사전에 안내하고, 접종 후 반응여부를 모니터링하는 인공지능(AI) 전화서비스를 선보인다. SK텔레콤(대표 박정호)은 코로나19 백신 접종을 돕는 '누구 백신 케어콜'을 상용화한다고 27일 발표했다. '누구 백신 케어콜'은 이동통신망(IMS)..."
647,"SKT 등 5개사, AI 서빙로봇 상용화 위해 뭉쳤다",2021.06.25.,"SK텔레콤(대표 박정호)은 우리로봇, 코가플렉스, 영우디에스피, 바르미 인터불고호텔대구와 손잡고 인공지능(AI), 실내자율 주행 기술 기반의 AI 서빙로봇 상용화를 위한 업무제휴 협약식을 25일 대구 인터불고호텔에서 진행했다고 27일 밝혔다. SKT는 AI로봇 상용화에 반드시 필요한 실내 원격관제를 위해..."
648,인공지능-지식재산 특위 2기 출범,2021.06.25.,대통령 소속 국가지식재산위원회는 글로벌 차원의 인공지능(AI) 지식재산(IP) 이슈를 정립하기 위한 'AI-IP 특별전문위원회 2기'가 출범한다고 밝혔다. AI특위는 전 세계적으로 논의 초기 단계에 있는 인공지능 지식재산 이슈를 정립하기 위해 지난해 6월 출범한 지재위 산하 특위다. 산학연 전문가 15인과...
649,"KT-질병관리청 맞손…""AI가 백신 이상반응 알린다""",2021.06.27.,"KT가 질병관리청과 손을 잡고 인공지능 백신접종 안내 서비스를 제공합니다. 오늘(29일) KT는 질병관리청과 '코로나19 백신접종안내 G보이스봇' 업무협약을 맺었습니다. 다음 달부터 인공지능이 접종 정보를 미리 알려주고, 이상반응 여부를 자동으로 확인할 예정입니다. [ / ]"
650,"[창원소식] 창원시, 2021년 데이터 청년 캠퍼스 ‘창원 빅리더 AI 아카데미’...",2021.06.22.,"단순히 교육 운영 지원에 그치지 않고 프로젝트에 직접 참여해 교육생들과 머리를 맞대고 지역 사회 문제를 인공지능(AI) 기술을 통해 해결할 수 있는 혁신 서비스를 창출해 사회 안전망 강화, 시민 편의 증진에 그 목적이 있다. 또한 데이터는 있지만 그것을 활용해 문제를 해결하는 데 인력, 재정적 여건의..."
651,"국가지식재산위, 29일 인공지능-지식재산 특위 2기 출범",2021.06.22.,"대통령 소속 국가지식재산위원회(공동위원장 국무총리, 정상조 서울대 교수)가 '인공지능(AI)-지식재산(IP) 특별전문위원회 2기'를 오는 29일 출범한다. 특위 2기를 이끌 위원장으로는 권영준 서울대 법학전문대학원 교수가 결정됐다. 이외 민간 전문가 15명, 관계부처(과기정통부, 문체부, 산업부, 중기부..."
652,SK텔레콤 등 5개사 대구 호텔에 AI 서빙로복 운영,2021.06.27.,"SK텔레콤 등 5개 회사가 개발한 서빙로봇 모습 [사진: SK텔레콤] SK텔레콤(대표 박정호)은 우리로봇, 코가플렉스, 영우디에스피, 바르미 인터불고호텔대구와 손잡고 인공지능(AI), 실내자율 주행 기술 기반의 서빙로봇 상용화를 위한 업무제휴 협약식을 25일 대구 인터불고 호텔에서 진행했다고 27일 밝혔다...."
653,"UNIST, AI 기술로 유기태양전지 제조 최적화 모델 찾다",2021.06.27.,최적의 조합으로 고효율 유기태양전지를 제조할 수 있는 인공지능(AI)기술이 개발됐다. 유기태양전지를 비롯한 다양한 인쇄형 광전소자 연구개발을 촉진할 것으로 기대된다. 울산과학기술원(UNIST·총장 이용훈)은 김진영 에너지화학공학과 교수팀이 박두진 호주 연방과학기술원 연구원과 공동으로 AI 머신러닝...
654,"""AI로 폐질환 찾는다""…LG전자, 디지털 엑스레이 검출기 출시",2021.06.27.,폐질환 의심 부위 분석해 자동 검출 LG전자는 인공지능(AI) 진단 보조 기능을 탑재한 '디지털 엑스레이 검출기'를 출시한다고 22일 밝혔다. 신제품은 '영상획득 소프트웨어'와 하드웨어인 '엑스레이 검출기'로 구성된다. 영상획득 소프트웨어에는 의료용 인공지능 솔루션 기업 '뷰노(VUNO)'의 인공지능 진단...
655,"프리스타일웍스코리아-서울과기대, 인공지능 기반 반려동물 진단 시스템 공동...",2021.06.27.,이용근 교수(왼쪽)와 프리스타일웍스코리아 김종욱 대표의 협약 식 후 기념촬영 모습 인공지능(AI) 반려동물 헬스케어 선도기업 프리스타일웍스코리아(대표 김종욱)는 서울과학기술대학교(총장 이동훈) 창의융합대학(학장 최병욱) 지능형반도체공학과( 이용근 교수)와 인공지능(AI) 기반 반려동물 진단 시스템...
656,AI가 코로나19 백신 접종 돕는다,2021.06.27.,"인공지능(AI)이 신종 코로나바이러스 감염증(코로나19) 백신 접종을 돕는다. SK텔레콤은 28일 충남 아산시를 시작으로 충청남도, 경상남도, 광주광역시 등에서 ‘누구 백신 케어콜’ 서비스를 시작한다. 이후 광역 지자체를 중심으로 대상지역을 지속 확대할 계획이다. 누구 백신 케어콜은 이동통신망 상에..."
657,부산시·CJ올리브네트웍스 ‘해운·항만물류’ AI 교육생 모집,2021.06.28.,"지역 ICT이노베이션 스퀘어 확산사업의 일환으로 진행되는 이번 교육과정은 인공지능(AI) 및 IT/SW분야 취업을 희망하는 미취업자 청년을 대상으로 일 8시간, 주 5일의 4개월 집중교육으로 구성돼 있다. 또 우수 교육생 대상으로 CJ올리브네트웍스의 실무를 체험할 수 있는 ‘리모트(Remote) 인턴십’..."
658,"[은행 AI혁명②] 신한은행, 디지털 데스크 채널 확대... 연내 AI은행원 시범 ...",2021.06.24.,KB국민·신한·하나·우리·농협은행 등 시중은행들이 업무 전반에 인공지능(AI) 기술 도입을 위한 발걸음이 빨라지고 있다. 일부에서 AI를 활용한 맞춤형 금융상품 추천과 고객상담 서비스는 이미 보편화됐고 보다 진보된 수준의 업무영역을 담당할 'AI 은행원' 개발 작업에도 박차를 가하고 있다. 이에...
659,"인공지능 투자 파운트, 3년새 100배 '폭풍성장'",2021.06.24.,파운트는 자체 개발한 AI(인공지능) 알고리즘이 세계 각국의 경제 및 시장지표를 조합해 5만 2000개가 넘는 시나리오 결과로 산출한 ‘파운트 마켓스코어’를 기반으로 개인의 투자성향에 따라 커스터마이징된 글로벌 자산배분 포트폴리오에 최소 10만원부터 투자 가능한 비대면 인공지능 투자...
660,"GS네오텍-AWS, ‘클라우드·AI로 혁신하는 고객경험’ 주제 공동 웨비나 개최",2021.06.24.,"양사가 공동 주최하는 이번 웨비나는 ‘클라우드와 인공지능(AI)으로 혁신하는 고객경험(CX)’이 주제다. AWS와 GS네오텍의 전문가가 발표를 맡는다. 발표자는 AWS CS 비즈니스 김선수 담당, 김정곤 솔루션즈 아키텍트와 GS네오텍 정보통신기술(ICT)사업부 사업기획팀 홍수용 리더, ICT사업부 수행팀 김대욱..."
661,"코난테크놀로지, AI기반 음성인식 자막지원 서비스 개발",2021.06.29.,인공지능 테크기업 코난테크놀로지(대표 김영섬)가 지난달 10일 교육부 국립특수교육원(원장 이한우)의 '2021년 AI기술기반 음성인식 자막지원 프로그램 개발 사업'의 수행기업으로 최종 선정됐다고 29일 밝혔다. 국립특수교육원은 한국의 특수교육을 대표하는 국가기관으로 특수교육 연구 및 실태조사...
662,"SKT, 충남대와 AI·빅데이터로 반려동물 의료 수준 끌어 올린다",2021.06.28.,<사진=SK텔레콤> SK텔레콤과 충남대학교가 인공지능(AI)과 빅데이터 등을 활용해 반려동물 진료 수준 개선에 나선다. SK텔레콤이 충남대학교 수의과대학과 함께 'AI기반 수의 영상진단 보조 솔루션 개발을 위한 업무협약'을 체결했다고 28일 밝혔다. 수의용 영상진단 보조 솔루션은 동물을 촬영한...
663,"제이엘케이, 인공지능 솔루션 ‘맘모아나’로 유방암 진단 돕는다",2021.06.28.,"제이엘케이, 세계 여성 발병율 1위 질병인 유방암에 의료 인공 진단 솔루션 제공 의료 인공지능(AI) 상장기업 제이엘케이(대표 김동민)가 자사 유방암 솔루션 ‘맘모아나’를 통해 여성 유방암 조기 진단을 돕고, 관련 시장 선점에 나선다. 2017년 국가 암 등록 통계에 따르면 유방암은 우리나라 여성 암 중..."
664,"뷰노-삼성전자, 디지털 엑스레이 시스템에 AI 탑재 계약 체결",2021.06.25.,응급실·중환자실 등에 유용할 것으로 기대 의료인공지능(AI) 전문 기업 뷰노는 삼성전자와 인공지능 기반 흉부 엑스레이 영상 판독 보조 솔루션 공급계약을 25일 체결했다고 밝혔다. 이번 계약은 삼성전자의 프리미엄 이동형 디지털 엑스레이 촬영장비 'GM85'에 뷰노가 개발한 '뷰노메드 체스트 엑스레이™'를...
665,"딥노이드, '의료 AI' 업고 코스닥 시장 노크",2021.06.25.,"의료 인공지능(AI) 솔루션 전문기업 딥노이드가 18일 금융위원회에 증권신고서를 제출하고 본격적인 공모 절차에 착수했다고 21일 밝혔다. 공모주식수는 30만주, 희망공모가밴드는 3만1500~4만2000원이며 공모규모는 94억5000만~126억원이다. 7월 14~15일 수요예측과 같은 달 21~22일 청약을 거쳐 7월 말 코스닥..."
666,[MWC 2021] 에임브로드 'AI가 전술 예측' 축구 내비게이션 공개,2021.06.25.,"모바일월드콩그레스(MWC) 2021 현장에서 축구 인공지능(AI) 스타트업 에임브로드가 혁신기술을 공개한다. 삼성전자(005930)와 국내 이통3사 등 굵직한 정보통신기술(ICT) 기업들이 오프라인 참여를 포기한 가운데 현장을 지켰다. 에임브로드는 세계 최초 축구 인공지능(AI) 개발업체로, 실시간 자가 진단 축구..."
667,"LIG넥스원, AI 양재 허브와 '미래 신기술 MOU' 체결",2021.06.24.,"이번 협약을 통해 LIG넥스원과 AI 양재 허브는 4차 산업혁명의 핵심 분야로 높은 관심의 대상이 되고 있는 인공지능(AI) 등 미래 신기술을 중심으로 협력 네트워크를 구축하는 한편, 혁신 스타트업들이 국방R&D 사업에 적극적으로 참여할 수 있도록 다양한 지원활동을 진행하게 된다. 또한 기술자료 및..."
668,"KAIST, AI학습모델 오류 수정 기술 개발",2021.06.24.,KAIST(총장 이광형)는 AI(인공지능)대학원 최재식 교수(설명가능 인공지능연구센터장) 연구팀이 심층학습(이하 딥러닝) 생성모델의 오류 수정 기술을 개발했다고 25일 밝혔다. 이 기술을 발전시키면 AI학습모델의 오류를 진단해 알려줄 수 있게 된다. 최근 딥러닝 생성모델(Deep Generative Models)은 이미지...
669,"""주행거리 늘었는데 오히려 수익은 감소…AI배달 비효율적""",2021.06.24.,뉴스토마토 = 이선율 기자 | 효율적인 시스템이라고 알려졌던 배달앱의 AI(인공지능) 알고리즘이 사실상 라이더들의 시간당 배달건수와 수익을 감소시키고 있는 것으로 조사됐다. 게다가 교통법규를 준수하며 배달할 때에는 시간당 배달건수와 수익이 급격히 감소하는 것으로 나타나 현행 배달앱들의...
670,"인공지능 투자 파운트, 출시 3년새 회원수 26만명 늘어",2021.06.25.,"20대·여성 이용고객 증가 적립식 투자 꾸준히 늘어 인공지능(AI) 투자업체 파운트는 24일 출시 3년만에 회원수가 26만명 가까이 늘었다고 밝혔다. 파운트는 지난 2018년 6월 출시된 AI 투자 애플리케이션이다. 파운트에 따르면 파운트의 6월말 회원수는 26만명으로, 2018년말(2580명) 대비 100배 이상..."
671,"볼보, 차세대 순수 전기차에 라이다·AI 기반 슈퍼컴퓨터 탑재",2021.06.25.,볼보자동차가 새롭게 개발하는 순수전기차에 라이다(LiDAR) 기술과 인공지능(AI) 기반 슈퍼컴퓨터를 표준으로 탑재해 차원이 다른 충돌방지 기능을 선보인다고 25일 밝혔다. 볼보는 자체 개발 소프트웨어와 자회사 젠스엑트·루미나가 개발한 자율주행 소프트웨어를 결합한 차세대 충돌방지 기술로 사망...
672,"AI 토익 튜터 산타, 전면 개편… '뤼이드 튜터'로 학습 경험 개선",2021.06.25.,AIEd(교육 인공지능) 솔루션 기업 뤼이드(Riiid)가 자사의 B2C 서비스 AI 토익 튜터 '산타'를 전면 개편하고 서비스명을 '뤼이드 튜터' 로 변경한다고 밝혔다. 공식 서비스명은 '뤼이드 튜터 - 토익 프렙'(이하 뤼이드 튜터)이다. 이번 리브랜딩은 딥테크 기업인 뤼이드의 AI 기술력을 서비스 전면에 내세움과 동시에...
673,AI 챗봇 통한 제주버스 안내·지방세 납부 서비스 구축 추진,2021.06.25.,제주에서 카카오톡을 이용한 인공지능(AI) 챗봇 민원 서비스가 구축된다. 제주특별자치도는 과학기술정보통신부와 한국지능정보사회진흥원이 주관한 ‘2021년 공공부문 클라우드 기술 선도 프로젝트’ 공모사업 대상자로 최종 선정돼 오는 7월부터 본격 추진한다고 27일 밝혔다. 제주도는 도민·관광객...
674,"서울산업진흥원 메이커스페이스G·캠프, 한국산업단지공단과 공동으로 'FULL ...",2021.06.27.,"컴퓨팅), AI(인공지능), ROS(로봇운영시스템)에 관심있는 중소기업 종사자, 메이커 등으로 서울디지털산업단지 내 입주기업 및 창업보육시설에 입주한 예비창업자, 초기 창업자에 교육 우선기회를 부여할 계획이다. MCU 교육은 총 6개 주제 100시간 과정으로 BLE, Zigbee, AVR, STM32, Cube MX, Free RTOS, AWS..."
