,제목,날짜,본문
1464,"한-캐 인공지능 사업에 주 캐나다 대사 ""보기 드문 성공모델""",2021.04.22.,"장경룡 주 캐나다 대한민국 대사가 '창원인공지능연구센터', '한-캐 인공지능(AI) 공동연구센터 운영사업'의 협력 성과에 대해 만족감을 나타냈다. 창원시는 22일 한-캐나다 협력 사업인 '창원인공지능연구센터'와 '한-캐 인공지능 공동연구 사업' 추진현황을 공유하고, 발전방안을 논의하기 위해..."
1465,"광주시·광주테크노파크·인공지능기업, 광주 AI 산업 생태계 조성 나선다",2021.04.22.,"이용섭 시장은 ""광주는 어느 지역보다 선제적으로 인공지능을 선점해 AI 4대 강국 대한민국을 뒷받침하고 있다""며 ""㈜글로벌케이, ㈜씨엔에스컴퍼니가 광주에서 데스밸리를 넘어 글로벌 경쟁력을 갖춘 스케일업으로, 유니콘기업으로 지속적으로 성장·발전하도록 가능한 모든 지원을 아끼지 않겠다""고 말했다...."
1466,"성남시, 콜센터에 인공지능 상담 서비스 도입",2021.04.22.,"성남시는 콜센터 민원응대를 효율적으로 하기 위해 오는 4월 22일부터 인공지능(AI) 상담 서비스를 시범 도입한다. 단순 반복적인 질의는 AI 상담원이 응대하고, 전문적이고 복잡한 질의는 시 콜센터 상담원 20명이 응대한다. 최근 코로나19 관련 지원금, 백신 접종 등에 관한 문의가 늘어 통화대기..."
1467,"CJ대한통운, AI 로봇 '디팔레타이저'업계 첫 상용화",2021.04.21.,"이러한 문제점을 인식한 CJ대한통운은 3D 이미지 센싱 및 인공지능(AI) 딥러닝 기술을 적용해 동일한 모양이 아닌 박스들도 연속 처리할 수 있는 시스템을 구현했다. 설비 상단에 설치된 비전 카메라(Vision Camera)로 상자의 면적, 높이, 모서리 위치를 실시간으로 촬영하고 데이터로 인식 및 스스로 학습해 각..."
1468,"AI 시스템 규제 나선 EU…일각선 ""혁신저해 우려""",2021.04.21.,"유럽연합(EU)의 행정부 격인 집행위원회가 사람들의 안전과 생계, 권리에 위협이 되는 인공지능(AI) 시스템을 금지하는 새로운 규제안을 21일(현지시간) 발표했다. AI에 대한 포괄적인 규제안은 EU가 전 세계에서 최초다. 개인의 자유와 권리를 보호한다는 목적이지만 일각에서는 혁신을 저해한다는 우려도..."
1469,"[인터뷰] 이진석 ""AI모델로 코로나 감염자 중증으로 악화될 가능성 예측""",2021.04.21.,▷편견인지 모르겠지만 AI인공지능하면 늘 생명윤리에 관한 윤리적 문제가 뒤따르게 되는데요. 이번에 이진석 교수 연구팀이 개발한 인공지능 모델은 생명윤리 관점에서 별다른 문제는 없는 겁니까? ▶저희는 환자의 과거 데이터를 기반으로 인공지능이란 통계적인 모델을 이용해서 결과를 낸 것입니다. 조금...
1470,"88년생 김일두, 카카오 AI사업 맡는다",2021.04.21.,"카카오 인공지능(AI) 연구 자회사 카카오브레인은 ‘딥러닝 알고리즘 연구’를 이끌어온 김일두 팀장을 신임 대표(33세, 사진)로 선임한다고 12일 밝혔다. 김일두 신임 대표는 지난 2012년 카카오 소프트웨어(SW) 엔지니어로 입사한 뒤, 약 7년간 AI 관련 다양한 서비스 연구개발(R&D)을 해왔다. 2018년부터는..."
1471,별점평가 없애고 AI로 '조작' 탐지,2021.04.22.,"플랫폼 허위 리뷰와 전면전 팩트 확인용 '영수증 리뷰'도 ◆ 자영업자 울리는 가짜 리뷰 ◆ 음식·카페·숙박 플랫폼이 악성 또는 허위·조작 리뷰를 막기 위해 인공지능(AI) 기술을 도입하거나 전담 감시팀을 운영하는 등 대응을 강화하고 있다. 23일 관련 업계에 따르면, 네이버는 식당·카페 등 장소 리뷰의 '별점..."
1472,CCTV와 AI가 뭉쳐 찾는다…스마트시티 대구 수성구,2021.04.21.,"아동, 치매 환자 실종 시에는 통신자로부터 위치정보를 받아 신속히 소재를 확인해 경찰이 긴급 구조를 할 수 있도록 지원하고 인공지능(AI)을 통한 재난재해·긴급상황 발생 징후 감지, 체납차량 위치 알림 등 다양한 서비스를 구축할 계획이다. 수성구청 관계자는 ""지능형 선별 관제 시스템을 도입한..."
1473,"현대重그룹, AI 기반 선박 화재 감시시스템 개발",2021.04.22.,"현대중공업그룹이 인공지능(AI) 기반의 화재 감시시스템 개발에 성공했다. 현대중공업그룹은 최근 '인공지능(AI) 기반 안전관리시스템(HiCAMS)'을 개발, 조선업계 최초로 한국선급 및 라이베리아 기국의 기본승인(AIP)을 획득했다고 밝혔다. 이번 AIP를 시작으로 현대중공업그룹은 향후 선박 전체로 확대 적용해..."
1474,"크기 다른 택배상자도 '척척'…CJ대한통운, 'AI 로봇팔' 상용화",2021.04.22.,"CJ대한통운은 택배 박스의 면적과 높이, 위치를 인식해 자동으로 컨베이어벨트에 옮기는 '인공지능(AI) 로봇 디팔레타이저'를 업계 최초로 상용화했다고 22일 밝혔다. 이 로봇은 다양한 규격의 박스가 여러 개 쌓여 있거나 나란히 정렬되지 않은 상태에서도 작업을 할 수 있는 등 마치 사람의 손처럼 움직이기..."
1475,"삼성전자, 로봇청소기 '비스포크 제트 봇 AI' 출시",2021.04.22.,"삼성전자가 인공지능 기술로 사물인식 능력과 주행성능을개선한 로봇청소기 '비스포크 제트 봇 AI'를 27일 출시했다. 비스포크 제트 봇 AI는 딥러닝 기반으로 100만장 이상의 이미지를 사전 학습해 국내 최다 수준의 사물 인식이 가능하다. 냉장고, 에어컨, TV, 소파, 침대 등 집안의 다양한 가전제품과 가구는..."
1476,"“디지털뉴딜 인재 양성한다” 과기정통부, AI전문대학원·SW중심대 추가 선정",2021.04.22.,"과학기술정보통신부는 21일 인공지능(AI)·소프트웨어(SW) 분야 인재양성을 위한 소프트웨어중심대학, 인공지능대학원, 스타랩에 신규 선정된 대학을 발표했다. 과기정통부는 한국판 뉴딜의 일환으로 올해부터 2025년까지 1조원을 투입해 ‘인공지능·소프트웨어 핵심인재 10만명 양성’을 추진하고..."
1477,"韓 AI기술, ""선진국보다 1.8년 뒤져…제도개선 시급""",2021.04.19.,"투데이코리아=김성민 기자 | 우리나라 4차 산업혁명(4차 산업)의 근간이 될 인공지능(AI) 기술이 선진국보다 뒤처진다는 평가가 나오면서 데이터 관련 제도 정비가 선행돼야 한다는 주장이 제기됐다. 전국경제인연합회(전경련)는 22일 '인공지능(AI) 분야 현황과 과제' 분석 결과를 통해 ""투자와 특허..."
1478,"신한은행, AI 사업총괄에 삼성SDS 출신 김민수 영입",2021.04.19.,신한은행은 인공지능(AI) 사업을 총괄하는 AICC(통합AI센터) 센터장에 1977년생의 김민수 삼성SDS AI선행연구랩(Lab)장을 영입했다고 오늘(19일) 밝혔습니다. 김민수 센터장은 KAIST에서 데이터마이닝을 전공하고 박사학위를 취득한 후 삼성SDS AI선행연구소 부서장을 지냈습니다. 김 센터장은 딥러닝...
1479,"해수부, 포항에 데이터·네트워크·AI 접목한 스마트양식 조성",2021.04.21.,스마트양식 클러스터 사업은 한국판 뉴딜의 일환으로 1차 산업인 양식업에 데이터ㆍ네트워크ㆍ인공지능(DataㆍNetworkㆍAI) 기술을 접목해 디지털산업으로 전환하는 사업이다. 경북 포항 스마트양식 클러스터 조감도 [사진=해양수산부] 포항 스마트양식 클러스터 조성사업은 포항 지진의 진상조사 및...
1480,"박근한 NHN AI 연구본부장 ""돈 버는 AI, 모든 산업 현장에 심겠다""",2021.04.21.,은퇴 경기를 준비하던 이세돌 9단은 마지막 대국의 ‘맞수’로 토종 바둑 인공지능(AI) ‘한돌’을 택했다. 한돌은 1999년부터 쌓아온 ‘한게임 바둑’의 데이터로 탄생한 바둑게임 프로그램. 이 9단이 2점을 먼저 까는 접바둑을 뒀지만 승리는 한돌(2승 1패)의 몫으로 돌아갔다. 알파고 이후 AI가 다시금...
1481,"전주, 인공지능·블록체인 핵심 인재 본격 양성",2021.04.21.,"앞으로 인공지능(AI) 및 블록체인 분야 인력을 양성하는 거점 역할을 맡게 된다. 2~4층은 오픈스페이스 회의실과 가변형 세미나와 교육이 가능한 이노베이션랩, 4차 산업혁명 기반 ICT전문교육장으로 구축됐으며, 5층은 창업관과 3D메이커스 창작실로 조성됐다. 이날 개소식에서는 미리 모집한 수강생 100명을..."
1482,"SKT, 'WIS 2021' 참가...AI·메타버스 기술 공개",2021.04.21.,SKT 홍보 모델이 '인공지능과 가상현실로 가득찬 미래'를 주제로 준비한 WIS 2021 SKT 전시 부스를 소개하고 있는 모습 [사진 : SK텔레콤] SK텔레콤이 21일~23일 열리는 국내 최대 ICT 전시회 '월드 IT쇼 2021(WIS 2021)'에서 AI(인공지능)와 메타버스 관련 혁신 기술과 서비스를 선보인다고 21일 밝혔다. SK텔레콤은...
1483,"한국IBM, 클라우드·데이터·AI 경력직 100여 명 채용",2021.04.21.,"한국IBM은 하이브리드 클라우드와 인공지능(AI)에 전사적 역량을 집중하고 있는 비즈니스 방향에 발맞춰, 기술 인력을 대거 채용한다고 21일 밝혔다. 이번에 채용하는 인력은 클라우드, 데이터, AI 부문 아키텍트, 엔지니어, 디자이너, 컨설턴트 분야에서 약 100여 명에 이른다. IBM은 글로벌 차원에서..."
1484,"KISA, 사이버 보안 AI 데이터셋 구축 사업 실시",2021.04.21.,한국인터넷진흥원(KISA)이 보안 분야에 인공지능(AI) 기술 적용 기반을 마련하기 위해 범용 사이버보안 AI 데이터셋을 구축한다. KISA(원장 이원태)는 과학기술정보통신부(장관 최기영)와 함께 민·관 협력을 통한 '사이버 보안 AI 데이터셋 구축·개방' 사업을 추진한다고 20일 발표했다. 데이터셋 구축 분야는...
1485,"조선대 SW중심대학사업단, 기아차 조합원 자녀 위한 'AI·SW 로봇코딩교실' 프...",2021.04.20.,조선대 SW중심대학사업단 26일 조선대학교에 따르면 조선대학교 SW중심대학사업단은 기아자동차 광주지회와 2021년 3월 4일 협약을 체결함에 따라 기아자동차 광주지회 조합원 초등학교 자녀들을 위한 'AI(인공지능)·SW(소프트웨어) 로봇코딩교실' 프로그램을 지난 4월 17일부터 24일까지 운영했다. 이번 AI...
1486,"통계청, 질문하면 자료 찾아주는 인공지능 플랫폼 ‘코봇’ 개발",2021.04.26.,"코봇은 국가통계 활용을 높이기 위해 인공지능(AI) 기술을 도입해 사용자 질문에 필요한 답변과 자료를 제공하는 형태다. 국가통계포털(KOSIS)을 통해 이용할 수 있으며, 자주 하는 질문과 용어 해설정보를 제공하고 자동완성 기능으로 질문에 따른 시기와 지표, 추세성 등을 보여준다. 대화 형식으로..."
1487,"CJ대한통운, 비정형 박스 자동으로 옮기는 'AI 로봇팔' 상용화",2021.04.22.,"CJ대한통운은 3D 이미지 센싱 및 인공지능(AI) 딥러닝 기술을 적용해 동일한 모양이 아닌 박스들도 연속 처리할 수 있는 시스템을 구현했다. 설비 상단에 설치된 비전 카메라(Vision Camera)로 상자의 면적, 높이, 모서리 위치를 실시간으로 촬영하고 데이터로 인식 및 스스로 학습해 각 상자의 상태에 맞춰 피킹..."
1488,"CJ대한통운, 비정형 박스 자동으로 옮기는 'AI 로봇팔' 상용화",2021.04.22.,"CJ대한통운은 3D 이미지 센싱 및 인공지능(AI) 딥러닝 기술을 적용해 동일한 모양이 아닌 박스들도 연속 처리할 수 있는 시스템을 구현했다. 설비 상단에 설치된 비전 카메라(Vision Camera)로 상자의 면적, 높이, 모서리 위치를 실시간으로 촬영하고 데이터로 인식 및 스스로 학습해 각 상자의 상태에 맞춰 피킹..."
1489,"포스코, '주니어 인공지능 온라인 캠프' 오픈…올해 4회 진행",2021.04.22.,"포스코는 지역 아동들의 디지털 교육 기회를 확대하고, 인공지능 분야 미래 인재를 양성하기 위해 AI 교육 프로그램을 마련했다. 교육 콘텐츠 제작에는 포스코 인재창조원의 전문 강사들이 참여해 교육의 질을 높였다. 포스코는 코로나19 확산으로 인해 대면 교육이 어려운 점을 고려해 전 과정 온라인으로 교육..."
1490,"KT 주도 'AI원팀', 우리은행 합류...금융권 AI 활용 본격화",2021.04.22.,"지난해 합류한 한국투자증권에 이어 은행권 최초로 우리은행이 힘을 더하며, 금융영역에서의 인공지능(AI) 활용과 공동연구 등 사업 협력을 본격화 할 예정이다. KT는 20일 서울 종로구 KT 광화문빌딩 이스트(East)에서 우리은행과 '대한민국 인공지능(AI) 1등 국가를 위한 업무협약(MOU)을 체결했다고..."
1491,AI대학원 마지막 티켓 서울대와 중대가 차지,2021.04.22.,"대학가의 큰 관심을 모은 인공지능(AI) 대학원 막차에 서울대와 중앙대가 탑승했다. 서강대, 경희대 등 11개 대학이 경합을 벌였지만 두 대학이 마지막 티켓을 거머쥐었다. 서울대는 작년에 이어 재수 끝에 막차에 올라 탔다. 이로써 AI대학원은 총 10곳으로 늘었다. 과기정통부는 특별한 사유가 없는..."
1492,"SKT ""시각장애인도 AI 기술로 독서·쇼핑""",2021.04.20.,"임팩트업스 2기 참여 기업 센시는 인공지능(AI) 기반 시각장애인용 점자 변환 소프트웨어 개발 회사다. 서적에 있는 글자는 물론 이미지와 복잡한 수식도 점자로 전환해주는 알고리즘을 구현, 제작에 6개월이 걸리는 300페이지 분량 점자책을 하루만에 만들 수 있도록 했다. 점자서적 판매가격도 기존..."
1493,"KISA, 사이버보안 분야 AI 데이터셋 구축·개방 사업 추진",2021.04.20.,한국인터넷진흥원(KISA)은 과학기술정보통신부와 함께 민·관 협력을 통한 ‘사이버보안 AI(인공지능) 데이터셋 구축 및 개방’ 사업을 추진한다고 20일 밝혔다. 최근 코로나19 영향으로 사회 전반에 디지털 전환이 가속화되면서 지능화된 사이버 공격도 급증하고 있다. 이에 KISA는 범용 사이버보안 AI...
1494,"선문대, 충남도교육청과 지역 AI·SW 인재 양성 협약",2021.04.20.,"선문대는 충남도교육청과 23일 도교육청 제1회의실에서 AI(인공지능)·SW(소프트웨어) 가치 확산과 활성화 지원을 위한 업무협약을 체결했다고 밝혔다.이에따라 양 기관은 지역의 초·중·고 대상의 AI, SW 동아리 집중 발굴 및 육성을 위해 다양한 사업을 공동으로 추진해 나가게 됐다. 선문대는..."
1495,"LG전자, 업계 최초 시스템에어컨 '인공지능 품질인증' 획득",2021.04.20.,"LG전자의 시스템 에어컨이 강력한 인공지능(AI) 성능을 공인 받았다. LG전자는 최근 LG 휘센 시스템 에어컨의 대표모델인 '멀티브이(MULTI V)'가 한국표준협회로부터 국내 시스템 에어컨 최초로 AI+ 인증을 획득, 제품에 탑재된 인공지능 기술의 신뢰성을 인정받았다고 21일 밝혔다. AI+ 인증은 국내 유일의..."
1496,SKT '월드 IT쇼'서 AI·메타버스 혁신 기술·서비스 선봬,2021.04.21.,"SK텔레콤이 21일부터 오는 23일까지 열리는 국내 최대 ICT 전시회 '월드 IT쇼 2021(WIS 2021)'에서 AI(인공지능), 메타버스와 관련된 혁신 기술과 서비스를 선보인다. SK텔레콤은 서울 코엑스(COEX) 3층에 있는 870㎡ 규모의 전시관에서 '인공지능과 가상현실로 가득 찬 미래'를 주제로 대한민국 ICT의 미래를 책임질..."
1497,[해군교육사] ‘스마트 네이비 구현’ AI 실무 인력 양성 나선다,2021.04.21.,해군교육사 ‘NAVY AI 캠프’ 기초역량 배양 위한 실습 교육 중점 심화 연수 등 자체 교육과정도 마련 해군이 ‘스마트 네이비’ 구현을 주도할 인공지능(AI) 실무 인력 양성과 자체 AI 교육 여건 마련에 본격 돌입했다. 해군교육사령부(교육사)는 27일 “한국마이크로소프트사(Microsoft Korea) 초청 ‘Navy AI...
1498,"한컴인텔리전스-세종대-아큐플라이에이아이, AI 산업 육성 협력",2021.04.21.,한컴MDS의 연결 자회사인 한컴인텔리전스는 세종대학교 인공지능융합연구센터 및 아큐플라이에이아이와 인공지능(AI) 산업 육성을 위한 업무협약을 체결했다고 21일 밝혔다. 이번 협약을 통해 세 기관은 AI 기술 공유 및 협력 체계 구축을 통한 AI 산업의 고부가가치 창출을 위해 협력하기로 뜻을 모았다....
1499,"조선대 SW중심대학사업단, 기아차 조합원 자녀 위한 ‘AI·SW 로봇코딩교실’...",2021.04.22.,26일 조선대학교에 따르면 조선대학교 SW중심대학사업단은 기아자동차 광주지회와 2021년 3월 4일 협약을 체결함에 따라 기아자동차 광주지회 조합원 초등학교 자녀들을 위한 ‘AI(인공지능)·SW(소프트웨어) 로봇코딩교실’ 프로그램을 지난 4월 17일부터 24일까지 운영했다.이번 AI·SW 로봇코딩교실은...
1500,"인하대, 인천 최초 AI특화 연구교육기관 개소…과기부·인천시 47억 지원",2021.04.22.,"/인하대 제공 인하대학교(총장 조명우)가 인천 최초 인공지능(AI)특화 연구교육기관을 열었다. 인하대는 23일 교내 정석학술정보관 국제회의장에서 '인공지능융합연구센터' 개소식을 개최했다고 26일 밝혔다. 이날 행사에는 전성배 정보통신기획평가원장, 신은호 인천시의회의장, 안영규 인천시..."
1501,"광주시, '인공지능 산업 생태계 조성' 전문기업과 협력",2021.04.22.,"광주광역시가 광주테크노파크, 인공지능(AI) 전문기업들과 손을 잡고 인공지능 산업생태계 조성에 나선다. 광주시는 오늘(21일) 인공지능 전문기업인 주식회사 글로벌케이, 주식회사 씨엔에스컴퍼니와 '인공지능 비즈니스 기반 조성을 위한 업무협약'을 체결했다고 밝혔다. 이번 협약은 광주시가 미래..."
1502,"CJ대한통운, ‘AI 로봇팔’ 업계 최초 상용화",2021.04.22.,"CJ대한통운은 3D 이미지 센싱 및 인공지능(AI) 딥러닝 기술을 적용해 동일한 모양이 아닌 박스들도 연속 처리할 수 있는 시스템을 구현했다. 설비 상단에 설치된 비전 카메라(Vision Camera)로 상자의 면적, 높이, 모서리 위치를 실시간으로 촬영하고 데이터로 인식 및 스스로 학습해 각 상자의 상태에 맞춰 피킹..."
1503,"현대차그룹, AI 석학 조경현 교수 자문위원 영입",2021.04.22.,현대자동차그룹이 인공지능(AI) 분야 세계적인 석학의 자문을 받으며 자체 AI 역량 강화에 나선다. 현대차그룹은 기계학습 및 AI 응용 연구 분야의 세계적인 전문가로 손꼽히는 미국 뉴욕대(NYU) 조경현(사진) 교수를 이달 초 자문위원으로 영입하고 협업 중이라고 25일 밝혔다. 조 교수는 현대차·기아 AI 기술의...
1504,AI 은행원도 나온다…불붙은 은행권 인공지능 개발 경쟁,2021.04.22.,"시중 은행들이 잇따라 인공지능(AI)을 활용한 금융 서비스 개발에 속도를 내고 있다. 단순한 역할에서 벗어나 ‘AI 뱅커(은행원)’을 만들어 도입하고, 자금관리·챗봇 서비스에서 인공 지능 활용 비중을 높이고 있다. 빅테크와의 비대면 금융 경쟁이 화두로 떠오르면서 ‘AI 경쟁력’이 곧 생존 키워드로..."
1505,"""'韓 '4차산업혁명의 쌀' AI, 선진국 대비 1.8년 뒤져""",2021.04.22.,"우리나라 AI(인공지능) 기술이 선진국 대비 1.8년 뒤처져 있다는 분석이 나왔다. 22일 전국경제인연합회(이하 전경련)이 'AI 분야 현황과 과제'를 분석한 결과에 따르면, 우리나라 AI 투자와 특허 등이 선진국 대비 경쟁력이 부족한 상황인 것으로 나타났다. 특히 AI 학습에 필요한 데이터 활용 제약하는..."
1506,"SKT, AI 인재 양성 프로그램 ‘AI 펠로우십’ 3기 모집",2021.04.21.,(사진제공=SKT) SK텔레콤(SKT)이 인공지능(AI) 분야 미래 인재들을 육성하는 ‘SKT AI 펠로우십(AI 펠로우십)’ 3기 지원자를 모집한다고 18일 밝혔다. 2019년 시작된 ‘SKT AI 펠로우십’은 대학(원)생들이 실제 기업에서 근무하는 개발자들의 피드백을 통해 AI 전문가로 성장할 수 있도록 돕는 멘토링...
1507,"SK텔레콤, 월드IT쇼 2021 참가 AI·메타버스 혁신 기술 선보여",2021.04.21.,SK텔레콤이 월드IT쇼 2021 참가해 AI·메타버스 관련 혁신 기술과 서비스를 선보인다 SK텔레콤(대표이사 박정호)이 21일~23일 열리는 국내 최대 ICT 전시회 '월드IT쇼 2021(WIS 2021)'에서 AI(인공지능)와 메타버스 관련 혁신 기술과 서비스를 선보인다. SKT는 서울 코엑스(COEX) 3층에 있는 870㎡ 규모의 전시관에서...
1508,"SK텔레콤, 월드IT쇼 2021 참가 AI·메타버스 혁신 기술 선보여",2021.04.21.,SK텔레콤이 월드IT쇼 2021 참가해 AI·메타버스 관련 혁신 기술과 서비스를 선보인다 SK텔레콤(대표이사 박정호)이 21일~23일 열리는 국내 최대 ICT 전시회 '월드IT쇼 2021(WIS 2021)'에서 AI(인공지능)와 메타버스 관련 혁신 기술과 서비스를 선보인다. SKT는 서울 코엑스(COEX) 3층에 있는 870㎡ 규모의 전시관에서...
1509,"CJ대한통운, 비정형 박스 옮기는 'AI 물류로봇' 업계 최초 상용화",2021.04.21.,"이에 CJ대한통운은 3D 이미지 센싱 및 인공지능(AI) 딥러닝 기술을 적용해 동일한 모양이 아닌 박스들도 연속 처리할 수 있는 시스템을 구현했다. 먼저 설비 상단에 설치된 비전 카메라(Vision Camera)로 상자의 면적, 높이, 모서리 위치를 실시간으로 촬영하고 데이터로 인식해 각 상자의 상태에 맞춰 피킹 작업을..."
1510,"엘에스웨어, 정보통신산업진흥원 민간지능정보서비스 확산사업 주관기관 선정",2021.04.21.,"사업에 쓰이는 기술은 인공지능(AI) 기반 영상 판독기술인 NFT(대체 불가능 토큰)다. 드론 수색 시 촬영한 영상물에 블록체인 기술을 활용해 복제와 위·변조를 원천 방지한다. 회사는 사업을 통해 자사 인공지능(AI) 기반 영상미디어 NFT 기술을 고도화하고, 이를 바탕으로 영화와 드라마 등 다양한 영상 NFT..."
1511,AI 스타트업 ‘글로벌 톱100’ 美 65곳·中 6곳인데… 韓기업은‘0’,2021.04.21.,- 전경련 ‘AI분야 현황’ 보고서 美와 기술격차 1.8년 못좁혀 정보보호·의료법 등 정비필요 데이터·전공 정원규제 풀어야 우리나라의 인공지능(AI) 경쟁력이 미국 등 선진국보다 1.8년 뒤진 것으로 나타났다. 특히 중국에도 기술 수준을 추월당한 것으로 파악됐다. 글로벌 100대 AI 스타트업에는 한 곳도...
1512,"한컴인텔리전스-세종대-아큐플라이에이아이, AI 산업 육성 협약",2021.04.22.,"기술협력 및 인적자원 교류 나서기로 한컴MDS의 연결 자회사인 한컴인텔리전스(대표 지창건)는 세종대학교(총장 배덕효) 인공지능융합연구센터(센터장 유성준) 및 아큐플라이에이아이(대표 오순영, 장우쉬)와 AI(인공지능) 산업 육성을 위해 협력한다고 밝혔다. 이들 기관은 세종대학교에서 지창건..."
1513,AI 산학연 협의체 'AI원팀'에 우리은행 합류,2021.04.22.,"KT가 20일 서울 종로구 KT 광화문빌딩 이스트에서 우리은행과 '대한민국 인공지능(AI) 1등 국가를 위한 업무협약(MOU)을 체결했다고 밝혔다. 이날 협약식에는 AI 원팀을 대표해 구현모 KT 대표이사, 송재호 AI/DX융합사업부문장 부사장, 권광석 우리은행 행장, 조병규 경영기획그룹장 부행장 등 주요..."
1514,오산시 융복합인재 키우는 ‘AI교육특별시’ 향한다,2021.04.22.,"포스트 코로나시대, AI기반 교육으로 미래인재양성 총력 오산시는 포스트 코로나를 대비하기 위해 인공지능과 같은 미래 4차 산업을 이끌 인재 양성에 중점을 두고 있다. 오산시는 이미 수년 전부터 시가 운영하는 메이커교육센터나 각 학교별로 메이커 스페이스를 구축할 수 있도록 지원하면서 초등학생..."
1515,"전북도교육청, AI활용 초등수학수업 지원시스템 현장 지원",2021.04.22.,전북도교육청은 초등학교 1~2학년 대상으로 인공지능(AI) 활용 초등수학수업 지원시스템인 ‘똑똑! 수학 탐험대’를 운영한다고 26일 밝혔다. 똑똑! 수학 탐험대는 EBS사이트를 통해 무료로 사용할 수 있는 시스템으로 인터넷 기반만 확보되면 어디서나 이용할 수 있다. 특히 학교에서는 수준별 개별화 학습이...
