,제목,날짜,본문
1246,"뷰노, ‘암 바이오마커 정량화’ AI 솔루션 식약처 인증",2021.06.18.,"바이오스펙테이터=서윤석 기자 | 디지털 스캔된 조직 검체 슬라이드 이미지 분석, 바이오마커 자동 정량화 솔루션 ‘뷰노메드 패스퀀트™’..분석시간 줄이고 정확도 높여 뷰노는 24일 인공지능(AI) 기반 디지털 병리 분석 솔루션 ‘뷰노메드 패스퀀트™(VUNO Med®-PathQuant™)’에 대해 식품의약품안전처..."
1247,"정부, AI 학습용 데이터 170종 4억8천만건 민간 개방",2021.06.18.,"AI허브에 개방되는 인공지능 학습용 데이터는 지난해 9월부터 8대 분야별 산학연 전문가 80여명이 참여하는 ‘품질자문위’를 거치면서 실제 수요자가 요구하는 데이터 품질을 확보했다. 이같은 데이터 개방을 통해 스타트업뿐 아니라, 대기업도 자체 확보하기 어려운 대규모 데이터를 제공한다는 점에서..."
1248,"의료 AI 구글 노리는 딥노이드, 2000억원 가치 정조준",2021.06.18.,의료 AI(인공지능) 플랫폼 기업 딥노이드가 오는 7월 공모에 나선다. AI 기술 경쟁력을 토대로 최대 2000억원 이상의 기업가치를 책정했다. 딥노이드는 데이터를 수집하고 분류해 결과를 도출하는 '딥러닝' 기반 의료 AI 플랫폼을 개발해 의료 현장에 공급하고 있다. 의료진은 딥노이드의 AI 플랫폼으로 의료...
1249,"중기부, '인공지능 스마트공장' 구축에 최대 1년간 4억원 지원",2021.06.18.,"#켐프는 금속 도금 공정에 인공지능(AI) 기술을 도입해 최적 조건을 산출했고, 이런 방식으로 공정의 불량률을 32%에서 4.9%로 줄였다. 인터로조의 경우 AI로 콘택트렌즈 가공 공정 최적화를 통해 도수 적중률을 70%에서 95%로 향상시켰다. 정부는 AI스마트 공장화를 중소·중견 제조기업 전반으로 확산하기..."
1250,"서울시, 전국 최초 세무 전용 AI챗봇 운영",2021.06.22.,"서울시는 14일부터 전국 최초 세무전용 인공지능(AI) 챗봇 '이지(IZY)'를 정식 운영한다고 밝혔다. 이지는 재산세, 자동차세 등 각종 세금과 관련된 상담부터 조회, 납부까지 한 번에 처리할 수 있는 AI 챗봇이다. 지난해 11월 코로나19로 비대면 방식을 선호하는 추세에 맞춰 신한은행과 함께 개발했고 시범운영..."
1251,"서울대·이화여대·성균관대 등 6곳, '예비교원 AI교육 강화 사업'에 선정",2021.06.22.,학교당 연평균 2억원씩 3년간 재정 지원 교육부와 한국과학창의재단은 '2021년 초·중등 교원양성대학 인공지능(AI) 교육 강화 지원 사업'에 6개 대학을 선정했다고 22일 밝혔다. 예비교원에 대한 AI 지도역량을 강화하기 위해 추진하는 이번 사업에는 △초등 AI 교육(초등교원양성대학) 부문에 대구교대와...
1252,"LG전자, AI 접목한 '디지털 엑스레이 검출기' 출시",2021.06.22.,LG전자에 따르면 신제품은 AI(인공지능) 진단 보조 기능을 탑재한 것이 특징이다. '영상획득 소프트웨어'와 하드웨어인 '엑스레이 검출기'로 구성됐다. 고객의 경우 하드웨어와 소프트웨어를 각각 구매할 수 있고 패키지 구매도 할 수 있다. 신제품은 원본 영상과 함께 인공지능 솔루션이 분석한 영상을 전송...
1253,"마크애니, AI 기반 무인점포 이상감지 기술 개발 착수",2021.06.22.,"마크애니는 인공지능(AI) 기반 무인점포 이상행위 감지 기술 개발에 착수한다고 21일 밝혔다. 이번 사업은 과학기술정보통신부의 ‘무인점포 환경 대응형 2D/3D영상 통합분석기반 지능형 영상보안시스템 기술 개발’의 일환으로, 딥러닝 영상분석 기술을 기반으로 점원없이 운영하는 점포의 보안 확보가..."
1254,"AI 학습용 데이터 품질 자신감 정부, 정확도 90~99% 검증",2021.06.22.,"정부가 대규모 인공지능(AI) 학습용 데이터 품질에 자신감을 드러냈다. 개인정보 침해 여지가 없도록 교차 검증도 마쳤으며, 혹시 모를 데이터 흠결에 대비해 집중개선기간을 3개월간 갖는다. 과학기술정보통신부와 한국지능정보사회진흥원(NIA)은 18일 AI 학습용 데이터 170종(4억8000만건)을 AI 허브를 통해..."
1255,"램브란트의 대표작, AI 기술로 되살렸다",2021.06.22.,네덜란드 거장의 예술작품이 인공지능(AI) 기술로 새롭게 복원됐다. 램브란트 반 레인의 대표작 ‘야경’(The Night Watch)이 AI 기술을 통해 원래 크기로 복원됐다고 더버지 등 외신들이 24일(현지시간) 보도했다. 사진=암스테르담 국립 미술관 램브란트의 대표작 ‘야경’은 1642년에 완성된 작품이다....
1256,"""소아희귀질환 15분만에 진단""…과기부, AI 주치의 '닥터앤서' 적극행정 우수...",2021.06.21.,과학기술정보통신부는 인사혁신처와 행정안전부가 공동으로 주관한 2021년 상반기 적극행정 우수사례 경진대회에서 토종 인공지능(AI) 주치의 '닥터앤서' 사례로 우수상을 받았다고 21일 밝혔다. 의료 빅데이터를 통해 의사의 진료·진단을 지원해주는 AI 의사인 닥터앤서는 AI와 의료 융합을 통해 한국인의...
1257,"알체라, '대한민국 인공지능 산업대상' 대상 장관상 수상",2021.06.21.,인공지능(AI) 영상인식 기업 알체라가 24일 열린 '제1회 대한민국 인공지능 산업대상'에서 대상인 '과학기술정보통신부 장관상'을 수상했다고 밝혔다. 올해 처음으로 개최하는 대한민국 인공지능 산업대상은 AI 유망 기업을 대상으로 △기업의 현재 정량적 지표 △기술의 혁신성 △성장 가능성 △기업...
1258,인공지능(AI) 활용 '사춘기 골연령 진단기술' 개발,2021.06.18.,고려대학교 안암병원 정형외과 장우영 교수팀이 뷰노와 함께 기존 솔루션 한계점을 극복하는 새로운 AI기반의 진단법을 개발했다. 사춘기 골연령을 확인하기 위한 팔꿈치 방사선 사진에 인공지능을 적용한 것이다. 장우영 교수팀은 인공지능인 딥뉴럴네트워크모델을 이용해 사춘기 청소년 팔꿈치...
1259,"서울시, 전국최초 AI 활용한 하수관로 결함탐지기 개발",2021.06.18.,"서울시가 사람이 육안에 의존해 찾아냈던 하수관로 천공, 붕괴 같은 결함 탐지 업무에 전국 최초로 인공지능(AI) 기술을 활용한다. 서울디지털재단은 컴퓨터가 영상·이미지 등을 인식하는 '컴퓨터 비전 기술'을 활용해 하수관로 CCTV 영상 내 결함을 자동으로 식별하는 '인공지능 기반 하수관로 결함탐지 시스템..."
1260,"정재승 카이스트 교수, 7월2일 성동구서 인공지능 특별강연",2021.06.18.,"서울 성동구는 정재승 카이스트 뇌공학교수가 7월2일 지역 내 초·중·고등학교를 대상으로 '인공지능(AI) 시대, 상상을 현실로'를 주제로 특별 강연한다고 21일 밝혔다. AI에 대한 이해도를 높이고, 청소년들이 AI 시대 우수 인재로 성장할 수 있도록 온라인 강의와 함께 디지털 게임 플랫폼(AI 월드)을 통해 직접..."
1261,[단독] 무인 수상정이 서로 교신하며 전투…병력 대신할 AI군대 '첫걸음',2021.06.18.,"손바닥만한 크기의 거미 로봇인 드로니는 슈트에 부착된 인공지능(AI) 시스템을 기반으로 움직인다. 스스로 비행경로를 설정하고 자유자재로 하늘을 날며, 적에게 은밀히 접근해 정보를 빼내는 등 위기에 빠진 스파이더맨을 번번이 구해낸다. 적에 함께 맞서는 ‘AI 전우’는 영화 속 얘기만은 아니다. 우리..."
1262,"""기저귀 갈 시간입니다""…일상으로 들어온 AI",2021.06.18.,인공지능 AI는 4차 산업혁명 시대의 핵심 기술입니다. 연구개발이 지속되면서 기술 상용화도 활발하게 이뤄지는 추세인데요. 자동으로 배뇨를 감지하는 스마트 기저귀에서부터 실내환경을 스스로 최적의 상태로 유지해주는 컨트롤러에 이르기까지 일상의 편리함을 넘어 새 가치를 창출하는 인공지능 기반...
1263,AI산업 발전 이끌 데이터댐 완성,2021.06.25.,학습용 데이터 170종 구축 오늘부터 AI허브에 개방 인공지능(AI) 산업발전을 견인할 '데이터댐'이 완성됐다. 과학기술정보통신부와 한국지능정보사회진흥원(NIA)은 인공지능 학습용 데이터 170종을 AI허브를 통해 개방한다고 18일 밝혔다. 과기정통부는 2017년부터 기업이나 연구자 등이 시간이나 비용문제로...
1264,"WAVE3D, AI-5G 드론 융합 기술로 신재생에너지 O&M 시장 공략",2021.06.22.,"AI-5G 융합 기술을 통해 플랜트의 상태를 실시간 모니터링 할 수 있는 드론이다. 다리, 빌딩, 풍력발전, 태양광 발전 패널 등의 유지보수 임무를 수행하고, 플랜트에 일정한 거리유지를 하면서 근접비행해 플랜트의 상태를 5G 네트워크 드론 시스템을 통한 인공지능 분석으로 실시간으로 모니터링한다...."
1265,중기부 “AI 스마트공장 구축에 최대 200억 투입”,2021.06.22.,"스마트공장 보급 등 저변확대와 인공지능 중소벤처 제조플랫폼 ‘켐프(KAMP, Korea AI Manufacturing Platform)’를 통해 데이터와 인공지능을 중심으로 스마트공장 고도화를 지원한다. 중기부는 지난해 12월부터 켐프 서비스를 시작한 이후 기업의 생산공정에서 불량률을 감소시키면서 신뢰도를 높였으며, 공정의..."
1266,[리포트]백신 모니터링 '인공지능에 맡긴다',2021.06.22.,"도입한 인공지능, 백신 케어 콜입니다. 접종 이틀 전부터 각종 정보를 안내하고, 접종 뒤 14일간 이상 반응이 있는지 세 차례 확인합니다. 스마트폰이나 2G폰 유선전화 등 어떤 전화라도 서비스할 수 있는데, 지자체는 이런 모니터링 결과를 실시간 확인할 수 있습니다. ◀ＳＹＮ▶ 조욱래 매니저/ SK텔레콤 AI서비..."
1267,"LG전자, AI탑재 디지털 엑스레이 검출기 출시…오진↓·피폭선량 최소",2021.06.18.,"인공지능이 병변 의심 부위 자동 검출…주요 폐질환 소견 신속하게 포착…한국, 미국, 유럽 등 글로벌 시장에 순차 출시할 계획 이복현 기자, LG전자(066570)가 인공지능(AI) 진단 보조 기능을 탑재한 ‘디지털 엑스레이 검출기(DXD: Digital X-ray Detector)’를 출시한다. 신제품은 영상획득 소프트웨어와..."
1268,"광주은행-지스트, 인공지능 산업 육성 협약",2021.06.18.,광주은행(은행장 송종욱)은 지스트(총장 김기선)와 인공지능(AI) 산업육성을 위한 협약을 체결했다고 18일 밝혔다. 이번 협약을 통해 광주은행과 지스트는 상호 긴밀한 협력을 통해 인공지능 분야의 역량 확보와 우수 기술 인재 육성을 위해 상호협력하며 교류를 확대해 나가기로 했다. 장기적으로는 인공지능...
1269,"광주시, 코로나19 안내모니터링 AI 활용한다",2021.06.21.,이용섭 광주광역시장이 21일 오후 시청 비즈니스룸에서 SK텔레콤 이현아 AI&CO장과 인공지능 활용 코로나19 방역체계 구축을 위한 업무협약을 체결한 후 기념촬영을 하고 있다. /광주광역시 제공 이번 협약은 광주시가 추진해온 광주형 인공지능 비즈니스 기반 조성을 위한 96번째 업무협약이다. 주요...
1270,"AI 학습용 데이터 4.8억건 개방…""한국어음성·자율주행 개발 도움""",2021.06.21.,"임혜숙 과학기술정보통신부 장관이 18일 오전 서울 강서구 LG 사이언스파크 ISC에서 열린 `인공지능(AI) 데이터 활용협의회 출범식`에 참석해 격려사를 하고 있다.(사진=과학기술정보통신부 제공)[이데일리 이후섭 기자] 한국어 음성, 헬스케어, 자율주행 등 인공지능(AI) 학습용 데이터 170종, 4억8000만건이 AI..."
1271,'UNIST와 인공지능으로 산업현장 문제 해결했어요',2021.06.21.,UNIST 인공지능혁신파크에서 진행한 '인공지능(AI) 노바투스 아카데미아' 수료생들의 사례다. 25일 오전 UNIST 산학융합캠퍼스에서 'AI 노바투스 아카데미아 1기 수료식'이 열렸다. 수료식에는 총 36명의 교육생들에게 수료증이 전달됐다. 참석자들은 지금까지의 교육과정 성과를 공유하고 소감을 나눴다. 심재영...
1272,아산시 전국 최초 AI 코로나19 백신 접종안내 및 이상반응 모니터링 시행,2021.06.18.,"AI 기술을 활용해 코로나19 백신 접종을 돕는 '누구 백신 케어콜(NUGU vaccine carecall)'을 시행한다. 아산시와 SKT는 지난 4월 13일 누구 백신 케어콜 도입을 위한 업무 협약을 체결했으며, 28일 아산에서 전국 최초로 본격 서비스를 시작했다. 누구 백신 케어콜은 이동통신망(IMS) 상에 구축된 SKT의 인공지능 누구..."
1273,"AI 카메라 IDS NXT, 식품산업에 활용",2021.06.18.,AI(인공지능)를 활용한 기술은 머신 비전 분야뿐만 아니라 다양한 산업 분야에서 변화를 일으키고 있다. AI카메라를 활용한 애플리케이션의 영역은 무한하다. 특히 식품산업에서도 AI 카메라를 활용할 수 있다. 농산물 등 고정된 규칙으로 특정짓기 어려운 식품을 AI 기반 이미지 프로세싱을 통해...
1274,"폐질환을 포착했다…LG전자, AI 탑재 디지털 엑스레이 검출기 공개",2021.06.28.,"LG전자가 인공지능(AI) 진단 보조 기능을 탑재한 ‘디지털 엑스레이 검출기(DXD: Digital X-ray Detector)’를 22일 출시한다. 이번 신제품은 ‘영상획득 소프트웨어’와 하드웨어인 ‘엑스레이 검출기’로 구성된다. 고객은 하드웨어와 소프트웨어를 각각 구매할 수도 있고, 패키지 구매도 할 수 있다. 영상획득..."
1275,"뷰노, 골연령 판독 AI 기술 입증",2021.06.22.,"이번 연구는 고대안암병원 정형외과와 영상의학과 연구팀이 함께 진행한 공동연구로, 사춘기 골연령 검사에서 인공지능(AI) 기술을 최초로 적용, 임상적 유효성을 확인한 연구로 주목 받았다. 연구팀은 소베그레인(Sauvegrain) 방법에서 뷰노의 딥러닝 모델이 판독한 골연령의 정확도를 확인하기 위해..."
1276,"[IT칼럼] 인공지능 반란, 누가 통제할 수 있을 것인가",2021.06.23.,세계 최대 전자상거래기업 아마존은 수년간 개발한 인공지능 채용 프로그램을 최근 폐기했다. 원인은 AI가 10년간 아마존 지원자 데이터를 분석한 결과 남성 지원자가 압도적으로 많았던 탓에 아마존 자체 AI 채용시스템이 여성 지원자를 차별했기 때문이다. 이와 유사한 문제는 국내에서도 발생했다. AI챗봇...
1277,"UNIST·호주연구진, AI 기반 인쇄형 유기 태양전지 개발 기술 선보여",2021.06.21.,롤투롤 공정으로 2000개 넘는 유기 태양전지 조합 소자 제작해 학습에 필요한 데이터 얻어 헬로티 이동재 기자 | UNIST와 호주 연방과학기술원 연구진이 인공지능(AI)을 유기 태양전지 개발에 접목한 기술을 선보였다. 해당 기술은 유기 태양전지를 비롯한 다양한 인쇄형 광전 소자 개발 연구를 가속화할...
1278,"서울시, 사람이 찾아냈던 '하수관로 결함탐지'에 AI 활용한다",2021.06.21.,"서울시가 사람이 육안에 의존해 찾아냈던 하수관로 천공, 붕괴 같은 결함 탐지 업무에 전국 최초로 인공지능(AI) 기술을 활용한다. 서울디지털재단은 컴퓨터가 영상·이미지 등을 인식하는 '컴퓨터 비전기술'을 활용해 하수관로 CCTV 영상 내 결함을 자동으로 식별하는 '인공지능 기반 하수관로 결함탐지 시스템..."
1279,"KT, 국내 최대 학술행사서 네트워크 지능화 기술 소개",2021.06.22.,"KT가 통신사 최초로 한국통신학회 하계종합학술대회에서 수십 년 간 축적한 네트워크 인공지능(AI) 기술 개발 노하우와 상용화 성과를 공유한다. KT는 2021년도 한국통신학회 하계종합학술대회에서 산업계, 학계, 연구기관 참석자들을 대상으로 ‘KT 네트워크(Network) 지능화 기술’ 특별세션을..."
1280,"LG전자, AI 디지털 엑스레이 검출기 출시...글로벌 시장서 순차 출시 계획",2021.06.22.,주요 폐질환 소견 신속하게 포착 소프트웨어 및 하드웨어 개선으로 표준 방사선量의 절반 수준으로 영상 획득 헬로티 이동재 기자 | LG전자가 인공지능(AI) 진단 보조 기능을 탑재한 '디지털 엑스레이 검출기(DXD: Digital X-ray Detector)'를 출시한다. 제품은 '영상획득 소프트웨어'와 하드웨어인 '엑스레이 검출기...
1281,이통3사 ‘AI 콜센터 선점하라’,2021.06.22.,"음성인식·자연어 처리 등 고도화 상담원 대신 고객 단순 요청 해결 상담업무 생산성 높이는 등 장점 LGU+, CNS와 솔루션 사업 진출 KT는 기업 간 거래 분야에 주력 SKT, AWS와 스마트 솔루션 개발 ‘AI(인공지능) 콜센터’가 통신업계 새로운 먹거리로 떠오르면서 관련 시장 선점을 위한 이통3사의 움직임이..."
1282,"[K매니지먼트 ④ LG] 4세 경영 구광모 LG 회장, 선택과 집중으로 변화와 혁신...",2021.06.22.,"또한 인공지능(AI)·2차전지·바이오플라스틱·헬스케어 등에 오픈이노베이션을 도입하고, 스타트업 투자 확대로 미래산업을 지속적으로 개척하고 있다. 구광모 회장을 회의를 통해 1주일에 한두 번은 만난다는 김영민 LG경제연구원 원장에게 구 회장이 평소 가장 강조하는 것이 무엇이냐고 물었더니..."
1283,"""집 팔렸어요?""…허위매물 확인전화, KT AI가 대신 해준다",2021.06.15.,디지털 플랫폼 기업 KT가 프롭테크 기업 직방과 음성 인공지능(AI) 기반 사업협력에 나선다. 프롭테크는 정보기술(IT)을 결합한 부동산 서비스를 뜻한다. KT는 17일 서울 광화문 KT 사옥에서 직방과 부동산 분야 AI 컨택센터 사업협력 등을 위한 업무협약(MOU)을 체결했다고 밝혔다. KT는 직방에 각종 음성인식...
1284,"라온피플, 중기부 지능형 공장 구축 사업 수혜 예상",2021.06.17.,"스마트공장 보급 등 저변확대와 인공지능 중소벤처 제조플랫폼 ‘켐프(KAMP, Korea AI Manufacturing Platform)’를 통해 데이터와 인공지능을 중심으로 스마트공장 고도화를 지원한다는 것이다. 이 같은 정부의 스마트공장 구축 지원사업은 레퍼런스가 다양한 라온피플 등 AI 기업에도 긍정적인 수혜가 예상되고..."
1285,"대구교대, ‘2021년 초등 교원양성대학 AI 교육 강화 지원 사업’ 선정",2021.06.22.,대구교대가 '2021년 초등 교원양성대학 인공지능(AI) 교육 강화 지원 사업'에 선정됐다.교육부와 한국과학창의재단은 '2021년 초&·중등 교원양성대학 인공지능(AI) 교육 강화 지원 사업(이하 지원 사업)'에 선정된 6개교를 22일 발표했다. 초등 인공지능(AI) 교육((초등교원양성대학) 분야에는 대구교대와...
1286,제주도 사투리도 알아듣는 AI비서 나온다…정부 AI 학습용데이터 170종 공개,2021.06.18.,"과기정통부는 또 이날 오전 마곡의 LG사이언스파크에서 '인공지능(AI) 데이터 활용협의회' 출범식을 갖고, 의견수렴을 위한 간담회를 개최했다. 협의회 출범식에는 LG, 네이버, 삼성전자, SK텔레콤, KT를 포함한 대기업과 딥노이드, 스트라드비젼 같은 스타트업, 카이스트 등이 참석했다. AI 허브 데이터를..."
1287,"LIG넥스원, AI 양재허브와 AI 스타트업 육성 나서",2021.06.22.,이번 협약을 통해 LIG넥스원과 AI 양재 허브는 4차 산업혁명의 핵심분야로 높은 관심의 대상이 되고 있는 인공지능(AI) 등 미래 신기술을 중심으로 협력 네트워크를 구축하고 혁신 스타트업들이 국방R&D 사업에 적극적으로 참여할 수 있도록 다양한 지원활동을 진행하게 된다. 또 기술자료 및 학술정보의...
1288,"""폐 질환, 인공지능이 잡는다""...LG전자, AI 탑재한 디지털 엑스레이 검출기 ...",2021.06.22.,"LG전자가 인공지능(AI) 진단 보조 기능을 탑재한 '디지털 엑스레이 검출기(DXD: Digital X-ray Detector)'를 출시한다고 22일 밝혔다. 신제품은 '영상획득 소프트웨어'와 하드웨어인 '엑스레이 검출기'로 구성된다. 고객은 하드웨어와 소프트웨어를 각각 구매할 수도 있고, 패키지 구매도 가능하다. 영상획득..."
1289,"네이버, CJ대한통운과 AI 물류 실험 시작",2021.06.22.,"네이버(대표 한성숙)는 CJ대한통운과 손잡고 곤지암에 이어 군포와 용인에 네이버 판매자 중심 풀필먼트 센터를 열고 인공지능(AI) 물류 실험을 시작한다고 20일 밝혔다. 네이버는 이들 풀필먼트 센터를 중심으로 ‘클로바 포캐스트’를 이용해 수요 예측도를 더욱 높이는 한편, 물류 로봇, 친환경 패키징 등..."
1290,"[AI경제] 네이버·LG·이통3사, 국내 '인공지능 생태계' 이끈다",2021.06.22.,"사진=SK텔레콤 제공 국내 산업계를 중심으로 인공지능(AI) 기술 개발이 가속화되고 있다. 기업을 중심으로 개발 생태계가 마련, AI 강대국과 국내의 격차가 좁혀질 수 있다는 기대가 나온다. 24일 업계에 따르면 네이버와 LG가 초거대AI 개발에 나섰다. SK텔레콤·KT·LG유플러스 등 이동통신 3사도 보유한..."
1291,[세계 속 AI ① 중국: 中 교육연구편] AI 학술 논문 발표량과 특허 출원량 모...,2021.06.20.,첨부파일 : 중국 연구 현황 정리_인공지능청사진 2030.xlsx표=정윤아 기자 / 자료 출처=정보통신기획평가원 인공지능 청사진2030표=정윤아 기자 / 자료 출처=정보통신기획평가원 인공지능 청사진 2030표=정윤아 기자 / 자료 출처=정보통신기획평가원 인공지능 청사진 2030 AI타임스 정윤아 기자...
1292,'2021 초·중등 교원양성대학 AI 교육 지원 사업' 6개교 선정,2021.06.20.,'2021 초·중등 교원양성대학 AI 교육 지원 사업' 6개교 선정 교육부와 한국과학창의재단은 ‘2021년 초·중등 교원양성대학 인공지능(AI) 교육 강화 지원 사업’ 선정 결과를 22일 발표했다. 이번 사업은 초·중등학교 AI 교육 강화 등 예비교원의 역량 함양을 지원하기 위해 마련됐으며 선정 대학은 교원 자격...
1293,[위클리 스마트] '공정한 편집자'라더니 이젠 퇴출 대상…예견된 뉴스 AI의 몰...,2021.06.23.,뉴스 서비스의 공정성 논란에 오랫동안 시달려 온 국내 포털 업체로서는 사람이 뉴스를 배치하는 체제에서 빚어진 문제를 기계학습(머신러닝) 기능으로 무장한 인공지능(AI) 알고리즘을 통해 해결할 수 있기를 기대했을 것이다. 카카오는 2015년 AI로 이용자 취향에 맞는 뉴스를 추천해 주는 '루빅스'를...
1294,"소프트뱅크벤처스, AI 업체 보이저엑스 투자에 참여...100억원 투입",2021.06.23.,"소프트뱅크벤처스는 브이플랫, 브루 등 인공지능(AI) 기반 서비스를 운영하고 있는 보이저엑스(대표 남세동)에 100억원을 투자했다고 23일 밝혔다. 보이저엑스는 소프트뱅크벤처스 외에 알토스벤처스, 옐로우독으로부터도 각각 100억원을 받아 총 300억원 규모 투자를 유치했다. 보이저엑스는 AI 기반 영상..."
1295,"AI 전문기업 소이넷, 경기창조, 산운초등학교와 초등학교 '비대면 AI 진단평가...",2021.06.23.,"지난 22일 협약식 후 기념 촬영 모습 경기창조경제혁신센터(이하 경기혁신센터, 센터장 신현삼), 소이넷(대표 김용호·박정우), 산운초등학교(교장 최창훈)가 최근 초등학교 비대면 인공지능 진단평가서비스 공동개발을 위한 업무협약을 체결하고 본격 개발에 나섰다. 협약은 초등학교 학년별 문제은행..."
1296,"국회 회의 중계, 세계 최초로 실시간 AI 자막시스템 구축",2021.06.22.,국회사무처는 국회 회의 중계에 세계 최초로 실시간 인공지능(AI) 음성인식 기술기반의 자막시스템을 구축했다고 21일 밝혔다. 국회사무처와 한국전자통신연구원(이하 ETRI)은 이날 '지능형 국회 구현 및 디지털 혁신을 위한 국회사무처-ETRI 간 업무협정 체결식'을 가졌다. 양 기관은 실시간 자막 서비스 제공을...
1297,"""AI 접목한 비파괴검사 플랫폼, NPP 세계 최초 론칭""",2021.06.22.,"김윤지 기자 휴대폰으로 '비파괴검사'를 의뢰하고 결과를 실시간으로 받아볼 수 있는 인공지능(AI)과 블록체인 등 4차 혁명 기술이 접목된 NPP 어플리케이션이 공식적으로 론칭됐다. 김 회장은 ""AI를 활용해 사람이 하던 일을 기계가 좀 더 정확하게 예측하며 할 수 있을까라는 고민에서 프로젝트를..."
