,제목,날짜,본문
2146,"광주광역시, 광주TP·글로벌케이·씨엔에스컴퍼니와 AI 기반 조성 업무 협약",2021.04.22.,"이용섭 시장은 “광주는 어느 지역보다 선제적으로 인공지능을 선점해 AI 4대 강국 대한민국을 뒷받침하고 있다”며 “㈜글로벌케이, ㈜씨엔에스컴퍼니가 광주에서 데스밸리를 넘어 글로벌 경쟁력을 갖춘 스케일업으로, 유니콘기업으로 지속적으로 성장·발전하도록 가능한 모든 지원을 아끼지 않겠다”고..."
2147,"건국대학교 창업단, AI 스타트업 바이칼에이아이, 중기부 '팁스' 선정",2021.04.13.,건국대학교 AI 스타트업 바이칼에이아이 로고 건국대학교 창업지원단(단장 박재민)은 언어처리 기반 인공지능(AI) 전문 스타트업 바이칼에이아이(대표 윤기현)가 중소벤처기업부에서 주관하는 '팁스(TIPS)' 프로그램에 선정됐다고 23일 밝혔다. 바이칼에이아이는 인공지능을 통해 사람과 사람을 더 깊게...
2148,"현대차그룹, 인공지능(AI) 분야 세계적 석학 조경현 교수 자문위원 영입",2021.04.13.,현대자동차그룹이 인공지능(AI) 분야 세계적인 석학의 자문을 받으며 자체 AI 역량 강화에 나선다. 현대차그룹은 기계학습 및 AI 응용 연구 분야의 세계적인 전문가로 손꼽히는 미국 뉴욕대(NYU) 조경현 교수를 이달 초 자문위원으로 영입하고 협업 중이라고 23일 밝혔다. 조 교수는 현대차그룹 AI 분야...
2149,"삼성SDS, 통합 AI 플랫폼으로 '디지털 트랜스포메이션' 확대",2021.04.13.,"삼성SDS가 인공지능(AI) 기술을 플랫폼화해 다양한 분야 기업들의 디지털 트랜스포메이션(디지털 전환) 지원을 강화한다. 22일 삼성SDS에 따르면 ‘브라이틱스(Brightics) AI’는 여러 산업 분야에서 발생하는 방대한 데이터를 빠르게 수집·분석하고 시각화하고, 해결책까지 제시하는 통합 AI 플랫폼이다. 현재..."
2150,"EU, 얼굴인식 사전심사 도입 등 세계 최초 AI 이용규제 나서",2021.04.13.,위반시 최대 400억원 또는 전세계 매출 6% 벌금 부과 유럽연합(EU)이 세계에서 처음으로 인공지능(AI) 이용규제에 나선다고 로이터통신 등 외신들이 21일(현지시간) 보도했다. EU집행위는 이날 AI의 이용에 관한 규정초안을 발표했다. 대부분의 감시와 아동착취로 연결되는 AI의 이용을 금지하는 한편 주요...
2151,GPT-3 탑재한 AI 로봇 '아티보' 일본 진출,2021.04.20.,"방법), 중국 위주로 특허와 상표권들이 등록되어 있고 KC, FCC 등 다수국가의 인증을 획득했다. 큐브로이드는 지난 2년 동안 개발과 테스트한 코딩 가능한 인공지능(AI) 로봇 ‘아티보’와 코딩블록이 큐브로이드가 미국, 일본, 영국 등 40개국에서 지난 해 100만 달러 수출을 돌파했다. (사진=큐브로이드 제공)"
2152,"광주시-광주TP-㈜글로벌케이·㈜씨엔에스컴퍼니, 광주 인공지능 산업 생태계 ...",2021.04.19.,"광주광역시와 광주테크노파크, 인공지능 전문기업인 ㈜글로벌케이, ㈜씨엔에스컴퍼니가 광주 인공지능(AI) 산업 생태계 조성에 함께 나선다. 광주시는 21일 광주시청 비즈니스룸에서 이용섭 시장과 김선민 광주테크노파크 원장, 김영은 글로벌케이 대표, 권만성 씨엔에스컴퍼니 대표 등이 참석한 가운데..."
2153,"세종대 ""한국지능시스템 2021 춘계 학술대회 개최""",2021.04.13.,"대양AI센터에서 개최된다""고 밝혔다. 홍보 포스터 한국지능시스템학회가 주최하는 이번 학술대회에서는 23일에 이상완 교수(KAIST)가 뇌과학 튜토리얼, 안치영 박사(국가수리과학연구소, NIMS)가 의료분야에서의 수학기반 인공지능 활용에 대하여 발표한다. 또한, 24일에는 이지형 교수(성균관대)가..."
2154,"금융당국, 'AI은행원' 위한 가이드라인 만든다",2021.04.13.,'AI(인공지능) 은행원'의 금융 상품 추천과 판매를 위한 금융당국 차원의 가이드라인이 나온다. 이를 위해 금융위원회는 실제 금융 영업현장에서 AI의 설명의무 준수가 가능한지 등을 실증적으로 측정하는 'AI 설명 테스트베드'를 구축한다. 금융위원회와 금융감독원 등은 13일 도규상 부위원장 주재로 '제7차...
2155,동해안 경계 AI에 맡긴다,2021.04.13.,사진=연합뉴스 육군 22사단의 동해안 경계가 잇따라 뚫리자 군 당국이 인공지능(AI) 경계시스템을 도입하기로 했다. 동해안 경계를 AI에게 맡기겠다는 것이다. 군 당국은 AI 시스템 도입이 끝날 때까지 육군 22사단을 관할하는 8군단 해체도 미루기로 했다. 국방부는 15일 청사 대회의실에서 서욱 장관...
2156,포스ICT 개발 '비전 AI'… CCTV 적용하니 지켜보는 '눈'에서 대응하는 '두뇌'...,2021.04.13.,"포스코ICT는 인공지능(AI) 기반의 영상인식과 분석기능을 제공하는 플랫폼인 비전(Vision) AI를 개발하고 본격적인 현장 적용에 나선다. 비전 AI는 CCTV 등을 통해 촬영된 영상을 딥러닝을 적용해 자동인식하고, 분석하는 기능을 제공한다. 영상에 포착된 행동을 인식하고 객체를 자동으로 탐지 및 분석해..."
2157,(영상)은행 '디지털·AI' 키우고 '몸집' 줄이고,2021.04.19.,"오프라인 점포를 꾸준히 축소하는 한편 디지털과 AI(인공지능) 역량 강화에 적극 나서고 있다. 일각에서는 금융소외계층(고령층·장애인)을 위해 속도 조절이 필요하다는 지적이 나온다. 19일 금융권에 따르면 은행들이 비대면 금융 강화를 위한 모바일 서비스 개편 및 상품 개발, 인공지능과 같은 혁신기술..."
2158,"아산시, 전국 최초 코로나19 백신 AI 모니터링 시스템 구축",2021.04.13.,충남 아산시는 전국 최초로 인공지능(AI)를 활용한 코로나19 백신 안내 및 이상반응 모니터링 시스템을 구축한다고 13일 밝혔다. 시는 SK텔레콤과 ‘SKT 누구(NUGU)’의 AI 기술을 활용한 백신 이상반응 모니터링 협약을 체결했다. ‘누구(NUGU)’가 코로나19 백신 접종 대상자에게 전화를 걸어 접종 일정을...
2159,"현대차·한국지능정보사회진흥원, AI 학습용 데이터 공유 MOU",2021.04.14.,"현대차, 자연어·교통 데이터 제공받아 음성인식·자율주행 적용 현대자동차그룹이 한국지능정보사회진흥원(NIA)과 손잡고 자동차 분야의 인공지능(AI) 학습용 데이터 활용 체계 구축에 나선다. 현대차그룹은 8일 김동욱 현대차그룹 부사장, 문용식 한국지능정보사회진흥원장 등이 참석한 가운데 'AI 학습용..."
2160,"엔비디아 ""AI스타트업-벤처캐피털 연결""",2021.04.20.,"엔비디아는 유망한 인공지능(AI) 스타트업들과 벤처캐피털리스트를 연결하는 엔비디아 인셉션 VC 얼라이언스를 출범했다고 16일 밝혔다. 이 프로그램은 스타트업과 벤처캐피털리스트 간 가교역할을 하며, 전세계에서 성장하고 있는 수많은 AI 스타트업들을 신속하게 지원하는 것을 목표로 한다. 미국..."
2161,"[IT오늘] SK텔레콤·KT, WIS 2021서 메타버스·AI 기술 전시…LG유플러스, 초...",2021.04.21.,"SK텔레콤은 오는 23일까지 서울 코엑스에서 열리는 국내 최대 ICT 전시회 '월드 IT쇼 2021(WIS 2021)'를 통해 AI(인공지능)와 메타버스 기술을 선보인다고 21일 밝혔다. ⓒSK텔레콤 SK텔레콤, WIS 2021 참가…AI·메타버스 기술 선보여 SK텔레콤은 오는 23일까지 서울 코엑스에서 열리는 국내 최대 ICT 전시회..."
2162,"""검색•AI 분야 연구 성과 공유"" 네이버, 기술 컨퍼런스 내달 7일 개최",2021.04.21.,/ 사진 = 네이버 제공 네이버는 국내외 검색 및 인공지능(AI) 관련 연구자들에게 기술 트렌드 및 노하우를 소개하는 '2021 네이버 검색 콜로키움 Global Re:Search'를 내달 7일 온라인으로 개최한다고 20일 밝혔다. ​'네이버 검색 콜로키움은 지난 2016년 처음 시작돼 올해로 5회째 진행하는 기술...
2163,AI 기술로 청각장애인 목소리 찾아준 KT,2021.04.21.,특히 사회(S) 영역에서는 KT의 차별화된 인공지능(AI)·빅데이터·클라우드 등 ABC 기술을 활용해 사회 문제를 해결하고 사회적 책임을 이행할 계획이다. AI 기술을 활용해 한국 최초로 추진한 목소리 복원 프로젝트가 대표적이다. 목소리 찾기는 청력을 잃었거나 사고나 질병 등으로 후천적으로 목소리를 잃은...
2164,"삼성카드, ‘엔비디아 GTC 2021’서 AI 마케팅 발표",2021.04.16.,"지난 2009년 처음 개최된 GTC는 매년 주요 개발자, 연구원, 기업 임원들이 참여해 AI(인공지능), 머신러닝, 고성능컴퓨팅 등 최신 트렌드와 정보를 공유하는 자리다. 올해 GTC에는 구글, 페이스북 AI, 우버 AI 등 인공지능 분야를 선도하는 기업들이 참여하고 국내사의 경우 삼성카드를 비롯해 현대자동차..."
2165,“AI·메타버스”...월드IT쇼서 SKT·KT가 선보인 ICT 혁신 기술은?,2021.04.16.,"SKT는 자체 개발한 인공지능의 핵심 두뇌 AI 반도체 ‘SAPEON(사피온)’과 함께 코로나 방역을 돕는 인공지능 로봇, 인공지능 서비스 ‘누구(NUGU)’가 탑재된 이어셋 ‘누구 버즈’와 인공지능 전기차 등 인공지능 기술을 선보입니다. 앞서 SKT는 작년 12월 국내 최초로 데이터센터에 적용 가능한 AI..."
2166,"현대차그룹, 인공지능 분야 세계적 석학 조경현 교수 자문위원 영입",2021.04.25.,현대자동차그룹이 인공지능(AI) 분야 세계적인 석학의 자문을 받으며 자체 AI 역량 강화에 나선다. 현대차그룹은 기계학습 및 AI 응용 연구 분야의 세계적인 전문가로 손꼽히는 미국 뉴욕대(NYU) 조경현 교수를 이달 초 자문위원으로 영입하고 협업 중이라고 지난 23일 밝혔다. 조 교수는 현대차그룹 AI 분야...
2167,"한국형 나트륨 관리 앱 출시…""사진만 찍으면 AI가 영양소 분석""",2021.04.13.,"한편, 'AI Salt Balance'는 한국지능정보화사회진흥원(NIA) 주관 인공지능 학습용 데이터 활용 우수사례로 선정되어 AI 허브사이트 및 사례집에 공개될 예정이다. 자세한 내용은 안드로이드 검색 및 어플 다운로드를 통해 확인할 수 있다."
2168,"시민주도 캠페인, AI, 협동조합... 자원순환 경제 위한 각 지역의 노력",2021.04.13.,"발표수퍼빈, AI로 순환경제 사업구조 설계방향 소개 국내외에서 기후위기에 대한 문제의식이 점차 커지고 있다. 국제사회에서는 신기후체제가 출범했고... 수퍼빈, 시민이 즐길 수 있는 재활용 시스템 구축 빅데이터 기반 인공지능과 로보틱스 기술을 활용해 쓰레기 문제를 해결하고 있는 수퍼빈의 김정빈..."
2169,[AI 중심도시 광주 청사진] ③ 문화도시 광주에 인공지능이 스며든다…AI·VR...,2021.04.13.,최근 인공지능(AI)을 비롯한 가상현실(VR)과 증강현실(AR) 등 첨단기술을 활용해 관람객들에게 색다른 체험을 선사하는 박물관과 전시관이 늘어나고 있다. (사진=셔터스톡). 인공지능(AI) 시대에 광주광역시는 어떻게 달라질까. 광주시가 'AI 중심도시'를 표방해 다양한 AI 사업 추진에 총력을 기울이고...
2170,AI·반도체 등 핵심기술 분야 특허 심사관 25명 경력직 채용,2021.04.13.,"인공지능(AI), 반도체, 연료전지, 바이오의약, 의료기기 등 핵심기술 분야가 대상이다. 행정직 3명과 기술직 22명을 채용하며, 학위(석사 이상) 또는 전문자격증(변호사, 변리사, 약사, 수의사 등)을 보유해야 응시할 수 있다. 원서접수는 내달 4∼7일 진행한다. 자세한 내용은 특허청 홈페이지 또는 인사혁신처..."
2171,"광주시, 인공지능 시제품·서비스 제작 지원",2021.04.15.,광주시와 인공지능산업융합사업단은 인공지능(AI) 시제품·서비스 제작지원 사업 참여기업을 9일부터 5월10일까지 모집한다. 이 사업은 인공지능 스타트업의 (시)제품·서비스 제작과 사업화 비용을 지원하는 것을 골자로 한다. 창업 7년 미만 인공지능 스타트업과 인공지능 기술을 도입하고자 하는...
2172,"우리은행, AI뱅커(인공지능 은행원) 개발 나선다",2021.04.16.,"라이언로켓과 인공지능(AI) 뱅커 개발을 위한 업무협약을 체결했다고 16일 밝혔다. AI뱅커는 딥러닝 기술을 기반으로 영상과 음성의 합성을 통해 특정인물의 외모, 자세 및 목소리를 반영해 가상의 은행원을 구현하는 것은 물론, AI뱅커와 상담하는 고객의 음성을 분석하고 이해해 실제 은행원이 상담하는..."
2173,"엔씨, 대학생 AI 인재 육성 지원",2021.04.21.,엔씨소프트(대표 김택진)는 인공지능(AI) 인재 육성 프로그램 'NC 펠로우십'을 진행한다고 15일 밝혔다. 올해 4회째를 맞은 'NC 펠로우십'은 재직 중인 AI 연구원들이 함께 과제를 수행하면서 참가자들이 AI 인재로 성장할 수 있도록 지원하는 대학생 대상 프로그램이다. 주요 대학에서 AI 분야를 공부하고...
2174,"중소·중견 제조 100개사, 인공지능으로 현장 문제 해결",2021.04.08.,"이를 위해 인공지능(AI) 마스터 2인(AI·데이터 전문가 1인, 공정전문가 1인)이 1팀으로 구성돼 지원기업의 인공지능 도입 컨설팅을 밀착 지원한다.△인공지능 솔루션 실증을 통해서는 컨설팅을 통해 도출된 인공지능 분석모델과 솔루션을 제조 현장에 실제로 적용해보는 기술검증(Proof of Concept)을 지원한다...."
2175,"우리은행, 인공지능 은행원 개발",2021.04.12.,"우리은행은 영상합성 기술 스타트업 '라이언로켓'과 AI뱅커(인공지능 은행원) 개발을 위한 업무협약을 체결했다고 16일 밝혔다. AI뱅커는 딥러닝(Deep Learning) 기술을 기반으로 영상과 음성의 합성을 통해 특정인물의 외모, 자세 및 목소리를 반영해 가상의 은행원을 구현한다. 또 AI뱅커와 상담하는 고객의..."
2176,"LG전자 '씽큐'-KT '기가지니', AI 서비스 연동‥원팀 첫 성과",2021.04.18.,LG전자가 KT와 인공지능(AI) 분야에서 협력하는 가운데 인공지능 서비스 사업화에 속도를 내고 있다. 6일 LG전자에 따르면 최근 경기도 판교에 있는 ‘LG 씽큐(LG ThinQ) 홈’에서 LG전자의 인공지능 플랫폼 ‘LG 씽큐’와 KT의 인공지능 플랫폼 ‘기가지니’를 연동하는 검증 작업을 마쳤다. 이번 검증은 양사가...
2177,"LG CNS, AI 튜터로 日 교육시장 진출",2021.04.16.,LG CNS가 인공지능(AI) 영어 학습 서비스 ‘AI튜터’로 일본 교육 시장에 진출한다. 동남아 시장 진출도 준비 중이다. LG CNS는 12일 일본 현지 기업 이온(AEON)과 손잡고 일본판 AI튜터 ‘AI 스피크 튜터’를 출시했다. 이온은 일본 2위 통신사 KDDI 그룹의 자회사로 일본에서 250여개의 직영 어학원을 운영하는...
2178,"AI 금융상품 나올까, 2분기 금융 AI가이드라인 나온다",2021.04.13.,정부가 상반기 안에 금융분야 인공지능(AI) 활용에 대한 가이드라인을 만들 예정이다. 금융업계와 핀테크·빅테크업체로 이루어진 디지털금융협의회는 △플랫폼·오픈뱅킹 △규제혁신 △데이터공유 △금융보안 등 4개 분과 중심으로 개편후 상설화해 지속 논의한다. 금융위원회와 금융감독원 등 금융당국은...
2179,"뷰노, 음성 AI 솔루션 '뷰노메드 딥ASR™' 인하대병원 도입",2021.04.13.,사진/뷰노 뷰노(338220)는 인공지능 기반 의료 음성인식 솔루션 '뷰노메드 딥ASR™'이 인하대학교의과대학부속병원에 도입됐다고 23일 밝혔다. 뷰노메드 딥ASR™은 뷰노의 자체 딥러닝 엔진 뷰노넷(VUNO Net)을 기반으로 수천시간에 달하는 국내 의료 데이터 수십만건을 학습해 개발된 의료 음성인식 솔루션이다. 99...
2180,"[WIS 2021]양환정 KAIT 부회장 ""한국기업 AI·IoT 글로벌 경쟁력 충분""",2021.04.19.,“인공지능(AI)과 사물인터넷(IoT) 등 초연결 기술이 일상에 다가왔다는 걸 느꼈습니다. 한국 기업이 도전정신과 진취성을 바탕으로 글로벌 시장에서도 승부를 걸 수 있을 것으로 생각합니다.” 양환정 한국정보통신진흥협회(KAIT) 부회장은 '월드IT쇼(WIS) 2021' 사무국 역할을 주도한 경험을 바탕으로 올해...
2181,"전경련 ""IT강국 한국, AI분야서 선진국에 1.8년 뒤져...제도개선 필요""",2021.04.19.,"4차 산업혁명의 근간이 될 인공지능(AI) 기술 분야에서 한국이 선진국보다 뒤처져 있다는 분석이 나왔다. 전국경제인연합회는 22일 발표한 'AI 분야 현황과 과제' 보고서에서 이같이 밝히며 AI 학습에 필수적인 데이터 활용을 제약하는 법 정비, 핵심 인력을 위한 제도 개선이 필요하다고 지적했다. AI는..."
2182,"신한은행, AI사업 총괄에 삼성SDS 출신 김민수 센터장 영입",2021.04.19.,뉴데일리 이나리 기자 = 신한은행은 AI(인공지능) 사업을 총괄하는 AICC(통합AI센터) 센터장에 김민수 삼성SDS AI선행연구Lab장을 영입했다고 19일 밝혔다. 김민수 센터장은 KAIST(카이스트)에서 데이터마이닝을 전공하고 박사 학위를 취득한 후 삼성SDS AI선행연구소 부서장으로 AI 기술 연구 및 관련 사업을...
2183,"성남시 콜센터, AI 상담 서비스 도입으로 상담 응대율 높인다",2021.04.21.,경기 성남시는 콜센터의 효율적인 민원응대를 위해 인공지능(AI) 상담 서비스를 시범 도입한다고 21일 밝혔다.22일부터 운영되는 AI 상담 서비스는 최근 코로나19와 관련된 지원금 및 백신 접종 등에 관한 문의가 증가함에 따라 통화대기 시간을 줄이고 콜 상담 응대율을 높이기 위해 운영된다.이에 따라...
2184,"""산업단지 맞춤형 지능형 분산에너지 기술개발""",2021.04.12.,"더불어 인공지능(AI)을 활용한 태양광, 태양열, 수소생산 및 저장장치 등 에너지설비 예측, 실시간 수급균형, 에너지 저감기술 등에 대해서도 소개했다.김 교수는 특히 산단을 포함한 도심분산에너지는 온도, 습도 등 기후적인 환경 외에도 도심 내 음영 등에 의한 에너지 생산-저장-소비에 대한 합리적인 모델..."
2185,"SKT, 국내 최대 ICT 전시회 '월드 IT쇼' 참가...AI와 메타버스 관련 혁신 기술...",2021.04.19.,[뉴스락] SK텔레콤(대표 박정호)이 21일~23일 열리는 국내 최대 ICT 전시회 '월드 IT쇼 2021'에서 AI(인공지능)와 메타버스 관련 혁신 기술과 서비스를 선보인다. SKT는 서울 코엑스 3층에 위치한 870㎡ 규모의 전시관에서 '인공지능과 가상현실로 가득찬 미래'를 주제로 대한민국 ICT 기술의 미래를 책임질 혁신...
2186,"중소·중견 제조기업 100개사, AI로 현장 문제 ‘해결’",2021.04.16.,"이를 위해 인공지능(AI) 마스터 2인(AI·데이터 전문가 1인, 공정전문가 1인)이 1팀으로 구성돼 지원기업의 인공지능 도입 컨설팅을 밀착 지원한다. 인공지능 솔루션 실증을 통해서는 컨설팅을 통해 도출된 인공지능 분석모델과 솔루션을 제조 현장에 실제로 적용해보는 기술검증(Proof of Concept)을..."
2187,“3년간 데이터 수집…‘멍멍’ 소리로 AI가 반려견 감정 알아내죠”,2021.04.20.,“펫펄스는 반려견의 음성을 실시간으로 수집하고 인공지능(AI)을 통해 행복·슬픔·불안·분노·안정 등 5가지 감정으로 해석해 주는 목걸이 형태의 웨어러블 스마트 기기입니다. 스마트폰 애플리케이션(앱)과 연동돼 반려견의 기분이 어떤지 감정 상태를 확인할 수 있습니다. 3년간 모은 강아지 음성...
2188,"카카오 AI 자회사 카카오브레인, 김일두 신임 대표 선임",2021.04.13.,"카카오브레인은 카카오가 2017년 2월 세운 인공지능(AI) 원천기술 자회사다. 김 대표는 지난 2012년 카카오 소프트웨어 엔지니어로 입사해 약 7년간 AI 관련 다양한 서비스 연구·개발에 힘써왔다. 2018년부터 카카오브레인 딥러닝 알고리즘 연구팀에 AI 엔지니어로 합류해 컴퓨터 비전, 데이터 증강 기술..."
2189,"현대차그룹, 인공지능 분야 세계적 석학 조경현 교수 자문위원 영입",2021.04.21.,현대차그룹이 인공지능 분야 전문가인 조경현 교수를 자문위원으로 영입했다 현대차그룹은 기계학습 및 AI 응용 연구 분야의 세계적인 전문가로 손꼽히는 미국 뉴욕대(NYU) 조경현 교수를 이달 초 자문위원으로 영입하고 협업 중이라고 23일 밝혔다. 조 교수는 현대차그룹 AI 분야 자문위원으로서 현대차·기아...
2190,"‘AI 투자’ 핀트, 출시 2주년…투자일임 자산 403억 돌파",2021.04.21.,이투데이=이다원 기자 | 누적회원수 44만…기존 금융사와 협력해 서비스 확장 박차 (사진제공=디셈버앤컴퍼니자산운용) 인공지능(AI) 투자일임 서비스 ‘핀트’가 출시 2년 만에 투자일임 자산(AUM) 403억 원을 돌파했다. 누적 회원 수도 44만 명에 달한다. 핀트를 운영하는 디셈버앤컴퍼니자산운용은 16일 출시...
2191,'AI원팀'에 은행권 최초 우리은행 합류...'금융영역 AI활용 본격화',2021.04.15.,KT가 지난 20일 서울 종로구 KT 광화문빌딩 East에서 우리은행과 '대한민국 인공지능(AI) 1등 국가를 위한 업무협약을 체결했다. KT 구현모 대표이사(오른쪽)와 우리은행 권광석 행장이 MOU를 마치고 기념사진을 촬영하고 있다.(사진=KT 제공) 우리은행이 AI원팀에 합류했다. KT는 서울 종로구 KT 광화문빌딩...
2192,"""KT AI 호텔로봇을 소개합니다""",2021.04.15.,"KT가 부산지역 호텔업계 관계자들을 대상으로 KT 'AI 호텔로봇'과 'AI 서빙로봇', 호텔 전용 인공지능서비스 'AI 호텔' 등 호텔 전용 AI 솔루션 시연 행사를 개최했다고 8일 밝혔다. 사진은 지난 7일 행사에서 부산지역 호텔업계 관계자들에게 AI 호텔로봇에 대해 설명하는 KT 직원. 2021.4.8"
2193,"가비아, 구글 AI 기반 '스마트 쇼핑 광고' 론칭…1개월 광고비 지원",2021.04.15.,고객이 자신의 웹사이트와 상품 정보를 미리 등록하면 인공지능(AI)이 상품별로 광고를 알아서 생성한다. 또 가장 성과가 좋았던 광고를 더 많이 노출해 최적의 광고를 찾아낸다. 광고를 어떤 지면에 노출할지도 인공지능이 판단한다. 가령 광고 운영 목표와 일치하는 최적의 광고 지면을 찾아 우선적으로 광고를...
2194,AI 기반 장애인 방송기술 시연회,2021.04.13.,'인공지능(AI) 기반 장애인 방송 기술 시연회'가 장애인의 날인 20일 서울 여의도 이룸센터에서 열렸다. 참석자가 한국전자통신연구원(ETRI)에서 개발한 아바타 수어 생성 시스템을 살펴보고 있다. 한상혁 방송통신위원장(왼쪽)이 한국전자통신연구원(ETRI)에서 개발한 아바타 수어 시스템을 살펴보고 있다.
2195,"국민대 AI양재허브, 신용보증기금·우리은행과 AI 특화기업지원 업무협약",2021.04.13.,"국민대학교가 운영하는 AI 양재 허브느 인공지능(AI) 특화기업에 대한 금융⋅비금융 지원을 위해 지난 19일 신용보증기금, 우리은행과 3자간 업무협약을 체결했다고 21일 밝혔다. 이번 협약은 신용보증기금과 우리은행의 협업을 통해 AI 양재 허브에 입주해 있는 인공지능 특화기업 100여개사에 대한 금융..."
2196,"KB국민銀·한국MS, AI?클라우드 활용 비즈니스 협업",2021.04.13.,한국마이크로소프트(한국MS)와 KB국민은행이 4월 12일 ‘데이터·인공지능(AI)을 활용한 신기술 개발과 비즈니스 협업을 위한 전략적 파트너십’을 체결했다고 13일 밝혔다. 양사는 이번 협약을 통해 ▲데이터와 AI 신기술을 활용한 비즈니스 협업 ▲국내 스타트업 대상 클라우드 서비스 제공 및 기술 교육...
2197,"인공지능 투자 '파운트', 펀드 1년 이상 투자자 연평균 수익률 13.67% 기록",2021.04.13.,"파운트가 자체 개발한 AI(인공지능) 알고리즘이 세계 각국의 경제, 시장지표를 조합해 5만2000개가 넘는 시나리오 결과로 산출한 '파운트 마켓스코어'를 기반으로 글로벌 경기흐름에 유기적으로 대응함으로써 투자자가 직접 수시 리밸런싱을 진행할 수 있도록 차별화된 서비스 제공을 통해 안정적인..."
