,제목,날짜,본문
733,"[뉴스투데이 E] 삼성전자, 인공지능 로봇청소기 ‘비스포크 제트 봇 AI’ 선보...",2021.04.27.,"[사진=삼성전자] 삼성전자가 인공지능(AI) 기술로 사물인식 능력과 주행성능을 대폭 개선한 로봇청소기 ‘비스포크 제트 봇 AI’를 27일 출시했다. 비스포크 제트 봇 AI는 딥러닝 기반으로 100만장 이상의 이미지를 사전 학습해 국내 최다 수준의 사물 인식이 가능하며 냉장고, 에어컨, TV 등 집안의 다양한..."
734,연말까지 경북도 공무원 대상 ‘AI 아카데미’ 운영,2021.04.27.,경북도는 인공지능(AI)시대에 발 빠르게 적응하고 AI 최신기술을 행정의 각 분야에 접목시키기 위해 도 공무원들을 대상으로‘AI(인공지능) 아카데미’를 운영한다. 이철우 도지사의 지시로 30일부터 연말까지 경북도청 동락관과 도 인재개발원에서 운영되는‘AI(인공지능) 아카데미’는 공무원들의 AI에...
735,"AI 석학 조경현 교수, 현대차 자문위원으로",2021.04.27.,"인공지능(AI) 분야에서 세계적인 석학으로 꼽히는 조경현 미국 뉴욕대(NYU) 교수(36·사진)가 현대자동차그룹에 합류한다. 조 교수는 현대차그룹 AI 분야 자문위원으로서 AI 기술의 연구개발(R&D) 방향 설정을 지원하고, 주요 프로젝트 추진 과정에서 필요한 AI 기술 개발 등 현안에 대한 자문을 담당한다."
736,[창간특집 석학대담] “팬데믹 후 AI로 기업간 양극화 크고 빠르게 심화될 것...,2021.04.27.,두 교수는 인공지능(AI)이 코로나19로 더욱 빠르게 확산하고 있다고 말했다. 이런 상황에서 AI 기술 및 활용에 뒤쳐진 기업은 경쟁에서 밀릴 수 있다는 점도 강조했다. 코로나19 위기의 시기 투자보다는 위험 회피가 해법이 아니라는 지적이다. AI 수준에서는 미국·중국과 비교해 우리나라가 밀리지만 특유의...
737,"기업은행, AI양재허브와 혁신기업 육성·지원",2021.04.26.,IBK기업은행은 지난 26일 인공지능(AI) 스타트업을 위해 서울 서초구 AI양재허브 본사에서 'AI 혁신기업 육성‧지원을 위한 업무협약'을 체결했다고 27일 밝혔다. AI양재허브는 서울시가 AI 산업 육성과 경쟁력 강화를 위해 운영하고 있는 인공지능 전문 지원·육성 기관이다. 기업은행과 AI양재허브는 이번...
738,"""TV 주변 청소해줘""…삼성전자, 사람 말 알아듣는 'AI 로봇청소기' 출시",2021.04.27.,"삼성전자는 27일 서울 강남 디지털프라자에서 가진 '비스포크 제트 봇 인공지능(AI)' 시연회에서 기존 제품의 단점을 대폭 개선한 AI 로봇청소기를 소개했다. 이번에 선보인 제품은 ""TV 주변을 청소해달라""고 명령하면 알아서 그 주변을 청소하고, 전용 스마트폰 응용소프트웨어(앱)에서 청소 결과까지 확인할..."
739,"LG 휘센 시스템에어컨, 업계 첫 '인공지능 품질인증' 획득",2021.04.27.,기존 휘센 멀티브이 시스템 에어컨에 장착해 소프트웨어를 업그레이드하면 신제품과 동일하게 인공지능 기능을 이용할 수 있는 인공지능 모듈인 ‘LG AI 엔진’도 함께 출시할 계획이다. 올해 처음 선보인 LG 휘센 타워를 비롯한 LG전자 가정용 스탠드 에어컨도 AI+ 인증을 받았다. LG전자는 이번 인증으로...
740,반려견 배설물도 인식…삼성 ‘비스포크 제트 봇 AI’ 출시,2021.04.27.,"삼성전자가 인공지능(AI) 기술로 사물인식 능력과 주행성능을 대폭 개선한 로봇청소기 ‘비스포크 제트 봇 AI’를 출시한다고 27일 밝혔다. 비스포크 제트 봇 AI는 딥러닝 기반으로 100만장 이상의 이미지를 사전 학습해 국내 최다 수준의 사물 인식이 가능하다. 냉장고, 에어컨, TV, 소파, 침대 등 집안의..."
741,시니어의 반려동물 건강은 AI로 똑똑하게,2021.04.27.,"특히 최근 4차 산업혁명의 물결로 반려동물 관련 상품에 사물인터넷(IoT), 인공지능(AI) 등 첨단 기술을 접목한 ‘펫테크’ 시장이 성장하고 있다. 펫테크 시장 초기는 외출 시 모니터로 반려동물의 상태를 확인하는 반려동물 전용 CCTV나 자동 급식기 등이 대부분이었다. 그러나 이제는 스마트폰 하나로 강아지의..."
742,"삼성전자, '비스포크 제트 봇 AI’ 출시",2021.04.27.,"삼성전자가 인공지능(AI) 기술로 사물인식 능력과 주행성능을 대폭 개선한 로봇청소기 ‘비스포크 제트 봇 AI’를 27일 출시한다. 비스포크 제트 봇 AI는 딥러닝 기반으로 100만장 이상의 이미지를 사전 학습해 국내 최다 수준의 사물 인식이 가능하다. 냉장고, 에어컨, TV, 소파, 침대 등 집안의 다양한..."
743,"광주광역시, 제10차 인공지능 산업육성 포럼 개최",2021.04.27.,"이번 제10차 포럼의 특화 주제는 ‘AI+에너지’ 분야로, 코로나19 상황임을 감안해 사전신청을 통해 광주 인공지능 특화산업 중 하나인 에너지 관련 산학연 관계자 30여명이 참여했다. 그동안 비대면 온라인방식으로 진행됐지만, 인공지능 산업생태계 조성을 위해 네트워크를 강화할 필요가 있다는 인공지능..."
744,"뷰노, 뷰웍스에 X레이 인공지능 판독 솔루션 공급",2021.04.27.,"양사는 이번 협업으로 뷰노의 AI 솔루션과 뷰웍스의 디텍터 영상처리 및 이미지 뷰어 소프트웨어 연동을 통해 의료영상 촬영과 동시에 인공지능으로 분석된 판독 결과를 확인할 수 있는 통합 솔루션을 의료진들에게 제공할 예정이다. 김현준 뷰노 대표는 ""엑스레이 필수 의료 장비인 디텍터 분야에서 독보적인..."
745,인천시 인공지능(AI)코로나19 능동감시자…방역 역할 톡톡,2021.04.28.,인천시 인공지능(AI)코로나19 능동감시자…방역 역할 톡톡 인천시가 AI(인공지능) 돌봄전화 서비스 ‘클로바 케어콜(CLOVA Care call)’을 행정에 접목해 ‘코로나19’ 능동감시자 상태 확인업무에 시범 적용한 것이 놀라운 효과를 거두고 있다. 27일 시에 따르면 네이버가 개발한‘클로바 케어콜(CLOVA Care call)...
746,"한컴인텔리전스, 곰앤컴퍼니와 인공지능 분야 업무협약",2021.04.28.,"한컴인텔리전스는 AIaaS(AI as a Service) 플랫폼 'NARU AI(나루 AI)'를 중심으로 다양한 인공지능 솔루션을 곰앤컴퍼니의 동영상 소프트웨어 및 플랫폼에 적용할 수 있도록 지원한다. 특히, 음성 대화를 비롯해 실시간 방송이나 영화, 강연 등의 영상 콘텐츠를 다국어로 자동 번역해주는 'NARU Live(나루 라이브)..."
747,"KT AI 원팀, 스타트업으로 협력 범위 확대…한국무역협회와 '맞손'",2021.04.26.,한편 AI원팀은 출범 이후 AI 전문가 40여명이 참여하는 라운드테이블 프로세스를 통해 R&D과제를 발굴해 AI 기술을 개발하고 있다. KT 인공지능 플랫폼 '기가지니'와 LG전자 인공지능 플랫폼 '씽큐'를 LG전자 '스마트미러'를 통해 연동하는 등 기업간 사업 협력 분야에서도 성과를 내놓았다. AI 실무형...
748,"IBK기업은행, 'AI 혁신기업' 육성 지원 나선다",2021.04.26.,IBK기업은행은 '인공지능(AI) 양재 허브'와 'AI 혁신기업 육성‧지원을 위한 업무협약'을 체결했다고 27일 밝혔다. 서울 서초구에 본사를 두고 있는 AI 양재 허브는 서울시가 AI 산업 육성 및 경쟁력 강화를 위해 운영하고 있는 인공지능 전문 지원·육성 기관이다. 이번 협약으로 두 기관은 유망 AI 혁신기술과...
749,"IBK기업은행, 'AI 혁신기업' 육성 지원 나선다",2021.04.27.,IBK기업은행은 '인공지능(AI) 양재 허브'와 'AI 혁신기업 육성‧지원을 위한 업무협약'을 체결했다고 27일 밝혔다. 서울 서초구에 본사를 두고 있는 AI 양재 허브는 서울시가 AI 산업 육성 및 경쟁력 강화를 위해 운영하고 있는 인공지능 전문 지원·육성 기관이다. 이번 협약으로 두 기관은 유망 AI 혁신기술과...
750,"KT AI 원팀, 시너지 창출 위해 스타트업까지 MOU 확대",2021.04.27.,"KT는 이를위해 전날(27일) 서울 강남구 코엑스 스타트업 브랜츠에서 한국무역협회와 '대한민국 인공지능 1등 국가 실현을 위한 개방형 혁신 생태계 조성' 업무협약을 맺었다. 협약식에는 AI원팀을 대표해 KT AI/Bigdata 사업본부장 최준기 상무, 한국무역협회 이동기 혁신성장본부장 등 주요 관계자들이..."
751,"개인정보위, AI 챗봇 ‘이루다’ 개발사 스캐터랩에 과징금 1억330만원",2021.04.28.,개인정보 무분별한 이용 제재 첫 사례 카톡 대화 94억여건 정보보호 미흡 정명섭 기자 jms9@ajunews.com 각종 혐오발언과 개인정보 유출 의혹으로 논란이 된 인공지능(AI) 챗봇 ‘이루다’가 개인정보보호법을 위반했다는 정부의 조사결과가 나왔다. 이루다 개발사인 스캐터랩은 카카오톡 대화 내용을 분석해 감정...
752,"포스코ICT, 청소년 2021 AI챌린지 개최",2021.04.28.,"포스코ICT가 인공지능(AI) 기술을 기반으로 하는 중·고교 학생들의 창의적인 아이디어, 프로그램 소스코드, 애플리케이션 등을 발굴해 시상하는 '포스코ICT 2021 AI 챌린지'를 개최한다고 27일 밝혔다. 올해로 2회를 맞이하는 공모전은 포스코ICT 주최, 지능정보산업협회 주관, 과학기술정보통신부가 후원한다...."
753,"ETRI, AI로봇 ㆍ디지털트윈으로 기반 시설물 점검 자동화",2021.04.28.,"한편, 참여 기관 중 하나인 ㈜케이아이는 ETRI 창업기업으로 1998년부터 인공지능과 로봇을 아우르는 기술력을 축적해 세계적 수준의 AI 로봇 기술을 확보했다. 덕분에 이번 과제에서 공동구 천장레일 이동형 AI로봇 개발을 주도하면서 정부 R&D 선순환을 이룬 모범 사례라는 평가를 받는다. 향후 연구진은 본..."
754,"한컴인텔리전스-곰앤컴퍼니, AI 기반 동영상 콘텐츠 사업 맞손",2021.04.28.,한컴인텔리전스(대표 지창건)는 곰앤컴퍼니(대표 이병기)와 인공지능(AI) 분야 교류 및 협력을 위한 업무협약을 체결했다고 26일 밝혔다. 이번 협약을 통해 한컴인텔리전스는 서비스형 인공지능(AIaaS) 플랫폼 &apos;나루 AI’를 중심으로 다양한 AI 솔루션을 곰앤컴퍼니의 동영상 소프트웨어 및...
755,"대우건설-LG전자, AI 스마트단지 구축 협력",2021.04.28.,대우건설과 LG전자가 인공지능(AI) 스마트 단지 구축을 위해 손을 잡았다. 대우건설은 전날(26일) 을지로 본사에서 LG전자는 미래 A.I 스마트 단지 구축을 위한 업무협약을 체결했다고 27일 밝혔다. 이번 협약을 통해 대우건설은 자체 개발한 스마트 푸르지오 플랫폼에 LG전자의 싱큐 플랫폼을 연동해 미래...
756,"단국대, 학생들에게 인공지능 비서 제공",2021.04.28.,단국대(총장 김수복)가 국내 최초로 AI(인공지능) 기반 맞춤형 교육·연구지원시스템인 '단아이'를 선보였다. 이 서비스는 단국대가 2017년 6월 모든 교육·연구관리에 AI(인공지능)를 도입한 지 5년 만에 얻은 결실이다. 이번에 공개한 단아이는 국내 최초로 학생이 관심 있는 주제어(Topic)를 담으면...
757,"현대차그룹, AI 전문가 조경현 뉴욕대 교수 영입",2021.04.26.,현대자동차그룹이 인공지능(AI) 분야의 세계적인 전문가로 꼽히는 조경현 미국 뉴욕대 교수의 자문을 받으며 자체 AI 역량 강화에 나선다. 현대차그룹은 조 교수를 이달 초 자문위원으로 영입하고 협업 중이라고 23일 밝혔다. 조 교수는 2009년 카이스트에서 컴퓨터과학 학부를 졸업한 뒤 2014년 핀란드...
758,‘포스코ICT AI 챌린지’ 개최,2021.04.26.,"포스코ICT(대표 정덕균·사진)는 인공지능(AI) 기술을 기반으로 하는 중·고교 학생들의 창의적인 아이디어, 프로그램 소스코드 등을 발굴해 시상하는 ‘포스코ICT 2021 AI 챌린지’를 주최한다고 27일 밝혔다. 올해 2회째인 이 공모전은 지능정보산업협회가 주관하고 과학기술정보통신부가 후원한다."
759,"단국대, 학생들에게 인공지능 비서 제공",2021.04.27.,단국대(총장 김수복)가 국내 최초로 AI(인공지능) 기반 맞춤형 교육·연구지원시스템인 '단아이'를 선보였다. 이 서비스는 단국대가 2017년 6월 모든 교육·연구관리에 AI(인공지능)를 도입한 지 5년 만에 얻은 결실이다. 이번에 공개한 단아이는 국내 최초로 학생이 관심 있는 주제어(Topic)를 담으면...
760,"현대차그룹, AI 전문가 조경현 뉴욕대 교수 영입",2021.04.23.,현대자동차그룹이 인공지능(AI) 분야의 세계적인 전문가로 꼽히는 조경현 미국 뉴욕대 교수의 자문을 받으며 자체 AI 역량 강화에 나선다. 현대차그룹은 조 교수를 이달 초 자문위원으로 영입하고 협업 중이라고 23일 밝혔다. 조 교수는 2009년 카이스트에서 컴퓨터과학 학부를 졸업한 뒤 2014년 핀란드...
761,‘포스코ICT AI 챌린지’ 개최,2021.04.23.,"포스코ICT(대표 정덕균·사진)는 인공지능(AI) 기술을 기반으로 하는 중·고교 학생들의 창의적인 아이디어, 프로그램 소스코드 등을 발굴해 시상하는 ‘포스코ICT 2021 AI 챌린지’를 주최한다고 27일 밝혔다. 올해 2회째인 이 공모전은 지능정보산업협회가 주관하고 과학기술정보통신부가 후원한다."
762,"기업은행-AI 양재 허브, 인공지능 혁신기업 육성‧지원을 위한 업무협약",2021.04.23.,"AI 양재 허브는 서울시가 인공지능(AI) 산업 육성 및 경쟁력 강화를 위해 운영 중인 인공지능 전문 지원·육성 기관이다. IBK기업은행- AI 양재 허브 [사진=IBK기업은행 제공] 이번 협약으로 두 기관은 유망 AI 혁신기술과 아이디어 보유기업을 발굴‧지원‧육성하는 것에 적극 협력하고, 원활한 협업진행을..."
763,"AI 챗봇 '이루다' 개발사 스캐터랩에 과징금·과태료 1억330만원...""개인정보...",2021.04.27.,AI 챗봇 '이루다' [사진=이루다 페이스북 캡처] 카톡 유출 논란이 일었던 인공지능(AI) 챗봇 '이루다'의 개발사 스캐터랩이 개인정보보호법 위반으로 총 1억330만원의 과징금과 과태료 처분을 받았다. 개인정보보호위원회는 28일 전체회의를 열고 '스캐터랩'의 개인정보보호 법규 위반행위에 대한 시정조치...
764,"[SR새상품] 삼성전자, 인공지능 로봇청소기 '비스포크 제트 봇 AI'·'서버용 ...",2021.04.27.,"삼성전자가 인공지능(AI) 기술로 사물인식 능력과 주행성능을 대폭 개선한 로봇청소기 '비스포크 제트 봇 AI'를 27일 출시한다. 비스포크 제트 봇 AI는 딥러닝 기반으로 100만장 이상의 이미지를 사전 학습해 국내 최다 수준의 사물 인식이 가능하다. 냉장고, 에어컨, TV, 소파, 침대 등 집안의 다양한..."
765,사람처럼 스스로 보고 판단해 청소하는 '비스포크 제트 봇 AI' 나와,2021.04.27.,삼성전자 모델이 삼성디지털프라자 강남본점에서 인공지능(AI) 기술로 사물인식 능력과 주행성능을 대폭 개선한 로봇청소기 '비스포크 제트 봇 AI'를 소개하고 있다. 삼성전자가 인공지능(AI) 기술로 사물인식 능력과 주행성능을 대폭 개선한 로봇청소기 '비스포크 제트 봇 AI'를 27일 출시했다고 밝혔다....
766,"부산교육청,‘모두의 AI교육을 위한 산학관 협력 워크숍’ 개최",2021.04.28.,"이번 워크숍은 AI교육 연구‧선도학교와 융합교육 중심학교의 교원들을 대상으로 인공지능 역량을 강화하고, AI교육의 학교현장 적용방안을 모색하기 위한 것이다. 이날 김민정 한국과학창의재단 연구원이 ‘인공지능 교육 정책사례’를, 배창섭 머신러닝 교사연구회 회장이 ‘머신러닝과 인공지능 교육’..."
767,"[WIS 2021] SK텔레콤, AI와 메타버스의 미래를 제시",2021.04.27.,"인공지능(AI) 방역로봇이 마스크 착용 여부를 점검하고 손소독제를 제공한다. 증강현실(AR) 헤드셋을 착용하자, 평소 입고 싶었던 스타일의 옷을 입고 가상 패션쇼를 체험한다. 메타버스 기술과 AI가 바꿔놓을 생활과 엔터테인먼트, 산업의 미래에 대한 방향이 제시됐다. SK텔레콤은 월드IT쇼(WIS) 2021에..."
768,"대우건설·LG전자, A.I 스마트 단지 함께 짓는다",2021.04.27.,사진=대우건설 대우건설은 26일 서울 중구 을지로 대우건설 본사에서 LG전자와 A.I(인공지능) 스마트 단지 구축을 위한 업무협약(MOU)을 체결했다고 27일 밝혔다. 이날 행사에는 백정완 대우건설 주택건축사업본부장과 허재철 LG전자 전무 등이 참석했다. 대우건설은 자체 개발한 '스마트 푸르지오 플랫폼'에...
769,"대우건설·LG전자, A.I 스마트 단지 함께 짓는다",2021.04.27.,사진=대우건설 대우건설은 26일 서울 중구 을지로 대우건설 본사에서 LG전자와 A.I(인공지능) 스마트 단지 구축을 위한 업무협약(MOU)을 체결했다고 27일 밝혔다. 이날 행사에는 백정완 대우건설 주택건축사업본부장과 허재철 LG전자 전무 등이 참석했다. 대우건설은 자체 개발한 '스마트 푸르지오 플랫폼'에...
770,"경찰, AI 기반 '범죄위험도 예측⋅분석 시스템' 5월 전국 운영",2021.04.27.,▲ <이미지 : 경찰청> 더퍼블릭 / 김민희 기자 meerah75@naver.com 경찰청이 다음 달 1일부터 치안⋅공공데이터를 통합한 빅데이터를 최신 알고리즘을 적용한 인공지능(AI)으로 분석하여 지역별 범죄위험도와 범죄발생 건수를 예측하고 효과적인 순찰 경로를 안내하는 '범죄위험도 예측⋅분석 시스템' 을 전국에서...
771,"AI 전문기업 아크릴, 광주 협력 사업 진출 '본격화'",2021.04.28.,"아크릴 관계자는 ""AI 특화 도시 광주에 지점을 낸다는 의미가 크다. 지역에서 생성되는 데이터를 기반으로 한 AI 특화 인공지능 및 서비스 개발에 주력할 것""이라며, ""AI 인재육성 및 일자리 창출로 광주 인공지능 생태계 조성에 이바지하겠다""고 강조했다."
772,한성숙 “네이버의 AI 기술·웹툰 노하우…왓패드 만나 큰 시너지낼 것”(종합...,2021.04.28.,"네이버의 인공지능(AI) 데이터 분석 기술과 네이버웹툰의 서비스 노하우를 왓패드에 접목시키는 한편, ‘슈퍼 IP(지식재산권)’의 발굴을 통해 커머스와 접목 등 다양한 신규 비즈니스를 창출하겠다는 목표다. “아시아 넘어 글로벌 도약 첫해..콘텐츠 중요” 한 대표는 21일(한국시간) 열린 북미 테크 콘퍼런스..."
773,"삼성전자, ‘비스포크 제트 봇 AI’ 출시…인공지능으로 사물인식 대폭 개선",2021.04.27.,삼성전자는 27일 인공지능(AI) 기술로 사물인식 능력과 주행성능을 대폭 개선한 로봇청소기 ‘비스포크 제트 봇 AI’를 출시한다고 밝혔다. 비스포크 제트 봇 AI는 딥러닝 기반으로 100만장 이상의 이미지를 사전 학습해 국내 최다 수준의 사물 인식이 가능하다. 실제 해당 제품은 국내 최초로 한국표준협회가...
774,"권광석 우리은행장, AI 경쟁력 강화로 '미래형 은행' 전환 박차",2021.04.27.,(사진=우리은행) 권광석 우리은행장이 인공지능(AI) 경쟁력 강화를 통한 디지털 혁신에 박차를 가하고 있다. 'AI은행원'으로 대표되는 대고객 서비스 외에도 금융사기 방지 및 인사시스템 등에 AI를 적극 활용함으로써 타 은행 대비 '미래형 은행'으로의 전환 작업에 적극적이다. 30일 은행권에 따르면...
775,"""코로나 1년, 5G·AI 등 '신기술 경제사회 모델' 요구""…NIA '10대 메가트렌드...",2021.04.27.,"임민철 기자 imc@ajunews.com 코로나19 확산 이후 5G, 인공지능(AI) 등의 신기술을 활용한 새로운 경제사회 모델에 대한 요구가 많아졌다는 분석이 나왔다. 한국지능정보사회진흥원(NIA)이 코로나 이후 1년간 공공·민간 분야의 변화를 데이터 기반으로 진단한 결과다. NIA는 디지털 전환 시대를 대비하기 위해..."
776,"이통3사, 5G·AI 기반 '로봇 산업' 진출 박차",2021.04.27.,"5G·인공지능(AI) 등 정보통신기술(ICT) 역량을 바탕으로 제조사와 협력을 강화, 시장 선점에 나섰다. 특히 자율주행 기능을 탑재한 로봇의 경우 이통사 영역인 '통신·관제' 시스템 접목이 필수적이다. KT는 전일 서울 강남구 공유먼트 청담점에서 로봇 분야의 각계 전문가들이 참석한 가운데 '로봇..."
777,"한컴인텔리전스-곰앤컴퍼니, 인공지능 분야 업무협력",2021.04.26.,한컴인텔리전스(대표 지창건)가 곰앤컴퍼니(대표 이병기)와 인공지능(AI) 분야 교류 및 협력을 위한 업무협약을 체결했다고 26일 밝혔다. 한컴인텔리전스는 AIaaS(AI as a Service) 플랫폼 '나루 AI(NARU AI)'를 중심으로 다양한 인공지능 솔루션을 곰앤컴퍼니의 동영상 소프트웨어 및 플랫폼에 적용할 수 있도록...
778,"머니브레인, 사람처럼 대화하는 AI 키오스크 선보인다",2021.04.27.,"사람처럼 말하고 반응하는 인공지능(AI) 키오스크가 나온다. AI 전문 기업 머니브레인은 대화형 AI 기술로 실제 상담원의 역할을 구현하는 ‘AI 키오스크’를 정식 출시한다고 27일 밝혔다. 머니브레인은 딥러닝 기반 영상합성, 음성합성 원천기술을 모두 보유한 기업으로, 대화형 AI를 구현하는 ‘인공인간(AI..."
779,[단독] 원양어선 불법조업 ‘AI 감시’ 좌초 위기…올해 예산 0원,2021.04.27.,폐쇄회로(CC)TV와 인공지능(AI) 기술을 통해 24시간 조업 상황을 감시하는 전자조업모니터링(EM) 시스템이 주인공이다. 당초 정부는 1년간 시범사업을 진행한 후 추가 사업을 검토하기로 했지만 올해 배정한 예산 자체가 없다. 해양강국이라면서 ‘불법어업국’ 지정을 예방할 수 있는 국산 기술을 사장시키려...
780,"보안업계, '무인 매장 지킴이' AI카메라 솔루션 개발 경쟁",2021.04.25.,보안업계가 인공지능(AI) 카메라를 활용한 솔루션을 잇따라 내놓고 있다. 무인 편의점 등 비대면 사업장 유지 관리부터 화재 감시 기능 등 AI의 활용도가 높아지는 상황에 대응하기 위해서다. 26일 보안업계에 따르면 에스원은 인공지능 기술을 적극 활용하고 있다. 에스원이 개발한 지능형 영상감시 솔루션은...
781,챗봇·인공지능(AI) 큐레이션까지...서초구 'AI 전자도서관' 운영,2021.04.25.,"우선 구는 최신 IT기술을 반영한 AI 인공지능 시스템을 활용한 ‘도서관 챗봇서비스’를 도입해 스마트한 도서정보 제공이 가능하게 한다. 도서관별 도서검색 및 예약, 희망도서 신청 연계가 원스톱으로 가능하며 빅데이터를 활용, 개인별 맞춤형 추천도서도 받아볼 수 있다. 또 도서 이용인원 제한이 없는..."
782,"삼성전자, 인공지능 로봇청소기 '비스포크 제트 봇 AI' 선봬",2021.04.27.,"세계 최초 인텔 AI 솔루션 탑재, 쇼파는 물론 양말까지 인식 업계 최초 액티브 스테레오 카메라, 장애물 감지 능력 향상 삼성전자가 인공지능(AI) 기술로 사물인식 능력과 주행성능을 대폭 개선한 로봇청소기 `비스포크 제트 봇 AI`를 27일 출시한다. 비스포크 제트 봇 AI는 딥러닝 기반으로 이미지 100만 장..."
783,"휴넷, 빅데이터-AI기반 '디지털 핵심 실무인재' 양성… 교육생 모집",2021.04.26.,"휴넷은 빅데이터 및 인공지능(AI) 기반의 디지털 전략 전문가과정을 맡았다. 과정은 내달 24일부터 9월 3일까지(총 수업시간 455시간) 휴넷캠퍼스(구로디지털단지 소재)에서 진행된다. 수업은 ▲SQL, 파이썬, R 활용 등 '빅데이터 분석' ▲인공지능 개념, 머신러닝 알고리즘 등 '인공지능 분석 및 활용 프로그램..."
784,"광주 인공지능 자율주행 인재양성 요람으로, 이용섭 미래차 중심 원해",2021.04.28.,이용섭 광주시장이 인공지능(AI) 자율주행차 인재육성을 위해 광주빛그린산학융합지구를 조성한다. 전남대학교 지능형모빌리티융합학과와 기업연구시설이 들어선다. 이 시장은 광주경제자유구역청을 통한 완성차·인공지능기업 유치와 전남대학교를 통한 인공지능 자율주행분야 인재의 지속육성이 동시에...
