,제목,날짜,본문
1872,"광주은행, 지스트와 인공지능 금융산업육성 MOU 체결",2021.06.15.,"광주은행이 지난 18일 지스트(광주과학기술원)에서 송종욱 광주은행장과 김기선 지스트 총장, 관계자 등이 참석한 가운데 인공지능(AI) 산업육성을 위한 협약식<사진>을 가졌다. 이번 협약식에서 광주은행과 지스트는 상호 긴밀한 협력을 통해 인공지능 분야의 역량 확보와 우수 기술 인재 육성을 위해..."
1873,"""AI·컴퓨터 교육 대폭 확대하라""…목소리 내는 과학기술 단체들",2021.06.23.,"국내 주요 과학기술 연구단체들이 초·중·고교 학생을 위한 소프트웨어 및 인공지능(AI) 의무 교육 강화를 주장하며 단체행동에 나섰다. 20일 정보기술(IT)업계에 따르면 한국과학기술한림원, 한국공학한림원, 한국경영학회, AI미래포럼 등 18개 민간 단체는 ‘전국 정보교육 네트워크’를 결성하고 ‘초·중..."
1874,반도체·기계·조선 등 8개 분야 ‘AI 융합형 산업현장기술인력’ 양성 본격 ...,2021.06.08.,"산업통상자원부는 제조 산업현장의 인공지능(AI) 기술 융합을 위해 추진하는 「AI 융합형 산업현장기술인력 혁신역량강화」 사업 지원분야를 미래차, 디지털헬스케어, 반도체, IoT가전, 기계, 섬유, 디스플레이, 조선 등 8개로 확정하고 본격 시행에 나섰다. 「AI 융합형 산업현장기술인력 혁신역량강화」..."
1875,인공지능 기반 보안플랫폼기업 이노뎁 18일 코스닥 상장,2021.06.17.,"인공지능(AI) 기반의 보안플랫폼기업 이노뎁이 코스닥에 상장된다. 한국거래소는 이노뎁의 코스닥시장 신규상장을 승인했다고 16일 밝혔다. 이성진 이노뎁 대표이사. 주식 거래는 18일 개시되며 공모가는 1만8천 원이다. 이노뎁은 2020년에 매출 667억 원, 영업이익 51억 원을 냈다. 이노뎁은 2008년에..."
1876,LIG넥스원-AI 양재 허브와‘미래 신기술 R&D 활성화를 위한 MOU’ 체결,2021.06.14.,"이번 협약을 통해 LIG넥스원과 AI 양재 허브는 4차 산업혁명의 핵심 분야로 높은 관심의 대상이 되고 있는 인공지능(AI) 등 미래 신기술을 중심으로 협력 네트워크를 구축하는 한편, 혁신 스타트업들이 국방R&D 사업에 적극적으로 참여할 수 있도록 다양한 지원활동을 진행하게 된다. 또한 △기술자료 및..."
1877,“GO ASTRO BOY GO!”...AI로봇 '뉴 아톰' 돌아오다,2021.06.09.,과거의 아톰은 자신의 정체성를 고민하며 인간을 위해 악당과 싸우는 SF 히어로물인 반면 뉴 아톰은 인간적인 남자 아이와 똑같이 생긴 초고성능 인공지능(AI) 로봇이다. 새끼 고양이 버전의 아스트로 ‘키티’와 천재소년 ‘스즈’ 이렇게 3명이 한팀을 이루어 지구에서 일어나는 다양한 문제를 해결하는...
1878,"한남대, 남호진 학생 CCTV 연계 'AI 스마트화재감시시스템' 개발",2021.06.15.,"한남대학교는 남호진(25·기계공학과) 학생이 폐쇄회로(CC)TV와 연계한 '인공지능(AI) 스마트화재감시시스템'을 개발해 특허 출원을 했다고 15일 밝혔다. AI 시스템이 CCTV를 통해 시각적으로 화재를 감지하고 화재 여부를 판단, 보안업체와 소방서, 관리자 등에 전송하는 방식이다. 남호진 학생은 지난해 소방방재..."
1879,"교육부, 예비교사들에게 AI교육한다... 초·중등 교원양성대학 6곳 선정",2021.06.10.,"교육부(장관 유은혜), 한국과학창의재단(이사장 조율래)은 '2021년 초‧중등 교원양성대학 인공지능(AI) 교육 강화 지원 사업'에 선정된 6개교를 지난 22일 발표했다. 이 지원 사업은 최근 디지털 혁신에 따른 초‧중등학교에서의 인공지능 교육 강화를 위해 예비교원에 대한 AI 교육역량 함양을 지원하는..."
1880,"광주은행, 지스트와 손잡고 AI 금융산업육성 발 벗고 나서",2021.06.15.,"광주은행은 지스트(광주과학기술원)에서 송종욱 광주은행장과 김기선 지스트 총장, 관계자 등이 참석한 가운데 인공지능(AI) 산업육성을 위한 협약식을 가졌다. 이번 협약식에서 광주은행과 지스트는 상호 긴밀한 협력을 통해 인공지능 분야의 역량 확보와 우수 기술 인재 육성을 위해 상호협력하며 교류를..."
1881,"LG유플러스-LG CNS, AI콜센터 시장 공동 진출한다",2021.06.15.,"인공지능(AI)을 통해 고객의 요청사항을 손쉽게 접수하고, 비교적 단순한 해결방안의 경우 상담원 대신 AI콜센터가 답변을 제공해 상담업무의 생산성을 높일 수 있다. AI콜센터가 상용화되기 위해서는 ▲고객의 음성을 AI가 실시간으로 인식하고(음성인식) ▲텍스트로 변환된 고객의 문의사항을..."
1882,인공지능 투자 파운트 설립 3년…회원수 100배 이상 ‘폭풍성장’,2021.06.15.,파운트는 자체 개발한 AI(인공지능) 알고리즘이 세계 각국의 경제 및 시장지표를 조합해 5만2000개가 넘는 시나리오 결과로 산출한 ‘파운트 마켓스코어’를 기반으로 개인의 투자성향에 따라 커스터마이징된 글로벌 자산배분 포트폴리오에 최소 10만원부터 투자 가능한 비대면 인공지능 투자...
1883,전기연구원 SNS 통해 AI '과학키트 무료'로 받아가세요,2021.06.16.,"한국전기연구원(KERI·원장 직무대행 유동욱)은 한정판 인공지능(AI) 과학키트를 무료로 나눠주는 '쪼물딱 전기톡(TALK) 시즌2'를 개최한다고 16일 밝혔다. 쪼물딱 전기톡은 진행자가 유튜브를 통해 과학키트 만드는 법을 직접 알려주면서, 학생들이 평소 궁금했던 다양한 전기 관련 상식도 전달하는 비대면..."
1884,"ML석학 조나단 쉐퍼 교수 ""한국, AI 상위 10개국 될 것...AI 대중화 앞장서야...",2021.06.07.,"(사진편집=임채린 디자이너) 한국이 인공지능(AI) 분야 상위 10위권 국가가 될 수 있다는 전망이 나왔다. AI 강국으로서 대중의 AI 인식 확산에 앞장서야 한다는 지적도 제기됐다. 머신러닝 분야 세계적인 석학 조나단 쉐퍼(Jonathan Schaeffer) 캐나다 알버타대학 교수는 24일 열린 'AI TechCon 2021'에서 ""인공지능(AI)..."
1885,CJ대한통운 AI 전문가 교육 실시한다,2021.06.07.,"CJ대한통운이 임직원 200여명을 대상으로 인공지능(AI), 빅데이터 전문가 양성과정을 운영한다. 실무 차원에서부터 디지털 전환을 가속화하기 위해서다. CJ대한통운은 임직원들을 대상으로 하는 AI·빅데이터 전문가 양성과정을 진행한다고 7일 밝혔다. 이번 교육 프로그램에는 정보기술(IT), 데이터 관련 업무..."
1886,"씨엘-유니스트, AI 모빌리티 플랫폼 기술개발 협업",2021.06.07.,"이번 협약은 인공지능(AI) 기술기반 모빌리티 플랫폼 핵심기술 개발 및 공동 연구소 구축 등을 위해 협력하고자 마련됐다. 최근 자율주행 모빌리티 분야 기술 경쟁이 치열해지고 있는 가운데 양 기관은 상호교류를 통해 관련 산업 분야에 대한 기술개발, 기술이전, 기술 고도화에 속도를 낼 전망이다. 씨엘..."
1887,"뷰노, 'AI로 판독하는 X-ray' 삼성서울병원·삼성전자와 협력",2021.06.14.,"인공지능 기반 CAD 탑재한 Mobile X-ray로 세계 시장 선도 기대 헬로티 서재창 기자 | 뷰노는 25일 삼성서울병원 및 삼성전자와 ‘Mobile X-ray용 AI CAD(Computer Aided Diagnosis, 컴퓨터 보조 진단) 신기술 개발’을 위한 3자 MOU를 체결했다고 밝혔다. 25일에 삼성서울병원에서 열린 이번 협약식에는 ㈜뷰노 대표..."
1888,"국회도서관, AI 기반 조세정책 개선 모색",2021.06.08.,"국회도서관은 15일 '인공지능(AI)과 조세'라는 주제로 제16차 'AI와 국회포럼'을 개최했다. 비대면 방식으로 개최된 이번 포럼에서는 인공지능을 기반으로 한 조세행정 현황을 살펴보고 과세권자와 세무대리인, 납세자 등 이해관계자 모두에게 도움이 되는 조세정책 개선 방향을 모색했다. 발제는 홍기용..."
1889,"양주시 일자리센터, AI기술 활용한 비대면 가상면접 체험실 운영",2021.06.16.,양주시 일자리센터는 오는 17일부터 양주고용복지플러스센터 2층에서 인공지능(AI) 면접 체험실을 운영한다고 14일 밝혔다. 인공지능(AI) 면접 체험실은 코로나19로 인한 비대면·디지털 채용 패러다임에 발맞춰 AI 면접과 화상 면접에 대한 실전감각을 높이고 구직자의 비대면 취업역량을 강화하기 위해...
1890,"GS샵 - 포항공대, 이커머스 AI 기술 공동연구 MOU 체결",2021.06.06.,GS샵은 포항공과대학교와 '인공지능(AI)을 활용한 이커머스 발전 협약(MOU)'을 체결했다고 14일 밝혔다. GS샵과 포항공과대학교는 이번 협약을 통해 검색·추천 분야 AI 모델 개발을 위한 연구와 협력을 수행할 계획이다. 해당 분야는 유통·이커머스의 핵심 영역으로 양측은 고객의 편의를 크게 향상 시킬 수 있을...
1891,"설계에서 품질현장까지…현대모비스, 경영 전반에 AI 적용",2021.06.06.,"현대모비스는 연구개발, 생산, 품질 등 효율성을 높이기 위해 경영 전반에 인공지능(AI)를 접목한 기술 사례가 40건을 넘어섰다고 6일 밝혔다. 대표적인 인공지능 기술 접목 사례는 품질관리 담당자가 필드 클레임이 발생한 자동차부품에 대한 관련 데이터를 시스템에 입력하고, 시스템이 제품 특성에 최적화된..."
1892,[時論]AI와 기본소득 무엇이 문제인가,2021.06.07.,인공지능(AI)과 로봇 때문이다. AI의 등장으로 제조업은 물론 서비스 부문 일자리도 위협받고 있다. 일본 후코쿠생명의 경우 보험 청구 시 적정 보험금액 산정을 AI가 대체한다. 은행은 지점의 30∼40%가 사라졌다. 이런 추세는 빠르게 확산할 것이다. 자율주행차 시대가 열리면 영업용 운전자는 일자리 걱정을...
1893,"라온피플, 중기부 ‘AI 스마트공장’ 구축 지원에 AI 솔루션 업계 수혜 예상",2021.06.07.,"스마트공장 보급 등 저변 확대와 인공지능 중소벤처 제조플랫폼 ‘켐프(KAMP, Korea AI Manufacturing Platform)’를 통해 데이터와 인공지능을 중심으로 스마트공장 고도화를 지원하는 사업이다. 이에 AI 스마트공장 구축 지원 대상인 국내 중소·중견 제조기업은 물론 레퍼런스가 다양한 AI 기업에도 긍정적인..."
1894,"대한통운, AI·빅데이터 전문가 키운다",2021.06.03.,"CJ대한통운은 임직원들을 대상으로 하는 인공지능(AI)·빅데이터 전문가 양성과정을 진행한다고 7일 밝혔다. 정보통신(IT) 기업이 아닌 물류기업이 수백명 단위의 대규모로 AI와 빅데이터 관련 교육을 진행하는 것은 이례적이라는 평가다. 이 교육 프로그램에는 IT, 데이터 관련 업무 담당자를 비롯해 계약물류..."
1895,호남대 AI역량 강화 방학 중에도 '열공',2021.06.15.,"또 정보통신산업진흥원 백은경 전문위원은 인공지능과 5G, 6G에 의한 산업과 인력의 미래를 전망했고, 이날 토크콘서트의 마지막 강연을 맡은 광주 MBC 황동현 PD는 광주 AI집적단지의 역할과 성공적 정착을 위한 다양한 과제들을 조명했다. 이와 별도로 호남대 AI빅데이터 연구소(소장 백란)가 AI대중화를 위해..."
1896,"LG유플러스-LG CNS, AI콜센터 시장 진출한다",2021.06.15.,인공지능(AI)을 통해 고객의 요청사항을 손쉽게 접수하고 비교적 단순한 해결방안의 경우 상담원 대신 AI콜센터가 답변을 제공해 상담업무의 생산성을 높일 수 있다.AI콜센터가 상용화되기 위해서는 △고객의 음성을 AI가 실시간으로 인식하고(음성인식) △텍스트로 변환된 고객의 문의사항을 파악해...
1897,"CJ대한통운, 임직원 대상 AI·빅데이터 전문가 양성",2021.06.15.,"CJ대한통운이 임직원들을 대상으로 인공지능(AI), 빅데이터 전문가 양성과정을 운영한다. 정보통신(IT) 기업도 아닌 물류기업이 수백명 단위의 대규모로 AI와 빅데이터 관련 교육을 진행하는 것은 이례적이라는 평가다. CJ대한통운은 임직원들을 대상으로 하는 AI·빅데이터 전문가 양성과정을 진행한다고 7일..."
1898,"옴니채널 대응하는 인공지능 챗봇,... 애피어 '봇보니' 발표, 새로운 고객 경...",2021.06.07.,이에 인공지능(AI) 선도기업 대만의 애피어(Appier)는 옴니채널 대화형 마케팅 플랫폼 AI '봇보니(BotBonnie)'를 22일 출시하고 다양한 메신저 서비스에서 복잡한 고객 여정을 지능적으로 탐색할 수 있도록 설계된 애피어의 AI 기반 솔루션 제품군을 한층 강화한다. 봇보니의 출시로 고객 중심 풀 퍼널...
1899,"'Arts & Technology MBA 과정', AI연계 콘텐츠 혁신인재 양성사업 선정",2021.06.07.,21일 상명대학교에 따르면 이번 '혁신인재 양성 사업'은 문화예술 콘텐츠 분야에서 인공지능(AI) 기술의 활용과 연계를 통해 창의적 콘텐츠를 발굴하는 혁신인재 양성과 산업계의 디지털 전환을 위해 진행되는 프로젝트다. 이번 경영대학원 Arts & Technology MBA 과정은 창의융복합 전문인력 양성을...
1900,"효성인포메이션시스템, 'UCP AI 플랫폼' 통해 디지털 전환 가속화 지원",2021.06.21.,"기업 클라우드 환경은 자체 업무만 운영하던 기존과 다르게 빅데이터, 인공지능/머신러닝(AI/ML), 사물인터넷(IoT) 같은 다양한 데이터 관련 업무를 수용하며 AI 시대에 맞춰 변화하고 있다. 또한 IT운영자부터 개발자, 데이터 사이언티스트에 이르기까지 모든 구성원이 역할에 맞게 사용하고 어떤 형태의..."
1901,"日 방위성, 인공지능 전투기 개발 추진...“2035년 실전 배치” 목표",2021.06.09.,일본 방위성이 인공지능(AI)을 탑재한 전투용 제트기를 개발한다고 NHK가 13일 보도했다. NHK에 따르면 일본 방위성은 기존에 사용하던 F-2 전투기가 2035년에 퇴역할 것을 대비해 이를 승계할 차기 무인기를 개발 중이다. 새로운 무인기는 적기와 미사일을 빠르게 추적하는 제트 엔진을 탑재해 조종사의 안전을...
1902,"한화손해보험, AI 기반 인슈어런스 로보텔러 도입",2021.06.10.,"한화손해보험이 10일 여의도 사옥에서 인공지능(AI) 대화엔진 전문기업 '페르소나AI'와 AI 기반 인슈어런스 로보텔러 도입을 위한 업무협약을 체결했다고 밝혔다. 한화손해보험은 TM(텔레마케팅) 계약 진행 단계에서 상담사 관리 아래 로보텔러가 상품 설명과 녹취를 수행하는 스크립트 자동화, 가입설계 및..."
1903,"콘진원, AI 기술 연계한 콘텐츠 개발 혁신인재 모집한다",2021.06.17.,"본 사업은 음악/공연, 게임, 웹툰, 스토리 등 다양한 분야의 문화콘텐츠와 AI기술을 접목한 프로젝트를 진행할 7개의 플랫폼기관을 선정했으며, 대학과 인공지능 및 문화콘텐츠 분야 기업 등으로 구성된 각 플랫폼 기관을 통해 150여 명의 교육생을 선발한다. 이번 교육은 콘텐츠 산업계 수요를 반영해 프로젝트..."
1904,"KT, 하이퍼스케일 AI 서비스 출시…""KT의 AI R&D인프라 활용하세요""",2021.06.23.,"KT가 인공지능(AI) 연구개발(R&D) 인프라를 빌려 쓸 수 있는 통합 솔루션 서비스를 시작한다. 9일 KT는AI 연구 및 상용화 인프라 환경과 운영 컨설팅을 지원하는 'KT 하이퍼스케일(Hyperscale) AI 서비스'를 출시했다고 밝혔다. KT 하이퍼스케일 AI 서비스는 AI 컴퓨팅 파워, 개발자 툴킷, 전문가그룹의 최적화..."
1905,"네이버, 유럽 AI 연구 거점 초고속 통신망 업그레이드",2021.06.16.,"로젠버그 OSI·모듈 데이터센터 협력 네이버가 유럽 인공지능(AI) 연구소에서 통신망 현대화 작업을 마쳤다. 초고속 네트워크를 구축해 연구소 가동에 매진한다. 프랑스 로젠버그 OSI(Rosenberger Optical Solutions & Infrastructure)는 23일 ""모듈 데이터센터(Modul'Data Center)와 공동으로 네이버랩스 유럽에서..."
1906,"""중2병 흑역사 더 선명하게""…싸이월드, AI로 고해상도 복원",2021.06.07.,"서비스가 종료됐던 SNS 싸이월드가 복귀를 선언하면서 인공지능(AI) 딥러닝 기술로 서버에 저장된 사진 170억장과 동영상 1억 5000개를 고해상도로 복원한다. 싸이월드제트는 17일 AI기업인 스누아이랩과 이미지·동영상 해상도 변환기업 에스프레소미디어, 싸이월드 서비스 개발 전담 기업 에프엑스기어 등과..."
1907,[Science in Biz] 희귀·난치병 임상 '대조군' 윤리적 문제…AI가 가상의 '위...,2021.06.07.,"이런 대조군 관련 문제로 인해 글로벌에서는 대안 논의가 이뤄져왔고, 최근 과거 임상시험 빅데이터를 인공지능(AI)으로 분석·활용해 대조군을 형성하는 '합성대조군'이 새롭게 떠올랐다. 합성대조군은 과거의 기존 임상시험 데이터를 활용해 가상의 대조군을 형성하는 방식으로, 위약 또는 기존 치료..."
1908,카카오엔터프라이즈·유베이스 AI 콘택트 센터 MOU,2021.06.15.,카카오엔터프라이즈가 콜센터 기업인 유베이스와 '차세대 인공지능(AI) 콘택트 센터 구축을 위한 업무협약(MOU)'을 체결했다고 3일 밝혔다. 사진은 지난 1일 협약식에서 기념 촬영하는 백상엽 카카오엔터프라이즈 대표와 허대건 유베이스 대표(왼쪽). 2021.6.3 [카카오 제공. 재판매 및 DB 금지]
1909,"LG유플러스, LG CNS와 AI콜센터 솔루션 사업 공동 진행 위해 맞손",2021.06.15.,"인공지능(AI)을 통해 고객의 요청사항을 손쉽게 접수하고, 비교적 단순한 해결방안의 경우 상담원 대신 AI콜센터가 답변을 제공해 상담업무의 생산성을 높일 수 있다. AI콜센터가 상용화되기 위해서는 ▲고객의 음성을 AI가 실시간으로 인식하고(음성인식) ▲텍스트로 변환된 고객의 문의사항을 파악해..."
1910,"강남구, 강남창업펀드 315억 조성... AI‧빅데이터 ICT 산업 스타트업 본격 투...",2021.06.15.,업무집행조합원을 맡은 위벤처스는 인공지능(AI)·빅데이터 같은 정보통신기술(ICT) 산업에 중점적으로 투자한다는 방침이다. 또 오는 9월 중 2차 클로징을 통해 규모를 500억원 이상으로 확대할 예정이다. 이 펀드는 구 출자금(10억원)의 500% 이상을 강남구 소재 기업에 의무적으로 투자하도록 해 관내...
1911,[이우탁의 형이상학 – 알고리즘 전쟁 ⑤] AI 로봇의 반란 막을 수 있나,2021.06.08.,"인공지능(AI) 알고리즘, 프로그래밍 언어, 소프트웨어, 로봇플랫폼 등은 인간이 만든 피조물이며 도구다. 하지만 그 피조물이 결국에는 인간의 소유와 통제를 벗어나 독자적인 운명을 개척하는 존재로 향해 갈지 모른다는 생각은 종종 AI 로봇에 대한 공포로 이어진다. 혹자는 AI 로봇이 멀지 않은 미래에 모든..."
1912,"대구은행, AI 챗봇 '앤디' 도입",2021.06.16.,DGB대구은행(행장 임성훈)은 인공지능(AI) 기반 고객상담 챗봇 서비스 '앤디(ND)' 개발을 마치고 서비스를 실시한다고 8일 밝혔다. 앤디는 지난해 11월 개발을 시작해 약 7개월 동안 준비기간을 거쳤다. 대구은행 IM뱅크의 캐릭터 '우디'가 모델이다. '질문에 답하는 우디(Answer Woodi)'의 영문 조합 발음에...
1913,모빌리티·로봇이 AI와 만나는 미래는…,2021.06.09.,"포럼에 참석한 모빌리티, 인공지능(AI), 로봇, 우주를 포괄하는 첨단기술 분야 17명의 세계적인 석학은 온·오프라인 특별강연을 통해 드론, 로봇 등 관련 기술과 산업에 대한 다양한 육성 방안을 제시했다. 월드포럼은 지난 2월 대전시와 한컴그룹이 대전을 한국형 디지털 뉴딜의 중심 4차 산업혁명특별시로..."
1914,"CJ대한통운, 인공지능·빅데이터 전문가 양성",2021.06.09.,"CJ대한통운은 임직원들을 대상으로 인공지능(AI)·빅데이터 전문가 양성과정을 운영한다고 7일 밝혔다. 이 교육프로그램에서는 IT, 데이터 관련 업무 담당자를 비롯해 계약물류(CL), 택배, 이커머스 등 실무자 200여 명이 참여해 지난 5월 12일부터 6월중순까지 약 한달여 동안 진행된다. 교육과정은 플랫폼..."
1915,"[강소기업을 가다] AI 반도체 기업 '블루닷', 네이버 신규 투자로 날개 달다",2021.06.07.,저화질 영상을 고화질 4K 비디오로 업스케일링 / 글로벌 1위 FPGA 기업 자일링스 주관 대회서 1위 차지 스마트테크코리아에 참가한 블루닷 부스 [사진=뉴스투데이] 우리나라 차세대 먹거리 중 하나로 인공지능(AI) 기반 반도체가 관심을 받고 있다. 삼성전자를 필두로 네패스와 같은 상장 기업들부터...
1916,"충남교육청, '인공지능(AI) 윤리교육 도움자료' 개발",2021.06.07.,"충남교육청(김지철 교육감)은 미래사회의 윤리 문제와 책임에 대한 교육을 위해 ‘충남형 인공지능(AI) 윤리교육 도움자료’를 개발, 각급 학교에 배포한다고 10일 밝혔다. 교육청에 따르면 ‘도움자료’는 전자 파일 형태로 배포된다. 주요 내용은 1부 인공지능(AI) 윤리교육에 관한 질의응답, 2부 우리 삶과..."
1917,"광주소방, AI 기반 119신고접수시스템 구축",2021.06.07.,"신고자 음성 자동 인식, 핵심 키워드 추출로 골든타임 확보[보안뉴스 ] 광주광역시 소방안전본부는 119신고전화 통화 내용을 인공지능으로 분석해 상황실 근무자가 재난 상황에 신속히 대응할 수 있는 ‘AI 기반 119신고접수시스템’ 구축을 본격 추진한다.119신고는 대부분 긴박한 현장 상황으로 인해..."
1918,"NHN, AI 반도체기업 그래프코어와 기술 협력",2021.06.18.,NHN은 글로벌 인공지능(AI) 반도체기업 그래프코어와 AI 및 클라우드 분야 기술 협력을 진행한다고 7일 밝혔다. 양사는 △오픈스택 등 주요 기술 요소 개발 △HPC(High Performance Computing) 등 AI 인프라 개발 △NHN 클라우드 시스템 연동 △AI 및 머신러닝(기계학습) 개발 생태계 확장을 위한 마케팅 등...
1919,"중기부, 'AI 스마트공장 구축 지원사업' 참여기업 모집...1년간 4억원 지원",2021.06.15.,중소벤처기업부(장관 권칠승)가 국내 중소/중견 제조기업 대상 '인공지능(AI) 스마트공장 구축 지원사업' 참가업체를 18일부터 모집한다. 해당 사업에 중기부는 총 200억원 예산을 투입하며 100개사 내외를 선정할 계획이다. 참가기업은 총 사업비의 50% 이내에서 최대 1년 동안 4억원 지원금을 받을 수...
1920,"광주시, AI집적단지 2단계 사업전략 마련한다",2021.06.15.,"손경종 시 인공지능산업국장은 ""AI집적단지 활성화를 위한 선제적이고 체계적인 추진전략 및 중점과제를 마련하기 위해 사업기획위원회를 구성했다""며 ""12월까지 AI집적단지 2단계 사업 추진 로드맵을 마련해 광주가 인공지능 강국을 뒷받침하고 인공지능 중심도시로 도약하도록 적극 지원하겠다""고..."
1921,"LG유플러스-LG CNS, AI콜센터 시장 공동 공략",2021.06.15.,인공지능(AI)을 통해 고객의 요청사항을 손쉽게 접수하고 비교적 단순한 해결방안은 상담원 대신 AI콜센터가 답변해 상담업무의 생산성을 높일 수 있다. AI콜센터가 상용화되기 위해서는 ▲고객 음성을 AI가 실시간으로 인식하고(음성인식) ▲텍스트로 변환된 고객의 문의사항을 파악해 답변을 찾고...
1922,"뷰노-삼성서울병원-삼성전자, Mobile X-ray용 AI CAD 공동개발 MOU 체결",2021.06.15.,"뷰노(대표 김현준)는 25일 삼성서울병원 및 삼성전자와 ‘Mobile X-ray용 AI CAD(Computer Aided Diagnosis, 컴퓨터 보조 진단) 신기술 개발’을 위한 3자... 세 기관은 이번 양해각서 체결로 Mobile X-ray 장비의 사용성을 획기적으로 개선할 수 있는 인공지능 기반 X-ray 판독 보조 소프트웨어 신기술을 공동으로..."
1923,대학 행정에도 AI가 떴다…성균관대 RPA 도입해 효율 ‘쑥’,2021.06.15.,"성균관대는 지난해부터 삼성SDS의 인공지능(AI) 업무 자동화 솔루션인 ‘브리티(Brity)’ RPA를 도입해 대학 행정 효율화를 추진하고 있다고 17일 밝혔다. 가장 큰 성과를 보고 있는 분야로는 외국인 유학생 입학 처리와 안내 시스템의 자동화를 꼽았다. 외국 유학생들은 학생비자를 발급받아야 하는데, 이때..."
