,제목,날짜,본문
1665,"[CES 2022] 유영상 대표 ""메타버스→AI 에이전트→아이버스로…미래 10년은 S...",2022.01.11.,"유영상 SK텔레콤 대표가 인공지능(AI) 에이전트에 메타버스가 융합된 세상 아이버스(AI-VERSE, AI와Universe의 합성어)라는 새로운 개념을 미래 비전으로 제시했다. 앞으로 '아이버스'를 스마트폰 외 미래형 디바이스에도 확대 적용해 향후 10년을 준비하겠다는 계획이다. 유영상 SK텔레콤 대표는 6일(현지시간)..."
1666,"코웨이 노블 정수기, 업계 최초 AI 품질 인증 획득",2022.01.12.,코웨이 노블 정수기는 인공지능(AI) 기술을 활용해 제품 상태를 관리해 주는 '스마트 진단 기능'을 구현했다. 해당 기능은 제품 상태를 실시간으로 모니터링하고 이상 발견 시 해결 방법을 안내한다. 이 제품은 음성 안내 기능과 함께 IoT 기능이 적용돼 IoCare 앱을 통한 제품 관리가 가능하다. [프레스맨]
1667,"LG전자의 AI 인플루언서 '래아', 미스틱스토리서 뮤지션 데뷔",2022.01.12.,"래아는 LG전자가 인공지능(AI) 기술을 활용해 구현한 가상 인플루언서다. 지난해 'CES 2021'에서 열린 'LG전자 프레스 콘퍼런스'에서 연설자로 깜짝 등장, 처음으로 대중 앞에 섰다. 이후 인스타그램 계정을 통해 '싱어송라이터 겸 DJ'라고 본인을 소개한 래아는 활기차고 자연스러운 일상을 대중에 공개하며..."
1668,"영양군, 전국 최초 ‘24시, 인공지능 통화비서 서비스’ 활용",2022.01.12.,"조인호 기자, 영양군은 20일부터 업무시간 이후 및 공휴일에 민원실로 걸려온 전화를 AI가 대신 받아주는 ‘24시, 인공지능 통화비서 서비스’ 를 행정기관 중 전국최초로 도입한다고 밝혔다. 군은 통신회사의 AI 통화비서 서비스가 365일 24시간 고객응대로 소상공인 등에 인기를 얻고 있음에 착안, 근무시간..."
1669,"코코넛사일로, '빅데이터/인공지능 활성화 지원사업' 참가기업 모집... 최대 ...",2022.01.12.,"AI 딥테크 스타트업 코코넛사일로가 최대 7,000만원 상당의 빅데이터/인공지능 기술 도입 지원을 제공하는 '2022 빅데이터/인공지능 활성화 지원사업'의 참가기업을 모집한다. 이번 사업의 신청 대상은 빅데이터/인공지능 기술을 도입하고자 하는 중소기업, 소상공인, 1인 창조기업, 예비 창업자로 신청..."
1670,"""명소? 맛집? 날씨? 무엇이든 물어보세요""…AI 휴먼, '앵커' 이어 '샤이니 민...",2022.01.20.,"인공지능(AI) 전문기업인 '딥브레인AI'가 서울 광화문에 새롭게 조성된 광화시대 프로젝트 가운데 하나인 '광화인'에 AI 휴먼 기술을 지원하면서, 최근 아이돌 그룹 '샤이니'의 멤버 민호 등을 키오스크 형태의 'AI 안내원'으로 구현해 화제를 모았다. (영상=딥브레인AI 유튜브). 안녕하세요, 광화시대의..."
1671,"""전투기의 수가 국방력? NO! AI 알고리즘 품질에 달려""",2022.01.13.,"이와 비슷하게, 인식하고 표현하는 인공지능(AI) 감각 지능들을 서로 결합하여 사람과 같이 유연한 AI를 만들겠다는 시도다. 다중감각 AI를 통한 질적 성장이 최근 급부상한 초거대 AI의 한계를 극복할 수 있을지 기대된다. ▷소프트웨어 2.0 : 소프트웨어(SW)를 개발하는 주체가 사람이 아닌 데이터로 점점..."
1672,"실리콘랩스, 엣지에 인공지능·머신 러닝 구현 지원하는 Matter-Ready 플랫폼...",2022.01.07.,"AI/ML 가속기 통합, 매터, 지그비, 오픈스레드, 저전력 블루투스, 블루투스 메시, 독자적 프로토콜 및 다중 프로토콜 작동 지원, 보안 인증... 또한 새로운 소프트웨어 툴키트로 개발자가 TensorFlow와 같이 가장 널리 사용되고 있는 도구를 사용하여 AI 및 ML 알고리즘을 신속하게 구축 및..."
1673,인공지능으로 사업화 유망 공공기술 찾아 준다,2022.01.11.,"이에 국내 모든 공공기술에 대한 One-stop 검색시스템 구축, 인공지능(AI) 기반 검색 서비스 제공, 유망 공공기술·수요기술 유통체계 고도화, 모바일 서비스 제공 등의 개선이 이뤄졌다 권석민 과기정통부 과학기술일자리혁신관은 “공공연구성과의 기술이전·거래가 활발히 이루어지기를 기대하며, 검색..."
1674,"SK텔레콤, AI·메타버스 사업 수장 각각 교체",2022.01.11.,"SK텔레콤은 ""이 CTO가 개발자 출신의 자연어·음성처리 전문가로서, 인공지능(AI)·디지털 인프라 서비스 컴퍼니라는 비전을 선언한 SK텔레콤의 연구 개발을 이끌 것""으로 기대했다. SK텔레콤은 또 신임 메타버스 CO(컴퍼니)장에 양맹석 메타버스사업담당을 선임했다. 신임 양 CO장은 SK텔레콤..."
1675,"셀바스AI, 음성합성 기술 적용 'AI 상담사' 보이스 공개",2022.01.11.,"인공지능(AI) 전문기업 셀바스AI가 AI음성합성 기술을 적용한 'AI 상담사' 보이스를 공개했다. 셀바스AI의 AI 상담사 보이스는 상담원의 발화 스타일을 그대로 구현해 만족도 높은 상담이 가능하다. AI 상담사 보이스는 이미 이동통신사의 비대면 언택트 매장, 금융권 등에 공급돼 경쟁력을 인정받고 있다...."
1676,한화시스템 AI 기술로 국방 클라우드 시장 공략,2022.01.20.,한화시스템이 차세대 국방 클라우드 기술인 ‘에지 인공지능(AI) 시스템’ 개발을 통해 국방 클라우드 시장에 본격 진출한다. 한화시스템은 4일(현지시간) 미국 라스베이거스 ‘CES 2022’ 행사장에서 지능형 사물인터넷(AIoT) 전문기업 펀진과 에지 AI 시스템 개발 협력을 위한 업무협약(MOU)을 맺었다. 에지 AI...
1677,"하나손해보험, 업계 최초 인공인간 AI휴먼 기술도입",2022.01.12.,인공지능 전문 기업인 '딥브레인AI'가 보유한 딥러닝 기반의 영상 합성기술을 통해 실제 사람과 유사한 수준으로 AI 휴먼을 구현할 수 있다. 또한 실시간 대화까지 가능한 대화형 AI 휴먼 영상 제작이 가능하다. 사람이 매번 영상을 직접 촬영할 필요없이 실시간 영상 합성 신기술을 활용하여 간단한 텍스트...
1678,"CJ올리브네트웍스, 광주과학기술원 HPC-AI 공용 인프라 구축 사업 수주",2022.01.12.,CJ올리브네트웍스는 광주과학기술원(이하 지스트)가 운영하는 고성능 컴퓨팅 기반 인공지능(HPC-AI) 공용 인프라 구축 사업을 수주했다고 밝혔다. 지난해 지스트는 인공지능 중심 산업융합 집적단지 조성사업의 일환으로 인공지능산업융합사업단이 주관하는 HPC-AI 공용 인프라 구축사업의...
1679,"코웨이 노블 정수기 품질, 인공지능이 인증했다",2022.01.12.,코웨이는 프리미엄 디자인 노블 정수기가 국내 최초로 'AI+(에이아이플러스)' 인공지능 품질 인증을 획득했다고 12일 밝혔다. 한국표준협회가 주관하는 AI+ 인증은 국내 유일 인공지능 품질 인증이다. 국제표준규격을 기반으로 인공지능 제품의 신뢰성·안전성 등에 대한 품질 수준을 평가해 인증한다. 코웨이...
1680,"우리자산운용, '우리 AI ESG 액티브 ETF'상장",2022.01.05.,"특히 국내 상장된 기존 ESG ETF들과 가장 큰 차이점은 인공지능(AI)을 기반으로 ESG 종목을 평가·분석한다는 것이다. CI=우리자산운용 기존 방식은 정보의 적시성이 다소 떨어질 수 있다는 단점이 있는 반면, 인공지능(AI) 기반의 ESG분석은 기업평가 및 투자 대상 종목 선정에 보다 정확하고 신속하게..."
1681,순천향대-충남도교육청. 인공지능 융합교육 전문인력 양성 협약,2022.01.11.,순천향대학교가 11일 대학 본관 회의실에서 충남도교육청과 인공지능 융합 교육 전문 인력 양성을 위한 업무협약을 체결했다.순천향대는 이번 협약에 따라 충남도교육청 소속 교사의 교육 기회 확대와 인공지능 기초 소양 능력 향상을 위한 ‘AI(인공지능) 융합교육학과’ 신설·운영한다.‘AI 융합교육학과’...
1682,"""AI 큐아이가 해오름극장 좌석 안내합니다""…국내공연장 최초 도입",2022.01.11.,박정환 문화전문기자 = 인공지능(AI) 문화해설 로봇 '큐레이팅 봇(큐아이)'가 국립극장 해오름극장에서 서비스를 본격적으로 시작한다. 큐아이가 국내 공연장에 도입된 것은 이번이 처음이다. 국립극장은 오는 14일 국립국악관현악단 '2022 신년 음악회'부터 '큐레이팅 봇(큐아이)'을 정식 운용한다고 밝혔다....
1683,"""AI로봇과 연주… 예술과 기술 벽 허물어야 진짜 치유""",2022.01.06.,"베토벤 바이올린 협주곡 10개를 바탕으로 인공지능(AI)가 만든 11번째 협주곡을 연주하기도 했고, AI 로봇과 함께 공연을 펼치지고 했다""며 이같이 말했다. 박지혜는 지난해 10월 한국콘텐츠진흥원이 운영하는 콘텐츠문화광장 스테이지66에서 4차 산업혁명시대 문화예술과 기술의 융복합을 소개하는 프로젝트로..."
1684,모더나 공동 설립자 “디지털 생물학 시대 도래”…AI 신약 기술 기업에 쏠리...,2022.01.12.,중요한 건 AI(인공지능) 및 머신러닝의 역할이다.” 지난 13일(현지 시각) 누바 아페얀 모더나 공동 설립자 겸 플래그십 파이어니어링(Flagship Pioneering) 대표가 자사 홈페이지에 올린 신년사에서 한 말이다. 플래그십 파이어니어링은 미국 바이오·헬스케어 전문 벤처캐피탈(VC)이다. 누바 아페얀은...
1685,"LG전자, AI 적용 ‘가정용 환기시스템’ 출시",2022.01.12.,LG전자는 인공지능(AI)이 최적 운전 조건을 찾아 자동으로 집안 공기를 관리해주는 가정용 환기시스템을 13일 출시했다고 밝혔다. 이 제품은 실내 공기를 바깥으로 배출하고 필터를 거친외부 공기를 집 안으로 공급한다. 이용자는 환기시스템을 통해 미세먼지가 심한 날이나 냉난방 중일 때도 창문을 열지...
1686,'주문'부터 '배송까지…카카오 AI 타고 달린다 [IT돋보기],2022.01.12.,"카카오 IT서비스 전문 자회사 카카오엔터프라이즈가 인공지능(AI) 기반 물류 생태계 구축에 나선다. 카카오엔터프라이즈는 오는 상반기 중 물류 비즈니스 플랫폼 카카오i 라스(LaaS)를 출범한다. 지난달부터 비공개 베타 테스트(CBT)를 진행 중이다. 또 최근 hy, 중앙일보, 이지스자산운용 등으로부터 총 620억원..."
1687,"코웨이 노블 정수기 4종, AI 품질 인증 획득",2022.01.12.,코웨이는 12일 노블 정수기가 업계 최초 인공지능(AI) 품질 인증을 획득했다고 12일 밝혔다. 한국표준협회가 주관하는 AI+ 인증은 국내 유일의 인공지능 품질 인증으로 국제표준규격을 기반으로 AI 제품의 신뢰성·안전성 등에 대한 품질 수준을 평가하여 인증하는 제도다. 코웨이 노블 정수기 4종(빌트인...
1688,"SK㈜ C&C, 국내 최초 'AI 뇌출혈 판독 공공의료서비스 구축한다",2022.01.17.,"SK㈜ C&C는 17일, 평창군보건의료원과 함께 인공지능(AI) 기반 뇌출혈 판독 솔루션 '메디컬 인사이트 플러스 뇌출혈 적용 협약식'을 진행했다고 밝혔다. SK㈜ C&C가 자체개발한 인공지능 기반 뇌출혈 판독 솔루션 '메디컬 인사이트 플러스 뇌출혈'은 뇌 CT영상을 수초 내로 분석해 97% 이상 정확도로 출혈..."
1689,"전현희 ""메타버스·AI 활용해 2030년 디지털 국민권익 플랫폼 구축""",2022.01.11.,"전 위원장은 ""이를 위해 2021년 1월3일 국회에서 발의된 '디지털 국민신문고법' 제정에 박차를 가해 디지털 국민권익 플랫폼 대도약을 위한 기반을 마련하고, 디지털 국민신문고, 디지털 국민생각함, 디지털 국민권익 빅데이터 분석 시스템에 메타버스, 블록체인, AI(인공지능) 등 디지털 신기술을 반영해 '디지털..."
1690,"셀바스 AI, 음성합성 기술 적용한 'AI 상담사' 보이스 공개",2022.01.11.,"인공지능(AI) 전문기업 셀바스AI(KOSDAQ 108860)가 AI음성합성 기술을 적용한 'AI 상담사' 보이스를 공개했다고 11일 밝혔다. 셀바스AI의 'AI 상담사' 보이스는 상담원의 발화 스타일을 그대로 구현해 만족도 높은 상담이 가능하다. 'AI 상담사' 보이스는 이미 이동통신사의 비대면 언택트 매장, 금융권 등에..."
1691,[IT큐레이션] 흔들리는 비트코인과 AI...유토피아의 배신,2022.01.10.,"IBM의 왓슨 포 온콜로지 등 의료 AI 솔루션들은 국내 부산대병원 등에 도입되며 큰 기대를 받았으나 현장에서는 ""쓸모가 없다""는 반발이 컸다. 의료 현장을 누비는 인공지능의 새로운 미래를 믿었던 사람들에게는 커다란 배신이다. 여기에 그치지 않는다. 지구촌 시대와 함께 수요와 공급의 큰 틀에서 세계를..."
1692,[CEO 투데이] '구광모의 진격' LG엔솔 흥행 이어 AI사업 키운다,2022.01.02.,"최근 인공지능(AI)에 꽂힌 구 회장은 과감한 투자를 결행하고 있다. 그는 AI가 신성장동력인 모빌리티, 로봇사업에 핵심인 만큼 공을 들이는 중이다. ◆LG엔솔 IPO 흥행은 예정된 빌드업 21일 금융투자업계에 따르면 19일 마감된 일반 투자자 공모 청약에서 LG에너지솔루션은 114조원 이상의 청약 증거금을..."
1693,"오라클 ""실제 비즈니스에 접목 가능한 AI 서비스 제공""",2022.01.02.,"문제는 이처럼 방대해진 비정형 데이터를 활용하려면 SQL 쿼리가 아니라 인공지능(AI)/머신러닝(ML) 기술이 반드시 필요하지만, 여태껏 시장에서는 AI/ML 활용이 '치와와'와 '머핀'을 구분하는 수준에 머물러 있어 실제 비즈니스에 적용하기 어려웠다는 평가가 많았다. 이에 오라클은 단순히 특정..."
1694,"AI·IoT 기술에 로봇까지 총출동… 삼성, 맞춤형 미래생활 제안 [CES 2022]",2022.01.07.,"삼성전자가 5~7일(현지시간) 미국 라스베이거스에서 열리는 세계 최대 가전·정보기술(IT) 전시회 'CES 2022'에서 인공지능(AI)·사물인터넷(IoT)·5세대(G) 등 혁신기술을 바탕으로 사용자 맞춤형 솔루션을 구현하고, 고객경험을 연결하는 미래 라이프스타일을 제안한다. 삼성전자는 라스베이거스 컨벤션센터(LVCC)..."
1695,"KAIST, 세계 첫 그래프 기반 AI 추론 가능한 SSD 개발···“엔비디아 GPU 성...",2022.01.07.,국내 연구진이 미국 반도체 제조업체 엔비디아의 최신 고성능 그래픽처리장치(GPU) 보다 7배 뛰어난 성능의 그래프 기반 인공지능(AI) 추론이 가능한 솔리드스테이트드라이브(SSD) 가속기를 개발하는데 성공했다. 한국과학기술원(KAIST)은 정명수(사진) KAIST 전기및전자공학부 교수 연구팀이 세계 최초로...
1696,"신한銀, CES2022 AI뱅커 활용 금융서비스 시연",2022.01.07.,신한은행이 금융권 최초로 국제전자제품박람회 'CES 2022'에 참가해 인공지능(AI) 뱅커를 활용한 혁신 금융서비스를 시연했다고 7일 밝혔다. 이번 CES에서 신한은행은 지난달 서소문 디지로그 브랜치에 설치한 AI 기반 업무안내 서비스기기인 'AI 컨시어지'와 실시간 화상상담 시스템 '디지털데스크'를...
1697,"세종사이버대 컴퓨터·AI공학과, 오는 15일 언택트 창업 특강 개최",2022.01.02.,"세종사이버대 컴퓨터·인공지능(AI)공학과는 오는 15일 경영학부 경영학과와 유통물류학과, 경영대학원 MBA학과와 공동으로 데이터·기술 사업화를 위한 언택트 창업 특강을 연다고 10일 밝혔다. 이번 창업 특강은 창업자 및 예비 창업자를 대상으로 ‘끌리는 사업계획서 작성 노하우’, ‘데이터 기반 혁신..."
1698,"SKT, CES서 'AI 반도체·싱글랜' 탄소저감 기술 공개",2022.01.09.,"AI 반도체는 인공지능 서비스 구현에 필요한 대규모 연산을 초고속, 저전력으로 실행하는 비메모리 반도체로 인공지능의 핵심 두뇌에 해당한다. 인공지능 서비스가 생활과 산업 전반에 빠르게 확대되면서 AI 데이터센터의 규모도 연일 증가하고 있다. 기존 AI 데이터센터는 그래픽 정보 처리를 위해..."
1699,[CES 2022] '고객 경험' 강조한 LG전자…AIㆍ로봇 등 미래비전 제시,2022.01.07.,"이투데이=노우리 기자 | 4일 온라인 통해 ‘LG 월드 프리미어’ 개최 고객경험 혁신, 인공지능 등 미래사업 강조 AI 기반 자율주행차 콘셉트 ‘옴니팟’ 공개 LG전자가 혁신적인 라이프스타일과 미래 비전을 소개하는 ‘LG 월드 프리미어(LG World Premiere)’를 개최한다. 온라인으로 진행하는 이번..."
1700,"추미애 ""'AI 윤석열' 등장, 국민 통제 디지털 독재 현실로""",2022.01.10.,"기사내용 요약""검찰당·AI대통령 국민 지배 땐 2030 미래 끔찍"" 홍준표에 맞장구 ""역사 위험 빠트리지 않을 책무"" 더불어민주당 명예선대위원장인 추미애 전 법무부 장관은 9일 'AI 윤석열'에 대해 ""앞으로 개개인의 취향이나 생각을 인공지능 알고리즘으로 파악해 국민을 통제할 수 있는 디지털 독재가 픽션이..."
1701,"[연중 기획 혁신창업의 길] AI인간의 진화, 앵커·은행원·상담원도 척척",2022.01.20.,"가로 68㎝, 세로 1m20㎝의 55인치 디스플레이 속에 청바지를 입은 중년 남자 모습의 인공지능(AI) 인간이 등장했다. 한국어·영어·중국어·일어 4개 국어로 말을 하고, 업무와 관련한 대화도 무리 없이 이끌어간다. 말을 할 때 얼굴 표정과 손짓도 실제 인간처럼 자연스럽게 살아있다. 음성·시각·언어 등..."
1702,"CJ올리브네트웍스, 광주과학기술원 'HPC-AI' 공용인프라 구축 사업 수주",2022.01.13.,CJ올리브네트웍스가 광주과학기술원(이하 지스트)에서 운영하는 고성능 컴퓨팅 기반 인공지능(HPC-AI) 공용인프라 구축 사업을 수주했다고 1월 20일 밝혔다. 지난해 지스트는 인공지능 중심 산업융합 집적단지 조성사업의 일환으로 인공지능산업융합사업단이 주관하는 HPC-AI 공용인프라 구축사업의...
1703,"AI두뇌 달고 인간과 교감… 서비스로봇, 비대면 시대 누빈다 [2022 신년기획]",2022.01.06.,특히 인공지능(AI) 기술을 활용해 사람과 교감하며 원하는 대로 움직이면서 다양한 서비스를 제공하는 로봇 출원이 전체 출원의 36% 정도를 차지하는 것으로 나타났다. 2011~2020년 최근 10년간 전체 가사 서비스용 로봇 특허 출원 1622건 중 대기업이 가장 많은 647건으로 약 40%를 차지했다. ■협동로봇...
1704,부산교육청 '인공지능 부산을 알려줘' 중학교 배포,2022.01.06.,부산시교육청은 지역문화로 인공지능(AI) 개념을 학습하고 지역의 사회문제를 해결하는데 도움을 주는 중학교 교과서를 발간했다. 시교육청은 '인공지능 부산을 알려줘'를 발간해 지역 내 중학교에 배포했다고 6일 밝혔다. 부산시교육청에서 배포한 중학교 교재 '인공지능 부산을 알려줘' 표지 2022.01.06...
1705,"SK지오, ‘친환경 수거 스테이션’ 구축한다…AI 로봇이 쓰레기 선별",2022.01.12.,"SK지오, ‘친환경 수거 스테이션’ 구축한다…AI 로봇이 쓰레기 선별 SK이노베이션의 화학 사업 자회사인 SK지오센트릭이 19일 경기도 화성시 및 친환경... 네프론은 캔과 페트병 등을 선별적으로 처리하는 로봇으로, 인공 지능 알고리즘이 적용돼 오염된 쓰레기나 재활용이 어려운 쓰레기도 구분할 수 있다...."
1706,당신 옆자리엔 어떤 AI동료가 앉아 있나요,2022.01.12.,"서류업무, 택배 처리 과정도 전부 디지털 전환해 효율 높이고 사고 줄여 CJ대한통운, AI로 화물선 도착시간 예측 등 물류 전과정 효율화 박차 로봇과 인공지능(AI), 데이터를 기반으로 한 스마트 물류가 유통산업은 물론 개인의 생활 방식까지 변화시키고 있다. 혁신 물류기술의 현주소와 우리 삶에..."
1707,"인공지능 가상 인플루언서, LG전자 '래아' 뮤지션으로 전격 데뷔한다",2022.01.05.,"LG전자가 인공지능(AI) 기술을 활용해 구현한 가상 인간 '래아킴(REAH KEEM. 이하, 래아)'이 뮤지션으로 전격 데뷔한다. LG전자는 지난달 엔터테인먼트 콘텐츠 기업 미스틱스토리와 래아의 뮤지션 데뷔를 위한 업무협약(MOU)를 체결했다. 업무협약에 따라 래아는 미스틱스토리의 '버추얼 휴먼 뮤지션..."
1708,"KT, 커피명가에 AI 통화비서 서비스 제공",2022.01.05.,"KT는 커피명가가 운영하는 프리미엄 매장인 커피명가 본을 포함한 전국 40개 커피명가 매장에 ‘KT AI(인공지능) 통화비서'를 도입한다고 5일 밝혔다. 커피명가는 1990년 핸드드립 전문점으로 시작한 국내 1세대 커피 업체다. 생두 직거래에서 로스팅, 유통, 카페 컨설팅까지 사업을 확대한 곳이다. KT는..."
1709,"[CES 2022] 삼성전자, AI·IoT 통해 연결성 극대화…고객 맞춤 솔루션 제안",2022.01.20.,삼성전자는 오는 5일부터 7일까지(현지 시간) 미국 라스베이거스에서 열리는 세계 최대 IT·가전 전시회 ‘CES(Consumer Electronics Show) 2022’에서 인공지능(AI)·사물인터넷(IoT)·5세대 이동통신(5G) 등 혁신 기술을 바탕으로 사용자 맞춤형 솔루션을 구현하고 고객 경험을 연결하는 미래...
1710,흉부 X-ray 검사로 골다공증 위험 예측하는 AI 알고리즘 개발 外,2022.01.20.,"서울아산병원 융합의학과 김남국ㆍ내분비내과 고정민 교수, 아산융합의학원 장미소 연구원팀은 간단한 흉부 X-ray 검사 영상으로 약 90%의 정확도로 골다공증 고위험군을 선별해내는 딥러닝 인공지능 알고리즘을 개발했다고 최근 밝혔다. 골다공증을 정확하게 진단하기 위해서는 골밀도 검사를 해야 한다...."
1711,"SK ICT 3사 초연합 선언, AI 반도체 글로벌 시장 진출 추진",2022.01.09.,"SK스퀘어와 SK텔레콤(SKT), SK하이닉스가 반도체와 5세대 이동통신(5G), 인공지능(AI) 분야를 아우르는 3사간 연합체를 1월부터 운영해 국내외 ICT 분야 공동 연구·개발(R&D)과 글로벌 투자를 추진한다. SK의 ICT 초연합 출범은 반도체-5G-AI 융합이 가속화하는 시장 변화에 대응하고 반도체와 통신, 투자를..."
1712,"딥브레인AI, 글로벌 리테일 전시 ‘NRF 2022′ 참가",2022.01.14.,"인공지능전문 기업 딥브레인AI(대표이사 장세영)는 오는16일부터18일까지 사흘간 미국 뉴욕에서 열리는 ‘NRF 2022’에 참가한다고14일 밝혔다. NRF 2022는 전미 소매 협회(National Retail Federation)가 주최하는 세계 최대 규모의 리테일 유통 전시회다.세계 각국의IT,반도체,금융,생활용품,가구 등 산업군의..."
1713,"파리크라상, 서강대와 AIㆍ빅데이터 연구 협력",2022.01.07.,"사진=파리크라상 파리바게뜨를 운영하는 파리크라상은 6일 서강대학교와 AI(인공지능)ㆍ빅데이터 연구 협력을 위한 업무협약(MOU)을 체결했다. 파리크라상은 이번 협약을 통해 서강대와 함께 푸드 프랜차이즈에 특화된 고유의 AI 수요 예측 모델을 연구개발하고, 최신 ICT 기술을 이용한 다양한 협력을 도모할..."
1714,"인공지능이 치료에 적용될 수 있을까…인공지능과 치료, 그리고 게임",2022.01.12.,"의료에 비유하자면 AI가 남녀의 문자를 확인하고 '잘 된다/남자 쪽이 더 좋아한다'와 같은 예측을 해주는 인공지능은 진단 AI, '이런 문자를 보내야 성공한다'라고 다음 '수'의 추천까지 해줄 수 있는 것은 치료/행동 추천 AI에 대응시킬 수 있겠다. 그리고 이 둘은 단순 비유가 아니라 기술적으로 실제 상동하다...."
1715,AI·SW 인재 확대… 메타버스 융합대학원도 설립,2022.01.12.,"정부, AI 융합혁신 대학원 5곳 선정 3285억 원 투입해 2만1500명 양성 군 장병 2000여 명 온라인 교육 추진 과학기술정보통신부(과기정통부)는 올해 인공지능(AI)과 소프트웨어(SW) 분야 인재양성에 3285억 원을 투입해 총 2만1500명의 인재를 키우기로 했다고 12일 밝혔다. 정부는 AI 융합혁신 인재양성 사업을..."
1716,"[특징주]솔트룩스, 애플 메타버스 본격 진출 전망에 국내 최고의 인공지능 관...",2022.01.12.,"솔트룩스는 방대한 빅데이터 분석과 인공지능(AI)기술을 결합해서 활용해 다양한 소프트웨어, 플랫폼 서비스를 제공하는 회사다. 13일 오후 2시 3분 현재 솔트룩스는 전 거래일 대비 1150원(7.35%) 오른 1만6750원에 거래 중이다. 12일(현지 시각) 월스리트저널(WSJ)은 최근 애플의 주가 상승에 대해 “투자자들과..."
