,제목,날짜,본문
624,"SK텔레콤 ""메타버스에 새 경제체제 도입…AI '슈퍼앱'도 낸다""",2022.03.28.,"유 대표는 이날 SK텔레콤이 주요 신사업으로 추진 중인 ‘인공지능(AI) 에이전트’에 대한 청사진도 내놨다. 그는 “AI에이전트는 미디어·모빌리티·전화·문자 등 여러 분야 서비스를 하나로 묶어 대화형 AI 캐릭터를 통해 제공하는 ‘슈퍼앱’이 될 것”이라며 “AI에이전트와 이프랜드, 구독서비스..."
625,"LG, 美미시간에 첫 글로벌 AI 연구센터",2022.03.28.,초대 센터장은 미시간대 교수 출신으로 세계 10대 인공지능(AI) 석학으로 꼽히는 이홍락 CSAI(최고AI과학자)가 맡았다. LG AI연구원은 23일 미시간대와 AI 선행 기술을 연구하고 세계적인 연구 협력 생태계를 주도할 LG AI리서치센터를 설립했다고 밝혔다. 지난 2월 미시간대 AI랩과 AI 선행기술 공동연구 및...
626,"틸론-서강대, AI·SW 인재 위해 '맞손'...AI 연구역량 강화",2022.03.28.,서강대학교 대학원 인공지능학과 AI융합전공 내 ‘메타버스 및 가상화 과정’ 개설 틸론은 서강대학교와 AI·Software 우수인재 양성 및 산학협력을 위한 업무협약을 맺었다고 밝혔다. 틸론과 서강대학교는 이번 협약을 통해 서강대학교 대학원 인공지능학과 AI융합전공 내에 ‘메타버스 및 가상화 과정을 개설해...
627,"테스트웍스, AI 데이터 품질 검증 도구 'ADQ' 베타버전 공개... ""데이터 셋 오...",2022.03.28.,"│이미지 제공-테스트웍스 ㈜테스트웍스(대표 윤석원)는 30일, 구축된 데이터 셋의 오류를 검증 및 분석하는 인공지능 데이터 품질 검증 전문 도구인 'ADQ' 베타버전을 발표했다. 인공지능의 서비스 상용화 및 성능 향상을 위한 품질 좋은 데이터 확보를 위해서는 데이터 구축 시점부터 품질에 대한 지속적인..."
628,골절 진단 AI 임상 가능성 입증…전문의와 차이 없어,2022.03.28.,골절 진단 보조를 위한 의료 인공지능(AI)이 이미 전문의 수준까지 발전한 만큼 충분히 임상에서 활용 가능하다는 연구 결과가 나왔다.대규모 메타분석 연구를 통해 유효성을 검증한 것으로 정확도 면에서 이미 차이가 없는 만큼 응급 상황 등에 활용 방안을 찾아야 한다는 것이 연구진의 설명이다.골절...
629,"글로벌텍스프리, AI 음성인식 번역플랫폼 1위 엘솔루 인수로 데이터 사업 본격...",2022.03.28.,"글로벌텍스프리가 인공지능(AI) 기반의 음성인식 및 번역플랫폼 1위 기업 엘솔루 인수를 마무리하고 본격적인 AI사업에 나선다. 31일 금융감독원 전자공시에 따르면 글로벌텍스프리는 이날 엘솔루 지분 52만5,500주의 대한 잔금을 납입하고 최대주주에 올라섰다. 엘솔루는 국내 음성 인식 및..."
630,"스마일게이트 AI센터, AI 평가 플랫폼 휴릭 공개",2022.03.24.,"AI 센터에서 첫 공개하는 휴릭은 인공지능에 기반한 다양한 언어 모델을 평가, 연구하며 그 결과를 공유하는 평가 플랫폼이다. 휴릭은 '인간다움'에 대한 탐구를 목적으로 실제 인간처럼 상호작용 할 수 있는 인공지능 언어 모델을 만들기 위해 데이터를 구축하고 평가한다. 이를 위해 AI센터는 인간처럼..."
631,"""짝퉁 NFT, AI로 식별한다""...마크비전, NFT 모니터링 서비스 오픈",2022.03.24.,인공지능(AI) 전문 기업 마크비전은 저작권·상표권 등 IP 권리자들이 NFT 거래소 내 IP 무단 도용 현황을 파할 수 있는 글로벌 NFT 모니터링 서비스를 출시했다고 29일 밝혔다. ⓒ마크비전 가짜 NFT(대체불가능토큰)를 탐지하고 삭제 신고할 수 있는 NFT 모니터링 서비스가 등장했다. 인공지능(AI) 전문...
632,"LG CNS, 중학생에 AI 교육한다…전국 30개 학교, 3000명 대상",2022.03.24.,"LG CNS는 24일 중학생 대상 인공지능(AI) 교육 프로그램인 ‘AI 지니어스’를 진행한다고 밝혔다. LG CNS에 따르면 AI 지니어스는 전날 서울 인헌중학교를 시작으로 연말까지 30개 학교, 중학생 3000여명에게 AI 교육을 무료 제공한다. 대상 학교에는 농어촌 지역 학교와 특수 학교를 포함한다. 지난해까지..."
633,AI 강군 육성 위해 전문연구요원 대체복무 확대 검토,2022.03.24.,인수위와 병무청은 인공지능(AI) 과학기술 강군 육성을 위해 필요한 전문연구요원을 확대하고 효율적으로 활용하는 방안을 다뤘다. 전문연구요원이란 연구기관에서 과학기술 연구나 학문 분야에 36개월간 종사함으로써 군 복무를 대체하는 제도다. 현행 편입 대상은 석사 이상 학위를 취득한 사람(석·박사학위...
634,"인수위, 해양경찰청 업무보고...빅데이터･인공지능 기반 해상교통 관제망 강...",2022.03.25.,"특히, 연안재해 및 해양사고로부터 국민의 안전을 위해 연안 취약해역 집중관리, △ 인명구조･구급체계 개선과 빅데이터･인공지능(AI) 기반의 해상교통 관제망 강화 등 다양한 대책을 보고하였다. 인수위원들은 위성 등을 활용한 해양감시체계 및 해양정보융합 플랫폼 구축 관련, 관계부처와의 협조를..."
635,"경남은행, AI부동산 서비스 출시…인공지능 기반 부동산정보 추천",2022.03.24.,"경남은행은 모바일뱅킹 애플리케이션(앱)을 통해 고객들에게 AI(인공지능) 기반의 아파트, 주택 등 맞춤형 부동산정보를 추천한다. 전국의 청약 정보, 등기 변동내역 실시간 안내, 부동산 신용보고서 서비스도 제공한다. 기존에 대면으로 처리하던 확정일자 신청 및 전입신고를 비대면에서 신청할 수 있도록..."
636,"JW중외제약, 온코크로스와 AI 혁신신약 공동개발",2022.03.24.,JW중외제약이 인공지능(AI) 신약개발 벤처인 온코크로스와 AI기반 혁신신약 개발을 위한 공동연구계약을 체결했다고 24일 밝혔다. 이번 계약에 따라 온코크로스의 AI 플랫폼인 '랩터(RAPTOR) AI'를 활용해 JW중외제약이 개발하고 있는 신약 파이프라인의 신규 적응증을 탐색하고 검증한다. 랩터(RAPTOR) AI는...
637,[조간브리핑]의상제작부터 집필까지···AI의 한계는?,2022.03.24.,"바둑 인공지능(AI) 알파고 개발사인 딥마인드는 지난달 초 인간 소프트웨어(SW) 개발자 수준의 코딩 능력을 보유한 AI 알파코드의 실력을 공개했다. 영국 BBC 등에 따르면, 알파코드는 인간 개발자 수만 명이 실력을 겨누는 프로그래밍 대회에 총 10차례 출전한 결과, 평균 성적이 상위 54% 안에 들었다고 한다...."
638,"[클라우드 2022] ""AI 프로젝트 난항?...구글 머신러닝 데이터로 극복""",2022.03.24.,"관련 인력이 있으나, 인프라 구축이 어렵거나 돈과 시간을 절약하고 싶다면 구글의 인공지능 플랫폼 버텍스(Vertex) AI를 이용하면 된다. 데이터 사이언티스트가 인공지능 모델을 관리하고 평가하는 툴을 제공하기 때문에 전체 작업시간을 줄일 수 있고 데이터 사이언티스트 간 협업도 가능하다."
639,"포항시·포항공대 등 4개 기관, 빅데이터 AI혁신센터 건립",2022.03.24.,"경북 포항시와 포항공대(포스텍) 등이 빅데이터 AI(인공지능)혁신센터를 만들어 데이터 전문기업과 인재를 육성하기로 했다. 시는 23일 시청에서 포항공대, 포항공대 인공지능연구원, 포항테크노파크와 '빅데이터 AI혁신센터' 설립을 위한 협약을 맺었다. 4개 기관은 올해부터 5년간 200억원을 들여 포항공대..."
640,"LG CNS, 중학생 3000명에게 AI 교육 무상 제공",2022.03.24.,"LG CNS가 중학생 3000명에 인공지능(AI) 교육을 무상 제공한다. LG CNS는 정보기술(IT) 꿈나무 양성을 위한 중학생 대상 디지털전환(DX) 사회공헌 프로그램 'AI지니어스'를 실시한다. AI지니어스는 연말까지 30개 학교, 3000여명 중학생에 AI 교육을 무료로 제공하는 게 핵심이다. 23일 서울시 인헌중학교를..."
641,SK텔레콤 AI 서비스 컴퍼니 진화 가속···메타버스 수출 가시권,2022.03.24.,"SK텔레콤이 인공지능(AI)과 메타버스 중심의 AI 서비스 컴퍼니로 도약을 선언했다. SK텔레콤메타버스 플랫폼 이프랜드는 유럽, 중동, 아시아 등 통신사와 협력을 통한 글로벌시장 진출이 초읽기에 돌입한 것으로 나타났다. SK텔레콤은 25일 을지로 본사 T타워에서 제 38기 주주총회를 열고 △2021년..."
642,"KT, 주거문화 트렌드 변화 세미나…AI 주택형 솔루션 소개",2022.03.24.,"세미나에 참석한 주택조합 및 시행사 관계자들은 최근 주택시장에서 관심이 높은 인공지능(AI) 기술로 안전하고 편리한 생활 환경을 구축할 수 있는 'AI 주택형 솔루션'에 대한 관심이 높았다. AI 주택형 솔루션은 아파트는 물론 오피스텔, 빌라, 타운하우스 등 중소형 주택단지 에도 인공지능 서비스를..."
643,"LG AI 연구원, 美 미시간주에 리서치센터 설립",2022.03.25.,AI(인공지능) 연구와 관련한 글로벌 네트워크를 확대하기 위한 포석이다. LG AI 연구원은 미시간주 앤아버에 ‘LG AI 리서치센터’를 신설했다고 23일 발표했다. 세계적인 AI 석학인 이홍락 CSAI(최고 AI 과학자·Chief Scientist of AI)가 센터장을 맡아 선행 기술 연구를 이끈다. 올해 초 연구원에 합류한...
644,"수성대학교, ""빅데이터‧AI 기반의 학습 데이터 교육과정 인재양성 매진한다""",2022.03.25.,"빅데이터‧AI 기반의 학습 데이터 교육과정 개발과 인재양성을 위한 협약을 맺었다.(사진제공=수성대학교) 수성대학교(총장 김선순)는 ""MBL센터(Mega Beauty Leader Center)를 중심으로 헬쓰‧뷰티 등 전통 서비스산업 학과와 관련된 산업의 인공지능 학습 데이터 작업을 실시하고 있다""고 밝혔다. 또..."
645,"[금일 의료·제약 주요기사] ""정부, 4차접종 검토"" 중증·사망률 높은 고령층...",2022.03.22.,아울러 한국제약바이오협회는 인공지능(AI) 기술로 신약 개발 주기를 15년에서 7년으로 줄일 수 있다는 전망과 함께 올해 하반기 신약 연구자를 위한 AI 플랫폼 출시 계획을 밝혔다. 이밖에 화이자사의 코로나19 먹는 치료제(경구용 치료제) '팍스로비드' 4만5천명분이 이달 말 추가로 국내에 도착한다는...
646,"AI로 말하는 인간…이안 쳉 “BTS, 칼 융 소재로 한 음악에 영감”",2022.03.24.,"인공지능(AI)과 게임 엔진을 통해 구축했기에 가능한 세계다. “하나의 살아있는 작품을 만들기 위해 끊임없이 플레이되는 방식을 구현했어요. 아무리 단순한 생명체라도 살아있는 모든 것은 예측 불가능한 점을 가지고 있어요. 그러한 예측불가능이 복잡성을 만들고, 그 복잡성이 흥미를 가져다 준다고..."
647,“너무나 복잡한 인간 의식...AI를 활용 안할수 없었죠”,2022.03.24.,"라이브 시뮬레이션은 가상의 생태계 속에서 인공 지능을 가진 등장인물과 자연환경이 서로 반응하면서 사건이 일어나는 것을 보여주는 형식이다. 이안... ‘인간의 의식’을 끊임없이 탐구하고, AI를 통해서도 인간의 존재 의의를 찾는다. 작가는 “어린 시절부터 인간 의식의 탐구에 대한 관심이 컸다”며..."
648,"엔씨소프트, GDC에서 강화학습 AI 기술 리니지 적용 사례 발표",2022.03.24.,회사는 인공지능 서밋에 참여해 다중접속온라인역할수행게임(MMORPG)에 적용한 인공지능(AI) 강화학습 모델을 발표했다. 엔씨소프트에 따르면 회사가 연구한 AI 강화학습 모델은 PC 온라인 게임 ‘리니지’에 실제로 도입해 운영한 콘텐츠다. 수십 명 단위의 AI가 전투를 수행하는 콘텐츠를 상용화...
649,"JW중외제약, 온코크로스와 AI 신약 개발 나선다",2022.03.24.,JW중외제약이 인공지능(AI) 기반 신약개발에 도전한다. JW중외제약은 AI 신약개발 벤처기업 온코크로스와 AI 기반의 혁신신약 개발을 위한 공동연구계약을 체결했다고 24일 밝혔다. 양사는 이번 계약에 따라 온코크로스의 AI 플랫폼인 ‘랩터 AI’를 활용해 JW중외제약이 개발하고 있는 신약 파이프라인의 신규...
650,"SKT ""통신 기반 'AI+메타버스' 등 5대 사업군으로 확장""",2022.03.24.,25일 정기 주주총회 유무선 통신·미디어 사업·엔터프라이즈 사업 ·AI버스(인공지능+메타버스)·커넥티드 인텔리전스 사업 계획 발표 ESG 경영 선도 SK텔레콤(SKT)이 ‘SKT 2.0시대’를 선포하며 유무선 통신·미디어 사업·엔터프라이즈 사업 ·AI버스(인공지능+메타버스)·커넥티드 인텔리전스(Connected...
651,울산시교육청 직업계고 인공지능 인재 양성 '박차',2022.03.25.,기사내용 요약울산정보산업진흥원·지역 10개 기업과 3자간 업무협약 고3 희망 학생 30명 선발해 160시간 교육 후 채용 연계 울산시교육청이 직업계고 학생을 대상으로 한 인공지능(AI) 인재양성에 박차를 가한다. 시교육청은 23일 울산정보산업진흥원에서 직업계고 인공지능 인재 양성을 위한 3자간 업무협약을...
652,LG AI 인력·투자 가속…美 리서치센터 신설,2022.03.25.,LG AI(인공지능)연구원이 23일 미국 미시간주앤아버에 'LG AI 리서치센터'를 신설하면서 글로벌 AI 연구 네트워크를 확장한다. LG AI 리서치센터는 LG AI연구원의 첫 글로벌 연구 거점으로 스스로 생각하고 판단하는 AI 등 최신 AI 선행 기술 연구와 글로벌 연구 협력 생태계를 주도하며 LG가 글로벌 AI...
653,"레드햇, 오픈시프트 4.10 발표…AI 지원 강화",2022.03.23.,"레드햇은 엔비디아와 인공지능(AI) 분야 협업을 반영한 레드햇 오픈시프트의 새로운 기능을 23일 발표했다. 새롭게 향상된 기능을 갖춘 ‘레드햇 오픈시프트 4.10’은 엔비디아 AI 엔터프라이즈 2.0 인증을 받았다. AI가 기업의 운영 방식을 바꾸고 있지만, AI 인프라 운영은 복잡하고 시간과 리소스를 많이..."
654,"엔씨·네이버·뤼이드, 학습형 AI 속속 도입",2022.03.23.,게임업체 등 정보기술(IT) 기업들이 학습형 인공지능(AI) 모델을 도입하고 있다. 서비스 이용자의 특성을 고려해 이용자 맞춤형 콘텐츠를 개발하기 위해서다. 엔씨소프트는 미국 샌프란시스코에서 열린 ‘글로벌 게임 개발자 콘퍼런스(GDC) 2022’에 참가해 다중접속역할수행게임(MMORPG)용 AI 강화학습 모델을...
655,"수성대, 전통 서비스산업학과에 빅데이터·AI '융복합 혁신'",2022.03.23.,안경광학과는 수성대 창업보육센터 입주기업인 인터라인과 AR기반의 API서비스를 위한 인공지능 학습 데이터 사업을 실시하고 있다. 또 수성대는 전통학과의 빅데이터·AI 융복합을 통한 고부가가치 창출을 위해 학국지능웰케어산업협회와 빅데이터·AI 기반의 학습 데이터 교육과정 개발과 인재양성을 위한...
656,"인공지능(AI), 아티스트와 만나서 교감을 그려내다!",2022.03.23.,인공지능(AI)과 미디어 아티스트가 합작한 ‘독특한 전시’가 울산에서 열린다. 예술가가 작업한 설치미술 작품 속 화면에 인공지능으로 생성한 이미지 표현방식을 적용했다. 이 화면 속 이미지는 인공지능이 텍스트를 읽고 만들어낸 것들이다. UNIST 교원창업기업 코어닷투데이가 오는 25일부터 4월 3일까지...
657,"수성대, 전통 서비스산업학과에 빅데이터·AI '융복합 혁신'",2022.03.24.,안경광학과는 수성대 창업보육센터 입주기업인 인터라인과 AR기반의 API서비스를 위한 인공지능 학습 데이터 사업을 실시하고 있다. 또 수성대는 전통학과의 빅데이터·AI 융복합을 통한 고부가가치 창출을 위해 학국지능웰케어산업협회와 빅데이터·AI 기반의 학습 데이터 교육과정 개발과 인재양성을 위한...
658,"인공지능(AI), 아티스트와 만나서 교감을 그려내다!",2022.03.24.,인공지능(AI)과 미디어 아티스트가 합작한 ‘독특한 전시’가 울산에서 열린다. 예술가가 작업한 설치미술 작품 속 화면에 인공지능으로 생성한 이미지 표현방식을 적용했다. 이 화면 속 이미지는 인공지능이 텍스트를 읽고 만들어낸 것들이다. UNIST 교원창업기업 코어닷투데이가 오는 25일부터 4월 3일까지...
659,특허 심사도 AI가 한다,2022.03.24.,"특허청은 심사 업무를 위한 ‘인공지능(AI) 특허 검색 시스템’ 시범 서비스를 오는 25일부터 실시한다고 24일 밝혔다. AI 기반 특허 검색 시스템은 심사관이 검색 키워드를 입력하지 않아도 AI가 심사 대상 문서로부터 키워드와 핵심 문장을 자동으로 추출하고, 가장 유사한 선행기술문헌을 검색해 추천한다...."
660,"딥노이드, 의료AI기반 디지털병리 시장 진출",2022.03.25.,의료 인공지능(AI) 플랫폼 전문기업 딥노이드(315640)는 가톨릭대학교 산학협렵단(성모병원) 인공지능 기반 요로상피암 세포병리 진단 알고리즘 모델 개발 계약을 완료하고 솔루션 고도화 및 본격적인 디지털병리(digital pathology)시장에 진출한다고 24일 밝혔다. 디지털 병리는 검체가 포함된 유리...
661,"멋쟁이사자처럼, AI SCHOOL 수강생 모집",2022.03.24.,글로벌 프로그래밍 교육브랜드 ㈜멋쟁이사자처럼은 디지털 현장 실무 역량을 기를 수 있는 인공지능 통합과정 AI SCHOOL 수강생을 4월 18일까지 모집한다고 밝혔다. 멋쟁이사자처럼 국비지원교육 관련 이미지 (사진=멋쟁이사자처럼)5월부터 진행되는 AI SCHOOL은 코로나19 확산 추세에 따라...
662,"""'나만의 챗봇' 만들어요""…LG CNS, 중학생 3000명 AI교육",2022.03.24.,"LG CNS가 중학생을 대상으로 무상 AI(인공지능) 교육을 제공한다. LG CNS는 IT 인재 육성을 위해 자체 개발한 중학생 대상 DX(디지털전환) 사회공헌 교육 프로그램 'AI지니어스'를 진행한다고 24일 밝혔다. 전날 서울 인헌중학교를 시작으로 농어촌·특수 학교 포함 총 30개교, 3000여명에 무료 AI 교육을..."
663,"틸론-서강대, AI∙SW 인재 양성·산학협력 위한 MOU 체결",2022.03.24.,서강대학교 대학원 인공지능학과 AI융합전공 내 ‘메타버스 및 가상화 과정’ 개설 ‘틸론 메타버스 및 가상화 연구 센터’ 공동 설립을 통해 AI 연구역량 강화 클라우드 가상화 선도기업 틸론(대표 최백준)은 서강대학교(총장 심종혁)와 AI∙Software(SW) 우수인재 양성 및 산학협력을 위한 업무협약(MOU)을...
664,경기도 내 어린이집 210곳 AI 로봇 도입,2022.03.24.,인공지능 로봇이 동화책을 읽어 주는 신기술 서비스가 경기도 내 어린이집 210곳에 도입됩니다 경기도는 코로나19로 외부 수업 등의 기회가 줄어든 영유아를 위해 어린이집에 인공지능 로봇을 한 달간 대여하는 사업을 시행한다고 밝혔습니다 제공되는 로봇은 네이버에서 검색할 수 있는 동요와 동화책 등의...
665,"아일리스·나이스디앤비, AI 기반 기업 신용평가 모형 개발",2022.03.28.,인공지능(AI) 전문기업 아일리스(대표 박재현)는 기업신용평가 전문기관인 나이스디앤비(대표 강용구)는 AI 기반의 기업 신용평가 예측 모형을 공동 개발했다고 밝혔다. 기업여신은 소매여신에 비해 데이터의 양과 질이 부족해 머신러닝 기술이 적용되기 어려운 영역으로 여겨져 왔다. 그러나 기존의 기업 여신...
666,"KT AI 실무자격인증, 신한은행 사내 자격증으로 인정",2022.03.28.,"올해 신한은행 임직원 600명 대상 시행 KT와 신한은행은 미래 금융 디지털 전환을 위해 인공지능(AI) 인재 양성에 협력한다고 22일 밝혔다. 이에 따라 신한은행은 KT와 협력해 AI 실무 자격인증 AIFB(AI Fundamentals for Business)를 사내 디지털 자격증 취득 과정으로 도입하고, 상·하반기 각각 300명씩 총..."
667,영광군 '인공지능 스마트 돌봄' 체계 구축,2022.03.28.,"전남 영광군과 미스터마인드 주식회사는 28일 영광형 인공지능(AI) 스마트 돌봄체계' 구축을 위한 업무협약을 체결했다. 이번 협약은 ▲포스트 코로나 시대를 대비한 취약계층 정서적 안정 ▲고독사 예방을 위한 AI(인공지능) 활용 비대면 돌봄서비스 제공 ▲치매, 우울증, 자살 등 노인문제 해결을 위한..."
668,"리턴제로, AI 통화앱 ‘비토’ 숫자·영문자 가독성 개선 업데이트",2022.03.24.,이투데이=심민규 기자 | 날짜·시간·화폐·단위 등 표기를 숫자·영문자로 변환 눈으로 보는 통화 앱 ‘비토(VITO)’를 운영 중인 인공지능(AI) 스타트업 리턴제로는 통화 내용의 가독성을 한층 더 높이는 서비스 업데이트를 진행했다고 28일 밝혔다. 이번 업데이트는 기존의 한글 표기만 사용됐던 비토의...
669,AI가 수학 문제 내고 토익 점수 예측...에듀테크 K스타트업 뜬다,2022.03.24.,"인공지능(AI), 로봇, 가상·증강현실(VR·AR) 등 IT 기술을 총동원해 교육의 질을 끌어올리는 데 주력하고 있다. 잘만 활용하면 지역·계층 간 교육 격차도 줄일 수 있어 교육 당국도 적극 지원하는 모습이다. 교육부는 2006년부터 진행해온 교육 박람회 명칭을 ‘이러닝(e-learning) 코리아’에서 지난 2020년부터..."
670,"강호동·국민과학수사대, AI와 가족 될 수 있을까",2022.03.24.,"'국과대표'에서는 국민MC 강호동이 오마이걸 승희, 코미디언 박성광, 이수진 기자와 함께 국민과학수사대를 결성, 과학 커뮤니케이터로 출연한 장동선 교수와 함께 우리 생활 깊숙이 자리 잡은 인공지능(AI) 기술을 파헤친다. 첫 회에서 '국과대표'는 인간이 과연 인공지능 감정교류를 넘어 가족이 될 수..."
671,"광주시, '인공지능 기반 어린이 상상 놀이터' 부지 5월 선정",2022.03.23.,"인공지능(AI) 기술과 놀이 콘텐츠가 어우러진 가칭 광주 인공지능 기반 어린이 상상 놀이터 부지가 오는 5월 결정된다. 광주시는 23일 소회의실에서 상상 놀이터 건립 사업 타당성 조사, 기본계획 용역 중간 보고회를 열었다. 사업 부지, 전문가 의견 조사 내용, 기본 구상, 추진 일정 등이 논의됐다. 광주시는..."
672,"JW중외제약, 온코크로스와 AI 활용 혁신신약 공동개발",2022.03.24.,JW중외제약이 AI 신약개발 기업 온코크로스와 인공지능(AI) 기반의 혁신신약 개발을 위한 공동연구 계약을 체결했다. 계약에 따라 온코크로스의 AI 플랫폼인 ‘랩터(RAPTOR) AI’를 활용해 JW중외제약이 개발하고 있는 신약 파이프라인의 신규 적응증을 탐색하고 개발 가능성을 검증하게 된다. 랩터(RAPTOR) AI는...
673,"SKT 유영상, 첫 주총서 신사업 비전 선포…AI 회사로 진격(종합)",2022.03.24.,이번 주총에서 유영상 대표는 회사의 지난해 성과와 함께 ‘SKT 2.0 시대’를 열면서 ‘인공지능(AI) 기반 서비스 컴퍼니’로 진화하겠다는 경영 비전을 주주들에게 설명했다. 그는 “유무선 통신을 기반으로 AI 서비스 컴퍼니로 진화하고 본업과 연계된 환경·사회·지배구조(ESG) 2.0 활동을 통해 고객에게...
674,"BMW, 첫 순수 전기차 '그란쿠페 i4' 국내 출시…""AI 가 주행중 교통흐름 파악...",2022.03.24.,"적응형 회생제동은 스스로 학습하는 인공지능(AI)이 주변 상황 및 교통흐름을 다각적으로 판단, 회생제동 강도 및 관성주행 여부를 스스로 조절해 에너지 회생 효율을 최적화한다. 기어 레버로 B모드를 선택하면 가속 페달에서 발을 떼는 것만으로도 최대한의 회생 제동이 이루어지며..."
675,"서강대, 틸론과 AI·SW 우수 인재 양성‧산학협력 위한 업무 협약 체결",2022.03.28.,양 기관은 이번 협약을 통해 서강대 대학원 인공지능학과 AI융합전공 내에 '메타버스 및 가상화 과정'을 개설해 AI 비전과 추진 전략에 적합한 인재를 육성할 것을 약속했다. 또한 서강대 내에 '틸론 메타버스 및 가상화 연구 센터'를 공동 설립해 중장기적으로 AI 연구 역량 강화‧핵심 기술 확보를 위해 힘쓸...
