,제목,날짜,본문
523,교육부 'AI교육 100인 포럼' 출범…윤리원칙 만든다,2022.01.26.,"교육부는 27일 이화여자대학교 교육관에서 '인공지능교육 활성화 100인 포럼'을 온·오프라인으로 개최했다고 밝혔다. 교육부가 이화여대 미래교육연구소와 공동으로 진행하는 100인 포럼은 앞으로 1~2개월마다 인공지능교육 활성화를 위한 사회적 논의를 이끌어낸다. 포럼에는 시도교육청, 학회, 연구기관..."
524,네이버 클로바 머신러닝 학회서 논문 12건 채택…AI 연구 역량 입증,2022.01.26.,ICLR은 올해로 10회째를 맞는 ML 학회로 인공지능(AI) 및 데이터 사이언스 분야에서 활용되는 딥러닝 핵심 기술과 관련된 전세계 첨단 연구들이 공유되는 컨퍼런스다. 지난해부터 '구글 스칼라'가 발표하는 탑티어 AI/ML 학회에서 1위를 차지에 올랐다. 네이버가 ICLR과 같은...
525,"광주시교육청, '(가칭) 광주AI교육연구원' 설립 승인",2022.01.26.,"또한, 우리 학생들에게 4차 산업혁명시대 기초역량으로서 인공지능(AI)과 디지털 소양 교육을 다양한 체험과 교과융합을 통해 제공하는 초석을 마련했다. AI교육연구원은 기존 교육연구정보원의 기능과 역할을 재구조화해 신설한다. 기존 역할에 더해 AI실습교육 제공을 위한 교육공간 및 시설과 AI교육..."
526,네이버 “AI-검색 경쟁력 확보”… 젊은 석학들 영입,2022.01.24.,네이버가 인공지능(AI)·검색 분야에서 뛰어난 연구성과를 낸 젊은 석학들을 영입해 기술 경쟁력 확보에 속도를 낸다. 네이버는 최근 미국 매사추세츠공대(MIT)의 김윤형 교수와 럿거스대의 칼 스트라토스(한국명 이장선) 교수를 ‘네이버 스칼라’로 영입했다고 24일 밝혔다. 네이버 스칼라는 미국 유럽 등에...
527,"과기부, 광주 AI단지에 올해 1076억 투입",2022.01.25.,"과학기술정보통신부는 올해 광주 AI(인공지능)중심산업융합집적단지 조성사업에 1076억원을 투입한다고 밝혔다. 정부는 이 사업에 2020년부터 2024년까지 4119억원을 투입해 광주 주력산업인 자동차, 헬스케어, 에너지와 AI 융합을 촉진하고, 데이터센터 등 각종 인프라·기업·인재·기술을 집약해 AI 융합..."
528,AI 반도체 개발에 4천억원 추가 투입…시장 창출 지원,2022.01.25.,과기부 2차 인공지능 최고위 전략대화…'초거대 AI 생태계 활성화' 추진 정부가 인공지능(AI) 반도체 분야의 국가 경쟁력 강화를 위해 4천여억원을 추가 투자한다. '초거대 인공지능 생태계 활성화'를 위한 중소기업 지원과 인재 양성 등 대책도 추진한다. 과학기술정보통신부는 19일 서울중앙우체국에서...
529,"카카오엔터프라이즈, 기업 맞춤형 AI 음성인식 서비스 공개",2022.01.26.,"카카오엔터프라이즈가 기업용 인공지능(AI) 음성 인식 변환 모델 '커스텀 STT'를 공개했다. [사진: 카카오엔터프라이즈] 카카오엔터프라이즈가 기업용 인공지능(AI) 음성 인식 변환 모델 '커스텀 STT'를 공개했다. 음성 인식(STT)은 AI를 활용해 음성을 텍스트로 변환해주는 기능이다. AI 스피커, 음성 검색..."
530,윤석열 “100만 디지털 인재…AI·소프트웨어 산업 육성”,2022.01.26.,<윤석열 / 국민의힘 대선 후보> “최적화된 기술과 솔루션을 도입하고 최고의 AI 시스템을 구축하여 이 시스템이 우리 정부뿐만 아니라 세계 모든 국가들이 사용하는 행정용 AI 시스템이 되도록 그 표준을 만들겠습니다.” AI인공지능과 소프트웨어 산업 육성을 위해 세계 최대의 AI 클라우드컴퓨팅 인프라를...
531,"국민은행, 'AI 은행원' 서비스 오픈",2022.01.26.,"KB국민은행은 인공지능(AI) 은행원 키오스크를 영업점에 시범적으로 도입한다고 26일 밝혔다. 국민은행은 지난해 3월 선보인 서울 여의도 신관 AI체험존의 상담사를 여의도영업부, 여의도인사이트점, 돈암동지점에 AI은행원으로 업그레이드해 순차 오픈한다. AI은행원은 AI 기술을 통해 ▲ 지능형 자동화기기..."
532,"인공지능 은행원, 현장 근무 나섰다!... KB국민은행, 영업점에 파일럿 형태로...",2022.01.26.,"AI은행원 키오스크 시연 모습 KB국민은행은 인공지능(AI) 기술을 활용한 AI은행원 키오스크를 영업점에 파일럿 형태로 본격 운영한다. 지난해 3월 선보인 KB국민은행 여의도 신관 AI체험존의 상담사를 여의도영업부, 여의도 InsighT점, 돈암동지점에 AI은행원으로 업그레이드해 순차적으로 오픈하며, 은행..."
533,"한전KDN, AI 활용 안전환경 구축 실증 성공적 완료",2022.01.26.,한전KDN(대표 김장현)은 인공지능(AI) 영상분석시스템(AI Vision)을 적용한 스마트 플랜트 안전환경 구축 현장 실증을 완료했다고 19일 밝혔다. 한전KDN은 지난해 4월부터 한국지역난방공사와 함께 한난 동탄지사에서 검증한 현장 실증이 성공적인 결과를 도출했다고 전했다. 한전KDN은 2020년 11월 한난...
534,"강남유나이티드병원, ‘무릎관절증 AI케어 지원사업’ 협력 의료기관 선정",2022.01.26.,이번 발대식은 스마트 헬스케어 시대에 발맞춰 노인성 무릎관절염으로 인공관절 수술을 받은 시니어를 대상으로 인공지능(AI) 반려로봇을 제공하여 노인 자립 생활을 돕는 데 협력 기관이 뜻을 모으고자 개최됐다. 강남유나이티드병원은 이 지원사업의 일환으로 무릎 인공관절 수술을 받은 원내 환자에게...
535,"코로나시대, AI은행원 대면거래 수월",2022.01.26.,KB국민은행 제공 #뉴스클레임 조현지 기자 / 점점 인공지능(AI)기술 발달이 사람의 업무를 대신하고 있다. 은행에도 행원을 AI가 대신하고 있어 화제다. KB국민은행은 26일 AI기술을 활용한 AI은행원 키오스크를 영업점에 파일럿 형태로 도입한다고 밝혔다. 지난해 3월 선보인 KB국민은행 여의도 신관...
536,CJ올리브네트웍스 지스트 고성능컴퓨팅 AI 공용인프라 사업 수주,2022.01.26.,CJ올리브네트웍스는 지스트(광주과학기술원)가 운영하는 고성능 컴퓨팅 기반 인공지능(HPC-AI) 공용인프라 구축 사업을 수주했다고 20일 밝혔다. 고성능 컴퓨팅(HPC)이란 고급 연산 문제를 풀기 위해 슈퍼컴퓨터 또는 컴퓨터 클러스터를 사용하는 것을 뜻한다. 인공지능산업융합사업단이 주관하는 HPC-AI...
537,"카카오엔터프라이즈, 기업용 AI 음성인식 서비스 공개",2022.01.26.,"카카오엔터프라이즈는 기업용 인공지능(AI) 음성인식-변환 모델 ‘커스텀 STT(Speech-to-Text)’를 공개했다고 25일 밝혔다. STT는 음성을 텍스트로 변환해 주는 기능이다. AI 스피커 및 음성 검색, 내비케이션 등 여러 곳에 활용되고 있다. 카카오엔터프라이즈에 따르면 새롭게 공개한 커스텀 STT는 각 기업이..."
538,"LS, AI·빅데이터·스마트에너지 접목해 디지털 전환시대 선도",2022.01.25.,"4차 산업혁명 시대를 맞아 디지털 전환(Digital Transformation)’을 그룹의 미래 준비 전략으로 정하고, 전통적인 제조업 분야에 AI(인공지능), 빅데이터, 스마트에너지 기술을 접목해 디지털 기업으로의 변신을 꾀하고 있다. 구자은 LS그룹 회장은 올해 1월 LS 회장에 취임하면서 취임 일성으로 양손잡이..."
539,네이버 검색은 한번만… AI `에어서치` 도입,2022.01.28.,질문의도·성별·연령 등 반영 인공지능 기술 '고도화' 단계 MIT 석학 등 추가영입 예고 네이버가 AI(인공지능) 검색 분야 서비스 고도화에 속도를 내고 있다. 차별화된 검색 경험으로 이용자층을 공고히 하고 구글 등 빅테크 기업이 우위를 점하고 있는 글로벌 시장에서 경쟁력을 확보한다는 구상이다. 26일...
540,"NHN, 코그넷나인 등과 AI 사업 협력 MOU 체결",2022.01.26.,"NHN(대표 정우진)은 인공지능 매니지드 서비스 전문기업(AI MSP) 코그넷나인, 자연어 처리(NLP) 전문 기업 NHN다이퀘스트 등과 AI 사업 협력에 대한 MOU를 체결했다고 28일 밝혔다. NHN은 협약을 통해 자사 클라우드 기반의 다양한 AI 서비스를 제공함으로써 기존 고객 유지와 함께 신규 고객 확보에 박차를..."
541,"KB국민은행, AI은행원 영업점에 순차 선보인다",2022.01.26.,"KB국민은행이 인공지능(AI) 은행원을 확대 도입한다. 국민은행은 AI기술을 활용한 AI은행원 키오스크를 영업점에 파일럿 형태로 도입한다고 26일 밝혔다. 지난해 3월 선보인 국민은행 여의도 신관 AI체험존의 상담사를 여의도영업부, 여의도 InsighT점, 돈암동지점에 AI은행원으로 업그레이드해 순차..."
542,"흥국생명, AI 문서인식 상용화…보험금 접수 자동화 시스템 구축",2022.01.26.,흥국생명 제공 [세계비즈=유은정 기자] 흥국생명은 보험금 접수 자동화를 위한 인공지능 문서인식(AI OCR) 시스템을 상용화했다고 26일 밝혔다. 이 시스템은 AI OCR 기술의 선두업체인 로민의 ‘텍스트스코프(Textscope™) 솔루션’이 적용됐다. AI OCR은 AI를 활용해 보험금 접수 프로세스 전반을 자동화하는...
543,"서울아산병원 ""AI활용 흉부 엑스레이로 골다공증 위험 90% 예측""",2022.01.26.,"서울아산병원 융합의학과 김남국 ·내분비내과 고정민 교수, 아산융합의학원 장미소 연구원팀은 간단한 흉부 엑스레이(X-ray) 검사 영상으로 90%의 정확도로 골다공증 고위험군을 선별해내는 딥러닝 인공지능(AI) 알고리즘을 개발했다고 27일 밝혔다. 골다공증을 정확하게 진단하기 위해서는 골밀도 검사를..."
544,"文대통령, 사우디에 “한국, 원전 최적 파트너”…‘AI 주치의’ 수출",2022.01.26.,‘인공지능(AI) 주치의’로 알려진 ‘닥터앤서’ 수출 구매의향서도 체결됐다. 문 대통령은 지난 2020년 11월 인공지능 관련 행사에서 “태어난 지 세 돌이 되도록 고개도 못 들던 발달지연 아기가 정밀진단 인공지능 ‘닥터앤서’의 진단과 처방으로 한 달 만에 고개를 들고 기어 다니게 됐다”며 성과를...
545,"AI 음성기록 ‘셀비 노트’, 대우조선해양 스마트 선박에 적용",2022.01.26.,셀바스AI “스마트 선박 시장 적극 공략” AI(인공지능) 전문기업 셀바스AI가 스마트 선박(스마트십) 시장 공략에 나선다. 셀바스AI는 '셀비 노트(Selvy Note)'를 대우조선해양 스마트 선박에 탑재한다고 25일 밝혔다. 셀비 노트는 다자 간 대화를 실시간 확인할 수 있는 AI 음성기록 솔루션이다. 대우조선해양 스마트...
546,"AI와 공존해야 하는 미래, 영화가 아니라 현실이다",2022.01.26.,인공지능(AI)은 미국 매사추세츠공대(MIT) 연구자였던 마빈 민키스가 창시한 개념이다. 그가 구상한 뇌 신경망을 모방한 컴퓨터 논리회로는 '지능을 가진 기계'로 점차 발전했다. 이후 존 매카시와 클로드 섀넌을 비롯한 수많은 연구자들이 발전시킨 현대적 AI 기술을 우리는 구글의 ‘알파고’나 애플의...
547,‘AI 올림픽’ 캐글 대회서 업스테이지 김윤수씨 2위,2022.01.26.,인공지능(AI) 스타트업 업스테이지의 김윤수(사진) 그랜드마스터가 25일 온라인 AI 경진대회 캐글에서 2위에 올랐다. 글로벌 금융기업 옵티버가 ‘주가 변동성 예측’을 주제로 주최한 이번 대회엔 200여개국의 900만명이 참가했다. 주식 시장에서 주가의 단기 변동성을 머신러닝 알고리즘으로 예측해 매수...
548,"국회, 25일 ‘알고리즘 및 AI 법률안 공청회’ 연다",2022.01.28.,국회의원 연구단체 ‘국회 디지털 혁신과 미래 포럼’은 25일 국회의원회관 제1세미나실에서 ‘알고리즘 및 인공지능(AI)에 관한 법률안 공청회’를 개최한다고 24일 밝혔다. 이번 공청회는 AI에 대한 올바른 이해를 바탕으로 산업 발전 방안을 모색하기 위해 마련됐다. 코로나19 확산 예방을 위해 유튜브 채널...
549,"메타, 세계 최고속 AI 슈퍼컴퓨터 개발 중…연내 완성",2022.01.21.,페이스북 운영사 메타가 5엑사플롭스급 AI 슈퍼컴퓨터를 개발하고 있다 [사진: 메타] 페이스북을 운영하고 있는 메타(Meta)가 새로운 형태의 인공지능(AI) 슈퍼컴퓨터를 연내 완성할 계획이라고 밝혔다. 5엑사플롭스(exaflops) 수준의 세계에서 가장 빠른 AI 슈퍼컴퓨터라는 게 메타의 설명이다. 메타가 개발...
550,KB국민은행 'AI 은행원 키오스크' 일부 지점에 시범 배치,2022.01.23.,"AI 은행원은 인공지능 기술을 이용해 ▲STM·ATM·미리작성서비스 등 은행 업무가 가능한 주변기기 사용방법 ▲국민은행 상품 소개 ▲업무별 필요 서류 ▲키오스크 설치 지점 위치 안내 등이 가능하다. 은행 업무 외에도 금융상식, 날씨, 주변시설 안내 등 생활서비스도 함께 제공한다는 설명이다. AI 은행원은..."
551,"진중권, 김어준에 ""李 욕설 AI 조작?…어이가 없다""",2022.01.23.,"방송인 김어준씨가 인공지능(AI)을 통해 이재명 더불어민주당 대선 후보의 목소리를 흉내 내 만들 수 있다며 '조작설'을 주장한 데 대해 진중권 전 동양대 교수가 ""어이가 없다""고 했다. 진 전 교수는 19일 CBS라디오 '한판승부'에서 ""지금 돌아다니는 그 녹취록이 AI일 수도 있으니 믿지 말라는 얘기를 하는 것..."
552,[DBR]SKT “통신-AI-인프라 3大핵심영역 신사업 발굴”,2022.01.26.,"올 초 인공지능(AI) 및 디지털 인프라 서비스 기업으로의 전환을 선언한 SK텔레콤이 통신, AI, 인프라 3대 핵심 사업 영역에서 신사업 발굴에 나선다. 새로운 비즈니스 모델을 바탕으로 2025년까지 매출 22조 원을 달성한다는 계획이다. SK텔레콤은 특히 이 3대 핵심 사업 영역 가운데서도 유무선 통신, AI..."
553,"이글루시큐리티, 최신 침해사고 재현한 1억 2천만 건 AI 데이터셋 구축",2022.01.26.,인공지능(AI) 기반 정보보호 선도 기업 이글루시큐리티(대표이사 이득춘)는 2021년 한국인터넷진흥원(KISA)의 '사이버보안 인공지능 데이터셋(침해사고 분야)' 구축 사업에 참여해 주요 침해사고를 재현한 1억 2천만 건의 데이터셋 구축을 완료했다고 밝혔다. 한국인터넷진흥원(KISA)은 K-사이버방역 추진...
554,한강 녹조 매주 예측…수돗물 냄새 잡는 AI 모델도 개발,2022.01.26.,"내년에는 인공지능(AI) 기술을 활용해 취수장 원수에서 맛·냄새 유발 물질(2-MIB, 지오스민)의 농도를 예측하는 모델도 개발할 계획이다. 서울시는 ""환경부에서는 조류 발생을 예측하고 있지만, 서울시 취수장과 떨어진 팔당호와 이천(남한강) 지점에서만 시행하고 있어 신속한 대응을 위한 예측 정보로는 부족한..."
555,"흥국생명, 로빈과 'AI OCR' 상용화 보험금 접수 자동화 시스템 상용화",2022.01.26.,태광그룹 금융계열사인 흥국생명(대표 박춘원)은 보험금 접수 자동화를 위한 인공지능 문서 인식(AI OCR) 시스템을 상용화했다고 26일 밝혔다. 이 시스템은 AI OCR 기술의 선두 업체인 로민(대표 강지홍)의 텍스트스코프(Textscope™) 솔루션이 적용됐다. AI OCR은 AI를 활용해 보험금 접수 프로세스 전반을...
556,"SKT, AI 스피커 '누구 캔들 SE' 출시…10만9000원",2022.01.26.,기사내용 요약'누구 캔들'의 후속 모델…오늘부터 11번가서 판매 한국어·영어 음성 AI 서비스는 내달부터 지원 예정 SK텔레콤은 인공지능(AI) 스피커 '누구 캔들 SE'를 18일부터 11번가를 통해 판매한다고 밝혔다. AI 플랫폼과 조명 기능을 결합한 새로운 AI 기기로 인기를 끌었던 '누구 캔들'의 후속...
557,"김어준 ""이재명 욕설, AI로 만든다고"" vs 김재원 ""흉내 불가능""",2022.01.19.,"방송인 김어준 씨는 이재명 더불어민주당 대선 후보의 욕설 파일을 인공지능(AI)을 통해 만들 수 있다는 주장을 내놓았다. 김재원 국민의힘 최고위원은 ""이 후보의 욕설은 AI에게 아무리 훈련을 시켜도 흉내를 낼 수 없는 수준""이라고 반박했다. 김어준 씨는 19일 자신이 진행하는 TBS 라디오 '김어준의 뉴스공장..."
558,인공지능 반도체·응용프로그램 호환성 높이고 개발비·시간 줄였다,2022.01.26.,한국전자통신연구원(ETRI)이 인공지능(AI) 핵심 시스템 소프트웨어인 딥러닝 컴파일러 ‘네스트(NEST-C)’를 개발했다. 개발자가 쉽게 활용할 수 있도록 자체 개발한 AI 반도체 하드웨어와 함께 웹(Github)에 공개했다. 이로써 그간 걸림돌이었던 하드웨어와 소프트웨어 간 호환성과 확장성 문제를 해소하는...
559,"세계적 석학 끌어모으는 네이버 ""차세대기술 'AI 검색' 초격차""",2022.01.24.,"네이버가 AI(인공지능) 분야의 글로벌 석학들을 잇달아 영입하고 기술 연구에 박차를 가하고 있다. 24일 네이버는 최근 미국 매사추세츠 공과대학(MIT) 김윤형 교수와 럭거스 대학의 칼 스트라토스(Karl Stratos, 이장선) 교수를 네이버 스칼라(Naver Scholar)로 영입했다고 밝혔다. 네이버 스칼라는 미국..."
560,[World & Now] 인공지능 기술에 국가 흥망 달렸다,2022.01.24.,바퀴·철기…인류 '범용기술' 발전할수록 쓰임새 다양해져 종국엔 사회변혁으로 이어져 미래의 범용기술은 인공지능 美中보다 더 과감한 혁신해야 '인공지능(AI)을 지배하는 국가가 21세기 패권을 잡을 것이다.' 스탠퍼드대 인간 중심 인공지능 연구소에서 지난주 '강대국의 흥망성쇠에 기술이 미치는 영향...
561,"퓨어스토리지, 메타와 파트너십 체결…AI 슈퍼컴퓨터 지원",2022.01.24.,"퓨어스토리지가 세계에서 가장 빠른 AI 슈퍼컴퓨터가 될 것으로 기대되는 메타(옛 페이스북)의 인공지능(AI) 리서치 슈퍼클러스터(Research SuperCluster, RSC)를 협력 지원한다. 지난 1월 24일(현지시간) 메타는 AI 연구원들이 수 조 개의 사례를 통한 학습과 수 백 개의 언어 연구, 텍스트, 사진, 영상의..."
562,"NHN 코그넷나인 NHN다이퀘스트, AI사업 협력 위한 업무협약 맺어",2022.01.28.,"강승한 NHN 클라우드사업실 전무, 박진우 NHN다이퀘스트 NLP그룹장, 한선호 코그넷나인 최고운영책임자(COO)이 27일 경기도 성남 NHN 플레이뮤지엄 사옥에서 인공지능(AI) 서비스 업무협약 체결식에서 기념사진을 촬영하고 있다. NHN이 인공지능(AI) 관련 역량 강화에 나선다. NHN은 27일 NHN 플레이뮤지엄..."
563,"카카오엔터프라이즈, 기업용 AI 음성 인식-변환 모델 '커스텀 STT' 공개",2022.01.24.,"카카오엔터프라이즈가 기업용 인공지능(AI) 음성 인식-변환 모델 '커스텀 STT(Custom Speech-to-Text)'를 공개했다. STT는 AI를 활용해 음성을 텍스트로 변환해주는 기능으로, AI 스피커, 음성 검색, 내비게이션 등 다양한 용도로 활용되고 있다. 카카오엔터프라이즈가 공개한 커스텀 STT는 각 기업의 고객과 산업..."
564,"GC녹십자·목암연구소, 서울대 AI연구원과 신약개발 공동연구",2022.01.24.,GC녹십자(006280)는 목암생명과학연구소와 함께 서울대학교 AI연구원과 경기도 용인에 위치한 목암타운에서 인공지능(AI) 신약 연구 플랫폼 구축을 위한 공동연구 협약을 체결했다고 25일 밝혔다. 협약을 통해 양측은 각종 AI 알고리즘을 이용한 '신약 후보물질 발굴 및 질병관련 유전체·단백질 연구 플랫폼을...
565,"네이버, AI·검색 분야 세계 석학 영입 박차",2022.01.24.,"지난해 9월 네이버에 합류한 김 책임리더는 마이크로소프트 코타나와 아마존 알렉사의 AI 핵심기술 개발을 총괄한 대화형 인공지능(Conversational AI) 분야의 세계적인 전문가다. 김광현 네이버 서치 CIC 대표는 ""올해도 미국, 유럽 등 글로벌 무대에서 활약하고 있는 우수한 연구인력들을 적극..."
566,"KB국민은행, AI은행원 서비스 오픈···자체 기술 KB-STA로 AI은행원 실현",2022.01.24.,"AI은행원은 인공지능 기술을 통해 STM, ATM, 미리작성서비스 등 은행 업무가 가능한 주변기기 사용 방법 KB국민은행 상품 소개 업무별 필요 서류 키오스크 설치 지점 위치 안내가 가능하다. 은행 업무 이외에도 금융 상식, 날씨, 주변 시설 안내 등의 생활 서비스도 제공한다. AI은행원은 음성인식 기술로..."
567,AI 혁신 기업에 '단감소프트·네오사피엔스',2022.01.24.,"단감소프트, 네오사피엔스가 인공지능(AI) 기술로 미래 혁신을 선도하는 1위 기업에 꼽혔다. 지능정보산업협회(AIIA, 회장 장홍성)는 '2022 Emerging AI+X Top 100'을 발표했다고 25일 발표했다. '2022 AI+X Top 100'은 산업 8개 분야, 융합(Cross, X) 산업 8개 분야로 구분하고 산업 분야는 제조업, 헬스케어..."
568,"메타, 메타버스 노리고 세계에서 제일 빠른 AI 수퍼컴 만들었다",2022.01.24.,"메타(옛 페이스북)가 전 세계에서 가장 빠른 인공지능(AI) 수퍼컴퓨터를 개발했다고 24일(현지시각) 밝혔다. ‘AI 리서치 수퍼 클러스트(RSC)’라고 부르는 이 수퍼컴퓨터는 메타가 2년 간 연구 개발한 것으로 엔비디아의 그래픽처리장치(GPU) 6080개가 탑재됐다. 현재는 세계에서 5번째 빠른 수준인데, 올..."
569,올해 인공지능 학습용 데이터 310종 구축에 5천800억원 투자,2022.01.26.,"과기정통부, 사업 공모 3월까지 순차 실시 과학기술정보통신부(과기정통부)는 올해 인공지능(AI) 학습용 데이터 구축사업의 공개 모집을 시작한다고 21일 밝혔다. 이 사업은 기업과 연구자, 개인 등이 개별적으로 구축하기 어려운 인공지능 학습용 데이터를 대규모로 구축해 AI 허브(www.aihub.or.kr)..."
570,AI‧신기술 분야 전문가 강연도 케이무크로… 2022 기본계획 발표,2022.01.26.,교육부는 청년층 대상 취업 준비 강좌(15개) 및 인공지능(AI) 신기술분야 등 해외 무크 우수 강좌(50개)를 선별해 한국어 자막 등 학습 서비스를 제공할 계획이다. 또한 정부재정지원사업 및 기관 자체 재원으로 개발한 강좌를 확대· 발굴하고 케이무크에도 제공해 강좌의 다양성을 높이겠다는 방침이다. 외국어...
571,"ETRI, 인공지능 핵심 소프트웨어 '딥러닝 컴파일러' 개발...오픈 소스로 공개",2022.01.25.,국내 연구진이 중소기업·스타트업에서 인공지능(AI) 반도체를 개발하기 위해 투입하는 시간과 비용을 단축하는 핵심기술로 그간 걸림돌이었던 하드웨어와 소프트웨어 간 호환성과 확장성 문제를 해소하는 시스템 소프트웨어 개발로 AI 반도체 개발에도 속도가 붙을 전망이다. 한국전자통신연구원(ETRI)은...
572,엔비디아-메타 대규모 인공지능 연구 슈퍼컴퓨터 개발 협력,2022.01.25.,"엔비디아는 엔비디아 DGX A100 고객 시스템 '메타(Meta)'의 인공지능(AI) 슈퍼컴퓨터를 통해 메타 AI 연구원에게 5 엑사플롭스(exaflops)급 AI 성능을 제공할 것이라고 25일 밝혔다. 엔디비아는 AI 컴퓨팅 기술 분야 기업이다. 메타의 AI 슈퍼컴퓨터는 최첨단 엔비디아 시스템, 인피니밴드(InfiniBand) 패브릭..."
573,SKT 신형 AI스피커 '누구 캔들 SE' 출시,2022.01.27.,"SK텔레콤은 인공지능(AI) 스피커 '누구 캔들 SE'(NUGU candle SE)'를 11번가를 통해 판매한다고 18일 밝혔다. 신제품은 AI 플랫폼과 조명 기능을 결합한 '누구 캔들'의 후속 모델로, 제품 색상을 변경하고 음향 품질을 개선했다. 한국어와 영어를 모두 지원하는 '누구 멀티 에이전트' 서비스도 지원한다. 이..."
574,인공지능이 다해준다!...AI 원스톱 서비스로 효율성 높이고 더 편리한 세상으...,2022.01.26.,"이용자들과 기업의 '가려운 곳'을 긁어 주기 위해 틈새 시장을 뚫고 등장한 인공지능(AI) 스타트업들이 제공하는 서비스의 인기가 드높다. 특히, '한국의 DNA'가 흐른다는 것을 증명이라도 하듯 한 번에 빨리, 효율적으로 서비스를 이용할 수 있도록 인공지능을 접목한 혁신적인 기술 개발에 집중하는 곳들이..."
