,제목,날짜,본문
1977,"SK이노, 울산CLX에 AI 폐수처리 시스템 구축",2022.03.13.,SK이노베이션은 울산콤플렉스(울산CLX)에 공장 폐수를 실시간으로 분석·예측할 수 있는 인공지능(AI) 폐수처리 시스템을 국내 정유사 최초로 구축했다고 13일 밝혔다. AI 폐수처리 시스템은 울산CLX 폐수처리장에 유입되는 폐수와 정화 후 방류되는 처리수를 실시간으로 분석할 수 있다. 실시간 분석 데이터에...
1978,인공지능이 대출업무도…은행 영업점 'AI은행원' 늘어,2022.03.17.,"사람 떠난 자리, AI가 채우나 인공지능(AI) 은행원이 처리하는 업무 범위가 영업점 내에서도 늘어나고 있다. 은행 점포 수 감소와 함께 '무인화'가 한 트렌드가 되고 있다. ◇신한은행, AI 은행원 금융 서비스 신용 대출로도 확대 신한은행은 지난 18일 AI 은행원의 금융 서비스 범위를 예ㆍ적금 신규, 신용대출..."
1979,"""데이터, 크기보다 질""…매스웍스가 꼽은 '2022 AI 트렌드 TOP 10'",2022.03.23.,미국에 본사를 둔 매트랩 제작 업체 ‘매스웍스’는 최근 인공지능(AI) 기업으로 탈바꿈이 한창입니다. 100개 국가 50만 명의 실사용 고객을 바탕으로 산업 현장에서 요구하는 AI 기능을 자사 SW에 녹여내고 있습니다. 지난해부터는 AI 업계의 한 해 전망을 담아낸 ‘트렌드 보고서’도 발표하고 있습니다....
1980,"휴림로봇-삼부토건, 스마트 건설로봇 사업 MOU 체결…“AI로봇 활용한 스마트...",2022.03.14.,휴림로봇은 먼저 인공지능(AI) 로봇 ‘테미(Temi)’의 기술과 론칭경험을 바탕으로 스마트 기술을 활용한 주거 서비스 분야에 진출할 예정이다. 지난해 휴림로봇은 삼성물산과의 협업을 통해 미래 지향적 주거문화를 담고 있는 ‘래미안 RAI(Raemian Artificial Intelligence) 라이프관’에 테미를 도입한 바 있다. 당시...
1981,"우리은행,‘AI 고객 상담 서비스’확대 운영",2022.03.15.,"/우리은행 우리은행은 AI(인공지능)상담봇과 AI챗봇 서비스를 포함한'AI 상담 서비스'를 고도화해 확대 적용한다고 10일 밝혔다. 우리은행은 작년 4월부터 해당 서비스를 개발해 지난 12월 시범 운영을 시작했다. 'AI 상담 서비스'는 STT(음성인식), TTS(음성합성), NLU(자연어이해) 등 AI 언어 기술이 융합된..."
1982,'취업지원도 이젠 AI시대' 영산대 AI취업솔루션 도입,2022.03.15.,와이즈유 영산대 중앙도서관이 학생들의 취업준비를 위해 올해 3월부터 '인공지능(AI) 솔루션'을 도입했다고 16일 전했다. 중앙도서관 학술정보팀은 4차 산업혁명과 코로나19로 인해 광범위하게 확산된 비대면 문화에 대응해 학생들의 취업을 실질적으로 지원하고자 이 프로그램을 도입했다. 이...
1983,전문가 추천 색상 제안...'삼성 비스포크 제작소 AI' 서비스 개시,2022.03.15.,AI 맞춤 컬러는 소비자가 자신의 집 또는 평소 마음에 들었던 공간 사진을 웹사이트에 업로드하면 인공지능 기반으로 이미지 속 주요 색상을 분석해 인테리어와 가장 잘 어울리는 제품 색상을 추천해준다. 전문가 추천 컬러는 문승지·김종완·장호석 등 국내 유명 디자이너들을 비롯해 글로벌 페인트 업체인...
1984,"기업들 ""尹 정부 AI·미래차 지원하고 중대재해법 개선해야""",2022.03.01.,"전경련, 중점 추진 과제 설문 조사 기업들이 차기 정부가 중점 지원해야 할 신사업으로 인공지능(AI)과 미래자동차 분야를 꼽았다. 올해 초 시행된 중대재해법은 개선이 필요하다고 봤다.전국경제인연합회가 시장조사 전문기관인 모노리서치에 의뢰해 매출 1000대 기업(응답 157개사)을 대상으로 ‘차기정부..."
1985,"KB국민카드, 'AI 투자 날씨' 서비스 오픈",2022.03.14.,"KB국민카드는 마이데이터 서비스 '리브메이트(Liiv Mate)'를 통해 투자 정보를 날씨 상황에 비유해 확인할 수 있는 '인공지능(AI) 투자 날씨' 서비스를 시작했다고 14일 밝혔다. 이번 서비스는 로보어드바이저 기업 '콴텍투자일임'의 빅데이터 및 AI 기술을 토대로 재무제표, 주가, 기사 등 정보가 종합적으로..."
1986,"동화약품․심플렉스, AI 기반 면역질환 치료제 개발 협력",2022.03.15.,"동화약품(대표이사 유준하)은 지난 14일, 인공지능(AI) 기반 신약 개발 벤처 심플렉스(대표이사 조성진)와 면역질환 치료제 개발을 위한 공동연구개발 계약을 체결했다고 15일 밝혔다. 이번 계약으로 심플렉스는 설명 가능한 인공지능(Explainable AI) 플랫폼인 ‘CEEK-CURE’를 활용해 면역질환 치료제 유효물질..."
1987,"SK이노, 국내 정유사 최초 인공지능으로 폐수처리",2022.03.15.,최첨단 ‘인공지능(AI) 폐수처리 시스템’을 성공적으로 구축했다고 13일 밝혔다. 국내 정유사 중 최초로 공정 폐수의 성상을 실시간으로 예측해 최적으로 처리할 수 있는 ‘선제적 폐수처리 시스템’을 만들었다. 울산CLX는 세계 최대규모 정유·석유화학공장 특성상 일일 약 5만t 이상의 산업 폐수를 배출...
1988,"딥노이드, 노코드 기반 AI 모델 개발 플랫폼 딥파이 4월 공식 출시",2022.03.08.,의료 인공지능(AI) 플랫폼 전문기업 딥노이드는 코딩 없이 애플리케이션을 개발할 수 있는 노코딩 플랫폼 '딥파이(DEEP:Phi)' 업데이트를 완료하고 4월 중순 정식 서비스에 들어간다고 15일 밝혔다. 회사측에 따르면 '딥파이'는 코딩을 몰라도 파워포인트나 포토샵처럼 마우스 클릭만으로 자신이 보유한 데이터만...
1989,"올리브영, '찍검' 운영사 로켓뷰 인수…AI추천 시스템 구축 추진",2022.03.08.,"CJ올리브영은 빅데이터 기반 인공지능(AI) 스타트업인 '로켓뷰'를 인수했다고 1일 밝혔다. 로켓뷰는 스마트폰 카메라로 화장품 상품명을 촬영하면 최저가와 상품 속성, 성분 등 상품 정보를 알려주는 '찍검' 앱을 운영하고 있다. 올리브영은 자체 보유하고 있는 연간 1억건 이상의 고객 구매 데이터와 로켓뷰의..."
1990,세계 권위 AI 학회 '뉴립스'에 한국인 연구자 4명 조직위원 선임,2022.03.11.,"(사진편집=김동원 기자) 세계적 권위의 인공지능(AI) 학회 '뉴립스(NeurlIPS, 인공신경망학회)'에 한국인 연구자 4명이 조직위원으로 선임됐다. 뉴립스는 AI, 머신러닝(ML), 뇌과학 분야에서 최상급의 권위를 가진 학회다. 24일 취재 결과 뉴립스 2022 조직위원회 위원으로 선임된 27명 중 한국인 연구자 4명이..."
1991,예술가와 AI가 만났다 '시냅틱 셀프'展,2022.03.11.,"전시작품은 강시라 작가가 AI 예술 알고리즘 '그'와 합작해 만든 것이다. 작품에 설치된 화면에서는 몽환적 이미지가 송출된다. 이 이미지를 생성한 주인공이 바로 인공지능이다. 이미지 생성에는 두 가지 인공지능이 쓰였는데, 하나는 수많은 이미지를 학습해 새로운 이미지를 형성하는 인공지능이고..."
1992,"최태원 회장 ""AI는 SK그룹의 새 성장동력""",2022.03.11.,최태원 SK회장이 11일 오후 SK텔레콤 인공지능(AI) 관련 구성원들과 타운홀 미팅을 가졌다. 최 회장은 이날 서울 을지로 SK텔레콤 본사 수펙스홀에서 SKT의 AI 사업을 실행하고 있는 350여명의 아폴로TF(태스크포스) 구성원들과 AI를 중심으로 한 회사의 비전과 개선 과제 등에 대해 2시간에 걸쳐 자유롭게...
1993,"의약품 개발 AI, 독성 물질 개발 AI로 변신",2022.03.11.,의약품 개발 AI의 용도를 변경해 인간에게 해가 되는 독성물질을 개발해줄 것을 주문했다.(사진=셔터스톡) 인공지능(AI)이 잘하는 것 중 하나는 수천 가지 화합물을 탐색하여 인간에 도움이 되는 약물을 찾아주는 것이다. 그러나 AI가 인간에 치명적인 화학 물질을 알려주는 데에도 놀라울 정도로...
1994,"포스코ICT, 인공지능 컨트롤타워 본격 가동",2022.03.15.,"포스코ICT가 조직내 인공지능(AI) 역량을 통합 운영하고, 인더스트리 영역의 AI기술을 선도하기 위해 'Industrial AI Research(IAR)'를 신설해 이달부터 본격적인 운영에 들어간다. 포스코ICT는 단위 조직 별로 운영해오던 AI를 비롯한 스마트 기술 엔지니어들을 통합해 조직간 시너지를 높이고, IAR를..."
1995,"영우디에스피, AI 서빙 로봇 '서빙고' 첫 출하식 개최",2022.03.14.,"디스플레이 장비 전문 기업 ㈜영우디에스피(143540, 대표이사 박금성)는 14일 급성장하는 로봇 시장을 겨냥하여 인공지능(AI) 서빙로봇 '서빙고'의 첫 출하식을 개최했다. 서빙고는 실내 자율주행 기술 기반의 서빙 로봇이다. 지난해 8월부터 대구 인터불고호텔의 로비, 식장에서 대략 10대의 '서빙고'가 시범운영..."
1996,"[MWC]KT, AI 기반 5G 운용 솔루션 '닥터와이즈' 선보여",2022.03.14.,"박정양 기자,이기범 기자 = KT는 스페인 바르셀로나에서 진행중인 'MWC2022'에서 5G망의 안정성을 강화해 주는 인공지능(AI) 관제 솔루션 '닥터와이즈(Dr. WAIS)를 처음으로 선보였다고 1일 밝혔다. 닥터와이즈는 AI에 기반을 둔 무선 네트워크 운용 관리 솔루션이다. 상용 5G 기지국의 무선 품질 이상을..."
1997,"㈜아이팝, '인공지능 학습용 데이터 구축 사업' 총괄한다",2022.03.14.,"전주대학교는 교원 창업기업인 ㈜아이팝이 한국지능정보사회진흥원(NIA)의 '2022년 인공지능 학습용 데이터 구축 사업' 소방 3D 객체 데이터 구축 분야... 사업 총괄 책임자인 전주대 ㈜아이팝 김동현 교수(대표이사)는 ""앞으로 소방 분야 3D 객체 AI 학습 데이터 구축 사업을 통해 우리나라 소방분야..."
1998,"서울대 인공지능 대학원-LG AI연구원, ‘AI 공동연구센터’ 설립 협약",2022.03.08.,"서울대 공대 협동과정 인공지능 전공(인공지능 대학원) 주임 이경무 교수, LG AI연구원 배경훈 원장 서울대 공과대학(학장 이병호) 협동과정 인공지능 전공(인공지능 대학원)과 LG AI연구원이 AI 공동연구센터 설립을 위한 업무협약(MOU)를 체결했다. 주요협력내용은 공동연구센터 설립 및 운영을 통해..."
1999,AI 교육 스타트업 뤼이드 '세계 최고 혁신기업' 등극,2022.03.08.,"인공지능(AI) 교육 솔루션 스타트업 뤼이드가 미국 기술경제 전문지 패스트컴퍼니가 발표한 ‘2022년 세계에서 가장 혁신적인 기업(The World’s Most Innovative Companies 2022)’에 선정됐다고 10일 밝혔다. 패스트컴퍼니는 포브스, 타임 등과 더불어 세계에서 손꼽히는 영향력을 지닌 매체다. 2008년부터는..."
2000,[안경애의 온테크] 팬데믹 한가운데서도 AI 투자는 뜨거웠다,2022.03.11.,"미 스탠퍼드대학교 HAI, 'AI 인덱스 2022' 발표 민간 AI 투자 935억달러로 1년만에 2배 이상 증가 기술 발전과 함께 윤리·규제이슈 커지고 법제화 활발 ""AI(인공지능)가 더이상 과학적 연구의 영역에 머물지 않고, 긍정적이든 부정적이든 현실세계에 실질적 영향을 미치기 시작했다."" 미 스탠퍼드대의 HAI..."
2001,"통화중 ATM 인출 등 이상행동...신한은행, AI로 보이스피싱 예방",2022.03.11.,"신한은행은 은행권 처음으로 'AI(인공지능) 이상행동탐지 ATM'을 도입한다고 7일 밝혔다. 그동안 쌓인 보이스피싱 데이터를 토대로 유사한 이상행동을 보일 경우 이를 탐지하고, 거래 전에 고객에게 주의하도록 안내하는 서비스다. ATM 거래 중 휴대폰 통화를 하거나 선글라스, 모자를 착용하는 행동 등이..."
2002,"카카오엔터프라이즈, '퓨리오사AI'와 '인공지능·메타버스·초거대 AI' 협력",2022.03.11.,퓨리오사AI는 고성능 인공지능(AI) 반도체에 필요한 하드웨어와 소프트웨어를 설계·개발하는 국내 스타트업이다. 최근 컴퓨터 비전용 고성능AI 반도체 ‘워보이(Warboy)'를 출시해 세계적인 수준의 기술력을 인정받았다. 이번 협력은 카카오엔터프라이즈가 국내 AI 반도체 산업과 맺는 첫 파트너십으로...
2003,"선문대-(사)한국인공지능협회, AI 인재 양성 업무협약 체결",2022.03.13.,선문대학교 산학협력단·LINC+사업단이 11일 (사)한국인공지능협회와 AI 인재 양성을 위한 업무협약을 체결했다. 이날 행사에 △선문대 김종해 산학협력단장 △한국인공지능협회 김원선 상임이사 등 9명이 참석했다. 이들은 선문대 재학생의 현장 인턴십 위탁 교육 및 연구 개발 등 교류 협력 증진과...
2004,"LX공사, AIㆍ빅데이터분석센터 구축",2022.03.21.,"김정렬 사장은 ""AI빅데이터기술센터가 싹을 틔운 만큼 데이터센터의 전초기지로서 인공지능(AI)과 빅데이터 기반의 도시ㆍ사회 문제 해결을 위한 허브 역할에 노력해주길 바란다""고 말했다. 김정렬 LX공사 사장과 손종영 공간정보연구원장 등 공사 관계자들이 LX공간정보연구원 내 AIㆍ빅데이터분석센터..."
2005,"AI, 빅데이터 등 디지털 농업 구현 위한 농업혁신을 꿈꾸다(下)",2022.03.14.,"사진=농촌진흥청 ①농진청, '디지털 농업 구현 위한 10대 핵심 과제' 발표(上) ②농진청, '디지털 농업 구현 위한 10대 핵심 과제' 발표(下) [농업경제신문 이호빈 기자] 박병홍 농촌진흥청장은 16일 농진청 기자실에서 e-브리핑을 통해 ""농업분야에 인공지능(AI), 빅데이터 등 4차 산업혁명 기술을 적극 도입해..."
2006,"인공지능 학습데이터 구축 문제 해결!...데이터헌트, 'AI 오토라벨링' 오류 줄...",2022.03.22.,이번 전시회에서 데이터헌트는 자사의 인공지능(AI) 오토라벨링(AI Auto Labeling) 기술을 선보일 예정이다. 사람에 의존하는 일반적인 데이터 라벨링의 과정에는 작업자 간의 서로 다른 작업 기준으로 인해 휴먼 에러의 발생 가능성이 크다. 샘플 데이터 이미지 데이터헌트는 이러한 오류율을 줄이고 데이터...
2007,"삼성전자 신사업은 메타버스·로봇… ""AI·5G 등 M&A 검토중""",2022.03.14.,"한 부회장은 인수합병(M&A) 계획도 언급했다. 그는 ""사업 영역에 제한을 두지 않고 있다""며 ""인공지능(AI)과 5G, 전장 등 새로운 성장동력이 될 수 있는 다양한 분야를 검토 중""이라고 말했다. 한편 이날 삼성전자 주총에서는 사내이사 선임 등 주요 안건들이 모두 원안대로 통과됐다."
2008,"농협카드, ‘인공지능 챗봇 서비스’ 도입",2022.03.14.,NH농협카드(대표 윤상운)는 모바일 플랫폼에서 인공지능(AI)을 기반으로 고객 상담을 수행하는 ‘AI 챗봇 서비스’(사진)를 도입했다고 14일 밝혔다. AI 챗봇 서비스는 농협카드의 모바일 애플리케이션(앱)인 ‘스마트NH농협카드’나 간편결제 플랫폼 ‘NH페이(NH pay)’에서 이용할 수 있다. 이들 앱을 설치한...
2009,"동화약품-심플렉스, AI 기반 면역질환 치료제 개발 협력",2022.03.15.,"동화약품이 지난 14일 인공지능(AI) 기반 신약 개발 벤처 심플렉스와 면역질환 치료제 개발을 위한 공동연구개발 계약을 체결했다고 15일 밝혔다. 양사는 이번 계약을 통해 심플렉스가 설명 가능한 인공지능(Explainable AI) 플랫폼인 'CEEK-CURE'를 활용, 면역질환 치료제 유효물질 탐색 및 최적화를 통한 최적의..."
2010,"최태원 SK 회장 ""AI는 그룹의 새로운 성장 동력""",2022.03.15.,"최태원 SK 회장이 11일 SK텔레콤 AI 관련 구성원들과 가진 타운홀 미팅에서 ""인공지능(AI)은 SK그룹의 새로운 성장 동력""이라고 밝혔다. 최 회장은 이날 서울 을지로 SK텔레콤 본사 수펙스홀에서 SKT의 AI 사업을 실행하고 있는 350여명의 아폴로TF 구성원들과 AI를 중심으로 한 회사의 비전과 개선 과제 등에..."
2011,"한화시스템, AI 기반 맞춤형 학사정보·취업교육·솔루션 'ai-CODI' 론칭",2022.03.11.,'인공지능 코디'를 의미하는 ai-CODI는 선배들로부터 정보를 구하기 어려운 코로나 팬데믹 시대에 대학생들에게 최적의 학습 및 취업 정보를 제공한다. 대학 내 다양한 지원 서비스를 통합한다. 또 AI와 머신러닝 기술 기반으로 학생들의 전공·진로·학습 성향·성취도와 선배들의 학습 이력을 분석해 학습자...
2012,"KB국민카드, 리브메이트 'AI 투자 날씨' 서비스 오픈",2022.03.11.,콴텍과 협업 출시 투자 정보를 날씨로 표현 [시장경제=김태영 기자] 사진=KB국민카드 제공 KB국민카드는 마이데이터 서비스 플랫폼 '리브메이트(Liiv Mate)'를 통해 날씨처럼 투자정보를 직관적이고 손쉽게 확인할 수 있는 '인공지능(AI) 투자 날씨' 서비스를 선보였다고 14일 밝혔다. 이번 서비스는...
2013,"SKT 직원들 만난 최태원 ""AI 회사로 새로운 도약""",2022.03.14.,"최태원 SK그룹 회장 SK텔레콤의 무보수 미등기 회장직을 맡은 최태원 SK그룹 회장이 SK텔레콤의 인공지능(AI) 사업 조직 아폴로 태스크포스(TF) 임직원들을 만나 ""AI 회사로 새로운 도약을 이뤄내겠다""고 약속했다. 최 회장은 11일 SK텔레콤 본사 수펙스홀에서 열린 타운홀 미팅에서 ""플랫폼 기업들과 그들의..."
2014,"테슬라의 영리한 선택, AI기술 '인슈어테크'…뭐가 좋길래",2022.03.14.,"자동차 제조 기업이 인공지능(AI) 기술을 활용한다면 과연 어디일까. 흔히 자동차에 적용되는 AI라고 한다면, 자율주행과 연관짓는 사람들이 많겠지만 최근 '보험' 영역에서 AI적용 움직임이 활발하게 전개되고 있다. 운전자 주행습관 데이터를 분석해 보험료를 산정하는 'BBI(Behavior-Based Insurance)' 상품 개발..."
2015,"동남권 ICT이노베이션스퀘어 ""AI·ICT 청년 창업 기회 살린다""",2022.03.15.,"보유한 AI 및 ICT 관련 예비‧초기 청년 창업 기업에 창업 및 데스밸리 극복의 기회를 제공해 지역 창업을 활성화 하기 위해 추진된다. 이 사업은 공고일... 진흥원은 인공지능, ICT 등 신성장 산업 분야를 중심으로 혁신 스타트업을 적극 발굴해 나가겠다""고 말했다. 한편 '2022 동남권 ICT이노베이션스퀘어..."
2016,"동화약품-심플렉스, AI 기반 면역질환 치료제 개발 협력",2022.03.22.,"동화약품이 14일, 인공지능(AI) 기반 신약 개발 벤처 심플렉스와 면역질환 치료제 개발을 위한 공동연구개발 계약을 체결했다고 밝혔다. 양사는 이번 계약을 통해 심플렉스가 설명 가능한 인공지능(Explainable AI) 플랫폼인 'CEEK-CURE'를 활용하여 면역질환 치료제 유효물질 탐색 및 최적화를 통한 최적의 신약..."
2017,김해시 AI 민원작성 도우미서비스 구축,2022.03.22.,"김해시민들은 앞으로 AI(artificial intelligence·인공지능)와 대화하면서 민원 신청서를 작성할 수 있다. 김해시는 행정안전부 주관 '2022년 첨단 정보기술 활용 공공서비스 촉진사업'에 최종 선정돼 지능형 민원서식 작성 도우미 서비스를 구축한다. 김해시를 비롯해 서울 도봉구, 서울 성동구, 대전소방본부..."
2018,"엔씨, ‘GDC 2022’서 강화학습 AI 기술 MMORPG 적용 사례 발표",2022.03.14.,"엔씨는 인공지능 서밋에 참여해 MMORPG에 적용한 AI 강화학습 모델을 발표했다. 엔씨가 연구한 AI 강화학습 모델은 PC 온라인 게임 '리니지'에 실제로 도입, 운영한 콘텐츠다. 수십 명 단위의 AI가 전투를 수행하는 콘텐츠를 상용화 수준까지 구현한 사례는 세계 최초다. 엔씨는 '리니지'에서 강화학습 기반..."
2019,"영우디에스피, AI 서빙 로봇 '서빙고' 첫 출하식 개최",2022.03.14.,"디스플레이 장비 전문 기업 영우디에스피(대표 박금성)는 급성장하는 로봇 시장을 겨냥한 인공지능(AI) 서빙로봇 '서빙고'의 첫 출하식을 개최했다고 밝혔다. 서빙고는 실내 자율주행 기술 기반의 서빙 로봇이다. 지난해 8월부터 대구 인터불고호텔의 로비, 식장에서 대략 10대의 '서빙고'가 시범운영 하였으며..."
2020,XR·메타버스·AI…지상파 3사 개표방송 신기술 승부,2022.03.08.,"3차원 가상세계인 메타버스에 개표방송을 볼 수 있는 공간을 마련하고, 확장현실(XR)·인공지능(AI) 등 첨단기술을 활용해 빠르고 정확한 분석을 할 계획이다. ◇KBS, XR·메타버스·AI 미래기술 총집합 KBS는 청와대를 XR로 구현해 데이터 쇼를 선보일 예정이다. 24m 초대형 직각 LED월, 듀얼 K-월을 통해 대선 양강..."
2021,"美中 기술경쟁, AI 분야도 파장···작년 공동연구 줄어",2022.03.08.,미국과 중국 간 기술경쟁의 여파로 지난해 양국 연구자 사이의 인공지능(AI) 분야 공동연구도 1년 전보다 줄어든 것으로 집계됐다. 미국 스탠퍼드대 인간중심 인공지능 연구소(HAI)는 최근 펴낸 보고서를 통해 지난해 미국과 중국 연구소 간 제휴에 따라 양국 연구자들이 공동으로 집필한 AI 관련 논문은...
2022,"KT, 웹페이지 코딩 교육 플랫폼 'AI 코딩블록 IoT 키트' 출시",2022.03.08.,"KT는 컴퓨터에 연결해 직접 실습할 수 있는 ‘KT 인공지능(AI) 코딩블록 사물인터넷(IoT) 키트’를 출시했다고 8일 밝혔다. AI 코딩블록 IoT 키트는 AI 기술을 학습, 구현하도록 지원하는 웹페이지 기반 AI 코딩 교육 플랫폼이다. 음성인식과 음성합성, 지도학습 등의 교육 기능을 추가한 것이 특징인..."
2023,"동화약품-심플렉스, AI 기반 면역질환 치료제 개발 협력",2022.03.15.,AI 활용한 신약 후보물질 발굴…유망 파이프라인 확보 협력 동화약품이은 인공지능(AI) 기반 신약 개발 벤처 심플렉스와 면역질환 치료제 개발을 위한 공동연구개발 계약을 체결했다고 15일 밝혔다. 양사는 이번 계약을 통해 심플렉스가 설명 가능한 인공지능 플랫폼인 ‘CEEK-CURE’를 활용해 면역질환 치료제...
2024,"영우디에스피, AI 서빙 로봇 ‘서빙고’ 출하",2022.03.15.,"14일 영우디에스피는 인공지능(AI) 서빙 로봇 ‘서빙고’ 출하식을 열었다고 밝혔다. 서빙고는 실내 자율주행 기술 기반 서빙 로봇이다. 지난해 8월부터 대구 인터불고호텔 로비, 식장에서 시범적으로 운영되고 있다. 호텔, 병원 프랜차이즈 식당에서 고객을 안내하고 주문한 음식과 요청 물품을 운반하는 등..."
2025,"엔씨, 강화학습 AI 기술 MMORPG 적용 사례 발표",2022.03.14.,"엔씨는 이번 인공지능 서밋에 참여해 MMORPG에 적용한 AI 강화학습 모델을 발표했다. 엔씨가 연구한 AI 강화학습 모델은 PC 온라인 게임 '리니지'에 실제로 도입, 운영한 콘텐츠로, 수십명 단위의 AI가 전투를 수행하는 콘텐츠를 상용화 수준까지 구현한 사례는 세계 최초라는 것이 회사 측의 설명이다...."
2026,"진진시스템-가톨릭대, '운동선수 헬스케어 분야' AI 연구 협업나서",2022.03.14.,"스포츠 전문 소프트웨어 개발사인 진진시스템은 오늘(24일) 서울 성수동 본사에서 가톨릭대와 '인공지능(AI) 연구'에 관한 산학협력 업무협약을 체결했다고 밝혔습니다. 진진시스템은 가톨릭대와 인공지능 분야의 스포츠 적용, 인력양성, 연구인력 공동활용, 신융합교육 등을 협력할 예정입니다. 이번 협약으로..."
2027,"포스코ICT, AI 컨트롤타워 본격 가동한다",2022.03.22.,"포스코ict가 조직내 인공지능(AI) 역량을 통합 운영하고, 산업 영역의 AI기술을 선도하기 위해 인더스트리얼 AI 리서치(IAR) 조직을 신설했다고 15일 밝혔다. 포스코ict는 단위 조직에서 각각 운영해오던 AI와 스마트 기술 엔지니어를 AI의 산업 응용에 초점을 맞춘 실용적 연구조직 IAR로 통합했다...."
2028,"'폐수관리도 AI로'…SK이노, 정유사 첫 AI 폐수처리 시스템 도입",2022.03.13.,시스템에는 실시간 분석 데이터에 기초해 유입 수질 변화와 방류 수질을 예측하는 인공지능(AI) 시스템이 탑재되어 있다. 이 시스템은 각종 공정운영 데이터에 기반한 시뮬레이션을 통해 최적의 폐수 처리 방안을 제시한다. 또 숙련된 운전원 이상의 판단력과 보다 높은 정확도를 갖추기 위해 '머신 러닝'을...
