,제목,날짜,본문
1249,"광주시, 수도권 AI유망기업 5개사와 108억원 투자협약",2022.07.15.,"광주시는 15일 시청 비즈니스룸에서 수도권 인공지능(AI) 유망기업 5개사와 108억원 규모의 투자협약을 체결했다. 협약 기업은 트랜스코스모스코리아, 펜타토닉, 비엔에스글로벌, 엘젠, 에이아이비즈 등이다. 이번 협약은 트랜스코스모스코리아 광주 연구센터 구축을 위한 신규 투자계획으로..."
1250,"""함께 고민해봐요""… 오산시, AI 시대 진로 진학 특강",2022.07.18.,"이날 특강은 서울과학기술대학교 인공지능학과 학과장인 박종열 교수와 함께 'AI(인공지능) 시대, 진로와 삶의 변화를 알아보다'라는 주제로 인공지능 시대를 맞이하는 학생들의 진로와 진학에 대해 전망해보는 시간이었다. 오산시는 지난 15일 지역 중학생과 학부모를 대상으로 오산시청 대회의실에서..."
1251,"AIA생명, 손흥민 선수의 AI 동생 'AI 쏘니' 공개",2022.07.18.,"AIA생명이 토트넘 홋스퍼 소속 손흥민 선수의 인공지능(AI) '동생'인 'AI 쏘니(AI Sonny)'를 선보였다. 'AI 쏘니'는 AIA생명의 AI 기반 대변인으로서 고객, 보험설계사 및 파트너들이 신체적, 정신적, 환경적인 건강을 증진시킬 수 있도록 참여를 이끌어내고, 교육하며, 영감을 주는데 기여할 예정이다. AIA생명은..."
1252,"카카오엔터프라이즈, 2022년 상반기 글로벌 탑티어 AI 학회 논문 17건 등재",2022.07.14.,"카카오엔터프라이즈, 2022년 상반기 글로벌 탑티어 AI 학회 논문 17건 등재 카카오엔터프라이즈는 2022년 상반기 인공지능(AI) 분야 탑티어 글로벌 학회에서 논문 17건을 등재했다고 19일 밝혔다. 카카오엔터프라이즈는 △자연어 처리 △음성 처리 △컴퓨터 비전 분야를 아우르는 연구 성과를 발표했고, 이번..."
1253,"LG, AI 아티스트 ‘틸다’ 뉴욕 페스티벌 ‘호평’",2022.07.14.,- ‘더 퓨처 나우’ 부문 금상·은상 수상 LG 인공지능(AI) 아티스트 틸다가 세계의 호평을 받았다. LG(대표 구광모 권봉석)는 ‘2022 뉴욕 페스티벌 국제 광고상’ ‘더 퓨처 나우(The Future Now)’ 부문에서 AI 아티스트 틸다가 금상과 은상을 수상했다고 17일 밝혔다. 틸다는 LG 초거대 멀티모발 AI 엑사원...
1254,"KT, 다국어 AI 음성합성 서비스 'AI 보이스 스튜디오' 출시",2022.07.19.,"감정 파악해 AI 보이스 제작 기술 적용 영어, 일어, 중국어 등 다국어 지원 AI 윤도현 오디오북 서비스 제공 [시장경제=유경표 기자] 사진=KT KT가 인간의 감정을 담은 인공지능(AI) 음성합성 콘텐츠를 제작할 수 있는 'AI 보이스 스튜디오' 서비스를 출시했다고 19일 밝혔다. AI 보이스 스튜디오는 100개의 AI..."
1255,"KT, 에듀테크 인공지능 기술 집중 육성",2022.07.19.,KT가 에듀테크(Edutech) 인공지능(AI) 기술 연구 강화를 위해 네오랩컨버전스와 협력한다고 밝혔다. 양사는 공동연구를 위한 업무협약(MOU)을 통해 스마트 펜으로 수집한 필기 데이터를 이용해 교육에 필요한 AI 기술을 연구하고 스마트 펜의 UX 편의성도 높이는데 협력하기로 했다. ABC(인공지능·빅데이터...
1256,"노원여성인력개발센터, AI데이터 어노테이터 양성 심화과정 진행",2022.07.19.,"‘AI 데이터 어노테이터 양성 심화과정’은 국비지원 직업훈련 교육으로, 컴퓨터(인공지능)가 학습할 수 있도록 이미지, 오디오, 텍스트 등 다양한 정보를 수집, 가공하는 어노테이터를 양성하는 과정이다. 심화과정이기 때문에 ‘AI어노테이터 기본교육과정’이수자, 데이터라벨러 교육 이수자, 라벨러..."
1257,"팁코, AI 모델 배포 지원 '팁코 모델옵스' 출시",2022.07.19.,팁코소프트웨어는 기업이 인공지능(AI) 모델을 어디에서나 더욱 빠르고 안전하며 규모에 따라 배포할 수 있도록 지원하는 '팁코 모델옵스(TIBCO ModelOps)'를 출시했다고 19일 밝혔다. 팁코는 기업이 비즈니스 성과를 연결 및 통합하고 자신 있게 예측해 복잡한 데이터 활용 과제를 해결할 수 있도록 지원한다....
1258,"엔비디아, 'AI 엔터프라이즈 2.1' 출시…퍼블릭클라우드 AI 지원 확장",2022.07.11.,"[이미지=엔비디아] 엔비디아가 인공지능(AI)·데이터 분석 소프트웨어인 '엔비디아 AI 엔터프라이즈'의 최신버전으로 2.1버전을 선보였다. 엔비디아 AI 엔터프라이즈 2.1은 기업이 베어메탈, 가상, 컨테이너, 클라우드 환경에서 AI 애플리케이션을 배포-확장할 수 있도록 업데이트됐다. 이번 2...."
1259,"중앙대 인문콘텐츠연구소, 제5회 인공지능인문학 국제학술대회 ICAIH 2022 성...",2022.07.19.,이번 국제학술대회를 주관한 중앙대 인문콘텐츠연구소 HK+ 인공지능인문학사업단은 기존에도 '인공지능이 인간과 사회에 미치는 영향'을 대주제로 정해 매년 국제학술대회 ICAIH(International Conference on AI Humanities)를 개최해 왔다. 인공지능인문학이라는 새로운 융합형 학문을 구축하기 위해 필요한...
1260,"""이달 복귀한다더니"" 테슬라 오토파일럿 팀 이끌던 AI 전문가 퇴사",2022.07.19.,글로벌 전기차 업체 테슬라의 자율주행 보조 기능인 오토파일럿 담당 팀을 이끌던 인공지능(AI) 전문가가 13일(현지시간) 회사를 떠나기로 했다. 안식기간을 끝마친 뒤 복귀하겠다는 뜻을 내비쳤지만 테슬라의 인력 감축 바람이 영향을 준 것으로 풀이된다. 블룸버그통신에 따르면 안드레이 카파시 테슬라 AI 및...
1261,"KT, IBK기업은행과 'AI보이스뱅킹' 상용화... 금융 디지털혁신 가속",2022.07.18.,KT가 IBK기업은행과 인공지능(AI) 음성인식 플랫폼 기가지니인사이드에 기반을 둔 'AI보이스뱅킹' 서비스를 공동으로 개발하고 상용화했다고 15일 밝혔다. 'AI보이스뱅킹' 서비스 개발은 KT와 IBK기업은행이 지난해 8월 체결한 '디지털 신기술 활용 신사업 공동발굴 및 개발협력'을 토대로 진행됐다. 양사는 AI...
1262,"오산시, AI(인공지능) 시대 진로와 삶의 변화 탐구 진로특강",2022.07.18.,오산시 AI(인공지능)시대 진로 진학 특강 교육도시 오산시는 AI융·복합 교육지원 사업의 일환으로 지난 15일 지역 중학생과 학부모를 대상으로 오산시청 대회의실에서 진로특강을 진행했다. AI 융·복합 교육지원 사업은 2025년 전면 시행 예정인 고교학점제를 전문화하고 다양한 진로 설계를 지원하기 위해...
1263,음성군의회 AI영재고 충북혁신도시 유치 촉구 건의안 채택,2022.07.18.,"충북 음성군의회는 19일 제347회 임시회 제3차 본회의를 열어 서효석 의원 등 8명 의원 전원이 공동발의한 'AI(인공지능)영재고 충북혁신도시 유치 촉구 건의안'을 채택했다. 군 의회는 건의문에서 ""충북혁신도시는 사통팔달의 교통망으로 전국에서 접근이 쉽고 정보통신산업진흥원..."
1264,"셀타스퀘어, 인공지능을 이용한 약물방법과 장치에 대한 특허 등록",2022.07.18.,㈜셀타스퀘어 신민경 대표이사는 “이 밖에도 인공지능 기술을 기반으로 한 3건의 기술 특허도 추가로 출원한 상태다. PV의 전문성과 AI/IT 전문 기술에 대한 진심으로 유용하고 새로운 솔루션을 지속적으로 개발하여 제약 분야의 혁신을 이끌어가고 싶다”고 전했다.
1265,"우리금융, 디노랩 3기 발대식 개최···AI·플랫폼 등 17개사 선정",2022.07.18.,"이번 디노랩 3기는 인공지능(AI), 데이터, 핀테크, 솔루션, 플랫폼, 인슈테크, 프롭테크 등 다양한 분야의 스타트업으로, 우리금융과의 협력 가능성이 높고 미래 성장성이 기대되는 기업들로 구성됐다. 이날 행사엔 디노랩 3기의 공식 활동을 선언하는 발대식에 이어서 우리금융 그룹사 약 15명의 실무자와..."
1266,"인하대 김민구 교수팀, 유아 행동·감정·의도를 감지·분석하는 AI기반 SUI ...",2022.07.18.,"소프트센서를 통해 유아의 행동, 감정, 의도를 감지하고 분석하는 인공지능(AI)을 SUI 플랫폼에 적용하는 것이 1차 목표다. 최종적으로 연구단은 유아의 인지와 놀이행동에 대한 데이터베이스를 바탕으로 SUI 교육콘텐츠를 개발하고 유아발달 지원체계를 만든다는 계획이다. 유아에 대한 인지행동 분석은..."
1267,"SK텔레콤, '누구 비즈콜'로 AI 콜 B2B 시장 진출",2022.07.19.,"SK텔레콤이 AI 기반 음성 안내 플랫폼, 누구 비즈콜로 인공지능(AI) 콜 기업간거래(B2B) 시장에 본격적으로 진출한다. 모델이 누구 비즈콜을 체험하고 있다. 사진, SK텔레콤. 인공지능(AI) 기반 사업모델을 강화 중인 SK텔레콤이 AI 콜 기업간거래(B2B) 시장에 본격 진출한다. SK텔레콤은 단순 고객 응대를 디지털화해..."
1268,"카카오엔터프라이즈, '사람같은 AI' 개발 성큼",2022.07.20.,"카카오엔터프라이즈 카카오엔터프라이즈는 올해 상반기에만 인공지능(AI) 분야 글로벌 학회에서 논문 17건을 등재했다고 19일 밝혔다. 카카오엔터프라이즈는 자연어 처리, 음성 처리, 컴퓨터 비전, 강화학습, 지식그래프 분야에서 활발한 연구 성과를 발표했다. 먼저, 자연어처리 분야 학회인 NAACL에서는 기존..."
1269,"대통령경호처, AI 과학경호 TF 출범",2022.07.13.,"대통령경호처는 12일 용산 대통령실 청사 9층 회의실에서 첨단 경호·경비 시스템 도입을 위해 민관이 함께하는 인공지능(AI) 과학경호·경비 플랫폼 구축 사업 추진단 출범식을 개최했다. 경호처의 인적 인프라에 민간 기업이 보유한 AI와 로봇, 5G 등 최첨단 정보통신기술(ICT)을 접목하겠다는 것이다. 그..."
1270,"KB국민은행, 제4회 'Future Finance A.I. Challenge' 개최",2022.07.19.,본선은 오는 8월 31일 이화여자대학교 삼성홀에서 열리는 '2022 Starting Out with Green Finance 국제 콘퍼런스 및 ESG 채용설명회'의 제2부 행사로 열릴 예정이다. 이번 콘퍼런스는 금융감독원 및 이화여자대학교가 공동 주최한다. #KB국민은행 #인공지능 #AI #공모전 #미래금융
1271,"'AI와 수학･과학기술･전통예술 만남!' ... 포항시, 인공지능 인재양성에 첫...",2022.07.18.,"캠프에 참여한 학생들은 4차산업혁명의 핵심기술인 AI인공지능을 생활 속에서 활용할 수 있는 기초이론과 실습 △인공지능 수학기초 △인공지능 알고리즘 △인공지능 코딩 △인공지능 음악작곡 △우주론 △한국 전통음악 기초이론 △한국의 장단 등을 학습하게 된다. 또한, 한국전통음악의 원리와 패턴을..."
1272,"카모아, AI 번역 플리토와 '맞손'... 해외 제휴사 확대 박차",2022.07.18.,렌터카 가격 비교앱 카모아가 인공지능(AI) 언어 번역 서비스를 제공하는 플리토와 글로벌 사업 확대를 위한 업무협약을 체결했다고 21일 밝혔다. [사진: 카모아] 렌터카 가격 비교앱 카모아가 인공지능(AI) 언어 번역 서비스를 제공하는 플리토와 글로벌 사업 확대를 위한 업무협약을 체결했다고 21일 밝혔다....
1273,"'제휴사가 직접 AI콜 시나리오 작성'…SKT, '누구 비즈콜' 출시",2022.07.18.,"SK텔레콤은 인공지능(AI) 음성 안내 플랫폼인 '누구 비즈콜'로 기업간거래(B2B) 시장에 진출한다고 18일 밝혔다. 누구 비즈콜은 SK텔레콤의 AI 대화기술 '누구 인터랙티브'를 바탕으로 음성인식과 자연어 처리, 다양한 음성 합성음을 지원하는 플랫폼이다. 제휴사는 '네', '아니오'와 객관식, 숫자형, 범위..."
1274,"카카오브레인-갤럭스, AI기반 신약 설계 플랫폼 연구 나선다",2022.07.12.,기사내용 요약 ‘AI 기반 항체 신약 설계 플랫폼’ 개발 위한 공동 연구 계약 체결 카카오브레인이 전략적으로 투자한 갤럭스…자체 AI 신약 개발팀 구성 [서울=뉴시스]송종호 기자 = 카카오브레인은 갤럭스와 인공지능(AI) 기반의 항체 신약 설계 플랫폼 구축을 위한 공동 연구 개발 계약을 체결했다고 밝혔다....
1275,"KT, 산학연 머리 맞댄 'AI 원팀' 전체회의 개최",2022.07.12.,"KT가 참여 중인 인공지능(AI) 원팀이 향후 범국가적인 AI 경쟁력 제고를 위한 협력을 다시 한번 다짐했다. AI 기술력 강화, AI 생태계 확대, AI 인재 발굴 등을 적극 추진해 나갈 계획이다. KT는 AI 원팀 참여기관이 모두 참여한 '2022 AI 원팀 전체회의'를 개최했다고 12일 밝혔다. AI 원팀에는 KT를 비롯해..."
1276,"광주광역시, 광주 인공지능 미래신산업 육성 발대식 개최",2022.07.12.,"먼저 ‘2022년 지역의 미래를 여는 과학기술 프로젝트’ 사업은 광주과학기술원 주관으로 5년간(2022~2026년) 총 104억원의 예산을 투입해 ‘인공지능(AI) 기반 메타버스 구현을 위한 융·복합 문화 스튜디오 조성’을 제목으로 진행되며, 지역 기업 및 대기업, 연구기관 12곳 이상이 참여한다. 이를 통해..."
1277,'로보컵(RoboCup) 2022' 국제 인공지능(AI) 로봇대회,2022.07.14.,부산대·서울대 연합 로봇팀 '타이디보이(Tidyboy)'(사진제공=부산대) 부산대학교(총장 차정인)는 부산대·서울대 연합 로봇팀 '타이디보이(Tidyboy)'가 지난 10일부터 17일까지 태국 방콕에서 오프라인으로 개최된 국제 인공지능(AI) 로봇대회인 '로보컵(RoboCup) 2022'에서 홈 서비스 부문 준우승을 차지했다고...
1278,"카카오엔터프라이즈, 상반기 글로벌 AI 학회 논문 17건 등재",2022.07.14.,"카카오엔터프라이즈는 올 상반기 인공지능(AI) 분야 글로벌 학회에서 자연어 처리, 음성 처리 관련 논문 17건을 발표했다고 19일 밝혔다. 자연어 처리 분야 세계 최고 권위 학회로 통하는 북미컴퓨터언어학회(NAACL)에서는 기존 사전학습 언어모델을 활용해 영어 이외의 언어 데이터에서 대화 속 감정을..."
1279,"KAIST, KAIㆍ대덕연구단지 벤처기업과 차세대 AI 연구 협력 체결.... SAR 위성...",2022.07.12.,"전기및전자공학부 윤찬현·김문철 교수팀이 참여하는 이번 연구 협력은 설명가능한 인공지능(AI) 기술, 위성탑재형 딥러닝 가속처리 하드웨어(HW) 기술 등을 적용해 고도화된 위성영상 분석 시스템 개발하는 것이 목표다. 이를 위해 KAIST는 KAI, I-OPS 등 위성전문기업 및 FISYS, 모두텍, 유니인포 등..."
1280,"의성안전체험관, 안전체험·AI교육 프로그램 운영",2022.07.12.,"교육은 체험중심의 시설을 활용해 △화재대피 △소화기안전 △교통안전 △풍수해안전(4D) △안전퀴즈를 통해 안전 사고대처 능력을 기르고, 로보마스터를 이용한 △AI교육을 통해 인공지능 활용 능력 향상을 목표로 하고 있다. 임미화 의성안전체험관장은 ""무엇보다 안전이 중요한 시기에 가족과..."
1281,"AIA생명, '손흥민 동생' AI 쏘니 공개",2022.07.26.,"AIA생명이 축구 국가대표 손흥민 선수의 인공지능(AI) 동생 'AI 쏘니(AI Sonny)'를 공개했다고 14일 밝혔다. AI 쏘니는 AIA생명 AI 대변인으로 고객, 보험설계사 및 파트너들이 신체적, 정신적, 환경적 건강을 증진시킬 수 있도록 참여를 이끌어내는 역할을 한다. AIA생명은 지난 13일 서울월드컵경기장에서..."
1282,"벤처기업협회-일루넥스, Ai 오픈이노베이션 ‘KOVA 이펙트몰’ 런칭",2022.07.18.,보유한 인공지능 산업 분석 플랫폼이다. 지난 4월 벤처기업협회와의 협약을 통해“협회 회원사를 위한 지능형 공급망 분석 서비스를 제공하겠다”고... ㈜일루넥스 박진혁 대표는“이펙트몰을 통해 기존 오프라인 형태의 오픈이노베이션에서 벗어나 Ai 플랫폼을 활용한 디지털 오픈이노베이션으로...
1283,"테크빌교육, KT 'AI 코디니' 활용 초등 융합 수업 사례 라이브 연수로 진행",2022.07.18.,"테크빌교육은 올 초부터 KT의 인공지능(AI), 소프트웨어(SW) 교육 플랫폼인 'AI 코딩블록'을 활용한 라이브 연수를 진행해 왔다. 'AI 코딩블록'은 최근 데이터 사이언스 및 AI 모델 학습 기능을 강화하고 지난 6월 'AI 코디니'로 명칭을 바꿨다. 변경된 명칭은 기존 KT 코딩블록의 캐릭터인 코디니를 내세워..."
1284,"SK텔레콤 AI 기반 음성안내 '누구비즈콜' 출시, B2B부문 AI 콜시장 진출",2022.07.21.,SK텔레콤이 B2B(기업간 거래) 부문 AI(인공지능) 콜시장에 본격적으로 진출한다. SK텔레콤은 AI 기반 음성안내플랫폼 '누구비즈콜(NUGU bizcall)'을 출시한다고 18일 밝혔다. SK텔레콤은 AI 기반 음성안내플랫폼 '누구비즈콜(NUGU bizcall)'을 출시한다고 18일 밝혔다. < SK텔레콤 > 누구비즈콜은 '누구케어콜(코로나19...
1285,"광주과기원, ‘게임 시뮬레이션 AI 기술 개발 나선다’",2022.07.18.,"광주과학기술원(GIST, 총장 김기선)의 융합기술 전문가들이 온라인 게임 시뮬레이션을 위한 인공지능(AI) 기술 개발에 나선다. GIST '게임 인공지능 연구센터(센터장 김경중 교수)'는 14일 '온라인 게임 콘텐츠 제작 지원을 위한 인공지능 기반 게임 시뮬레이션 기술 개발' 사업이 '2022년 문화체육관광..."
1286,"무하유, '2022 인공지능 학습용 데이터 구축사업' 주관기관으로 선정",2022.07.13.,자연어를 이해하는 실용 인공지능(AI) 기술 기업 무하유(대표 신동호)는 과학기술정보통신부가 주관하고 한국지능정보사회진흥원(NIA)이 추진하는 '2022년 인공지능 학습용 데이터 구축사업'의 '채용면접 인터뷰 데이터 구축' 주관기관으로 선정됐다고 밝혔다. 이번 사업은 무하유를 주관기관으로...
1287,숨소리로 수면 단계 분석...국내서 AI 모델 개발 성공,2022.07.13.,"사진 = 게티이미지뱅크 스마트폰으로 녹음한 숨소리를 기반으로 수면 단계를 분석하는 인공지능(AI) 모델이 국내서 개발됐다. 슬립테크 스타트업 에이슬립과 분당서울대병원 김정훈, 윤인영 교수 연구팀의 공동 성과로 의학적인 수준으로 수면 단계를 분석할 수 있다. 해당 연구를 통해 개발한 AI모델을 통해..."
1288,"기업은행, AI 음성인식 기반 '기가지니 음성 서비스' 실시",2022.07.19.,IBK기업은행이 KT와 'i-ONE Bank(아이원뱅크)' 내 인공지능(AI) 음성인식 플랫폼(기가지니인사이드)에 기반을 둔 '기가지니 음성 서비스'를 제공한다고 15일 밝혔다. 기가지니 음성 서비스는 기업은행과 KT가 지난해 8월 체결한 '디지털 신기술 활용 신사업 공동발굴 및 개발협력'을 통해 마련됐다. 고객들은i-ONE...
1289,"카이스트, 스스로 진화하는 흉부 엑스선 AI 진단기술 개발​",2022.07.11.,"카이스트 김재철AI대학원 예종철 교수 연구팀이 서울대학교 병원, 서울 아산병원, 충남대학교 병원, 영남대학교 병원, 경북대학교 병원과의 공동연구를 통해 결핵, 기흉, 코로나19 등의 흉부 엑스선 영상을 이용한 폐 질환의 자동 판독 능력을 스스로 향상할 수 있는 자기 진화형 인공지능 기술을..."
1290,"데이터 테크기업 라이앤캐처스, AI바우처 지원사업 최종 선정",2022.07.14.,"라이앤캐처스는 '인공지능 기반 개인화 추천 및 이커머스 솔루션'으로 AI 바우처 사업을 수행한다. 쇼핑 등 이커머스 솔루션을 비롯하여 스마트 물류 시스템, 프로덕트 추천이 가능한 각종 커머스에 적용하거나 솔루션화가 가능하며, 자사의 비블리 서비스를 비롯하여 타기업과의 프로젝트에서 인적 자원..."
1291,"“엄마에게 5만원 송금해줘”… KT, 기업은행과 ‘AI보이스뱅킹’ 상용화",2022.07.15.,KT(030200)는 IBK기업은행과 인공지능(AI) 음성인식 플랫폼 ‘기가지니인사이드’에 기반한 ‘AI보이스뱅킹’ 서비스를 공동 개발·상용화했다고 15일 밝혔다. IBK기업은행은 AI보이스뱅킹 서비스를 모바일뱅킹 애플리케이션(앱)인 ‘아이원뱅크’에 적용해 업데이트 했다. 아이원뱅크 업데이트를 통해...
1292,"광주시, 수도권 인공지능 유망기업과 투자협약",2022.07.15.,지난 2월 광주시와 투자협약을 체결한 후 바로 사업에 착수하고 '광주 인공지능(AI) 컨택센터'를 개소해 운영 중이다. 이번 투자협약은 ㈜트랜스코스모스코리아 광주 연구센터 구축을 위한 신규 투자계획으로 '인공지능형 컨택센터'와 '스마트 키오스크' 연계 플랫폼 모델 개발 및 사업화를 진행할...
1293,[AI-META 시대 '미래전략'] <14>웹3.0 블록체인,2022.07.15.,"현재 웹 개발뿐만 아니라 인공지능(AI), 데이터베이스 등 컴퓨터 공학 잔반에 걸쳐 디지털 전환을 주도할 개발자 숫자는 턱없이 부족한 상황이다. 웹3.0 기반의 서비스 개발자는 더욱 산업체에서 구하기가 어려운 상황이다. 이를 반증하듯 웹2.0 기반 서비스는 350만개 정도가 구글이나 앱스토어를 통하여..."
1294,"경희대치과병원, 국내 최초 'AI 3D 통합영상분석 플랫폼' 개발 나선다",2022.07.15.,<경희의료원> 경희대학교치과병원(원장 황의환)은 지난 18일 세계적인 3D 렌더링 소프트웨어 개발사인 미국 오스티오이드(Osteoid Inc.·대표 허정훈)와 국내 최초 '인공지능(AI) 3D 통합영상분석 플랫폼인 트위맥 개발'을 위한 업무협약을 체결했다고 22일 밝혔다. 경희대치과병원은 오스티오이드와 함께 환자의...
1295,"구글, 자체 개발 AI에 ""인간 수준 지각 능력 있다"" 주장한 엔지니어 해고... ...",2022.07.15.,"구글이 자체 개발 중인 대화형 AI(인공지능) '람다(LaMDA)'의 성능을 인간에 버금간다고 주장한 개발자를 해고해 논란이 일고 있다. 23일(현지 시각) 워싱턴포스트(WP) 등 외신에 따르면, 구글은 람다의 지각 능력을 주장한 자사 개발자 블레이크 르모인의 주장에 신빙성이 없으며 회사 비밀 유지 의무를 위반했다는..."
1296,"‘국내 12개 AI 기관 한자리에’… KT, AI 원팀 전체회의 개최",2022.07.12.,"KT는 지난 11일 서울 서초동 LG전자 R&D(연구개발)캠퍼스에서 AI(인공지능) 원팀 참여기관과 함께 ‘2022 전체회의’를 개최했다고 12일 밝혔다. AI 원팀은 지난 2020년 2월부터 대한민국을 AI 1등 국가로 만들겠다는 취지로, 12개 산학연이 모인 AI 협력체다. 현재 현대중공업그룹, LG전자, 한국투자증권..."
1297,"하윤수 부산교육감 ""초·중등 SW·AI 교육 강화""",2022.07.12.,"부산교육감직 인수위원회는 11일 ""초·중등 SW(소프트웨어)·AI(인공지능) 교육을 강화하겠다""고 밝혔다. 인수위에 따르면 앞으로 초등 5~6학년 실과교과(17시간)와 창의적 체험활동(17시간) 확보 권장, 중학교 정보교과(68시간 이상) 권장 등 SW·AI 관련 교과목 시수응 확대 편성토록 할 계획이다. 또..."
1298,"카페24, “콘텐츠 자동 제작 AI로 만든 쇼핑몰 상세페이지 500만 건 돌파”",2022.07.28.,"“또한 AI 이미지 자동 분류 기능 덕에 사진을 일일이 상세페이지에 배치하는 작업이 훨씬 쉬워져 콘텐츠 제작 과정에 크게 도움이 되고 있다”고 밝혔다. 카페24 이재석 대표는 “앞으로 콘텐츠에 대한 중요도가 더욱 높아지는 이커머스 시장 환경이 조성될 것으로 전망된다”며 “인공지능, 빅데이터 등..."
1299,"""엄마한테 5만원 보내줘""…KT·기업銀, 'AI 보이스뱅킹' 서비스",2022.07.15.,KT가 IBK기업은행과 AI(인공지능) 음성인식 플랫폼을 이용한 'AI보이스뱅킹 서비스'를 공동 개발하고 상용화했다고 15일 밝혔다. AI보이스뱅킹 서비스가 적용된 기능은 △간편송금 △메뉴찾기 △일상대화 등 세 가지다. 간편송금은 별칭으로 등록된 계좌에 빠르게 돈을 보내는 기능이다. '엄마'로 등록된...
1300,"""AI음성 서비스 시장 잡아라"" 통신3사 고객잡기 혈투[1일IT템]",2022.07.18.,"SK텔레콤, KT, LG유플러스 등 통신3사가 연간 9조원 규모로 추산되는 'AI콘택트센터(AICC)' 등 인공지능(AI) 기술을 기반으로 한 AI음성인식 서비스 영역에서 파이 쟁탈전을 벌인다. 공공, 금융, 의료, 소상공인, 개인 등 각 영역에서 각자 강점을 살린 AI음성인식 서비스를 중심으로 더 많은 고객층을..."
