,제목,날짜,본문
624,"미래에셋증권, 네이버클라우드와 클라우드·AI 기반 고객 서비스 협약",2022.07.26.,"미래에셋증권이 네이버클라우드와 함께 인공지능(AI) 및 클라우드 기반의 고객 서비스를 출시한다. 양사는 투자 콘텐츠 공급부터 콜센터, 영업점 관리 등 전방위에서 고객 경험 향상을 위해 협력한다. 미래에셋증권은 2018년 네이버클라우드 고성능 컴퓨팅(HPC) 도입을 시작으로 클라우드 기반 금융 IT..."
625,"KAI, 카이스트와 함께 우주 AI 기술 고도화 나서",2022.07.26.,"사진=KAI 제공 한국항공우주산업(KAI)은 한국과학기술원(KAIST)과 손잡고 인공지능(AI)을 활용한 우주기술 고도화, 시장 개척에 나선다고 25일 밝혔다. 양측은 최근 업무협약을 맺고 위성이 전송하는 사진을 저해상도에서 고해상도로 변환하는 초해상화 기술을 비롯해 우주산업 고도화에 필요한 핵심기술..."
626,"KAI, 카이스트와 함께 우주 AI 기술 고도화 나서",2022.07.26.,"사진=KAI 제공 한국항공우주산업(KAI)은 한국과학기술원(KAIST)과 손잡고 인공지능(AI)을 활용한 우주기술 고도화, 시장 개척에 나선다고 25일 밝혔다. 양측은 최근 업무협약을 맺고 위성이 전송하는 사진을 저해상도에서 고해상도로 변환하는 초해상화 기술을 비롯해 우주산업 고도화에 필요한 핵심기술..."
627,"`비전공자도 개발자로`… 솔트룩스, 무료 AI개발자 교육",2022.07.22.,솔트룩스는 서울산업진흥원과 손잡고 청년취업사관학교 '새싹(SeSAC)'의 AI(인공지능) 응용SW(소프트웨어) 개발자 교육 참가자를 모집한다고 밝혔다. 새싹 청년취업사관학교는 서울시 거주 청년과 장년층에게 디지털 신기술 관련 실무교육을 제공한다. 오세훈 서울시장은 청년취업사관학교를 통해 연 2000명의...
628,"미래에셋증권, 클라우드 기반 금융AI 서비스 강화..네이버클라우드와 협력",2022.07.22.,/사진=미레에셋증권 미래에셋증권은 25일 서울 종로구 포시즌스호텔서울에서 네이버클라우드와 '클라우드 기반 금융 특화AI(인공지능) 서비스 업무협약' 을 체결했다고 26일 밝혔다. 양사는 협약을 통해 AI·클라우드 기반 대고객 서비스 증진을 위한 오픈 이노베이션 (개방형 혁신) 확대에 나설 계획이다....
629,"어니스트펀드, AI 기반 중금리 개인신용대출 서비스 오픈",2022.07.22.,온라인투자연계금융기업(온투기업) '어니스트펀드'가 인공지능(AI) 알고리즘을 기반으로 한 중저신용자 대상 개인신용대출 서비스를 재개한다고 20일 밝혔다. 이번 개인신용대출은 금융 데이터와 비신용 데이터를 더한 200여개의 항목을 분석하는 AI알고리즘이 신용평가모형(CSS)에 적용됐다. 이에 과거 대비...
630,AI로 유전성 심장질환 등 9대 소아희귀질환 치료 돕는다,2022.07.19.,"과기정통부가 인공지능(AI)을 활용해 선천성 다발기형, 유전성 심장질환 같은 9대 소아희귀질환을 진단, 치료, 예후 관리한다. 서울대병원, 카카오헬스케어 등 병원과 IT기업 11곳이 참여하는 컨소시엄에 3년간 80억원을 지원, 솔루션 개발에 나선다. 22일 과학기술정보통신부(과기정통부)와 정보통신산업진흥원..."
631,"카카오엔터프라이즈 ""한국어 감정 인식 AI 기술 국제학회 발표""",2022.07.19.,"""상반기 글로벌 AI 학회에 논문 17건 발표"" 카카오엔터프라이즈는 올해 상반기 글로벌 인공지능(AI) 학회에 논문 17건을 발표했다고 19일 밝혔다. 논문 분야는 ▲ 자연어 처리 ▲ 음성 처리 ▲ 컴퓨터 비전으로 올해는 ▲ 강화학습 ▲ 지식그래프 분야에도 처음 논문을 발표했다고 카카오엔터프라이즈는..."
632,"LG전자, 사운드하운드와 손잡고 AI 음성인식 솔루션 공동개발",2022.07.28.,"LG전자가 미국 AI 음성인식 솔루션업체인 사운드하운드(Soundhound)와 손잡고 차량용 인포테인먼트 시스템에 적용할 음성인식 솔루션을 강화한다.... 독자 인공지능 기술로 복잡한 음성 명령을 빠른 속도로 처리할 수 있는 솔루션을 개발한다. 이 솔루션은 고객이 차량 안에서 콘텐츠 재생, 차량 설정 등..."
633,"KAIST, 스스로 진화하는 흉부 엑스선 인공지능 진단기술 개발",2022.07.28.,"KAIST연구팀이 흉부 엑스선 영상을 이용한 폐 질환의 자동 판독 능력을 스스로 향상할 수 있는 자기 진화형 인공지능 기술을 개발했다. (사진=KAIST 제공) KAIST(총장 이광형)는 김재철AI대학원 예종철 교수 연구팀이 서울대 병원, 서울아산병원, 충남대병원, 영남대병원, 경북대병원과의 공동연구를 통해..."
634,"'AI 영상분석' 핀텔, 코스닥 상장예비심사 통과",2022.07.28.,"고해상도 인공지능(AI) 영상분석 전문기업 핀텔이 지난 21일 한국거래소의 코스닥 상장예비심사를 통과했다고 22일 밝혔다. 핀텔은 올해 반기 실적 검토 등 준비를 마치는 대로 증권신고서를 제출하고, 기업공개(IPO)를 위한 공모 절차에 착수할 예정이다. 상장 주관사는 대신증권이다. 2015년에 설립된 핀텔은 자체..."
635,"이글루코퍼레이션, 머신러닝 예측 성능 개선 'AI 특허' 취득",2022.07.28.,"인공지능의 한 분야인 머신러닝은 기계(알고리즘)가 데이터에 대한 학습을 토대로 자체적인 판단 기준을 만들어 또 다른 데이터에 대한 예측을 내리게... 가능한 AI(XAI, eXplainable AI)’ 지수를 토대로 공격 유형 별 예측 이벤트 지수를 산출하고, 이를 기존에 저장된 공격 유형 별 피드백 이벤트 선별 기준과..."
636,"KISA ""보안 AI 데이터셋 8억건 구축…30곳 단계적 개방 추진""",2022.07.21.,정부가 지난해 구축한 '사이버 보안 인공지능(AI) 데이터셋 8억건을 올해 기업·학교 등 30여 곳에 실증사업을 통해 단계적으로 개방할 계획이라고 밝혔다. 한국인터넷진흥원(KISA)은 21일 오후 서울 중구 플라자 호텔에서 '사이버보안 AI 데이터셋 구축 사업성과 공유회'에서 이같은 내용을 담은 로드맵을...
637,"네이버, AI로 원하는 선수만 골라 본다",2022.07.28.,"네이버가 인공지능(AI) 기술로 개발한 태깅 기능을 활용해 골프·야구·축구 경기 시청자 편의를 제고한다. 네이버는 '네이버 스포츠'를 통해 각종 스포츠에 실시간 태깅 기능을 적용, 종목별 이벤트 시작 지점을 바로 찾거나 응원하는 개별 선수가 뛰는 모습만 골라서 볼 수 있도록 지원한다. 골프 특성상..."
638,"한국교통대 LINC 3.0사업단, AI산업 융합생태계 조성 광역협력 교류회",2022.07.19.,한국교통대·전남대 LINC 3.0 사업단이 마련한 인공지능(AI)산업 융합 생태계 조성을 위한 광역협력 교류회 모습. 사진=한국교통대 제공 한국교통대학교는 LINC 3.0 사업단이 지난 27~28일 전남대 LINC 3.0 사업단과 공동으로 인공지능(AI)산업 융합 생태계 조성을 위한 광역 협력 교류회를 열었다고 28일...
639,'초개인화' 시대…AI가 옷 골라주고 화장품 제조도 척척,2022.07.28.,"AI(인공지능) 기술이 나의 취향과 생각을 분석해 상품과 서비스를 적재적소에 맞게 제공하거나, 내 취향을 반영한 커스터마이징(주문 제작) 서비스를 제안하는 식이다. 21일 관련 업계에 따르면 GS프레시몰에서 선보인 AI 기반 '초개인화 큐레이션 서비스' 이용자가 크게 늘었다. GS프레시몰에서 최근 한달(지난..."
640,"카카오엔터프라이즈, 글로벌 AI 학회서 논문 17건 등재",2022.07.24.,"기사내용 요약 자연어 처리, 음성 처리 분야 성과 두드러져 사람처럼 말하고 감정 인지하는 AI 개발 [서울=뉴시스]최은수 기자 = 카카오엔터프라이즈의 인공지능(AI) 기술이 자연어 및 음성 처리 분야에서 두각을 나타내며 글로벌 AI 업계에서 주목을 받고 있다. 카카오엔터프라이즈는 올 상반기 글로벌 AI..."
641,"""구글 AI 지각력 있다"" 주장 르모인 해고",2022.07.26.,구글의 초거대 인공지능(AI) 대화형 언어 모델인 ‘람다(LaMDA)’가 사람과 같은 수준의 지각력과 자의식을 갖고 있다는 주장을 한 구글 엔지니어가 해고됐다. 구글 측은 그의 주장에 신빙성이 없다고 최종 결론을 내렸다. 23일(현지 시간) 워싱턴포스트(WP) 등은 구글이 회사의 비밀 유지 방침 위반을 이유로...
642,"""AI가 용접 공정 불량 판별한다""…SKT, '인더스트리얼 AI' 사업 확대",2022.07.26.,"SK텔레콤이 인더스트리얼 인공지능(AI) 사업 확대에 본격적으로 나선다. 인더스트리얼 AI는 산업 현장의 전문성과 AI 기술을 결합해 생산 공정의 완전 자동화가 가능하도록 하는 게 목표로, 이를 위해 딥 러닝 기반 AI 기술을 주요 생산 공정에 적용하는 사업을 말한다. 최근 우리나라와 같이 제조업 비중이 큰..."
643,"엣지 AI 기업 '노타', 대전시에 인공지능 기반 안전 횡단보도 구축한다",2022.07.27.,"엣지 인공지능 기술 기업 노타(대표 채명수)가 대전광역시에 AI 안전 횡단보도(AI Safe Crossing)를 설치하고 인공지능 기반으로 보다 안전한 보행 환경을 구현한다. 이번 사업은 국토교통부(장관 원희룡)의 '2022년 스마트시티 기업주도형 혁신기술 발굴사업'으로 노타가 주관하며, 사업을 위한 컨소시엄은..."
644,"KAIST, 스스로 진화하는 흉부 엑스선 인공지능 진단기술 개발",2022.07.21.,"김재철AI대학원 예종철 교수 연구팀이 서울대학교 병원, 서울 아산병원, 충남대학교 병원, 영남대학교 병원, 경북대학교 병원과의 공동연구를 통해 결핵, 기흉, 코로나-19 등의 흉부 엑스선 영상을 이용한 폐 질환의 자동 판독 능력을 스스로 향상할 수 있는 자기 진화형 인공지능 기술을 개발했다고 27일..."
645,"전북대, 국립국어원과 AI 활용 국어능력 진단체계 개발",2022.07.21.,"사진=전북대 제공 전북대학교가 26일 국립국어원과 인공지능(AI)을 활용한 국어능력 진단체계 개발, 관련 업무 추진을 위해 업무협약을 체결했다. 이번 협약은 인공지능을 활용해 국민의 국어능력 진단을 위한 도구 개발과 기법의 고도화, 진단 결과 피드백, 이를 종합적으로 검토․관리․운영하는 체계 개발의..."
646,"KT·네오랩컨버전스, 에듀테크 AI 기술 연구 위해 맞손",2022.07.21.,"사진=KT KT가 네오랩컨버전스와 에듀테크(Edutech) 인공지능(AI) 기술 연구에 협력한다고 21일 밝혔다. 에듀테크는 빅데이터, AI 등 정보통신기술을 활용한 차세대 교육을 의미한다. KT와 네오랩컨버전스는 에듀테크 AI 공동연구를 위한 업무협약(MOU)을 맺고, 스마트펜으로 수집한 필기 데이터를 이용해 교육에..."
647,"세븐미어캣, AI 기반 아파트 ICT 통합관리 솔루션 강화",2022.07.21.,"[사진=세븐미어캣] 세븐미어캣이 인공지능(AI) 주차관제 시스템을 기반으로 한 '아파트 IT리모델링 솔루션'을 강화했다고 밝혔다. 전기차(EV) 충전, 출입관제 IoT 시스템 연동 등의 다양한 서비스를 하나로 통합해 일상 생활에서 보다 편리하게 ICT 기술의 이점을 얻을 수 있도록 한 것이다. 그동안 기축 아파트에..."
648,"AI 신약 개발 기업 스탠다임, 오라클 클라우드 도입",2022.07.26.,인공지능(AI) 신야 개발 기업 스탠다임은 고성능 정보기술(IT) 인프라 환경 구축을 위해 오라클 클라우드 인프라스트럭처(OCI)를 도입했다고 26일 밝혔다. 스탠다임은 AI를 통해 다양한 가설을 탐색·예측함으로써 신약 개발 기간을 단축시키는 기업이다. 현재 국내·외 제약회사 및 연구기관과 연구를 진행하며...
649,"SKT, '인터스트리얼 AI' 사업 확대 잰걸음",2022.07.19.,[사진=SK텔레콤] SK텔레콤이 자동차 부품 제조 전문업체 ㈜화신과 인공지능(AI) 기술로 용접 품질을 관리하는 '웰딩(Welding) AI 솔루션' 상용화 계약을 맺고 인더스트리얼(Industrial) AI 사업 확대에 나선다고 밝혔다. 인더스트리얼 AI는 산업 현장의 전문성과 AI기술을 결합해 생산 공정의 완전 자동화(Self...
650,"KT, AI 음성합성 서비스 출시…""인간의 5가지 감정 담아""",2022.07.22.,"KT가 인공지능(AI) 음성합성 콘텐츠를 제작할 수 있는 'AI 보이스 스튜디오' 서비스를 출시했다고 19일 밝혔다. AI 목소리로 인간의 감정을 표현할 수 있는 '감정 더빙' 기술이 특징이다. AI 보이스 스튜디오는 100개의 AI 목소리를 기반으로 즐거움, 침착함, 중립, 슬픔, 화남 등 5가지 감정으로 합성할 수..."
651,"인천시, 홀로사는 중장년 5천 가구 인공지능(AI)으로 돌본다",2022.07.22.,"고독사 위험 40세 이상 중장년 1인 가구 대상 AI로 통화해 건강상태 등 파악, 위기 시 공무원과 연결 케어콜 흐름도.(제공: 인천시청) [천지일보 인천=김미정 기자] 인천시가 혼자 사는 중장년 가구에 인공지능(AI) 전화를 걸어 안부를 묻고 특이상황을 모니터링한다. 인천시가 1인가구의 고독사를 예방하기..."
652,"CJ올리브네트웍스, AI·메타버스 인재 양성…CJ유닛 7기 모집",2022.07.26.,"상반기에는 제주지역 4개 중학교와 4개 고등학교를 대상으로 '찾아가는 인공지능(AI)∙SW창의캠프'와 '오픈이노베이션 과정'을 동시에 운영했다. 찾아가는 AI∙SW창의캠프는 제주지역 중학교 1학년 학생들을 대상으로 자유학년제 및 방과후 수업과 연계해, 대면과 비대면 수업을 결합한 하이브리드..."
653,‘인공지능 대가’가 무보수로 신약개발 연구소장 맡은 까닭은,2022.07.25.,세계적인 인공지능(AI) 석학으로 꼽히는 김 교수의 인사 소식은 제약 업계에서 화제가 됐다. 1984년 GC녹십자가 설립한 비영리 연구재단인 목암연구소가‘AI 신약’ 개발을 선언하면서 이뤄진 파격 영입이어서다. 지난 21일 경기도 용인에 있는 목암연구소에서 만난 김 소장과 신현진(49) 부소장은...
654,"세종대 김수연 교수, AI 학습용 데이터 구축 지원사업 선정",2022.07.25.,"수집해 AI 음성인식이 가능하도록 정제하고 가공하는 내용이다. 김 교수팀은 데이터 수집과 구축을 기획했다. 연구팀은 전라, 충청, 경상, 강원, 제주 등 전국 5개도 중노년층 화자의 발화 의도와 감성지수를 파악한다. 구축된 데이터는 노인 챗봇, 응급상황 인식 알리미 서비스 등 고령인구를 위한 인공지능..."
655,"KAIST-KAI-대덕연구단지 벤처기업, 차세대 AI 연구 협력 체결",2022.07.28.,"25일 KAIST에 따르면 전기및전자공학부 윤찬현·김문철 교수팀이 참여하는 이번 연구 협력은 설명가능한 인공지능(AI) 기술, 위성탑재형 딥러닝 가속처리 하드웨어(HW) 기술 등을 적용해 고도화된 위성영상 분석 시스템 개발하는 것이 목표다. 이를 위해 KAIST는 KAI, ㈜I-OPS 등의 위성전문기업과 ㈜FISYS, ㈜모두텍..."
656,"LG전자·사운드하운드, 차량용 AI 음성인식 솔루션 공동개발",2022.07.28.,"AI 음성인식 솔루션 전문업체로 자동차, 모바일, 스마트홈, 로봇 등 여러 산업 분야에 솔루션을 제공하고 있다. 양사는 사람이 실제 인지하는 방식과 동일한 '실시간 사용자 음성 의미 분석 (Speech-to-Meaning)' 및 '사용자 음성 핵심 의미 이해(Deep Meaning understanding)' 등 사운드하운드의 독자 인공지능..."
657,"네이버클라우드-미래에셋증권, 초대규모 인공지능 및 클라우드 기반 대고객 서...",2022.07.28.,"안인성 미래에셋증권 디지털부문대표와 김태창 네이버클라우드 사업총괄 네이버클라우드(대표 박원기)가 미래에셋증권(회장 최현만)과 인공지능(AI) 및 클라우드 기반 서비스 개발로 대고객 서비스를 출시하고 투자 콘텐츠 공급부터 콜센터, 영업점 관리 등 전방위적 고객 경험 향상을 위해 협력한다...."
658,"KAIST, SAR 위성영상 활용 차세대 AI 연구 협력 나선다",2022.07.25.,"KAIST 전기및전자공학부 윤찬현·김문철 교수팀이 참여하는 이번 연구 협력은 설명가능한 인공지능(AI) 기술, 위성탑재형 딥러닝 가속처리 하드웨어(HW) 기술 등을 적용해 고도화된 위성영상 분석 시스템 개발하는 것이 목표다. 이번 협약에 참여한 곳은 KAIST를 비롯해 KAI, ㈜I-OPS 등 위성전문기업과 ㈜FISYS..."
659,"LG전자·사운드하운드, 차량용 AI 음성인식 솔루션 공동개발",2022.07.25.,"AI 음성인식 솔루션 전문업체로 자동차, 모바일, 스마트홈, 로봇 등 여러 산업 분야에 솔루션을 제공하고 있다. 양사는 사람이 실제 인지하는 방식과 동일한 '실시간 사용자 음성 의미 분석 (Speech-to-Meaning)' 및 '사용자 음성 핵심 의미 이해(Deep Meaning understanding)' 등 사운드하운드의 독자 인공지능..."
660,"네이버클라우드-미래에셋증권, 초대규모 인공지능 및 클라우드 기반 대고객 서...",2022.07.28.,"안인성 미래에셋증권 디지털부문대표와 김태창 네이버클라우드 사업총괄 네이버클라우드(대표 박원기)가 미래에셋증권(회장 최현만)과 인공지능(AI) 및 클라우드 기반 서비스 개발로 대고객 서비스를 출시하고 투자 콘텐츠 공급부터 콜센터, 영업점 관리 등 전방위적 고객 경험 향상을 위해 협력한다...."
661,"KT-네오랩컨버전스, 스마트펜 활용 에듀테크 AI 공동연구",2022.07.28.,"KT가 네오랩컨버전스와 스마트펜을 활용한 '에듀테크 인공지능(AI)' 공동연구를 추진한다. KT(대표 구현모)는 네오랩컨버전스(대표 이상규)와 '에듀테크 AI' 기술 연구에 협력한다고 21일 발표했다. 에듀테크는 빅데이터, AI 등 정보통신기술을 활용한 차세대 교육을 의미한다. KT와 네오랩컨버전스는 에듀테크..."
662,"삼성전자, AI 아티스트와 '갤럭시 북 아트 프로젝트' 진행",2022.07.28.,삼성전자가 25일부터 인공지능(AI) 아티스트를 거쳐 자사 노트북 '갤럭시북'을 꾸며볼 수 있는 '갤럭시북 아트 프로젝트'를 진행한다고 24일 밝혔다. 갤럭시북 아트 프로젝트는 갤럭시 북2 시리즈와 '카카오브레인'의 AI모델을 기반으로 탄생한 AI 아티스트 '칼로(Karlo)'가 함께 한다. 칼로는 빅데이터를 기반으로...
663,"인공지능이 추천하는 중학교 영어단어 학습, ‘AI 매일 VOCA’ 오픈",2022.07.28.,이에 천재교육의 자회사 천재교과서가 만든 스마트 중학인강 ‘밀크T 중학’은 영어 단어 루틴 어휘학습 ‘AI 매일 VOCA’ 서비스를 오픈했다. AI 매일 VOCA는 중등인강 학습생에게 맞는 레벨을 추천해주고 중학부터 고등까지 필수 영어 어휘를 꾸준하게 학습할 수 있는 영어 학습 서비스다. 중학 영어 교과서...
664,"오산문화스포츠센터, AI로봇 시설안내 등 정보제공",2022.07.21.,"오산문화스포츠센터는 27일부터 다음달 1일까지 인공지능(AI)을 기반으로 시설 안내 로봇(문스봇) 2대를 도입하고 시범운영한다고 밝혔다. 오산문화스포츠센터에 AI로봇이 고객들에게 시설안내 등 정보제공을 한다.(사진=오산시) 문스봇은 어린이, 노인, 시각·청각장애인 등 이용 취약 계층과 코로나19로 인한..."
665,남해군 ‘인공지능 통합 돌봄 서비스’ 확대 시행,2022.07.21.,"이 같은 모든 서비스는 AI(인공지능) 스피커와 IoT(사물인터넷) 센서 등을 통해 이루어진다. 실제 지난해 관내 한 대상자는 극심한 어지럼증에 '아리아 도와줘'라고 외쳤고, ‘아리아(AI스피커)’가 이를 인식해 119 연계 시스템을 통해 신속하게 병원으로 이송돼 적절한 치료를 받았던 사례가 있었다. 이처럼..."
666,"과기정통부 “첨단 반도체 공정 서비스, 인공지능·데이터기반 제공”",2022.07.21.,과학기술정보통신부(과기정통부)는 올해 신규 사업으로 ‘인공지능(AI)·데이터 기반 나노팹 공정 스마트 서비스’ 구축을 추진한다고 밝혔습니다. 과기정통부 이종호 장관은 오늘(20일) 나노종합기술원에서 ‘공공 나노팹 운영 혁신 자문위원회’를 열고 올해부터 2026년까지 총 270억 원을 투입해 이 사업을...
667,"LG CNS, 정부세종청사 AI 관제시스템 구축사업 수주",2022.07.21.,행정안전부가 발주한 이 사업은 2023년 4월까지 정부세종청사에 '인공지능(AI) 통합 관제시스템'을 구축하는 프로젝트다. 사진은 디지털 트윈으로 구현한 가상 정부세종청사를 홍보하는 모델들. 2022.7.19 [LG CNS 제공. 재판매 및 DB 금지]
668,"과기정통부 “첨단 반도체 공정 서비스, 인공지능·데이터기반 제공”",2022.07.20.,과학기술정보통신부(과기정통부)는 올해 신규 사업으로 ‘인공지능(AI)·데이터 기반 나노팹 공정 스마트 서비스’ 구축을 추진한다고 밝혔습니다. 과기정통부 이종호 장관은 오늘(20일) 나노종합기술원에서 ‘공공 나노팹 운영 혁신 자문위원회’를 열고 올해부터 2026년까지 총 270억 원을 투입해 이 사업을...
669,"LG CNS, 정부세종청사 AI 관제시스템 구축사업 수주",2022.07.19.,행정안전부가 발주한 이 사업은 2023년 4월까지 정부세종청사에 '인공지능(AI) 통합 관제시스템'을 구축하는 프로젝트다. 사진은 디지털 트윈으로 구현한 가상 정부세종청사를 홍보하는 모델들. 2022.7.19 [LG CNS 제공. 재판매 및 DB 금지]
670,"KT·네오랩컨버전스, 에듀테크 분야 AI 공동연구 나서",2022.07.21.,KT는 스마트펜 전문 업체 네오랩컨버전스와 에듀테크 인공지능(AI) 공동연구에 들어간다고 21일 밝혔다. 이번 협력으로 KT의 비대면 교육 플랫폼 ‘랜선에듀’와 네오랩컨버전스가 스마트펜 사업에서 확보한 필기 데이터의 분석·처리 기술이 결합된다. 차세대 교육 솔루션이 탄생하는 셈이다. 네오랩...
671,"테라젠바이오 ""소아희귀질환 진단 인공지능 개발 사업자 선정""",2022.07.21.,테라젠바이오는 22일 정보통신기획평가원(IITP)이 주관하는 '소아희귀질환 다면분석 AI 통합 소프트웨어(SW) 솔루션 개발' 사업자로 선정됐다고 밝혔다. 이 사업은 소아희귀질환 9개 질환군의 진단 및 예후관리 인공지능 모델 등 소프트웨어 솔루션을 개발하기 위해 진행된다. 이번 사업에는 2024년까지 총...
672,"LG AI 아티스트 '틸다', 뉴욕 페스티벌서 금·은상 수상",2022.07.21.,'더 퓨처 나우' 부문 수상…AI 아티스트 작품 수상 첫 사례 LG의 인공지능(AI) 아티스트 '틸다'(Tilda)가 지난 15일(현지시간) 열린 '2022 뉴욕 페스티벌 광고 어워드'에서 금상과 은상을 받았다고 LG가 17일 밝혔다. 세계 3대 광고제인 뉴욕 페스티벌 광고 어워드는 AI 등 최신 기술을 활용해 혁신적 방법으로...
673,"[Pangyo Tech] 미스터마인드, 대전시와 AI 돌봄로봇 '꿈돌이' 보급 사업 추진",2022.07.22.,"미스터마인드는 대전시와 대전시청에서 지역사회통합돌봄 대상 어르신 등을 위한 인공지능(AI) 돌봄로봇 '꿈돌이' 입양식을 개최했다고 전했다. 이번 입양식은 홀로 사시는 어르신들과 장애인분들의 외로움, 고독사 등을 방지하고 안정적인 일상 케어를 돕기 위한 '인공지능(AI) 돌봄로봇 시범사업'의 일환으로..."
674,"SKT, 용접 내·외부 불량 판별 가능한 '인더스트리얼 AI' 사업 확대",2022.07.22.,SK텔레콤은 자동차 부품 제조 전문업체 화신과 인공지능(AI) 기술로 용접 품질을 관리하는 '웰딩 AI 솔루션' 상용화 계약을 맺고 인더스트리얼 사업 확대에 나선다고 26일 밝혔다. 인더스트리얼 AI는 산업 현장의 전문성과 AI 기술을 결합해 생산 공정의 완전 자동화가 가능하도록 하는 것을 목표로 삼는다. 이를...
675,"LG전자, 美 사운드하운드社와 차량용 AI 음성인식 솔루션 공동개발",2022.07.22.,LG전자가 미국 AI 음성인식 기업 사운드하운드(Soundhound)와 손잡고 차량용 인포테인먼트 시스템에 적용하는 음성인식 솔루션을 강화한다. LG전자는... 독자 인공지능 기술로 복잡한 음성 명령을 빠른 속도로 처리할 수 있는 솔루션을 개발한다. 이 솔루션은 클라우드 기반으로 멀티미디어 서비스...
