Unnamed: 0,제목,날짜,본문
229,"SK텔레콤, 7대 AI 추구가치 제정...AI 회사로 혁신 가속화",2021.05.13.,"자문단에는 오병철 연세대 교수(윤리 법학)와 박상철 서울대 교수(인공지능법), 김현경 서울과학기술대 교수(지적재산권, 정보기술), AI 사회적 기업인 테스트웍스 윤석원 대표, 카이스트 전산학부 오혜연 교수(소셜 컴퓨팅), 김윤 CTO가 참가했다."
230,[Who Is ?] 이용섭 광주광역시 시장,2021.05.13.,"광주에 인공지능(AI), 신재생에너지산업을 육성하고, 상생형 일자리를 늘리기 위해 온힘을 쏟고 있다. 수도권 집중화에 대응하기 위해 광주시와 전남의... ◆ 기타 정부 공직자윤리위원회가 2021년 3월25일 공개한 공직자 재산변동사항 신고내역을 보면 약 11억 원의 재산을 보유하고 있다. 고향인 전남 한평의..."
231,[Who Is ?] 이인호 한국무역보험공사 사장,2021.05.13.,"◆ 상훈 ◆ 기타 2018년 3월 정부 공직자윤리위원회가 공개한 공직자 재산등록사항을 보면 본인과 배우자, 두 아들의 명의로 모두 8억286만7천 원의... 빅데이터·인공지능(AI)등 신기술을 활용해 고객에게 새로운 가치를 제공할 수 있도록 고객 친화적 제도 개선에 힘쓰겠다."" (2019/01/02, 한국무역보험공사 사장..."
232,"[테마캠퍼스/가톨릭대학교] ""의생명·4차 산업혁명 첨단 클러스터 구축 '총력...",2021.05.23.,졸업생들은 △인공지능 프로그래밍 △지능형 소프트웨어 개발 △의료 AI 시스템 프로그래밍 △게임프로그래밍 △드론 개발 △로봇공학 기술... 윤리적 리더 양성 위한 체계적 교양 교육 가톨릭대의 교양 교육은 윤리적 품성과 창의적 문제 해결 능력 함양에 초점을 둔 자체 특화 교육 브랜드로 명성이 높다....
233,"이원태 KISA 원장 ""정책 수립 역할 강화해 위상 높일 것""",2021.05.20.,"향후 인공지능(AI) 기반 인터넷침해대응센터(KISC)의 침해사고 대응능력 강화 등을 통해 국가 정책 및 국민과 밀접한 보안이슈 현안을 해결할 방침이다.... 한편 이 원장은 한국인터넷윤리학회·한국인공지능법학회 부회장, 개인정보보호위원회 자문위원, 대통령직속 정책기획위원회 위원..."
234,전 세계 자산 규모 8년새 3배 ↑… 기업 투자 결정적 요소로 [심층기획],2021.05.20.,"ESG란 기업 경영 시 재무적 지표에 더해 환경과 사회 영향, 윤리적인 지배구조 등 비재무적 성과도 중요하게 고려하는 것이다. 기존의 기업... GS건설과 LG유플러스는 산재 예방을 위해 인공지능(AI)·무선통신 인프라를 건설 현장에 적용한 스마트건설 기술개발에 나섰다. SK텔레콤과 카카오는 ESG..."
235,"""알고리즘 뒤에 숨는 기업 너무 많이 봐왔다""",2021.05.12.,과기정통부는 '사람 중심의 인공지능'을 키워드로 자율규범 성격의 '국가 AI 윤리기준'을 발표했다. 방통위는 최근 기업 자율규제에 초점을 맞춘 'AI 기반 추천 서비스 이용자 보호를 위한 기본원칙'을 공개했다. 하지만 자율규제만으로는 AI의 역기능을 방지하고 이용자 보호할 수 없다는 게 시민사회의 비판이다....
236,"서울과학기술대학교, '대한민국 혁신인물(기업·기관) 브랜드 대상' 수상",2021.05.12.,인재상인 ▲윤리적 인재(Ethic) ▲실천적 인재(Practicality) ▲창의적 인재(ideal Creativity)와 6대 핵심역량인 ▲인문 ▲소통 ▲학문 ▲글로벌 ▲창의 ▲융합... 기존 2개월이던 여름방학기간을 3개월로 확대하여 4개 분야 ▲파이썬 등 프로그램 기반 코딩스쿨 ▲AI 인공지능스쿨 ▲메이커스 기반 창업스쿨 ▲반도체...
237,학생 맞춤형 공간·교육 통해 '세종 고교학점제' 선도한다,2021.05.12.,"과학·AI·예술·인문 등 중점 학습도 고교학점제 전면 도입 앞서 준비 최선 [충청투데이 강대묵 기자] 세종시교육청이 2025년부터 전면 도입되는... 속에서 인공지능의 윤리적 결정에 대한 사회적 인식, 딥페이크 기술의 양면성 등에 대해 심도 있게 토의해 인공지능 사회에서 요구되는 윤리 의식을 기르고 있다...."
238,"“ESG 가치, 대학 정책-학사 운영 핵심 의제로”",2021.05.12.,"이 총장은 “학생 중심의 교육혁신대학 실현을 위해 인공지능(AI)과 연계된 환경, 기후, 윤리 교육을 강화할 생각”이라며 “ESG를 실제 교과과정에 넣어 학생들이 선택할 수 있도록 할 것”이라고 밝혔다. 그는 이어 “지역혁신(RIS) 사업 등을 통해 지역과 함께하는 사업을 발굴하고 3단계 산학연 협력..."
239,"[테마캠퍼스/경희대학교] 첨단학과 신설, 약학과 6년제 개편으로 인간 중심 후...",2021.05.20.,"인공지능학과가 추구하는 인재상은 △글로벌 경쟁력을 갖춘 AI Core 인재 △AI+X 융합 능력과 실전 능력을 갖춘 인재 △인간 중심의 윤리의식을 갖춘 인재 △생태 경제학적 가치를 추구하는 인재다. 약학과가 2022학년도부터 6년제로 개편, 이론과 임상·실무 교육의 확장으로 국민 보건 향상을 위한 약학인을..."
240,'제2 이루다 없게'…AI 개발-운영 개인정보보호 자율점검표 마련,2021.05.12.,"'사생활 침해·사회적 차별없게 유의' 등 핵심원칙과 단계별 기준 제시 추가 의견 반영·상세 체크리스트 포함해 이달 말 최종 발표 인공지능(AI) 챗봇... 먼저 개인정보보호법과 개인정보보호 중심설계(PbD·Privacy by Design) 원칙, 과학기술정보통신부의 AI 윤리기준 등을 통합해 6대 핵심 원칙을 적법성·공정성..."
241,"임혜숙 장관, 취임 후 첫 발걸음…경북대 실험실 사고현장",2021.05.12.,"이들은 차세대 인공지능(AI)과 뇌-기계연결(BMI), 뇌파통신 등은 4차산업혁명을 주도할 ‘미래 유망 선도기술’이고 치매와 우울증 등 뇌 질환을 극복하기... 임 장관은 ""뇌는 현대과학이 풀어내야 할 미지의 영역""이라며 ""뇌 연구의 핵심은 사람에게 있는 만큼 연구 과정에서 윤리적 문제도 함께 고려해야 한다..."
243,기업 문화가 그 기업의 미래를 말해준다,2021.05.12.,"경쟁에서 이기는 것이 윤리보다 더 중요할까. 사실 이 문제 중 큰 액자에 걸린 선언문을 힌트 삼아 풀 수 있는 것은 하나도 없다. 아니 애초에 정답이 없는... 인공지능(AI)이 인간을 대체하고 사업의 흥망성쇠 주기는 점점 짧아지고 있으며 미래를 예측한다는 것은 불가능에 가깝다. 이런 시대에는 원하든, 원하지..."
244,"보험硏, '코리아 핀테크 위크 2021' 온라인 세미나 개최",2021.05.18.,"'보험산업의 인공지능(AI) 적용 현황과 과제'라는 주제로 열리는 이번 세미나는 보험산업의 디지털 전환에 있어서 AI의 보험산업 적용 현황을 알아보고... 상무(AI와 보험 비즈니스 전망), 홍성호 보험개발원 팀장(보험산업 AI 적용 현황 및 주요 이슈), 김규동 보험연구원 연구위원(보험산업의 AI 윤리문제와..."
246,[기관탐방]'국민과 함께 수산과학연구 100년' 국립수산과학원,2021.05.12.,"아울러 인공지능(AI) 기반 원격진료기능을 개발해 지원 영역을 확대해 갈 방침이다. NIFS는 2022년까지 세 가지 목표를 두고 있다. Δ연 1건씩 세계 최고수준... 또 투명, 고정, 청렴한 윤리경영 강화, 사회적 가치 중심 효율적 조직을 운영해 고객만족도 향상을 도모한다는 전략이다. 최완현 NIFS 원장은..."
247,4차산업시대 일자리 창출의 주체,2021.05.12.,"결국 4차산업혁명시대, 인공지능 시대가 더 빨리 다가오면서 AI와 로봇이 인간의 일자리를 빠른 속도로 잠식하고 있는 상황이다. 많은 전문가들은... 우리나라 국가의 힘을 강하게 만드는 중추적인 역할을 하게 될 주체가 될 것임을 믿어 의심치 않는다. 전창배 한국인공지능윤리협회 이사장, 아이오냅 대표이사"
248,[디지털 이코노미] AI 안면인식기술 지닌 MS가 규제를 요청한 사연은,2021.05.12.,인공지능(AI) 안면인식 기술이 대표적이다. 기업이 정부에 특정 제품을 규제해달라는 요구를 이상하게 여기는 사람들도 많았다. 실리콘밸리에서는 관련... 이후 사내 AI 윤리위원회에서는 전 세계 자유와 민주주의를 지속적으로 감시하는 독립 감시단체인 ‘프리덤 하우스’가 지적한 국가에 안면인식 기술 사용...
250,“AI 컴퍼니 DNA로 싹 바꾼다”…SK텔레콤 탈바꿈 첫 걸음,2021.05.13.,SK텔레콤이 ‘인공지능(AI) 컴퍼니’로 도약하기 위해 ‘사람 중심의 AI’를 핵심으로 하는 7대 AI 이념을 마련했다. 올 초 박정호〈사진〉 SK텔레콤... 피드백까지 AI가 적용되는 모든 단계에서 윤리성을 확보할 수 있도록 할 예정이다. AI 체크리스트도 개발한다. 체크리스트는 기존 AI 서비스에 적용된다....
251,"개인정보위, AI 관련 개인정보보호 자율점검표 이달말 공개",2021.05.13.,"개인정보보호위원회는 인공지능(AI) 서비스 관련 개인정보보호 자율점검표를 이달 말에 발표한다. AI 서비스 개발자·운영자가 반드시 알아야 할... 활용과 AI 기술발전에 대응할 계획이다. 윤종인 개인정보위 위원장은 ""최근 AI로 인한 사생활 침해 등 다양한 윤리적 이슈가 발생하고 있는데, AI 서비스 개발..."
252,"SKT, ‘사람’ 중심의 AI 가치 추구",2021.05.13.,"자문단에는 이번 추구 가치 제정의 자문 역할을 한 연세대 법대 오병철 교수(윤리 법학)와 서울대 법대 박상철 교수(인공지능법), 서울과학기술대 김현경 교수(지적재산권, 정보기술), AI 사회적 기업인 테스트웍스 윤석원 대표, 카이스트 전산학부 오혜연 교수(소셜 컴퓨팅), 김윤 CTO가 참가한다. SKT는..."
253,정세균 “성장·분배 담론은 DJ와 나뿐…주전자 아닌 솥 될 것”,2021.05.12.,"자문단은 2011년 조직된 싱크탱크 ‘국민시대’(대표 장하진 전 여성부 장관)가 주축으로,국회 공직자윤리위원장을 맡았던 윤성식 고려대 행정학과 명예교수가 좌장이다. 박찬표 목포대 정치학 교수가 정치 어젠다를, 공구 한양대 의학과 교수가 4차 산업혁명과 인공지능(AI) 부분을, 이근 서울대 국제대학원..."
254,"[하승창의 생각가게]6. 편견에 취약한 알고리즘, 투명하게 설명돼야",2021.05.12.,"만약 잘못된 윤리기준을 가지고 판단하고 결정할 때 사용되는 인공지능이 있다면 그 피해를 입는 사람들은 대개 이미 우리 사회에서 불평등한 상태에... 백인남성은 거의 오류를 내지 않았고, 백인여성에게선 가끔 오류가 났고, 흑인 남성은 잦은 오류가, 흑인 여성은 얼굴 발견 못함 이라는 메시지를 보내는 AI는..."
256,"보험연구원, '코리아 핀테크 위크' 온라인 세미나 개최",2021.05.12.,"이번 세미나의 주제는 '보험산업의 인공지능(AI) 적용 현황과 과제'다. 주제발표는 이준섭 한화생명 상무(AI와 보험 비즈니스 전망), 홍성호 보험개발원... (보험산업의 AI 윤리문제와 윤리기준 제정 방안) 등이 진행한다. 성주호 경희대 교수 사회로 진행되는 패널토론에는 강용성 와이즈넛 대표, 김민기..."
258,"네이버, '초대규모 AI' 공개한다… 'AI NOW' 25일 개최",2021.05.12.,"뿐만 아니라 글로벌 AI 리더십 확보를 위한 연구 생태계 조성 계획, '올바른' AI 사용을 위해 네이버가 학계와 함께 설계한 AI 윤리 준칙이 현실에서 적용되고 있는 방식도 함께 공유될 예정이다. [네이버 제공] 테크 세션을 통해서는 방대한 양의 한국어 데이터를 학습하는 과정, 검색이나 인공지능 비서..."
259,이철성 총장 “가르쳤으면 책임지자는 건양대 철학에 ESG 가치 접목”,2021.05.12.,"이 총장은 “학생 중심의 교육혁신대학 실현을 위해 인공지능(AI)과 연계된 환경, 기후, 윤리 교육을 강화할 생각”이라며 “ESG를 실제 교과과정에 넣어 학생들이 선택할 수 있도록 할 것”이라고 밝혔다. 그는 이어 “지역혁신(RIS) 사업 등을 통해 지역과 함께 하는 사업을 발굴하고 3단계 산학연 협력..."
260,[기자시각] IT 기술 발전이 가져올 미래 없어질 직업 '기자'…기계들 틈에서 ...,2021.05.12.,4차 산업 혁명 자체가 IT(정보기술)를 핵심으로 하는 디지털과 바이오 산업 등 AI(인공지능·Artificial Intelligence) 기술 및 사물인터넷(IoT·Internet of... 공헌·지배구조 윤리경영) 경영을 메인 이슈로 다루고 있다. 4차 산업 혁명은 이미 일상화가 돼버렸다. 지난달 개최됐던 정보통신기술 전시회인...
261,[안혜리 논설위원이 간다]절박한 네이버가 몸을 낮췄다,2021.05.12.,네이버의 인공지능(AI) 플랫폼인 클로바 CIC 정석근 대표가 지난 4월 1일 이렇게 대면 보고를 하자 이해진 네이버 창업자(GIO·글로벌투자책임자)는... 여성 혐오 논란 등으로 올 초 서비스 시작 19일 만에 퇴출당한 챗봇 '이루다' 사례에서도 볼 수 있듯 AI 윤리 문제는 서비스에 앞서 반드시 해결해야 한다. 하...
262,보험사 숙원 '공공의료데이터' 물꼬 튼다,2021.05.12.,24일 업계 따르면 보건복지부 산하 생명윤리위원회(IRB)는 최근 생명·손해보험사 10개사 중 2개사를 선정해 공공의료데이터 사용을 위한 신청을... 이후 빅데이터·인공지능(AI) 산업발전을 위해 국가차원에서 '아시아 실리콘밸리 샌드박스'를 추진해 보험사를 포함한 산업계에 의료데이터 한시적 신청(1년간)과...
263,"""AI, 개인정보는 이렇게""…'이루다' 재발 막는다",2021.05.18.,"개인정보보호위원회가 인공지능(AI) 등 신기술 기반 서비스 개발 기업이 알아야 할 개인정보보호법 내용 및 실천사항을 확인할 수 있는 자율점검표를... 윤종인 개인정보위 위원장은 “최근 AI로 인한 사생활 침해 등 다양한 윤리적 이슈가 발생하고 있는데, AI 서비스 개발·운영 과정에서 방대한 개인정보가..."
264,"포스텍, 소통과공론연구소 심포지엄 '과학기술의 사회적 책임'",2021.05.18.,"이번 정기 심포지엄에서는 장애, 의료, 환경, AI 등 다양한 분야의 전문가들이 발표를 맡았다. 최근 코로나19를 비롯하여 전 지구적 차원의 위기감이... 2부에서는 포스텍 환경공학부 최원용 교수와 서울대 철학과 천현득 교수가 '지속가능한 환경과 과학기술', '인공지능에서 윤리가 왜 문제인가'라는 주제로..."
267,"임혜숙 과기부 장관, 첫 현장 소통...경북대·뇌연구원 방문",2021.05.12.,"임 장관은 모두발언을 통해 ""뇌는 현대과학이 풀어내야 할 미지 영역으로, 뇌연구 핵심은 사람에게 있는 만큼 연구과정에서 윤리적 문제도 함께 고려할 것""이라고 당부했다. 이에 연구자들도 ""차세대 인공지능(AI), 뇌-기계연결(BMI), 뇌파통신 등은 4차 산업혁명을 주도할 '미래 유망 선도기술'로 뇌연구 주도권..."
268,"편도행 우주선, 로봇과 휴머니즘…신간 SF소설, 참신 그 자체",2021.05.12.,"‘언맨드’는 인공지능과 4차 산업혁명이 더는 낯설지 않은 일상의 용어가 된 지금, 머지않은 미래에 우리가 맞닥뜨릴 질문을 품은 소설이다. “조지 오웰 식의 디스토피아를 공상하는 우울한 SF”(최원식 문학평론가), “로봇과 휴머니즘은 많이 다뤄져온 소재지만 윤리적 질문을 파고들어 새로운 실감과 흥미를..."
269,[기자수첩] 'AI 산업 진흥' 위한 정부 정책 일관성 있어야,2021.05.18.,"있는 인공지능(AI) 실현전략'을 발표하는 자리에서 이같이 말했다. AI 기업들이 기술적으로 충분히 뒷받침됐을 때, 시장과 소통을 통해 수용가능한... 한 업계 관계자는 ""부처 간 AI선점을 위해 AI윤리나 기준을 제정하려는 경쟁이 심화되고 있다""고 지적하기도 했다. 이어 ""AI 활용, 부작용 방지 등을 전담하는..."
270,“D.N.A. 정책…코로나19 경험 반영해 재정비해야”,2021.05.18.,"이를 위해 과학기술정보통신부는 세계적인 인공지능 기술수준 확보를 위해 중장기 기술개발(R&D)을 추진하고, 사회·경제 각 분야에 인공지능 활용을 촉진하기 위해 ‘AI를 활용한 불법복제품 판독’과 같은 다양한 인공지능 융합 프로젝트를 추진한다. 또한 사람이 중심이 되는 ‘인공지능 윤리기준’도..."
271,"포스텍 소통과 공론 연구소, 2021년 정기 심포지엄 개최",2021.05.20.,"2021년 소통과 공론 연구소 정기 심포지엄 포스터 이번 정기 심포지엄에서는 장애, 의료, 환경, AI 등 다양한 분야의 전문가들이 발표를 맡았다. 최근... 2부에서는 포스텍 환경공학부 최원용 교수와 서울대 철학과 천현득 교수가 '지속가능한 환경과 과학기술', '인공지능에서 윤리가 왜 문제인가'라는 주제로..."
272,네이버… 'NAVER AI NOW' 25일 개최,2021.05.20.,"뿐만 아니라 글로벌 AI 리더십 확보를 위한 연구 생태계 조성 계획, '올바른' AI 사용을 위해 네이버가 학계와 함께 설계한 AI 윤리 준칙이 현실에서 적용되고 있는 방식도 함께 공유될 예정이다. 테크 세션을 통해서는 방대한 양의 한국어 데이터를 학습하는 과정, 검색이나 인공지능 비서(AI Assistant)..."
273,보험硏 ‘코리아 핀테크 위크 2021’ 세미나,2021.05.20.,"‘보험산업의 인공지능(AI) 적용 현황과 과제’를 주제로 열리는 이번 세미나에서는 보험산업의 디지털 전환에 있어서 AI의 보험산업 적용 현황을... 상무(AI와 보험 비즈니스 전망), 홍성호 보험개발원 팀장(보험산업 AI 적용 현황 및 주요 이슈), 김규동 보험연구원 연구위원(보험산업의 AI 윤리문제와..."
274,자유를 찾아 나선 로봇들…소설 '언맨드',2021.05.12.,"인공지능(AI) 로봇이 통제와 속박을 거부하고 자유로운 사고와 행동을 하게 된다면 인간과는 뭐가 다른 걸까? 제17회 세계문학상 당선작인 채기성의... AI가 모든 인류의 지능을 합친 것보다 더 강력하고 똑똑해지는 '특이점'이 올 것이라는 예측이 나오는 가운데, 이 소설은 기술 발전이 새로운 철학과 윤리 기준을..."
276,‘초대규모 AI’ 연구센터 설립 손잡은 네이버·서울대,2021.05.04.,네이버와 서울대학교가 손을 잡고 ‘초대규모(Hyperscale) 인공지능(AI)’ 공동 연구에 나선다. 최인혁 네이버 최고운영책임자(COO)와 장병탁 서울대... 서울대의 AI 협업은 이번이 처음은 아니다. 네이버는 지난 2월 서울대 AI 정책 이니셔티브(SAPI)와 공동 웨비나(온라인 세미나)를 열고 ‘네이버 AI 윤리 준칙’...
277,"[전문]임혜숙 장관 후보자 ""과학기술과 ICT로 코로나 위기 극복할 것""",2021.05.04.,"대한민국의 미래를 책임진다는 각오로 전 분야에서 데이터 댐과 인공지능의 접목 등 디지털 혁신 인프라를 시급히 확충하고 각계에서 필요로 하는 AI?SW... 보호, 인공지능 시대 윤리와 신뢰성 제고 등 4차 산업혁명 시대에 나타날 수 있는 그늘과 역기능을 최소화하기 위한 정비도 소홀히 하지 않겠습니다...."
278,"디지털시대…""데이터 목록 쌓였지만, 실제 쓸만한 데이터 부족""",2021.05.04.,"정부는 디지털 시대로의 변화에 발맞춰 'D·N·A(데이터·네트워크·인공지능)'를 중심으로 하는 관련 정책을 제시했다. 대표적인 예로 지난해 정부가 D·N·A 생태계를 강화하겠다며 발표한 디지털 뉴딜이 있다. 디지털 뉴딜은 AI와 소프트웨어 인재 양성, 데이터댐 구축, 빅데이터 플랫폼 설립 등의 사업을 골자로..."
279,'정도경영' 고 구본무 회장 3주기…구광모 '뉴LG' 안착,2021.05.12.,구 선대 회장은 정도경영에 입각해 'LG 윤리규범'을 제정해 사이버 신문고를 운영했다. 이에 따라 기업 내 투명 경영의 기준을 세웠다. LG그룹은 국가... 이 같은 유산은 화담의 뒤를 이은 구광모 LG그룹 제4대 회장의 실리주의와 결합해 그룹이 인공지능(AI) 등 다방면에서 빛을 발하고 있다. 구광모 LG그룹...
280,"네이버, ‘초대규모 AI’ 공개…기술력·비전 공유",2021.05.12.,"이와함께 글로벌 AI 리더십 확보를 위한 연구 생태계 조성 계획, ‘올바른’ AI 사용을 위해 네이버가 학계와 함께 설계한 AI 윤리 준칙이 현실에서 적용되고 있는 방식도 함께 공유될 예정이다.테크 세션을 통해서는 방대한 양의 한국어 데이터를 학습하는 과정, 검색이나 인공지능 비서(AI Assistant)를..."
281,"포스텍 소통과 공론 연구소, 2021년 정기 심포지엄 개최",2021.05.20.,"이번 정기 심포지엄에서는 장애, 의료, 환경, AI 등 다양한 분야의 전문가들이 발표를 맡았다. 최근 코로나19를 비롯하여 전 지구적 차원의 위기감이... 2부에서는 POSTECH 환경공학부 최원용 교수와 서울대 철학과 천현득 교수가 ‘지속가능한 환경과 과학기술’, ‘인공지능에서 윤리가 왜 문제인가’라는..."
282,"포스코건설, 2차 하도사 체불예방 협력사 대상 '파격 인센티브'",2021.05.12.,"포스코건설은 현재 인공지능(AI)등을 이용해 부당특약 선정 예방을 위한 입찰 전 사전 점검 프로세스를 운영하고 있다. 이를 바탕으로 대금지급 지연... 포스코건설 관계자는 “비즈니스파트너와 함께 강건한 산업생태계를 조성한다는 포스코 기업시민 경영이념 아래 공정거래, 윤리경영을 통해 협력사와..."
283,"POSTECH, ‘과학기술의 사회적 책임’ 주제로 2021년 정기 심포지엄",2021.05.12.,"이번 정기 심포지엄에서는 장애, 의료, 환경, AI 등 다양한 분야의 전문가들이 발표를 맡았다. 최근 코로나19를 비롯해 전 지구적 차원의 위기감이... 2부에서는 POSTECH 환경공학부 최원용 교수와 서울대 철학과 천현득 교수가 ‘지속가능한 환경과 과학기술’, ‘인공지능에서 윤리가 왜 문제인가’라는..."
284,"‘이루다’가 쏘아올린 공, 과기정통부ㆍ개인정보위의 대답은",2021.05.12.,이에 과기정통부가 관련 업무를 맡아 AI의 신뢰를 높이기 위한 법제도ㆍ윤리ㆍ기술적 요구사항을 망라한 인공지능 개발 가이드북을 제작하고 보급하기로 했다. 과기정통부가 구상 중인 AI 개발사 원스톱 지원 플랫폼이다. (사진제공=과기정통부) 이루다 사태를 겪은 과기정통부의 고민이 이번 실현전략에...
285,"임혜숙 후보 ""디지털 뉴딜 성공시켜 대한민국 대전환 기여""",2021.05.04.,"임혜숙 과학기술정보통신부 장관 후보자가 인사청문회에서 질문을 듣고 있다 특히 디지털뉴딜 성공을 위해 데이터댐, 인공지능(AI), 5G 네트워크 등... 이어 “전환기에는 안전망 확보가 중요한데, 디스토피아가 되지 않도록 국민들이 염려하는 사이버 보안에 만전을 기하고, 인공지능 시대 윤리와 신뢰성 제고 등..."
287,"네이버, ‘초대규모 AI’ 공개…“슈퍼컴퓨터 성과 공유”",2021.05.04.,"정보기술(IT) 업계의 새 트렌드로 자리잡고 있는 ‘초대규모(Hyperscale) 인공지능(AI)’에 대한 네이버의 성과와 비전이 공개된다. 12일 네이버(대표... 글로벌 AI 리더십 확보를 위한 연구 생태계 조성 계획, ‘올바른’ AI 사용을 위해 네이버가 학계와 함께 설계한 AI 윤리 준칙이 현실에서 적용되는..."
290,"SK텔레콤, 사람 중심의 'AI 컴퍼니' 전환 선언",2021.05.06.,"전문가들의 의견을 반영할 수 있도록 연세대 법대 오병철 교수(윤리 법학)와 서울대 법대 박상철 교수(인공지능법), 서울과학기술대 김현경 교수(지적재산권, 정보기술), AI 사회적 기업인 테스트웍스 윤석원 대표, 카이스트 전산학부 오혜연 교수(소셜 컴퓨팅), 김윤 CTO 등으로 자문단도 구성했다. 백성원"
291,[이슈분석]메타버스 활성화 과제는,2021.05.06.,"김 본부장은 메타버스 역시 많은 부분을 인공지능(AI)에 바탕을 둘 것이기 때문에 최근 '이루다' 사태처럼 AI 윤리, 프라이버시 침해 등에 대해서 어떻게 대비할지 고민해야 한다고 말했다. 일각에서는 메타버스에서는 국경 없이 세계 이용자가 만나기 때문에 범죄 같은 문제 발생 시 해외 이용자에 대한 처분이..."
