Unnamed: 0,제목,날짜,본문
53,"SK텔레콤, '사람 중심 AI' 추구 선언",2021.05.13.,SK텔레콤이 AI(인공지능) 윤리를 경영 시스템에 담았다. SK텔레콤은 13일 '사람 중심의 AI'를 핵심 이념으로 하는 AI 추구 가치 제정을 선언하며 AI 컴퍼니로의 혁신을 본격화한다고 밝혔다. SKT는 이를 기반으로 사규 반영 및 AI 서비스 체크리스트 개발 등 경영 시스템 전반에 적용하는 구체적인 방안을...
56,"정부, AI 실현 3대 전략 10대 실행과제 수립",2021.05.13.,"민간의 AI 서비스 구현을 체계적으로 지원하고, 이용자가 믿고 안전하게 사용할 수 있도록 제도를 보완하며, 사회 전반에 건전한 인공지능 윤리를 확산하는 것이 중점 방향이다. 먼저, 인공지능 제품·서비스 구현단계별 신뢰 확보 체계를 마련하기 위해 민간에서 인공지능 제품･서비스를 구현하는 단계(개발..."
57,"‘사악해지지 말자’ 구글, AI 윤리 연구 인력 2배로 늘린다",2021.05.13.,"AP뉴시스 구글이 ‘인공지능(AI) 윤리’를 강화하기 위해 담당 연구원 수를 현재 200명에서 2배인 400명으로 늘린 계획이라고 11일(현지시각) 월스트리트저널(WSJ)이 보도했다. 매리언 크로크 구글 엔지니어링 담당 부사장은 이날 WSJ가 주최한 행사에서 ""AI 기술을 개발하고 보급하는 방식에 책임을 지는 것이..."
61,SKT 사람 중심 AI 추구 가치 제정,2021.05.12.,"SK텔레콤은 ‘사람 중심의 인공지능(AI)’을 핵심으로 하는 AI 추구 가치 제정을 선언하고, AI 컴퍼니로의 혁신을 본격화한다고 13일 밝혔다. SK텔레콤이... 자문단은 정기 회의를 통해 AI 윤리 관련 이슈를 논의하고, AI 적용 시스템을 강화하는 방안을 제안할 예정이다. 또 5월과 6월 2회 개최하는 웨비나에..."
63,"SK텔레콤, '사람 중심 AI' 추구 선언...AI 기업으로 변신 본격화",2021.05.13.,"자문단에는 이번 추구 가치 제정의 자문 역할을 한 연세대 법대 오병철 교수(윤리 법학)와 서울대 법대 박상철 교수(인공지능법), 서울과학기술대 김현경 교수(지적재산권, 정보기술), AI 사회적 기업인 테스트웍스 윤석원 대표, 카이스트 전산학부 오혜연 교수(소셜 컴퓨팅), 김윤 최고기술책임자(CTO)..."
65,"""제2 이루다 사태 막자""…'AI 신뢰성' 검증기술 만든다",2021.05.13.,"과학기술정보통신부가 내년부터 오는 2026년까지 650억원 이상을 투입, 스타트업이 인공지능(AI) 신뢰성 확보가 가능하도록 원천기술과 표준 플랫폼 개발을 지원한다. AI 적용 서비스가 기술과 윤리적 기준 등 '신뢰성'을 확보했는지를 민간이 자율 인증하는 제도를 내년부터 시범 시행한다. 개인정보를 무단..."
67,"구글, AI 윤리 연구원 400명까지 늘린다…""브랜드 중대 손상""",2021.05.12.,AI 윤리란 인공지능이 윤리적으로 활용되고 인간과 공존할 수 있도록 개발·운용하는 것을 의미한다. 한국에서는 최근 '이루다'라는 챗봇이 혐오성 발언을 해 논란이 되며 AI 윤리에 대한 논란이 불거졌다. 현재 구글에서 AI의 윤리적 책임 문제를 연구하는 인원은 200명이다. 연구진 규모가 두 배가 된다면...
69,조선대 SW중심대학사업단 광주교육청 AI정보영재교육원 SW/AI과정 호응,2021.05.12.,"조선대 SW중심대학사업단이 5월부터 진행하고 있는 '2021년 광주광역시교육연구정보원부설 AI정보영재교육원 SW·AI(인공지능) 과정 프로그램'이... AI기계학습, AI이미지학습을 통한 전염병 예방수칙 사전, 화학원소 안내 사전 제작, 정보보안과 시대별 암호화 방법, 언어를 활용한 빅데이터 분석, AI윤리..."
73,‘사업 성패 가를수도’···AI 윤리 강화 나선 구글,2021.05.12.,구글이 인공지능(AI) 윤리 문제를 연구하는 인력을 2배로 늘리고 AI의 오류를 최소화하기 위해 예산 증액도 추진한다. AI 윤리에 대한 관심이 커지면서 윤리 강화가 사업의 성패를 가를 핵심 변수가 될 수 있는 만큼 문제 발생의 여지를 줄이기 위해 선제 대응에 나선 것이다. 11일(현지 시간)...
74,"SKT, `사람 중심 AI` 컴퍼니 선언",2021.05.12.,"SKT는 AI 추구 가치에 다양한 분야의 전문성을 반영하기 위해 전문가 자문단을 구성했다. 자문단에는 이번 추구 가치 제정의 자문 역할을 한 오병철 연세대 법대 교수(윤리 법학)와 박상철 서울대 법대 교수(인공지능법), 김현경 서울과학기술대 교수(지적재산권, 정보기술), 윤석원 테스트웍스 대표..."
76,AI 스스로 '법·제도·윤리적 편향성'까지 판단…원천기술 개발 추진,2021.05.13.,"정부가 이미 구현중인 인공지능(AI) 시스템에 판단기술 등을 설명할 수 있는 기능을 추가하고, 인공기능이 스스로 법과 제도, 윤리적 편향성을 진단하고 효율적으로 제거할 수 있도록 하는 원천기술 개발을 추진한다. 과학기술정보통신부는 13일 오후 서울중앙우체국 스카이홀에서 열린 대통령 직속..."
79,"네이버, 하이퍼스케일 AI 첫 공개",2021.05.13.,"뿐만 아니라 글로벌 AI 리더십 확보를 위한 연구 생태계 조성 계획, ‘올바른’ AI 사용을 위해 네이버가 학계와 함께 설계한 AI 윤리 준칙이 현실에서 적용되고 있는 방식도 함께 공유될 예정이다. ?테크 세션에서는 방대한 양의 한국어 데이터를 학습하는 과정, 검색이나 인공지능 비서(AI Assistant)를..."
82,“제2의 이루다 막겠다”…정부 AI 가이드라인 도입,2021.05.13.,이와 함께 정부 차원에서 AI 윤리교육 과정을 개발해 교육을 진행한다. 현재 ‘카카오 알고리즘 헌장’ ‘네이버 인공지능 윤리’ 등 정보기술(IT) 기업을 중심으로 윤리 원칙을 수립하기 위한 노력이 이뤄지고 있다. 정부는 이를 바탕으로 시민ㆍ전문가 등 다양한 주체의 의견을 수렴할 수 있는 윤리정책...
84,"SKT, AI 추구 가치 제정으로 新 사업 혁신 가속",2021.05.12.,"자문단에는 오병철 연세대 교수(윤리 법학)와 박상철 서울대 교수(인공지능법), 김현경 서울과학기술대 교수(지적재산권, 정보기술), 윤석원 테스트웍스 대표(AI 사회적 기업), 오혜연 한국과학기술원 교수(소셜 컴퓨팅), 김윤 SK텔레콤 최고기술책임자(CTO)가 참가한다. SK텔레콤은 매년 개최하는 ‘ai.x..."
88,"과기부, '신뢰할 수 있는 인공지능(AI) 실현전략' 발표",2021.05.13.,"최근 성차별과 소수자 차별 논란을 일으킨 인공지능(AI) 챗봇 '이루다' 사태 등 AI의 부정적 영향에 대응하기 위해 '신뢰할 수 있는 인공지능 실현전략'이... 있는 인공지능 실현전략'을 발표했다. 이번 전략은 ""누구나 신뢰할 수 있는 인공지능, 모두가 누릴 수 있는 인공지능 구현""을 비전으로, 기술･제도･윤리..."
94,"정부, 인공지능 신뢰성 높여 제2 이루다 사태 막는다",2021.05.13.,기업 입장에서는 인공지능 윤리기준 자체가 추상적인 개념이라 서비스 개발에 어려움을 겪는다. 정부 차원의 인공지능 윤리기준 구체화가 필요한... 중소기업·스타트업을 위해 인공지능 구현 목적의 ‘데이터 확보-알고리즘 학습-검증’을 통합 지원하는 플랫폼도 만든다. 정부는 2018년부터 AI 허브를 통해...
96,막말 하는 인공지능 못 나온다…정부 '신뢰할 수 있는 AI 실현전략' 발표,2021.05.13.,정부도 이번에 ‘신뢰할 수 있는 인공지능 실현전략’을 통해 기술·제도·윤리 3개 부분에서 AI의 신뢰도를 높일 수 있도록 10대 실행과제를 마련했다. 기술적으로는 2026년까지 총 295억 원을 투입해 ‘설명가능’ ‘공정’ ‘견고’ 등 3개 분야에서 원천기술을 개발한다. 이를 통해 기존 시스템에...
97,"SK텔레콤, ‘사람 중심의 AI’ 핵심 이념으로 AI 추구 가치 정립",2021.05.13.,"자문단에는 이번 추구 가치 제정의 자문 역할을 한 오병철 연세대 법대 교수(윤리 법학)와 박상철 서울대 법대 교수(인공지능법), 김현경 서울과학기술대 교수(지적재산권, 정보기술), AI 사회적 기업인 윤석원 테스트웍스 대표, 오혜연 카이스트 전산학부 교수(소셜 컴퓨팅), 김윤 CTO가 참가한다...."
98,'네이버 AI 나우' 25일 개최...초대규모 인공지능 공개,2021.05.13.,"글로벌 AI 리더십 확보를 위한 연구 생태계 조성 계획,‘올바른’AI 사용을 위해 네이버가 학계와 함께 설계한AI 윤리 준칙이 현실에서 적용되고 있는 방식도 함께 공유될 예정이다. 테크 세션에서는 방대한 양의 한국어 데이터를 학습하는 과정,검색이나 인공지능 비서(AI Assistant)를 비롯한 여러 서비스에..."
99,"SKT ""AI설계부터 운영까지 사람이 중심""",2021.05.13.,SK텔레콤이 인공지능(AI) 시대에 맞춰 사람 중심의 윤리를 발표했다. SK텔레콤은 이를 기반으로 사규 반영과 AI 서비스 체크리스트 개발 등 경영 시스템 전반에 적용하는 구체적인 방안을 수립할 계획이다. 13일 SK텔레콤에 따르면 사람 중심의 AI를 핵심 이념으로 하는 AI 추구 가치를 제정했다. AI 추구 가치...
102,[미래생각]인공지능 시대 맞이할 준비해야,2021.05.13.,"인공지능(AI)은 대표적인 4차 산업혁명 대응기술이다. 알고리즘 개선을 통한 인지능력 향상 등 인공지능 기술 자체가 가지는 의미 외에도, 범용 정보기술... 판단되며 인공지능이 사회경제적으로 미치는 부작용, 윤리와 법적 문제, 사회적 영향 등에 대한 논의와 합의는 선제적으로 충분한 준비가 필요함에도..."
105,"SKT, 사람 중심 ‘AI 추구 가치’ 정립… 전사 프로세스 반영 계획",2021.05.13.,"이번 제정의 자문 역할을 한 오병철 연세대 법대 교수(윤리법학)와 박상철 서울대 법대 교수(인공지능법), 김현경 서울과학기술대 교수(지적재산권·정보기술), AI 사회적 기업인 테스트웍스 윤석원 대표, 오혜연 카이스트 전산학부 교수(소셜컴퓨팅), 김윤 SK텔레콤 CTO(최고기술책임자)가 참가한다. 정기..."
108,"정부 '신뢰할 수 있는 AI 실현전략' 마련…""AI 윤리 강화""",2021.05.12.,"있도록 인공지능 윤리교육 총론을 마련하고, 개발자·시민에게 맞춤형 교육도 진행할 예정이다. 개발자, 이용자 등이 업무, 일상생활 속에서 윤리 준수 여부를 자율점검을 할 수 있는 체크리스트도 개발한다. 최기영 과기부 장관은 ""최근 챗봇 사건은 우리 사회가 AI의 신뢰성에 대해 어떻게 대처해야 하는지..."
110,"""제2 이루다 없게"" AI 개인정보 지침서 나온다",2021.05.12.,"빚은 AI(인공지능) 챗봇 서비스 '이루다' 사태의 재발을 막기 위해 팔을 걷어 붙였다. 개인정보보호위원회는 AI 서비스 개발자·운영자들이 지켜야 할... 구체적으로 개인정보보호법과 개인정보보호 중심설계(PbD) 원칙, 과학기술정보통신부의 AI 윤리기준을 바탕으로 △적법성 △공정성 △안정성 △책임성..."
112,[뉴스해설]규제보다 진흥으로 AI 신뢰성 확보 추진,2021.05.13.,"신뢰할 수 있는 AI 실현전략 핵심은 민간에서 인공지능 제품서비스를 구현하는 단계에서 기업과 개발자 등이 신뢰성 구현을 위해 참조할 수 있는 신뢰 확보 기준과 방법론을 제시하고 지원하는 것이다. 과기정통부는 전문가·기업·개발자 등과 복잡한 AI 관련 법·규제와 개인정보보호, 윤리기준 등을 포함한..."
114,"SKT, 'AI 가치 정립'…전사 프로세스 반영",2021.05.12.,"자문단에는 오병철 연세대 법대 교수(윤리 법학), 박상철 서울대 법대 교수(인공지능법), 김현경 서울과학기술대 교수(지적재산권·정보기술), 윤석원 테스트웍스 대표(AI 사회적기업), 오혜연 카이스트 전산학부 교수(소셜 컴퓨팅), 김윤 SKT 최고기술책임자(CTO)가 참가한다. 자문단은 정기 회의를 통해..."
117,"과기정통부, 신뢰할 수 있는 인공지능 실현전략 발표",2021.05.13.,"AI Hub) 플랫폼에서 검증체계에 따른 신뢰 속성별 수준 분석, 실제환경 테스트 등의 기능을 추가 개발·연계해 일괄적으로 지원한다.마지막으로 ③인공지능 신뢰성 원천기술을 개발한다. 이미 구현된 시스템에 인공지능이 판단기준 등을 설명할 수 있는 기능을 추가할 수 있고, 인공지능이 스스로 법･제도･윤리..."
120,구글 ‘AI 윤리 강화’ 나선다… 연구 인원 2배 확대,2021.05.18.,인공지능(AI) 기술 개발에 박차를 가하고 있는 구글이 사내 윤리 문제 연구팀을 대폭 강화하기로 했다. 최근 AI 윤리 이슈가 각국 정부는 물론 정보기술(IT) 기업의 최대 관심사가 되면서 인력과 예산을 투입해 문제 발생 소지를 줄이기로 한 것이다. 매리언 크로크 구글 엔지니어링 담당 부사장은 11일...
121,SKT 'AI 컴퍼니로의 혁신' 선언… '사람' 중심의 AI 이념 설정,2021.05.18.,"교수(인공지능법), 김현경 서울과학기술대 교수(지적재산권, 정보기술), 윤석원 테스트웍스 대표, 오혜연 카이스트 전산학부 교수(소셜 컴퓨팅), 김윤 CTO가 참가한다. 자문단은 정기 회의를 통해 AI 윤리 관련 이슈를 논의하고 AI 적용 시스템을 강화하는 방안을 제안할 예정이다. 또한 5월과 6월 2회..."
122,"네이버, 이달 25일 ‘NAVER AI NOW’ 25일 개최…‘초대규모 AI’ 공개",2021.05.18.,"뿐만 아니라 글로벌 AI 리더십 확보를 위한 연구 생태계 조성 계획, ‘올바른’ AI 사용을 위해 네이버가 학계와 함께 설계한 AI 윤리 준칙이 현실에서 적용되고 있는 방식도 함께 공유될 예정이다. 테크 세션을 통해서는 방대한 양의 한국어 데이터를 학습하는 과정, 검색이나 인공지능 비서(AI Assistant)를..."
123,"'AI 컴퍼니로의 혁신'…SKT, '사람 중심' AI 이념 정립",2021.05.13.,"자문단에는 이번 추구 가치 제정의 자문 역할을 한 오병철 연세대학교 교수(윤리 법학)와 박상철 서울대학교 교수(인공지능법), 김현경 서울과학기술대학교 교수(지적재산권·정보기술), AI 사회적 기업 윤석원 테스트웍스 대표, 오혜연 카이스트 전산학부 교수(소셜 컴퓨팅), 김윤 SK텔레콤 CTO가..."
124,개발과정서 윤리문제 진단… AI 신뢰 확보 기준 만든다,2021.05.13.,"정부가 오는 2025년까지 신뢰 가능한 AI(인공지능) 환경을 조성한다. 안전한 AI 활용 기반을 마련해 사회 전반에 건전한 AI 의식을 확산시키고 AI 강국으로... 있는 AI 실현전략을 마련했다. 정부가 이날 발표한 전략은 '누구나 신뢰할 수 있는 AI, 모두가 누릴 수 있는 AI 구현'을 비전으로 기술·제도·윤리 측면의..."
125,"과기부, 인공지능 인증제 도입하고 개발 가이드북 보급한다",2021.05.13.,"허브(AI Hub) 플랫폼에서 검증체계에 따른 신뢰 속성별 수준 분석, 실(實)환경 테스트 등의 기능을 추가 개발·연계해 일괄적으로 지원한다. 이미 구현된 시스템에 인공지능이 판단기준 등을 설명할 수 있는 기능을 추가할 수 있고, 인공지능이 스스로 법제도윤리적 편향성을 진단하고 효율적으로 제거할 수..."
126,보험연구원 '보험산업의 AI 적용 현황과 과제' 세미나 개최,2021.05.13.,"김규동 보험연구원 연구위원은 보험산업의 AI 윤리문제와 윤리기준 제정 방안을 이야기한다. 홍성호 보험개발원 팀장은 보험산업 AI 적용 현황과 주요 이슈에 대해 말한다. 패널토론에서는 인공지능 적용과 관련한 쟁점사항과 향후 과제를 논한다. 강용성 와이즈넛 대표, 김민기 카이스트 교수, 안수현..."
129,"참여연대·민변 등 120개 시민단체, ""인권·안전·민주주의 보장 AI 정책 마련...",2021.05.13.,"인공지능 제품이 어떻게 개인정보를 오남용하고 사회적 혐오를 재생산할 수 있는지 목격했다. 공공기관과 민간기업이 AI채용을 확대하고 있지만 불합격된 사람은 어떻게 평가받고 탈락됐는지 알 수 없다""며 정보공개의 필요성을 강조했다. 이들은 ""딥러닝 등 특정한 기술적 특성이나 기업의 자율적인 윤리가..."
130,"AI 신뢰성 확보한다… 정부, ‘사람 중심 AI 실현 전략’ 발표",2021.05.13.,최근 인공지능(AI) 챗봇 ‘이루다’가 점화시킨 인공지능 윤리 관련 논의에 정부가 가이드라인을 제시했다. 스타트업 등에 대한 지원과 신뢰성 확보를 위한 기술 개발도 추진한다. 과학기술정보통신부가 지난 13일 대통령 직속 4차산업혁명위원회 제22차 전체회의에서 사람이 중심이 되는 인공지능을 위한...
131,"정부, 신뢰받는 AI 실현전략 마련…규제 보다 '진흥'",2021.05.13.,"또 고위험 인공지능 정의 등 잠재적 위험을 미칠 AI 범주를 설정하고, 서비스 제공 전 해당 인공지능의 활용 여부 고지 의무화를 추진한다. 연구·개발자, 이용자 등이 AI 윤리 준수 여부를 자율점검을 할 수 있는 '체크리스트'를 보급한다. 윤성로 위원장은 ""인공지능 대중화를 위해서는 '신뢰할 수 있는..."
132,"개인정보위, 이달 말 `AI 관련 개인정보보호 자율점검표` 공개",2021.05.13.,"개인정보보호위원회가 'AI(인공지능) 관련 개인정보보호 자율점검표'를 이달 말 발표할 계획이라고 12일 밝혔다. AI 관련 개인정보보호 자율점검표는 AI... 활용과 AI 기술발전에도 대응한다. 윤종인 개인정보위 위원장은 ""최근 AI로 인한 사생활 침해 등 다양한 윤리적 이슈가 발생하고 있고 AI 서비스 개발..."
133,"SKT, ‘사람’ 중심 AI 윤리 사내 적용 천명",2021.05.13.,"지난 2월에는 온라인 세미나를 통해 AI 윤리에 대한 구성원들의 이해도를 높였다. 이러한 과정을 통해 ‘사람 중심의 AI’라는 이념을 핵심으로 한 ‘AI 추구 가치’가 정립됐다. 인공지능 서비스를 활용한 독거노인 돌봄 서비스, 내 주변의 코로나 안전도 확인 서비스인 ‘SafeCaster’ 등 사람을 위한 사회적..."
134,"""누구나 신뢰하고 누릴 수 있는 AI 만든다""",2021.05.13.,"허브(AI Hub) 플랫폼에서 검증체계에 따른 신뢰 속성별 수준 분석, 실 환경 테스트 등의 기능을 추가 개발·연계해 일괄적으로 지원한다. 이미 구현된 시스템에 인공지능이 판단기준 등을 설명할 수 있는 기능을 추가할 수 있고, 인공지능이 스스로 법·제도·윤리적 편향성을 진단하고 효율적으로 제거할 수 있도록..."
135,"SKT, ‘사람 중심' AI 추구 가치 정립…전사 프로세스 반영",2021.05.13.,"자문단에는 이번 추구 가치 제정의 자문 역할을 한 오병철 연세대 법대 교수(윤리 법학)와 박상철 서울대 법대 교수(인공지능법), 김현경 서울과학기술대 교수(지적재산권, 정보기술), AI 사회적 기업인 테스트웍스 윤석원 대표, 카이스트 전산학부 오혜연 교수(소셜 컴퓨팅), 김윤 CTO가 참가한다.자문단은..."
136,네이버의 '초대규모 AI' 공개한다… 'NAVER AI NOW' 25일 개최,2021.05.13.,"뿐만 아니라 글로벌 AI 리더십 확보를 위한 연구 생태계 조성 계획, '올바른' AI 사용을 위해 네이버가 학계와 함께 설계한 AI 윤리 준칙이 현실에서 적용되고 있는 방식도 함께 공유될 예정이다. 테크 세션을 통해서는 방대한 양의 한국어 데이터를 학습하는 과정, 검색이나 인공지능 비서(AI Assistant)를..."
142,[해외 AI대학원] ③ 인공지능의 대부 'MIT'와 AI 윤리 핵심 'UC 버클리',2021.05.13.,"인공지능의 윤리 문제는 1학년 AI 교육과정의 일부로서 인공지능의 미래 방향성을 이끌고자 하는 BAIR 연구자들의 핵심 연구 주제이다. 이 외에도, ▶하버드 대학교(Harvard University) ▶프린스턴 대학교(Princeton University) ▶캘리포니아 공과대학(California Institute of Technology) ▶워싱턴 대학교(University of..."
143,"정부, '제2의 이루다 사태' 근절한다... AI 신뢰성 확보 전략 추진",2021.05.13.,뉴데일리 김동준 기자 = 정부가 혐오 발언 및 개인정보 유출 등의 이슈로 논란이 된 인공지능(AI) 챗봇 '이루다' 사태의 재발을 방지하기 위해 '신뢰할 수... 있는 인공지능 실현을 위한 지원 정책이 조속히 필요하다는 판단 하에 이번 전략을 마련했다. 이번 전략은 지난해 발표한 '인공지능 윤리기준'의 실천방안을...
148,"네이버, '네이버 AI 나우'서 초대규모 AI 공개",2021.05.13.,뿐만 아니라 글로벌 AI 리더십 확보를 위한 연구 생태계 조성 계획과 올바른 AI 사용을 위해 네이버가 학계와 함께 설계한 AI 윤리 준칙이 현실에서 적용되고 있는 방식도 함께 공유될 예정이다. 테크 세션을 통해서는 방대한 양의 한국어 데이터를 학습하는 과정과 검색이나 인공지능 비서를 비롯한 여러...
156,"SKT, '사람' 중심 AI 추구 가치 정립",2021.05.13.,"자문단에는 이번 추구 가치 제정의 자문 역할을 한 연세대 법대 오병철 교수(윤리 법학)와 서울대 법대 박상철 교수(인공지능법), 서울과학기술대 김현경 교수(지적재산권, 정보기술), AI 사회적 기업 테스트웍스 윤석원 대표, 카이스트 전산학부 오혜연 교수(소셜 컴퓨팅), 김윤 CTO가 참가한다...."
157,"‘사람 중심의 AI’…SK텔레콤, 사규에 반영한다",2021.05.13.,SK텔레콤이 제공 중인 다양한 서비스의 PLM 프로세스에도 적용해 서비스 사전 검토부터 고객의 피드백까지 AI가 적용되는 모든 단계에서 윤리성을... 지난 2018년부터 개최한 ai.x컨퍼런스를 통해 ‘사람’을 위한 AI 생태계의 필요성과 AI 오용 예방의 중요성을 강조해 왔다. 또한 인공지능 서비스를 활용한...
160,'위험한 AI' 걸러내는 원천기술 개발·영향평가 추진된다,2021.05.13.,정부는 실현 전략에 담긴 기술·제도·윤리 측면의 3대 전략과 10대 실행 과제를 2025년까지 단계적으로 추진할 계획이다. ━ '알고리즘 설명 가능한 AI' 만드는 원천기술 개발 추진 ━ 정부는 인공지능이 내린 판단에 대해 왜 그런 결과가 도출됐는지를 개발자들이 설명할 수 있도록 해 공정성을 담보하는 것을...
161,"개인정보위, AI 자율점검표 이달 말 공개…'이루다 사태' 재발 막는다",2021.05.13.,"개인정보보호위원회는 인공지능(AI) 서비스 개발자·운영자가 반드시 알아야 할 개인정보보호 법령 상 의무사항과 참고사항 등을 안내하고, 스스로 점검... 활용과 AI 기술발전에도 대응해 나갈 계획이다. 윤종인 개인정보위 위원장은 “최근 AI로 인한 사생활 침해 등 다양한 윤리적 이슈가 발생하고 있는데, AI..."
162,"과기부, 신뢰할 수 있는 AI 인증제 도입…'제2 이루다 사태' 막는다",2021.05.13.,"4차산업혁명위원회는 13일 열린 제22차 전체회의에서 ‘신뢰할 수 있는 인공지능 실현전략’을 발표했다. 기술·제도·윤리 측면의 3대 전략과 10대 실행과제를 2025년까지 단계적으로 추진하겠다는 내용이 담겼다. 이를 통해 AI 활용에서 세계 5위, 신뢰 가능한 사회 세계 10위, 안전한 사이버국가 세계 5위에..."
164,SKT ‘AI 기업’ 혁신 본격화… 추구가치 정립해 사규 반영,2021.05.13.,"자문단에는 이번 추구 가치 제정의 자문 역할을 한 연세대 법대 오병철 교수(윤리 법학)와 서울대 법대 박상철 교수(인공지능법), 서울과학기술대 김현경 교수(지적재산권, 정보기술), AI 사회적 기업인 테스트웍스 윤석원 대표, 카이스트 전산학부 오혜연 교수(소셜 컴퓨팅), 김윤 CTO가 참가한다. SKT 김윤..."
167,"보험연구원, 26일 ‘보험산업의 AI 적용 현황과 과제’ 온라인 세미나",2021.05.13.,"‘보험산업의 인공지능(AI) 적용 현황과 과제’란 주제로 열리는 이번 세미나는 보험산업의 디지털 전환에 있어서 AI의 보험산업 적용 현황을 알아보고... 상무(AI와 보험 비즈니스 전망), 보험개발원 홍성호 팀장(보험산업 AI 적용 현황 및 주요 이슈), 보험연구원 김규동 연구위원(보험산업의 AI 윤리문제와..."
