Unnamed: 0,제목,날짜,본문
168,"AI 서비스 인증체계 마련···""인공지능 신뢰 확보""",2021.05.13.,"이와 함께 정부는 인공지능 영향평가를 실시하고, 인공지능에 대한 신뢰 확보와 이용자 보호 등을 위한 법·제도 정비도 추진할 계획입니다. (영상취재: 김태형 / 영상편집: 오희현) 또, 인공지능 윤리교육 과정을 개발해 시민과 연구·개발자, 학생 등을 대상으로 교육도 실시할 예정입니다. KTV 문기혁입니다."
169,과기정통부 AI 가이드라인 만드는 변호사들...로펌 최초 AI팀 인터뷰,2021.05.13.,"(왼쪽부터)이수진, 이재규, 마경태 변호사, 김득원 박사, 이상직 변호사.(사진=이하나 기자) 우리나라 인공지능(AI) 윤리 이슈에 불을 지핀 AI 챗봇 이루다가 공식적으로 법적 처벌을 받았다. 개인정보보호위원회는 지난 4월 28일 개인정보보호법 위반을 이유로 이루다 개발사 스캐터랩에 1억330만원 과징금을..."
170,"과기정통부, 인공지능 그랜드 챌린지' 5차 대회 개최...총상금 47억원 규모",2021.05.13.,"있는 AI 기반 기술 확보할 목적으로 연구역량을 직접 검증, 우수팀을 선발한다. 참가팀은 모집기간 동안 인공지능 그랜드 챌린지 홈페이지를 통해... com [관련기사] SKT, AI 회사로서 '사람 중심' 7대 추구 가치 정립 [관련기사] 구글, 게브루 사태 이후 새 전환점 맞나‥ AI윤리팀 인력 두 배로 늘린다"
171,[뉴스투데이 E] 네이버 '인공지능 기술'은 어느 정도일까?…'NAVER AI NOW' 행...,2021.05.13.,"뿐만 아니라 글로벌 AI 리더십 확보를 위한 연구 생태계 조성 계획, ‘올바른’ AI 사용을 위해 네이버가 학계와 함께 설계한 AI 윤리 준칙이 현실에서 적용되고 있는 방식도 함께 공유한다. 테크 세션은 방대한 양의 한국어 데이터를 학습하는 과정, 검색이나 인공지능 비서(AI Assistant)를 비롯한 여러..."
172,"안민석 의원, 4차산업 이끌 AI 인재양성 범정부 지원법 발의",2021.05.13.,최근 AI 인재 양성과 AI교육이 교육정책의 중요한 화두가 되고 있으나 인간 중심 AI교육을 범정부 차원에서 종합적으로 지원하는 법·제도 및 정책은 미흡한 실정이다. '인공지능교육진흥법안'에는 ▶인간 중심의 윤리적 책임을 고려한 인공지능교육을 체계적으로 추진함으로써 인공지능 시대를 주도해 나갈...
174,"[IT오늘] SK텔레콤이 정의한 AI 7대 추구 가치는?…KT, 韓 최초 AI 미디어 관...",2021.05.13.,"자문단에는 △오병철 연세대 법대 교수(윤리 법학) △박상철 서울대 법대 교수(인공지능법) △김현경 서울과학기술대 교수(지적재산권, 정보기술) △AI 사회적 기업 테스트웍스 윤석원 대표 △오혜연 카이스트 전산학부 교수(소셜 컴퓨팅) △김윤 CTO 등이 참여했다. 자문단은 정기 회의를 통해 AI 윤리..."
175,"과기정통부, 'AI 실현전략' 발표…3대 전략‧10대 실천과제 제시",2021.05.13.,"중심으로 AI에 대한 신뢰성 확보를 추진 중이다. 이날 발표된 실천전략은 지난해 발표한 AI 윤리기준의 실천방안을 구체화하고 민간 자율 신뢰성 확보를... 등이 인공지능 제품·서비스 개발 과정에서 혼란을 겪거나 국민이 피해 보는 일이 없도록 AI 신뢰 확보 기준을 명확하게 하겠다""고 밝혔다. 이어 ""기술적..."
176,"보험연구원, '보험산업의 AI 적용 현황과 과제' 세미나 개최",2021.05.13.,"보험연구원이 이달 26일 '보험산업의 인공지능(AI) 적용 현황과 과제'라는 주제로 온라인 세미나를 개최한다고 18일 밝혔다. 보험산업 디지털 전환에서... 상무(AI와 보험 비즈니스 전망), 보험개발원 홍성호 팀장(보험산업 AI 적용 현황 및 주요 이슈), 보험연구원 김규동 연구위원(보험산업의 AI 윤리문제와..."
178,[한상기 칼럼] '신뢰'를 인공지능의 핵심 경쟁력으로 만들자,2021.05.13.,인공지능 윤리를 발표했다. 그러나 이런 원칙이나 가이드라인을 제정한다고 해서 인공지능 기술의 발전을 촉진하는 것은 아니다. 이제 원칙과 가이드라인 얘기는 그만하고 그에 맞는 기술 프레임워크를 개발하는 것이 더 중요하다. '이루다 AI'가 보여준 현재 인공지능 기술의 부족함이나 실 세계에서 적용...
182,"'AI 이루다 사태 예방'에 총력 기울이는 정부, 650억 이상 투입(종합)",2021.05.13.,민간의 인공지능 서비스 구현을 체계적으로 지원하고 이용자가 믿고 안전하게 사용할 수 있도록 제도를 보완하며 사회 전반에 건전한 인공지능 윤리를 확산하는 것이 중점 방향이다. 3대 전략은 ▲신뢰 가능한 AI 구현 환경 ▲안전한 AI 활용 기반 마련 ▲사회 전반의 건전한 AI 의식 확산 등이다. 신뢰 가능한...
183,"국가 'AI 실현전략' 발표…""신뢰성 높이고 민간 인증도 지원""",2021.05.13.,"신뢰할 수 있는 인공지능 실현전략의 비전·목표·추진전략. 사진/과기정통부 먼저 민간 기업·개발자가 개발 과정에서 참고할 가이드북을 보급한다. 개발 단계에서 AI 신뢰성과 관련한 법·제도·윤리사항을 담았고, 이후 이를 검증할 수 있는 절차·방법 등 체계를 마련한다. 아울러 민간 자율의 AI 제품..."
184,"SKT, 'AI 컴퍼니'로 거듭난다…‘사람 중심의 AI‘ 핵심 가치 정립",2021.05.13.,"교수(인공지능법), 김현경 서울과학기술대 교수(지적재산권, 정보기술), 윤석원 테스트웍스의 대표, 오혜연 카이스트 전산학부 교수(소셜 컴퓨팅), 김윤 CTO가 참가한다. 자문단은 정기 회의를 통해 AI 윤리 관련 이슈를 논의하고, AI 적용 시스템을 강화하는 방안을 제안할 예정이다. 또한 5월과 6월 2회..."
186,"SK텔레콤, 사람 중심 AI 추구 가치 정립 나서",2021.05.13.,지난 2월 'AI 윤리'를 주제로 한 세미나에 구성원들이 온라인으로 참여하고 있는 모습. [사진=SKT] SK텔레콤이 인공지능(AI) 회사로 혁신 선언에 발 맞춰 사람 중심의 AI 추구 가치 정립에 나섰다. SKT는 AI 회사로의 혁신을 본격화 하기 위해 AI 서비스 체크리스트 개발 등 경영 시스템 전반에 적용하는...
188,"美, 'AI 관련법' 151건 발의…韓, 4건에 그쳐",2021.05.13.,"그나마 이상민 의원 법안은 '생명윤리' 부문을 다뤘다. 최근 5년 동안 국가연구개발사업을 통해 추진하고 있는 AI 관련 과제는 대폭 증가 추세에 있다. 국회미래연구원에서 제공한 '연도별 인공지능 관련 국가연구개발사업 현황'에 따르면 2016년 151건에서 2017년 313건, 2020년 682건으로 늘었다. 연구의 양적..."
189,[리뷰] 벤처가 대기업을 먹어 치울 시간이 왔다... AI가 바꿔놓을 10년 뒤,2021.05.16.,"인공지능(AI) 기술이 미래 경쟁력의 핵심이라는 것은 삼척동자도 안다. 실제 무인자동차부터 드론, 로봇, 블록체인 등 인간의 일상에 인공지능이 점차... 대표적으로 식물성 단백질을 개발하는 '임파서블푸드'는 가축 도축을 꺼리는 윤리적 인식과 친환경적인 소비 경향으로 인해 점차 소비자를 늘려가는..."
190,[기자수첩] '성숙한' 인공지능 키우려면,2021.05.13.,"이미 구현된 시스템에 인공지능이 판단기준 등을 설명할 수 있는 기능을 추가할 수 있고, 인공지능이 스스로 법･제도･윤리적 편향성을 진단하고 효율적으로 제거할 수 있는 신뢰성 원천기술 개발도 정부에 의해 추진된다. 특히 신뢰성 확보 역량이 떨어지는 중소 AI 개발사들을 위한 가이드북 및 검증 체계..."
191,"네이버, 25일 ‘초대규모 AI’ 첫 공개...슈퍼컴퓨터 성과 공유",2021.05.13.,아울러 ▲글로벌 AI 리더십 확보를 위한 연구 생태계 조성 계획 ▲바람직한 AI 사용을 위해 네이버와 학계가 함께 설계한 AI 윤리 준칙이 현실에서 적용되고 있는 방식도 함께 공유될 예정입니다. 테크 세션을 통해서는 방대한 양의 한국어 데이터를 학습하는 과정·검색이나 인공지능 비서(AI Assistant)를...
192,"AI 원스톱 지원 플랫폼 구축… 사업자등록번호, 공공데이터로 개방한다",2021.05.14.,"제3자가 AI의 신뢰성 관련 법·제도, 윤리·기술적 요구 사항을 확인할 수 있는 개발 가이드북을 제작하는 한편 검증 체계를 마련하고 민간 자율 인증과 공시도 추진한다.이와 함께 국민의 안전이나 기본권에 잠재적 위험을 미칠 수 있는 고위험 인공지능의 범주를 설정하고 해당 기업이 서비스를 제공하기 전에..."
195,"정부, '사람이 중심되는 신뢰할 수 있는 AI 실현전략' 마련",2021.05.14.,"앞서 인공지능 윤리기준은 '인간성을 위한 AI'를 위해 사회구성원이 지켜야 할 3대 원칙(인간 존엄성, 사회 공공선, 기술의 합목적성)과 10대 요건(책임성, 안전성, 투명성)을 제시했다. 이번 전략은 '누구나 신뢰할 수 있는 인공지능, 모두가 누릴 수 있는 인공지능 구현'을 비전으로 기술·제도·윤리 측면의 3대..."
196,"과기부, 4차위 전체회의서 'AI 개발 가이드북 제작·보급' 추진",2021.05.13.,과학기술정보통신부(과기부)는 13일 대통령 직속 4차산업혁명위원회 제22차 전체회의에서 사람 중심이 되는 AI를 위한 '신뢰할 수 있는 인공지능 실현전략'을 발표했다. AI 신뢰 구현을 위한 법제도·윤리·기술적 요구사항을 종합한 인공지능 개발 가이드북을 제작·보급한다는 계획이다. AI가 전 산업·사회에...
197,"프랑스, 전쟁터에 '인공지능 로봇개' 투입 검토",2021.05.13.,5km 이상 달리며 현장 상황 대처 능력 갖춰 '살인 무감각해진다' 일부 반대에도 미·영·프 등은 개발 지속 프랑스가 인공 지능(AI)을 탑재한 로봇을 전쟁터에 투입하는 방안을 검토하고 있어 논란이 예상된다. 3일(현지시간) 일간 더타임스에 따르면 군과 민간인으로 구성된 프랑스 국방윤리위원회는 최근 엄격한...
199,"SKT, 사람 중심 AI 이념 설정…AI 컴퍼니 혁신 본격화",2021.05.13.,"자문단에는 이번 추구 가치 제정의 자문 역할을 한 오병철 연세대 법대 교수(윤리 법학)와 박상철 서울대 법대 교수(인공지능법), 김현경 서울과학기술대 교수(지적재산권, 정보기술), AI 사회적 기업인 테스트웍스의 윤석원 대표, 오혜연 카이스트 전산학부 교수(소셜 컴퓨팅), 김윤 CTO가 참가한다...."
200,[이상직 변호사의 AI 법률사무소](19)무엇을 어떻게 지킬 것인가. AI윤리와 법,2021.05.13.,"지난해 12월 23일 정부는 인공지능(AI) 윤리기준을 발표했다. 정부, 공공기관, 기업, 고객이 AI 개발 및 활용 과정에서 지켜야 할 주요 원칙과 핵심 요건을 담았다. 사람 중심 AI를 목적으로 인간존엄성 원칙(행복추구, 인권보장, 개인정보보호, 다양성 존중, 해악금지), 사회공공선 원칙(공공성, 개방성, 연대성..."
201,"SK텔레콤, '사람 중심 AI' 추구 가치 정립...AI 컴퍼니로 혁신 본격화",2021.05.15.,"SKT는 이번 AI 추구 가치에 다양한 분야의 전문성을 반영하기 위해 연세대 법대 오병철 교수(윤리 법학)와 서울대 법대 박상철 교수(인공지능법), 서울과학기술대 김현경 교수(지적재산권, 정보기술), AI 사회적 기업인 테스트웍스 윤석원 대표, 카이스트 전산학부 오혜연 교수(소셜 컴퓨팅), 김윤 SKT CTO..."
202,[IT돋보기] '처벌'까지 불사한 해외 AI규제…국내는?,2021.05.14.,"""인공지능(AI)와 같은 신기술이 우리 사회에 정착하기 위해서는 정부 차원에서 노력이 필요하다. 주요국 정부는 AI 개발 및 사용 과정에서 신뢰성을... 의무화, AI 창작물에 저작권 부여 등은 아직 사회적 합의가 필요한 부분이다. 또 지난해 말부터 정부 주도로 AI 윤리 기준안을 준비 중이다. 자율적..."
203,"신뢰할 수 있는 인공지능, 모두가 누릴 수 있는 AI 구현... 정부, 3대 전략 1...",2021.05.14.,"인공지능 윤리를 확산하는 것이 중점 방향이다. 주요 내용으로는 먼저, ▶신뢰 가능한 인공지능 구현 환경 조성으로 ▷인공지능 제품·서비스 구현단계별 신뢰 확보 체계를 마련하고 민간에서 AI 제품･서비스를 구현하는 단계(개발→ 검증→ 인증)에 따라, 기업, 개발자, 제3자 등이 신뢰성 구현을 위해 참조할..."
204,"SKT, AI 회사로서 '사람 중심' 7대 추구 가치 정립",2021.05.13.,"자문단에는 이번 추구 가치 제정의 자문 역할을 한 연세대 법대 오병철 교수(윤리 법학)와 서울대 법대 박상철 교수(인공지능법), 서울과학기술대 김현경 교수(지적재산권, 정보기술), AI 사회적 기업인 테스트웍스 윤석원 대표, 카이스트 전산학부 오혜연 교수(소셜 컴퓨팅), 김윤 CTO가 참가한다. SKT..."
205,"갈수록 문턱 높아지는 글로벌 AI 규제…""결국 시장의 선택이 관건""",2021.05.12.,"◆ ""가이드라인 제시하며 AI 산업 싹 키울 때"" 정부가 이번에 제시한 '신뢰할 수 있는 인공지능 실현전략'을 보면, 신뢰구현 법제도·윤리·기술적 요구사항을 종합한 AI 개발 가이드북이나 AI 윤리기준 실천을 위한 윤리 교육 강화 및 개발자·이용자용 체크리스트는 얼핏 강화된 규제처럼 보인다는..."
206,"""열린 인공지능 교육으로 AI 개발자 문턱 낮추겠다""...이지석 아이펠(AIFEEL)...",2021.05.13.,"(사진=김동원 기자) 인공지능(AI) 개발자를 꿈꾸는 사람들을 위한 열린 학교 아이펠(AIFEEL). 이곳은 모두의연구소에서 AI 교육 저변 확대를 위해... 인상 좋은 윤리 선생님 같았다. 의외라는 질문에 이 교장은 ""(직책을) 학장으로 하려다가 너무 어려워 보여 교장으로 했는데 처음 만난 분들은 다들 신기해하십니다..."
207,"[이 시각 세계] 프랑스, 전쟁터에 '인공지능 로봇개' 투입 검토",2021.05.13.,모델의 AI 로봇을 우선 검토 중인 것으로 알려졌습니다. 무게 31kg의 '스폿'은 5km 이상을 달릴 수 있고 스스로 현장 상황에 대처 가능하다는데요. 하지만 자동으로 임무를 수행하는 인공 지능 로봇은 살인이 무감각해진다는 윤리적인 문제가 있어 전 세계 약 30개 국가와 단체들은 전쟁에서 이런 무기의 사용을...
208,[기획연재]⑧ 인공지능 연구 국가 경쟁력 좌우…한양대 임종우 AI학과장,2021.05.10.,"한양대학교 ITBT관 (사진=한양대학교 일반대학원 인공지능학과) 한양대 인공지능 대학원은 AI 특화 교육ㆍ연구와 산학연 프로그램을 운영하고 있다.... 또한, AI 기술의 사회적 파급효과를 인지하여 윤리 의식을 갖고 연구에 임하는 AI 인재 양성을 추구한다. 한양대 인문학 진흥센터와 연계를 통해 AI 윤리..."
209,"카카오, 첫 ESG 보고서 '2020 카카오의 약속과 책임' 발간",2021.05.31.,"카카오는 디지털 책임, 인공지능(AI) 윤리, 프라이버시, 글로벌 협력, 소셜 임팩트 등 다양한 분야에서 사회적 책임을 다 하고 있으며 특히 디지털 기업 고유의 ESG 영역인 ‘기업의 디지털 책임’을 다 하기 위해 노력 중이다. 지난 1월 '카카오 인권경영선언문'을 제정하고 이를 구체화하기 위해 국내 민간 기업..."
210,엔씨소프트의 ESG 전략 주도하는 윤송이 CSO… 윤리·미래 세대에 투자 '집중...,2021.05.31.,▲미래세대에 대한 고려 ▲사회적 약자에 대한 지원 ▲환경 생태계의 보호 ▲인공지능(AI) 시대의 리더십과 윤리 등 4가지다. 특히 엔씨는 AI 시대의 리더십과 윤리에 집중하고 있는 모습이다. 'AI 프레임워크(Framework)' 시리즈는 엔씨가 ESG 경영 핵심 분야 중 하나인 'AI 시대의 리더십과 윤리(Leadership and...
211,AI 개발·운영 시 자율점검 가능한 개인정보보호 기준 나왔다,2021.05.31.,인공지능(AI) 서비스 개발 및 운영 시 발생할 수 있는 개인정보 침해를 예방하기 위한 개인정보보호 기준이 발표됐다. 개인정보보호위원회는 31일... 이와 같은 내용은 AI의 개인정보 처리 특성을 고려해 개인정보 보호법과 AI 윤리기준 및 국제적으로 통용되는 개인정보보호 중심설계 원칙 등을 반영했다....
212,"서울과학기술대학교, ‘2021 대한민국 혁신기관’으로 선정",2021.05.31.,"‘EPiC 졸업요건제’는 서울과기대 3대 인재상인 윤리적 인재(Ethic), 실천적 인재(Practicality), 창의적 인재(ideal Creativity)와 6대 핵심역량인 인문, 소통... ‘디스커버리학기제’는 4차 산업혁명의 변화에 대응해 신설된 신규 학기제로 여름방학 기간을 3개월로 확대해 프로그램 기반 코딩스쿨, AI 인공지능스쿨..."
213,"신한카드, 업계 최초 이사회 내 ESG위원회 신설... ""선진 거버넌스 확립""",2021.05.31.,"CDR 경영 원칙에 따라 윤리헌장을 제정하고 디지털 소비자 보호, 윤리적 인공지능(AI) 알고리즘, 사이버 보안 강화 등을 경영 전반에 도입하기로 했다. 이사회 내부 소위원회로 CDR 경영 위원회를 구성하는 것을 검토하는 등 지배구조 전반에 CDR 경영을 체계화하기 위한 노력도 병행해나갈 구상이다...."
214,"[기획연재]① 내년 모집 정원 2배 늘린다, 세계 AI연구 주도하는 KAIST AI대학...",2021.05.31.,이번 가을학기부터 KAIST 인공지능대학원생들은 오혜연 교수의 AI 윤리 과목을 들을 수 있다. 작년 뉴립스(NeurIPS)에 채택된 한국 논문 60%는 KAIST에서 나왔습니다. -KAIST 인공지능대학원 정송 원장- 정송 KAIST 인공지능대학원장(사진=박성은기자) Q. 올해로 3년차를 맞게 된 소감이 궁금하다. 시간이 어떻게...
215,구글 또 송사…이번엔 남녀 임금차별로 집단소송,2021.05.31.,"구글도 올초부터 인공지능(AI) 윤리 여성 연구원들이 다양성과 편견 등을 이유로 회사 측과 충돌했다. 이번 소송에 대해 구글 측은 ""우리 정책과 관행이 공정하다고 확신한다”면서 “남녀 간 임금 차이가 발견된다면, 바로 상향 조정한다”고 강조했다."
216,"IT업계, 이제 '메타버스다'…코로나19發 블루오션으로 급부상",2021.05.31.,"한동호 우석대학교 교수는 ""최근 이루다 사태로 인공지능(AI) 윤리, 개발사의 개인정보 침해 등에 대한 문제가 부각됐다""며 ""정부는 메타버스 산업 육성뿐만이 아니라 윤리, 사생활 침해 등에 대해 대비할 수 있는 법·제도적 장치를 마련해야 한다""고 지적했다."
217,"[엔씨 AI 프레임워크] 페이페이 리 ""AI 기술 발전, 정부·기업·대학 협력해야...",2021.05.27.,핵심 분야인 AI 시대 리더십과 윤리를 다루기 위해 마련한 연중기획 시리즈로 지난달 30일 공식 유튜브와 블로그에서 공개됐다. 윤송이 CSO가 하버드·스탠퍼드·매사추세츠공과대학(MIT) 등의 AI 연구·정치학·철학 등 분야별 석학과 대담하며 인공지능 기술을 바라보는 새로운 관점과 방향을 제시한다.
218,"서울과기대, '2021 대한민국 혁신기관' 선정",2021.05.27.,"'EPiC 졸업요건제'는 서울과기대 3대 인재상인 윤리적 인재(Ethic), 실천적 인재(Practicality), 창의적 인재(ideal Creativity)와 6대 핵심역량인 인문, 소통, 학문... 또 '디스커버리학기제'는 4차 산업혁명의 변화에 대응해 신설된 신규 학기제로 여름방학 기간을 3개월로 확대해 프로그램 기반 코딩스쿨, AI 인공지능스..."
219,코로나에도 명품 M&A ‘쑤욱’…한국 보면 이유안다,2021.05.04.,"소비자가 관심 있는 제품을 편안하게 둘러보고 쇼핑할 수 있도록 빅데이터 분석 등 인공지능(AI)과 고도의 정보기술(IT)이 필요합니다. 넷째, 지속가능성과 윤리경영에 대한 관심입니다. 이른바 MZ세대(밀레니얼·Z세대)는 환경과 사회적 이슈에 대해 매우 민감합니다. 명품 패션에서 살아있는 동물 털로..."
220,"[코로나 시대 뉴노멀 2.0] 한국 사회, '뉴노멀 2.0'에 대비하라",2021.05.04.,"친환경과 지속가능한 경제, 기업의 책임 경영, 사회적 불균형·역차별 해소, 나라별·지역별 갈등·격차 완화, 빅데이터·인공지능(AI) 등 4차 산업혁명의... 투명성 ▲윤리·준법경영 등이 두루 포함된다. 한 마디로 매출·영업이익 등 재무성과를 제외한 기업의 모든 활동을 포괄하고 있는 것이다. 대한상의의..."
221,대선 앞두고 또…정치권 '포털 알고리즘' 소환,2021.05.04.,본격 대선 정국을 앞두고 정치권이 다시 포털 인공지능(AI) 알고리즘을 도마 위에 올렸다. 포털 뉴스 검색 노출과 배열 방식에 대해 정치적 편향성을 문제... 허 의원은 “포털이 그동안 사용자들에게 충분한 설명을 하지 않은 부분이 있어 성급한 법적 의무보다는 사업자별 자율적 윤리가이드를 지키는 것이...
222,"120개 시민단체 ""인권·안전·민주 보장 AI 법규 마련해야""",2021.05.04.,"이들은 ""인공지능은 헌법과 법률에 따라 개인정보를 보호하고 인권 침해와 차별을 해서는 안 된다""며 ""딥러닝 등 특정한 기술적 특성이나 기업의 자율적인 윤리가 인권 보장과 법률 준수 의무를 회피하는 이유가 돼서도 안 된다""고 강조했다. 그러면서 ▲ 인공지능 국가 감독 체계 마련 ▲ 정보 공개와 국민의..."
223,"서울사이버대, K-MOOC 12개 과정 공개강좌 실시",2021.05.04.,인공지능(AI)강좌인 △인공지능 윤리(컴퓨터공학과 이성태 교수 외 1인)는 인공지능 기술의 발전과 함께 적극적으로 논의되어야 하는 인공지능 윤리를 다루고 있다. 강인 서울사이버대학교 총장은 “서울사이버대는 언택트 시대에 대응하여 품격 있는 강의를 선보이고 있다”며 “앞으로도 K-MOOC의 확산에도...
224,"조선대 SW중심대학사업단, 광주시교육청 AI정보영재교육원 SW·AI과정 호응",2021.05.20.,"SW·인공지능(AI) 과정 프로그램'이 참여자들의 호응을 얻고 있다고 24일 밝혔다. 광주시 AI정보영재교육원 SW·AI 과정 프로그램은 1년 과정으로... AI기계학습, AI이미지학습을 통한 전염병 예방수칙 사전, 화학원소 안내 사전 제작, 정보보안과 시대별 암호화 방법, 언어를 활용한 빅데이터 분석, AI윤리..."
225,한국판 어벤저스 뭉친 'K-메타버스' 첫 발 떼다,2021.05.20.,"얼라이언스는 참여기업과 영역을 확장해 나가면서 △메타버스 산업과 기술 동향을 공유하는 포럼 △메타버스 시장의 윤리적, 문화적 이슈 검토 및... 넥슨은 딥러닝과 비전컴퓨팅에 기반한 차세대 인공지능(AI) 기술과 반응형 진행·연출 시스템을 활용해 새로운 형태의 즐거움을 제공하는 신개념 놀이..."
226,불붙은 로톡 vs. 변협 전면전…“청년변호사ㆍ스타트업 싹 도려내는 행위”,2021.05.20.,이에 더해 변협이 플랫폼 가입 변호사에 대한 징계 방안을 담은 ‘변호사 윤리장전’도 개정하겠다고 밝히면서 갈등이 구체화했다. 로톡은 이런 조치가... 로톡뿐만 아니라 인공지능(AI)을 기반으로 법률·판례 검색 서비스를 제공하는 스타트업에도 불똥이 뛰게 된 셈이다. 코리아스타트업포럼(코스포)은 이날...
227,서울사이버대 K-MOOC 12개 과정 공개강좌 실시,2021.05.04.,"또한 인공지능(AI)강좌인 ▲인공지능 윤리(컴퓨터공학과 이성태 교수 외 1인)는 인공지능 기술의 발전과 함께 적극적으로 논의되어야 하는 인공지능 윤리를 다루고 있다. 서울사이버대학교 강인 총장은 ""서울사이버대는 언택트 시대에 대응하여 품격 있는 강의를 선보이고 있다""라며, ""앞으로도 K-MOOC의..."
228,[ET단상]코로나19 시대 의료 데이터 융합의 중요성,2021.05.13.,"머신러닝 기반으로 발전한 의료 인공지능(AI) 기술은 코로나19로 말미암은 제한점을 극복하는 대안으로 떠오르고 있다. 기존 임상 데이터 기반으로... 의료 AI 사업 활성화를 위해 개인정보 보호와 생명윤리법 등 복잡하게 얽힌 문제를 풀어야 할 숙제가 있으며, 제도적 뒷받침도 필요하다. 김진국..."
